Localisation	Id. source	Segment source	Segment cible	Id. cible
1.1.7	tSYUCzp	e desfiziere la comunidat solamente <b> que el pueda allegar riquezas e dineros . </b> Ca aquel que bien entiende	si depraedetur populum et Rem publicam , <b> dum tamen possit pecuniam congregare , </b> qui enim bene intelligit ,	dEHnjG9
1.2.17	oUtcrWb	mas guardar el omne <b> lo suyo non es husar del auerante es mas ganar lo e allegar lo . </b> por la qual cosa paresçe	Custodire autem proprios redditus , <b> non est uti pecunia , | sed magis est acquirere </b> et generare ipsam .	yoFlDnV, hP6uvFS
2.1.20	aJVWFEL	conuiene les de guardar se <b> de allegar se mucho alas mugers . Et pues que assi es conuiene les alos casados </b> de guardar tienpo conuenible	insurgere nocumentum proli , <b> decet abstinere a tali copula : | est ergo obseruandum tempus debitum . </b> Sic etiam obseruandus est locus congruus	bdBlawn, cAaJqFZ
2.2.4	y00ndb6	Ca los padres son inclia a dos a amar los fijos <b> para allegar les los bienes </b> que les faz menestra .	quia parentes afficiuntur ad filios <b> ut congregant eis bona : </b> et congregare aliis bona ,	sJdFny0
2.2.4	kluH80l	que les faz menestra . <b> Commo allegar les los bienes </b> e ser cuydadosos	ut congregant eis bona : <b> et congregare aliis bona , </b> et solicitari circa eorum vitam ,	g50i9qs
2.2.5	rggODxR	La terçera razon para prouar esto se tomad esto <b> que aquellas cosas que son dela fe nos deuemos allegar firmemente . </b> por que veemos que la costunbre es	sumitur ex eo quod <b> iis quae sunt fidei est firmiter adhaerendum . </b> Videmus enim quod consuetudo est	i6tN9NH
3.2.13	zYrL52Z	si non a grant ganançia propria <b> e allegar grand auer acor̃tele </b> por quel tomne los tesoos Oude Dize el philosofo	nisi ad lucrum proprium , <b> et ad congregandam pecuniam inuadunt ipsum , | et accipiunt thesauros eius . </b> Unde dicitur 5 Polit’	wxt5wQF, s0BkgkD
3.2.29	zf6PxCd	que se pueda en coruar <b> e allegar alas obras delos omes . </b> Et por ende conuiene quela ley que se ençorue	quod mensurentur regula plumbea , <b> quae sit applicabilis humanis actibus . </b> Oportet igitur aliquando legem plicare ad partem unam ,	aJeNhZ0
3.3.19	eXHVYtG	fasta los muros de la fortaleza cercada <b> e pueden por estos muslos allegar los castiellos </b> fasta la fortaleza que tienen cercada .	usque ad moenia munitionis obsessae . <b> Potest autem per huiusmodi musculos </b> quasi continuari castra	vQrMoHO
