Localisation	Id. source	Segment source	Segment cible	Id. cible
3.1.20	jyCJ6sY	quod aliquem defectum contineant , <b> et alia quae circa istam materiam sunt quaerenda , </b> infra diffusius tractabuntur :	puesto que algunan mengua aya en sus dichos <b> e las otras cosas </b> que en esta materia son de dezer adelante lo tractaremos mas conplidamente .	lDCpipw
3.2.2	uW03QzJ	tunc dicitur Monarchia siue Regnum : <b> regis autem est intendere commune bonum . </b> Si vero ille unus dominans	e estonçe es dicho tal sennorio monarch̃ia o e egno <b> ca al Rey parte nesçe de enteder el bien comun . </b> Et li aquel vno assi	b2qkl3E
3.2.4	vH5NciE	simpliciter fuisse de intentione Philosophi , <b> dominium plurium esse comendabilius dominio unius , </b> dum tamen utrunque sit rectum ,	que fue la entençion del philosofo <b> que el ssennorio de muchos es mas de alabar | que el ssennorio de vno </b> Puesto que amos los ssennorios sean derechs	lpEE0Jq, esrxrBB
3.2.5	mI8opGC	Ideo ne periclitetur bonum commune , <b> de omnibus filiis Regis cura diligens est habenda . </b> Philosophus 5 Politic’	a qual de los fijos pertenesçra el regno . <b> Por ende por que el bien comun non sea puesto a peligro de todos los fios deuen auer los padres grant cuydado </b> pho en el quanto libro delas poluenta tres cosas	m22q8nm
3.2.8	ykz9zob	Haec etiam tria sunt . <b> Nam primo commissa sunt supplenda : </b> ut si viderint aliquid deesse	Et para esto ver son menester tres cosas . <b> ¶ Ca lo primero las cosas | que menguna a buen gouernamiento </b> son de ennader	uH8hSyZ, kErihiA
3.2.8	o1ov0fj	ad bonum regimen ciuitatis , <b> illud est supplendum : </b> hoc autem fieri potest	para buen gouernamiento dela çibdat <b> aquello deuen cunplir </b> e esto se puede fazer	xBWhDZv
3.2.8	zvN8Vvi	Secundo , bonae ordinationes , <b> et bona statuta debent esse obseruanda . </b> Tertio , bene operantes	Lo segundo los bueons ordenamientos <b> e los bueons | establesçimientos son de guardar </b> ¶ Lo terçero los que bien obran	uegdorQ, kCUmSsQ
3.2.8	mHskZUr	per quae resultat commune bonum , <b> sunt remunerandi et praemiandi : </b> nam licet commissa supplere ,	por que viene grant bien al comun son de gualardonar <b> e de les fazer bien . Ca commo quier que las cosas menguadas se cunplan </b> e los bienes ordenados se guarden .	iiY3Ed3
3.2.11	oMUduhj	Ex hoc autem manifeste patet , <b> tyrannidem maxime esse fugiendam a regibus : </b> quia pessimum de se ,	e desto paresçe manifiesta miente <b> que la tirama es much de escusar alos Reyes | e mucho han de foyr della </b> por que es . muy mala .	p0zsTqz, e4oLUZy
3.2.12	tPYgEVm	et perimere diuites et insignes . <b> Summe ergo est cauenda tyrannis a Rege , </b> in qua tot mala congregantur .	e de matar los nobles e los rricos <b> E pues que asi es muncho es de esquar alos rreyes la tiranja </b> enla qual son ayuntados tantos males commo son dichos	iSMeDay
3.2.15	hLzJEzD	paulatim defluit in maiora . <b> Principiis ergo est obstandum , </b> et inhibendae sunt obliquitates ,	pequanos males ayna cahe en los grandes . <b> Et pues que assi es deuemos contradezir en los comientos </b> e deuen avn ser defendidos los males pequanos .	qALXGq9
3.2.16	yv3ZS3U	quantum spectat ad praesens negocium , <b> sufficienter tractauimus quae circa Principem sunt dicenda . </b> Restat ergo de consilio pertransire	Et quanto parte nesçe a este negoçio presente <b> conplidamente dixiemos aquellas cosas | que eran de dezer </b> para enformaçion del prinçipe .	iLsw2f7, xt88XJe
3.2.16	t8u36sB	Si autem circa talia cadit consilium ; <b> hoc non est secundum se , </b> sed prout deseruiunt actionibus nostris :	sobre tales cosas commo estas . <b> mas si en tales cosas cae algun conse io esto non es </b> por si mas en quanto siruen algunas obras nr̃as .	qZsGYpp
3.2.16	xpiUIDR	ut sciamus quo tempore <b> quae opera sunt fienda . </b> Tertio non sunt consiliabilia	por que sepamos en <b> quetp̃o son de fazer algunas obras | e en que tp̃o orͣ̃s . </b> L tercero non cae so consseio	wHN167I, zVD6c5O
3.2.17	zyYv6yc	quia est quaestio agibilium humanorum : <b> restat videre qualiter est consiliandum , </b> et quem modum in consiliis habere debemus .	ca es question delas obras <b> que pueden fazer los omes finca de ver | en qual manera es de tomar el conseio </b> e qual manera deuemos tener en los conseios	lSWBLEC, c1BUBAU
3.2.17	dwG7jse	( quantum ad praesens spectat ) sex obseruanda , <b> ut sciamus qualiter sit consiliandum . </b> Primum est ,	Mas quanto pertenesçe alo presente seys <b> cosasson de guardar para que sepamos en qual manera auemos de tomar conseio . </b> La primera cosa es que quanto alguna cosa es mas deteranada	mFMMpKc
3.2.17	baGsEKE	et quanto minus habet certas et determinatas vias , <b> tanto per plus tempus est consiliandum , </b> ut de illis viis facilior et melior eligatur .	e determinadas carreras <b> para se fazer tanto mayor tienpo ha menester omne | para tomar consseio dello . </b> Porque de aquellas carreras escoia omne la meior e la mas ligera ¶	xzZUBto, esGRhEW
3.2.18	yo1QGCO	Haec autem sunt tria , <b> secundum quod in omni locutione tria sunt consideranda , </b> videlicet dicentem	e estas son tres cosas conuiene saber . <b> ¶ el dezidor que fabla </b> Et el oydor a quien fabla	eneweC3
3.2.18	bHeMwAk	quia cognoscent negocia agibilia , <b> et scient qualiter sit agendum . </b> Haec ergo tria quaerenda sunt in consiliariis :	que han de fazer <b> e saben en qual manera los han de fazer . </b> Et pues que assi es estas tres cosas	qbb6MKx
3.2.19	g3hMpY8	Primo enim contingit esse Regis consilium circa prouentus , <b> in quo duo sunt attendenda . </b> Primo , ne maiestas regia	sea cerca las sus rentas <b> en la qual cosa dos cosas conuiene de penssar </b> ¶Lo primero couiene que el Rey non tome ningunas rentas	pGe30zN
3.2.19	mQcM7cx	quod esse non posset , si bona eorum quae sunt in regno usurparet iniuste . <b> Rursus est attendendum , </b> ne in suis prouentibus defraudetur :	la qual cosa non podria ser <b> si tomasse los bienes </b> de aquellos que son en el su regno sin derech	tJqYgXH
3.2.19	iLXUAIy	Rursus circa custodiam ciuitatis et regni <b> non solum sunt adhibenda consilia </b> propter ipsos ciues vel propter eos	Otrossi çerca la guarda dela çibdat <b> e del regno non solamente son de tomar consseios </b> por essos mismos çibdadanos o por aquellos que son en el regno	ft1fa7B
3.2.19	i7tnYcS	et de hoc quod principaliter intenditur , <b> nullus dubitat ipsum esse prosequendum . </b> De eius autem opposito	e de aquello que prinçipalmente omne entiende ninguno <b> non dubda delo segnir . </b> Et del contrario della cada vno sabe	a1oLggx
3.2.19	pSfSTAT	quilibet cognoscit <b> ipsum esse fugiendum . </b> Ideo pax ciuium pro viribus est prosequenda ,	Et del contrario della cada vno sabe <b> que es de foyr . </b> Por la qual cosa la paz de los çibdadanos	mRPTM92
3.2.19	qgWRC97	ipsum esse fugiendum . <b> Ideo pax ciuium pro viribus est prosequenda , </b> et eorum dissensiones	que es de foyr . <b> Por la qual cosa la paz de los çibdadanos | con todo poder es de segnir . </b> Et las discordias dellos	bz1fDgQ, vJlUc7l
3.2.19	xqZfBVT	Rector ciuitatis aut regni , <b> qualiter circa lationem legum sit consiliandum . </b> Quae autem leges sunt ferendae , ut saluetur principatus eius ,	podra ser enssennado el gouernador dela çibdat e del regno . <b> en qual manera se deue consseiar çerca el establesçimiento delas leyes </b> Et quales leyes son de establesçer e de poner	zpXDzyn
3.2.19	f8oQSoO	qualiter circa lationem legum sit consiliandum . <b> Quae autem leges sunt ferendae , ut saluetur principatus eius , </b> intendimus in capitulis sequentibus de legibus multa inquirere ,	en qual manera se deue consseiar çerca el establesçimiento delas leyes <b> Et quales leyes son de establesçer e de poner | por que se salue el prinçipado </b> e el sennorio del Rey .	fb0B2Sv, c8IqmTs
3.2.20	xv2c6wT	aut per arbitrium , <b> aut per utrunque priusquam ostendamus qualiter sit iudicandum , </b> declarare volumus quod quantum possibile est	por las leyes o por aluedrio o por amas estas cosas . <b> ante que mostremos en qual manera deuemos iudgar . | queremos declarar </b> que quanto puede ser todas las cosas son de determinar	dxrBCr2, mRzkDTY
3.2.20	kv7D3Qc	tamen quantum possibile est <b> omnia legibus sunt determinanda , </b> et quanto pauciora possunt ,	Enpero quanto pudieren ser <b> todas las cosas deuen ser determinadas por las leyes e muy pocas cosas se deuen dexar en aluedrio de los mezes </b> assi commo dize el pho en el vij̊ .	gFi7n2D
3.2.21	h06Su46	et ad benignitatem et misericordiam erga seipsos . <b> Sed quod tales sermones sint prohibendi , </b> triplici via inuestigare possumus .	e pugnan por lo mouer amanssedunbre e amiscderia contra si mismos . <b> Mas que estas palabras malas sean de defender | e de deue dar </b> ante los alcalłs rodemos lo prouar por tres razones ¶	ywAficK, tlXpqVI
3.2.23	krHIMuc	ideo dicitur 1 Rhetor’ <b> quod epiikis est indulgere humanis : </b> dicitur enim esse epiikiis	que mas que iusto es el <b> que perdona alas obras humanales | e por ende el que perdona alas obras humanales </b> llama el pho	gDACPLX, jdiG0KZ
3.2.23	vfngaEf	Philosophus igitur parcentem humanis appellat supra iustum , <b> quia clementia est extollenda supra veritatem , </b> et supra iustitiam .	Ca la piadat es mas de alabar <b> e mas de enssalças | que el castigo afincado </b> nin que la iustiçia afincada ¶	rUTieSn, sSus2Py
3.2.24	tEMHRqz	quae sunt naturae . <b> Quare si ius naturale dictat fures et maleficos esse puniendos , </b> hoc praesupponens ius positiuum procedit ulterius ,	que son dela natura <b> Por la qual cosa si el derecho natural manda | que los ladrones </b> e los mas fechores sean castigados	ud5epqn, nKvlYgO
3.2.25	dzn1j7z	tanto plures defectus contrahunt , <b> et in pluribus casibus non sunt obseruandae , </b> et maiorem mutationem suscipiunt :	quanto mas se allegan a algua materia espeçial tanto mas trahe consigo alguons desfallesçimientos <b> e en muchos casos non son de guardar </b> e resçiben mayor mudamiento .	kO8PTZA
3.2.26	c4YIClq	et ad gentem ad quam applicatur , <b> quae per illam legem est regulanda . </b> Tria igitur lex habere debet ,	e puede se conparar ala gente ala que es dada . <b> la qual gente ha de ser reglada | por aquella ley . </b> Et pues que al sy es tres cosas	nJ3aczT, pTjcpGh
3.2.26	fijVbxn	Tertio lex prout comparatur ad populum <b> cui est imponenda , </b> debet esse compossibilis	en quanto es conparada al pueblo <b> al quien es dada deue ser tal que se pueda guardar </b> e sea conuenible ala tierra	v3z9RRn
3.2.27	eEA8tbh	et dirigere aliquos in aliquod bonum , <b> eiusdem est condere leges , </b> et regulas agibilium	Ca aquel cuyo es de ordenar e enderesçar a alguos en algun bien atlgun aquel parte nesçe <b> establesçer leyes e reglas delas nuestras obras . </b> por las quales leyes ymosa aquel bien .	zuqdSSX
3.2.28	nrjAHKf	aliquem populum regere . <b> Ideo non solum permittenda sunt indifferentia , </b> sed etiam quae modicam malitiam habent	o por quales quier culpas pequanas apenas o nunca poder e gouernar ningun pueblo . <b> Por ende non solamente son de conssentir aquellas cosas | que nin son malas nin bueans . </b> Mas avn aquellas cosas	x2tBfos, iSbNL7N
3.2.28	zhM5Eiq	antequam fiant , <b> sunt prohibenda : </b> sed postquam iam facta sunt ,	ø	ø
3.2.28	uoxtgAP	sed postquam iam facta sunt , <b> sunt punienda . </b> Opera vero notabiliter bona ,	assi que las malas obras ante que se fagan son mucho de defender . <b> mas despues que son ya fechas son de castigar . </b> Et las obras buen asante	jWmdpBW
3.2.28	hoSFAvM	antequam fiant , <b> per leges sunt praecipienda et consulenda : </b> facta vero sunt praemianda .	que se fagan son demandar <b> e de consseiar por las leyes . </b> Mas despues que son fechͣs son de gualardonar .	bp5KvUt
3.2.28	cixAade	per leges sunt praecipienda et consulenda : <b> facta vero sunt praemianda . </b> Sed opera indifferentia ,	e de consseiar por las leyes . <b> Mas despues que son fechͣs son de gualardonar . </b> Mas las que non son buenas nin malas o nin son muy buean so muy malas .	s39VXCM
3.2.28	qzOg5UN	et suos consiliarios discutiant <b> quae bona sunt praecipienda et praemianda , </b> et quae mala sunt prohibenda ,	asi que con grant acuçia <b> por si e por sus consseieros examun en quales bueans obras son demandar </b> e de poner so mandamiento .	v7jU0uj
3.2.28	yBHnp5r	quae bona sunt praecipienda et praemianda , <b> et quae mala sunt prohibenda , </b> et quae dissimulanda ,	por si e por sus consseieros examun en quales bueans obras son demandar <b> e de poner so mandamiento . | Et quales malas son de vedar e poner so pena </b> et quales son de desseneiar e de sofrir	ueKEzbP, mT0LfxV
3.2.29	fpOP6VP	quod eligibilius est principari lege , <b> quia Reges aut Principes ita sunt instituendi , </b> ut seruatores legis et ministri .	que la ley enssennore <b> e que los Reyes e los prinçipes </b> que son establesçidos paser guardadores dela ley o seruidores delas leyes .	sGqxE9j
3.2.29	q6mtWW0	Itaque ut appareat <b> quid circa hanc materiam sit dicendum , </b> sciendum est regem	Et por ende por que parezca meior <b> que auemos de dezir e de sentir en esta tal materia . </b> conuiene de saber que el rey	fcJKp9K
3.2.29	lJ14Vsr	et non obseruare legem , <b> ubi non est obseruanda . </b> Ex hoc autem patere potest ,	e qua non guarde la ley positiua <b> do non la deue guardar . </b> Et desto puede paresçer en qual manera el rigor	batDolY
3.2.31	xz9IcfU	vel quaecunque aliae leges sic prauae et iniustae , <b> non sunt obseruandae , </b> sed extirpandae .	o otras quales si quier leyes malas <b> e non derechas non son de guardar </b> mas de tirar e de derraygar .	hbNJaQw
3.2.31	arsz27A	dato quod occurrant leges meliores et magis sufficientes , <b> non est assuescendum innouare leges . </b> Primo , quia aliquando contingit	que sean falladas leyes meiores e mas conplidas . <b> Enpero non nos auemos a acostunbrar a renouar las leyes . </b> Lo primero por que algunans vegadas contesçe que se engannan los omes	smr0wjq
3.2.33	mRbdwJy	ex aequalitate et iustitia , <b> quae est seruanda in ciuitate : </b> Nam ( ut ait Philosophus )	la terçera razon se toma dela egualdat e dela iustiçia <b> que se deue guardar en la çibdat . </b> Ca assi commo dize el philosofo	gDRPMca
3.2.33	mEHAYBu	Qui autem secundum excessum <b> sunt indigentes et pauperes , </b> nesciunt principari .	Mas los otros que sobrepuian en grand mengua <b> e en grand pobreza </b> non saben	glzofFl
3.2.34	yfTUiRv	Nam ( ut dicebatur in praecedentibus ) <b> intentio legislatoris est inducere ciues ad virtutem . </b> In recta enim Politia	dich̃en los capitulos <b> sobredichos la entençion del ponedor dela ley es enduzer los çibdadanos o uirtud . </b> Ca en la derecha poliçia	pH85ISt
3.2.36	jpXnq1b	et ex dilectione legislatoris , <b> cuius est intendere commune bonum , </b> quiescant male agere :	e por amor del prinçipe ponedor dela ley <b> cuya entençiones de tener mientes al bien comun </b> que por ende queden los omes de mal fazer .	r1mAsEm
3.3.1	k2HMcLF	et ad quid sit instituta . <b> Sciendum igitur militiam esse quandam prudentiam , </b> siue quandam speciem prudentiae .	Et pues que assi es deuedes saber <b> que la caualleria es vna prudençia o vna manera de sabiduria . . | Mas podemos quanto pertenesçe a lo presente </b> departir çinco maneras de prudençia e de sabiduria .	yitX7z1, pBR0Gsq
3.3.2	fFl0bBM	In partibus igitur nimis propinquis soli , <b> non sunt eligendi bellantes : </b> quia in eis deficit strenuitas	que son muy cercanas al sol <b> non son de escoger los lidiadores </b> por que en aquellas tierrras	w6pu3GQ
3.3.2	t7lQZ95	et nimis a sole remotis , <b> non sunt eligendi bellantes : </b> quia et si illis est sanguinis copia ,	e muy arredradas del sol <b> non son de escoger los lidiadores por que commo quier que en aquellas abonde mucho la sangre </b> assi que non teman las feridas .	hqmns3T
3.3.2	bjxccta	in hominibus bellicosis , <b> ut sciamus quales homines sunt eligendi ad bellum , </b> et ex quibus artibus sunt assumendi bellantes .	que son menester en los omnes lidiadores <b> por que sepamos quales omnes son de escoger para la batalla </b> e de quales artes son de tomar los lidiadores .	bzhsTBR
3.3.2	a0xmfks	ut sciamus quales homines sunt eligendi ad bellum , <b> et ex quibus artibus sunt assumendi bellantes . </b> Sciendum ergo quod cum bellantes debeant	por que sepamos quales omnes son de escoger para la batalla <b> e de quales artes son de tomar los lidiadores . </b> Et pues que assi es conuiene de saber	ridpiPr
3.3.2	htN7q8W	Aucupes , et Piscatores <b> non sunt eligendi ad huiusmodi opera : </b> eo quod non habeant artem conformem operibus bellicosis .	e los bretadores <b> que toman los paxaros con el brete | e los pescadores no son do escoger </b> para las obras de la batalla	ywnJN09, nVzSUpA
3.3.4	pMvol5K	et feriendi valde est expediens bellatoribus . <b> Qualiter , autem talis industria habeatur , et qualiter sit feriendum hostem , </b> et quae adminiculantur ad ista ,	mucho es conuenible a los lidiadores <b> Mas en qual manera tal sabiduria se puede auer | e en qual manera han de ferir alos enemigos </b> e otras cosas que se ayuntan a estas adelante paresçra Lo . viij°	pUaXly9, qsmFqtw
3.3.4	jQPJHtX	et pro communi bono exponenda est periculo corporalis vita , <b> non est cauenda effusio sanguinis , </b> et caetera alia sunt fienda ,	es de poner la vida corporal a periglo de muerte <b> e non deue foyr | nin auer miedo de esparzer la sangre </b> e todas las otras cosas dichas	yqRubiu, lNp13fp
3.3.4	lQCiW1b	non est cauenda effusio sanguinis , <b> et caetera alia sunt fienda , </b> per quae iustitia et commune bonum defendi potest .	nin auer miedo de esparzer la sangre <b> e todas las otras cosas dichas </b> que son de fazer	pEYACHy
3.3.6	q7W7aHT	propter inexercitium armorum <b> non sunt industres in bellis . </b> Exercitium enim in quolibet negocio praebet audaciam ,	por non auer vso de las armas <b> non son sabidores en las faziendas . </b> Ca el vso en cada vn negocio	ci9rKKh
3.3.7	jvf1Kpw	Rursus , non solum arma , <b> sed etiam plura alia sunt ferenda in bello : </b> ideo etiam ad maiora pondera	Otrossi non solamente son de vsar los lidiadores a leuar las armas . <b> mas avn a otras muchas cosas | que son de leuar en las batallas . </b> Et por ende prouechosa cosa es de se acostunbrar los lidiadores a leuar grandes pesos .	d0uP9fg, gFVhQTD
3.3.8	olDTWHc	quis superabundare cautelis . <b> In pugna enim omnino est eligendum , </b> maiorem diligentiam habuisse	que mas non sean menester . <b> Ca en la batalla sienpre auemos de tomar mayor acuçia </b> de que demandan las batallas .	lXawdoL
3.3.8	oTUyRaV	quod contra suos victores vix aut nunquam audent bella committere . <b> Quare si in bellis omnino est superabundandum cautelis , </b> non est praetermittendum	e apenas o nunca osan acometer batalla contra ellos . <b> Por la qual cosa si en las batallas auemos de auer muchas cautellas </b> non deuemos dexar qual si quier cosa que sea aprouechosa a la hueste en qualquier caso .	q3Us3NV
3.3.8	opWb33O	quomodo huiusmodi monitiones <b> et castra sunt construenda . </b> Nam si hostes sunt absentes	finca de demostrar en qual manera las tales guarniciones <b> et los tales castiellos se deuen fazer . </b> Ca si los enemigos non estudieren cerca de ligero pueden fazer carcauas çerca de la hueste	yf6acN0
3.3.8	wH2lbFT	inter quorum spatium est exercitus collocandus , <b> tria sunt consideranda , </b> videlicet situs , forma ;	deue estar assentada la hueste toda . <b> Et por ende son de penssar tres cosas . </b> Conuiene a saber el assentamiento	m73K2fV
3.3.9	uC33NfC	quantum ad praesens spectat <b> sex sunt attendenda : </b> sicut etiam ex parte auxiliorum	que lidian quanto pertenesçe a lo presente <b> son seys cosas de penssar . </b> Assi commo avn de parte de las ayudas	ucZ13He
3.3.9	ckA4N2v	sex alia enumerari possunt , <b> quae etiam sunt attendenda . </b> In uniuerso igitur rex ,	otras seys cosas <b> las quales avn son de penssar . </b> Et pues que assi es en general el rey o el prinçipe	pTb1uf6
3.3.9	u36ZoAW	et duriores corpore . <b> Quinto , qui sunt industriores , </b> et sagaciores mente .	e mas duros en el cuerpo . <b> Lo quinto quales son mas sabidores </b> e mas arteros para lidiar .	dXxBTCm
3.3.9	t9x3hVS	ut dimicare non possint . <b> Sexto est attendendum , </b> qui plures auxiliatores expectant .	contra si resçiben daño de los oios en manera que non pueden lidiar . <b> Lo vi° es de penssar quales esperan mayores ayudas . </b> ca si los enemigos esperan mayores ayudas	xDCjMG3
3.3.9	jXhIgvD	Nam si hostes plura expectant auxilia , <b> vel non est bellandum , </b> vel acceleranda est pugna .	ca si los enemigos esperan mayores ayudas <b> o non conuiene de </b> lidiaro conuiene de apressurar la batalla .	eEg2IgK
3.3.10	mB1cFk4	et ignorantes ad quid deberent attendere : propter quod si in debellatione vita multorum hominum periculis mortis exponitur , <b> cum magna diligentia vexillifer est quaerendus . </b> Ex dictis etiam patere potest ,	es puesta a periglos de muerte <b> con grant acuçia | e con grant diligençia </b> deue ser escogido el alferes .	r55BAzq, iYTVx54
3.3.11	pAfWKRr	de quorum consilio agat <b> quicquid viderit ipse dux belli esse fiendum . </b> Nam ubi tantum currit periculum ,	de cuyo conseio faga todas aquellas cosas <b> que ouiere de fazer . </b> Ca do puede contesçer tan grant periglo	t8CkFCd
3.3.11	uUf1hCi	Itaque cum pericula visa minus noceant , <b> per velocissimos equites sunt detegendae insidiae , </b> ne exercitus circa aliquam partem ex improuiso patiatur molestias .	Et por ende por que los periglos que son ante vistos menos enpeesçen . <b> por caualleros muy ligeros son de descobrir las çeladas </b> por que la hueste non aya de resçebir a desora en alguna parte algunos daños .	sprrK4i
3.3.12	w8SQS3E	ut se defendant : <b> tunc est construenda acies </b> secundum rotundam formam ;	Mas cunpleles que se puedan defender . <b> Estonçe es de establesçer el az </b> segunt forma redonda .	lQ8lCUq
3.3.12	jM1APe9	secundum formam quam appellant conum , <b> id est secundum figuram pyramidalem et acutam , </b> ut possit hostes scindere et diuidere .	segunt forma que llaman cuño <b> o segunt forma de pera e aguda . </b> por que puedan fender	vLAXheb
3.3.13	mPd6nZo	Ostenso qualiter sunt acies ordinandae et construendae , <b> reliquum est ostendere , </b> qualiter pugnantes percutere debeant ,	m mostrado en qual manera son de establesçer <b> e de ordenar las azes fincanos de mostrar en qual manera los lidiadores deuen ferir </b> e si es meior de ferir cortando o ferir de punta o estocando .	k1cLT7i
3.3.14	yvIcP1p	cum modo opposito se habent , <b> sunt inuadendi et debellandi . </b> Primo igitur dux belli per insidias	quando son las maneras contrarias <b> de aquellas siete son de acometer e de ferir . </b> Et pues que assi es lo primero el señor de la batalla por ascuchas	thcLlve
3.3.14	bySSDtU	ponat eam Vegetius , <b> non multum est appretianda : </b> quia repugnaret bonis moribus .	Mas esta cautela commo quier que la ponga vegeçio <b> non es mucho de preçiar </b> por que es contraria a buenas costunbres .	cyr5yan
3.3.15	dHeiSjZ	Inde est quod laudatur Scipionis sententia , dicentis : <b> Nunquam sic esse claudendos hostes , </b> quod non pateat eis aditus fugiendi .	Et por ende es alabada la sentençia de çipion <b> por la qual dizia que nunca eran de encerrar los enemigos </b> assi que les non fincasse logar para foyr .	vbpD1YQ
3.3.15	zOJs3Bg	Restat nunc tertio declarare , <b> qualiter sit declinandum a pugna , </b> si non habeatur consilium ,	finca nos agora lo terçero de mostrar <b> en qual manera se deuan arredrar de la batalla </b> si non ouieren conseio de lidiar	bwyIu0D
3.3.15	qYjEGhN	Nam et si dux consilium habeat <b> non esse pugnandum , </b> debet hoc valde paucis patefacere ,	La primera es de parte de la su hueste propria . <b> Ca si el cabdiello ouiere conseio de non lidiar . </b> esto deue dezir en su poridat a muy pocos	d7YshPp
3.3.16	x0zTvxZ	Amplius si post bellum <b> et pugnam munitiones sunt obtinendae , </b> melius est hoc agere aestiuo tempore .	por fanbre e por mengua . <b> Otrossi si por batalla o por lid son de ganar las fortalezas </b> meior es de acometerlas en este tienpo .	csgOxqy
3.3.17	yyjeC5V	quod viae subterraneae <b> semper sunt muniendae tabulis et aliis artificiis , </b> ne cadat terra	que las cueuas soterrañas <b> deuen ser sotenidas de tablas | e de otros artifiçios </b> e de otros apoyamientos	mXmdLji, qS447vB
3.3.18	gaDqVDm	et eleuans virgam machinae , <b> ad quam coniuncta est funda , </b> qua lapides iaciuntur .	e leuante el pertegal del engennio <b> al qual pertegal esta </b> atada la fonda en que enbia las piedras .	qW7MDhZ
3.3.20	dxYTAVn	Nam in munitione fienda <b> non solum est quaerenda bonitas situs , </b> et angularitas murorum ,	Ca en la fortaleza que es de fazer <b> non solamente es de catar la bondat do esta assentada </b> e que sean los muros fechos de esquinas .	wD6FGLj
3.3.20	btTm0VZ	circa munitionem illam , <b> vel est aliunde terra apportanda , </b> et ponenda in illo spatio intermedio .	las quales carcauas son de fazer enderredor de la fortaleza e de los muros <b> o ssi alli non ouiesse tierra deue se traer de otra parte </b> e deuesse echar entre el espaçio	i6OewJx
3.3.21	zKuNNcr	nisi sciatur <b> quomodo sunt muniendae , </b> ut non de facili vinci possint .	e commo deuen ser assentadas <b> sil non sopieremos commo son de bastecer </b> por que non puedan de ligero ser tomadas .	y9BG7pd
