Localisation	Id. source	Segment source	Segment cible	Id. cible
1.1.9	oxd7DIZ	e muestre algua bondat de fuera <b> por la qual cosa commo al Rey conuenga ser todo diuinal e semeiante a dios </b> si non es cosa conuenible	quod exterius bona praetendat . <b> Quare cum Regem deceat </b> esse totum diuinum ,	j18mKXK
1.2.1	w26STq8	e la su bien andança . <b> Et que non los conuiene poner la su fin en riquezas </b> nin en poderio çiuil	suam felicitatem debeant ponere , <b> quia non decet | eos suum finem ponere in diuitiis , </b> nec in ciuili potentia ,	qBYaESG, qFbMCPZ
1.2.5	vkDV8KB	assi commo son las passiones dela saña . <b> Conuiene dar alguna uirtud en las passiones </b> por la qual las passiones non nos pueden mouer	ut passiones irascibiles : <b> circa passiones oportet | dare virtutem aliquam , </b> ne passiones nos impellant	rA3Avx7, e0hw29D
1.2.10	rJ8JB6k	assi conmosi quisiere auer mas de aquellos bienes <b> de quanto le conuiene auer </b> por esta razon viene danno alos otros çibdadanos	ut quod velit habere plus de iis , <b> quam eum deceat : </b> ex hoc infertur nocumentum aliis ciuibus :	xrTiQGf
1.2.18	xGRKpuc	que si espendiere <b> do non le conuiene espender </b> Mas los Reyes e los prinçipes de suranse	ubi oportet , <b> quam si expendat | ubi non oportet . </b> Deuiant autem a liberalitate Reges ,	dKm0FUJ, hWkzqc3
1.3.6	qoHCUA1	en el primero libͤ de los grandes morales . <b> Et pues que assi es conuiene deuer </b> en qual manera conuiene alos Reyes de sertemosos	non est fortis , sed satuus . <b> Oportet ergo videre </b> quo modo eos esse deceat timidos , et audaces .	jrWLWKK
2.2.2	h1q7blt	e en algun sennorio <b> en quel conuiene gouernar los otros </b> mucho les conuiene de ser sabios e buenos .	et in aliquo dominio , <b> in quo oportet eos alios gubernare ; </b> maxime decet eos esse prudentes et bonos .	gbtoUWJ
2.3.20	jY5FJcA	Et pues que assi es los Reyes <b> e los prinçipeᷤ alos quales conuiene ser muy tenprados </b> e guardar la orden natural en toda	Reges ergo et Principes , <b> quos decet maxime temperatos esse , </b> et obseruare ordinem naturalem	gzM6GsW
