Localisation	Id. source	Segment source	Segment cible	Id. cible
3.2.31	xJ2xBkN	dato etiam quod occurrant leges aliquae <b> quae videantur esse magis proficuae et meliores . </b> Adducit autem Phil’	puesto avn que algunas leyes fuessen falladas <b> que paresçiessen ser mas aprouechosas e meiores . </b> Mas el philosofo enel quarto libro delas politicas pone quatro razones	gc5Pwx5
3.2.31	kLC5WVv	nam esse vestitum videtur contrariari <b> ei quod est esse nudum . </b> Secundum hunc modum loquendi loquuntur Iuristae ,	e la uestidura es contra a natura <b> Ca ser el omne uestido paresçe contrario a aquello que es ser de sudo . </b> Et segunt esta manera de fablar fablan los iuristas del derecho natural	fGrxpJN
3.2.34	z5eZkRh	et secundum dictum Homeri , <b> est esse magis bestiam , </b> quam hominem .	e segunt el dicho comun de los omes <b> es mas ser bestia que omne . </b> Por la qual cosa los que non guardan las leyes	eduyY58
3.2.36	wF06AXN	ut Reges diligantur a populo , <b> decet eos esse iustos , et aequales . </b> Nam maxime prouocatur populus ad odium Regis ,	La terçera cosa para que los Reyes sean amados del pueblo <b> es quales conuiene de ser derechureros e eguales . </b> Ca el pueblo mayormente se le una taria a mal querençia del Rey	gTa4gNP
3.3.1	w1Npbeg	hunc totalem librum diuisimus in tres libros . <b> Quia in primo libro docuimus Regem esse prudentem </b> prout Rex aut Princeps est quaedam persona in se ,	e los prinçipes partimos este libro todo en tres libros <b> Ca en el primero libro mostramos al Rey ser sabio </b> en quanto el Rey	mPJmZcl
3.3.1	wCflwYu	Quare sicut nullus efficiendus est magister in aliis scientiis , <b> nisi constet ipsum esse doctum in arte illa : </b> sic nullus assumendus est	si non fuere çierto <b> que el es ensseñado en aquella sçiençia | de la qual ha de ser maestro . </b> En essa misma manera ninguno non deue ser tomado	dAodJ3R, wcjUTZP
3.3.3	whFOMBa	Viso in qua aetate assuescendi sunt <b> qui debent effici bellatores </b> ad actiones bellicas :	Visto en qual hedat son de acostunbrar a obras de batalla <b> aquellos que se deuen fazir caualleros e ser lidiadores . </b> finca de ver por quales señales se han de conosçer los buenos lidiadores .	hhTBYNq
3.3.3	iTtEnaG	homines similiores animalibus bellicosis , <b> utiliores videntur esse ad bellum . </b> Tribus igitur generibus signorum	que son semeiantes masa las animalias lidiadoras <b> paresçe ser mas prouechosos para la batalla . </b> Et pues que asy es	kFH75go
3.3.4	bsSicLy	propter quod tales debent <b> esse homines pugnatiui , </b> ut diu tolerare possint	para dar las feridas . <b> Por la qual cosa tales deuen ser los omnes lidiadores </b> que prolongadamente puedan sofrir el andar	wT5Xx5C
3.3.5	qbsg4tI	diuersi eligendi sunt bellatores . <b> Potest enim esse pugna pedestris , et equestris . </b> In pedestri itaque certamine	son de escoger departidos lidiadores . <b> Ca la batalla puede ser de omnes de pie o de omnes de cauallo . </b> Et por ende en la batalla de los peones	h5aPq2z
3.3.6	a4rxuVu	propter particularium inexperientiam <b> esse imprudentem in aliquo . </b> Unde multotiens contingit ,	por non auer prueua de las cosas particulares <b> de non ser sabio en otra cosa . </b> Onde muchas vezes	oZkec2h
3.3.6	e10doXC	et pedites , et etiam milites , <b> si contingat eos pedestres esse , si volunt boni bellatores existere , </b> sic ab ipsa iuuentute exercitandi sunt ad saliendum ,	Et los peones <b> e avn los caualleros si contesçiere que ellos esten de pie | si quieren ser buenos lidiadores </b> conuiene que en su mançebia sean usados a saltar	lIkTott, quP2LYx
3.3.8	qcQBhRp	munitiones et fossas fiendas circa exercitum debere <b> habere formam quadrilateram oblongam . </b> Attamen quia figura circularis est capacissima ,	que son de fazer çerca de la hueste <b> deuen ser quadradas e luengas . </b> Enpero por que la forma redonda conprehende	x2iSkTa
3.3.8	a1t1JuG	quod si non immineat magna vis hostium , <b> fossa debet esse lata pedes nouem , alta septem . </b> Sed si aduersariorum vis acrior imminet ,	diziendo que si paresciere grant fuerça de los enemigos . <b> la carcaua deue ser muy ancha de nueue pies e alta de siete . </b> Mas si la fuerça de los enemigos paresciere mas fuerte conuiene de fazer las carcauas mas anchas et mas fondas	a2hUeyh
3.3.9	tOCtlKl	Considerato enim bello in uniuersali , <b> omnes volunt esse boni bellatores , </b> sed postquam veniunt	Ca penssada la batalla en general <b> todos quieren ser buenos lidiadores </b> mas despues que vienen a la prueua de los fechos particulares	b6fOEc4
3.3.16	vQSr0tr	quia sicut contingit <b> esse pugnam in terra , </b> sic contingit eam esse in aquis .	naual de las naues e de la mar . <b> Ca assi commo contesçe de ser batalla en la tierra </b> assi contesçe de ser en las aguas .	jlofIgz
3.3.16	gkwfhYx	contingat obtineri et deuinci munitiones et urbanitates : <b> restat dicere quot modis talia deuinci possunt . </b> Est autem triplex modus obtinendi	e los castiellos e fortalezas . <b> fincanos de dezir | en quantas maneras tales fortalezas pueden ser vençidas . </b> Et conuiene de saber	fMsCCeQ, szhvWlF
3.3.20	hxu7XRJ	Rursus supra cataractam debet <b> esse murus perforatus recipiens ipsam , </b> per quem locum poterunt proiici lapides ,	Otrossi sobre las puertas de la trayçion <b> deue ser el muro foradado de guisa | que la puedan leuantar arriba et baxarla cada que quisieren . </b> Et por aquel logar pueden lançar piedras .	tfQkSjJ, yCUZBZm
3.3.23	oho2VzK	cum quo teruntur muri ciuitatis obsessae . <b> Debet autem sic ordinari lignum illud , </b> ut ligamentum retinens	que sea tal commo el carnero con el qual suelen quebrar los muros de la çibdat çercada . <b> Et deue este madero | assi ser ordenado </b> que con el atadura	oiWk9XY, xc0PcVF
