Localisation	Id. source	Segment source	Segment cible	Id. cible
1.2.13	rxtcR8Z	dize <b> que la fortaleza es cerca los temores repremiendo los </b> e cerca las osadias res renando las	circa timores , et audacias . <b> Magis tamen est | circa timores reprimendo eos , </b> quam circa audacias moderando ipsas	h4KB9vZ, ndB8pE0
1.2.18	hTBF5bY	nin por la razon que deue . <b> por la qual razon commo el gastador non sea amador de los </b> desbien commo el libal non lo es de ligero se puede fazer	et cuius gratia debet . <b> Quare cum prodigus non sit amator pecuniae , </b> sicut nec liberalis ,	cFmoqwl
1.2.25	tFkFcO3	e cerca los grandes bienes contesçe de pecar en dos maneras ¶ <b> Lo primero si mas que la razon e el </b> entendimientomanda nos tiremos de aquellas cosas	et circa magna bona dupliciter contingit peccare . <b> Primo , si ultra quam ratio dictet </b> prosequamur ea inquantum bona sunt .	kBqea4q
2.3.3	u73zMbF	¶ <b> Lo terçero de los dineros ¶ Lo </b> quartode los siruientes mas entre todas las otras cosas	Secundo determinabitur de ipsis possessionibus . <b> Tertio de numismatibus . </b> Quarto de ministris .	fblrGqD
2.3.5	fyJsBw1	en el primero libro delas politicas <b> la possession de las cosas es neçessaria en el </b> gouernamientode la casa si alguno quisiere beuir uida politica .	sed secundum Philosophum primo Polit’ <b> necessaria est rerum possessio in gubernatione domus , </b> si quis debeat politice viuere ;	s8BjThb
3.1.7	jyqzK6J	assi commo dizen los caçadores <b> comunalmente son meiores las fenbras que los mas los </b> e por ende los mas los valen menos que las fenbras .	ut dicitur , <b> sunt omnes foeminae , </b> quarum masculi sunt viliores eis .	buM7djh
3.2.23	cDc8o8O	que nos auie fech <b> por ende el pho en el primero libro de la </b> rectorica quariendo enduzir los iuezes a misericordia	quam iniuriae illatae . <b> Ideo Philos’ 1 Rhet’ </b> volens iudicantes	gh7MYj1
