Localisation	Id. source	Segment source	Segment cible	Id. cible
1.2.19	gNDcZ2v	et moderans consumptiones . <b> Et sicut liberalitas est faciens sumptus , </b> et dationes proportionatas facultatibus :	e tienpra los consumimientos e destruymientos . <b> Et assi commo la libalidat faze espenssas </b> e da dones conuenibles a las riquezas	r4ZtO0q
1.2.19	uwzHtRN	et dationes proportionatas facultatibus : <b> sic magnificentia est faciens sumptus decentes magnis operibus . </b> Viso quid est magnificentia :	e da dones conuenibles a las riquezas <b> assi la magnificençia faze espenssas conuenibles alas grandes obras ¶ </b> visto que cosa es la magnificençia	jIaagbk
1.2.20	jogsMTI	quod quaecunque facit paruificus , <b> semper facit tardans . </b> Videtur enim ei ,	que faze el paruifico <b> sienpre las faze tardando . </b> Ca paresçe leal paruifico	ixL4Rwk
1.2.22	hqYZTFZ	Sicut igitur circa ipsa bona utilia est duplex virtus <b> una respiciens magnos sumptus , </b> ut magnificentia ,	Por enl de assi commo çerca los bienes aprouechosos son dos uirtudes . <b> La vna que cata alas grandes espenssas </b> assi commo es la magnificençia .	cgmXmBx
1.2.22	fzUKkbk	ideo est virtus <b> quaedam reprimens auaritias , </b> et moderans prodigalitates :	Por ende es dicha uirtud <b> que repreme las auariçias </b> e tienpra los gastamientos en espender .	wm4URiG
1.2.22	vTYottA	quaedam reprimens auaritias , <b> et moderans prodigalitates : </b> sic magnanimitas ,	que repreme las auariçias <b> e tienpra los gastamientos en espender . </b> En essa misma manera la magnanimidat	cyUsqeM
1.2.22	vky6Ssn	et praesumptionem , <b> est virtus quaedam reprimens pusillanimitates , </b> et moderans praesumptiones .	es dicha uirtud <b> que repreme las pus illanimidades | que son flaquezas de coraçon </b> e tienpra las presunpçiones	l0YFRzA, l0s5jji
1.2.22	yJ5Z3fo	est virtus quaedam reprimens pusillanimitates , <b> et moderans praesumptiones . </b> Viso quid est magnanimitas ,	que son flaquezas de coraçon <b> e tienpra las presunpçiones | que son sobrepuiamientos </b> en cometer las grandes cosas	jJnYMQm, oifGNnJ
1.2.24	loorOqp	esse aliarum virtutum , et magnanimitatis . <b> Nam agens opera fortitudinis , </b> et aggrediens pugnam ,	Et pues que assi es essas mismas obras pueden ser delas otras uirtudes e dela magnanimidat . <b> Ca aquel que faze las obras dela fortaleza </b> e acomete la batalla	owsO9v9
1.2.24	cdvrGEp	Nam agens opera fortitudinis , <b> et aggrediens pugnam , </b> si hoc facit ,	Ca aquel que faze las obras dela fortaleza <b> e acomete la batalla </b> si esto faze por que se delecta en tales obras	b86cJzJ
1.2.24	cO5cGka	Nam cum honor inter exteriora bona sit bonum excellens , <b> faciens opera virtutum , </b> inquantum sunt honore digna ,	sea mas alto e meior bien <b> el que faze obras de uirtudes </b> en quanto son diguas de honrra	cVvjU7j
1.2.25	ddbH44K	aeque principaliter <b> et per se non est eadem virtus retrahens et impellens : </b> nec est eadem virtus principaliter moderans passiones ,	que vna uirtud egualmente <b> e por li nos tire | e nos allegue a aquello </b> que dize la razon	sSuh7el, voDswpB
1.2.25	amfJXeW	et per se non est eadem virtus retrahens et impellens : <b> nec est eadem virtus principaliter moderans passiones , </b> et impellens nos	que dize la razon <b> nin es vna uirtud prinçipal | que tienpra las passiones </b> que nos allegan	wq4k492, weqFodv
1.2.25	oZSvFWJ	nec est eadem virtus principaliter moderans passiones , <b> et impellens nos </b> ab eo quod ratio vetat .	que tienpra las passiones <b> que nos allegan </b> a aquello que la razon vieda e que nos tira de aquello que la razon manda .	lux0Nl7
1.2.25	j7Czl7K	Ideo humilis dicitur alios reuereri , <b> quia considerans proprios defectus , </b> in rebus licitis et honestis alios reueretur .	que ha en reuerençia alos otros <b> por que cuydando en los sus desfallesçimientos propios en las cosas conuenibles e honestas . </b> faze reuerençia alos otros ¶	ctpFqgS
1.2.25	uFPK8O0	Humilitas vero principaliter moderat ipsam spem , <b> ne aliquis nimis sperans de ipso bono , </b> ultra rationem prosequatur magnos honores .	Mas la humildat prinçipalmente tienpra la esꝑanca <b> por que alguno auiendo grand esperança del bien </b> non vaya en pos grandes honrras	pt25iph
1.2.25	poI0njV	quia ille dicitur humilis , <b> qui moderans spem ipsam </b> ad adipiscendum honores magnos ,	por que aquel es dicho humildoso <b> que tienpra la esperança de ganar grandes honrras </b> e va a ellas medianeramente .	rsC17gB
1.2.25	bhgeyGq	cum virtute <b> illa quam Philosophus distinguens a magnanimitate appellat eam honoris amatiuam ? </b> Non est praesentis speculationis .	sinplemente con aquella uirtud <b> la qual el philosofo aparta dela magnanimidat | e llama la amadora de honrra . </b> Esto non es de esta presente arte	xWQLzxf, ymst5VT
1.2.26	gyTBBWv	magnanimitas magis est <b> virtus impellens in magna , </b> quam retrahens nos ab illis .	mas es uirtud <b> quanos allega | e nos esfuerca a cosas grandes </b> que non retrayendo nos dellas .	ceQoNyw, uL1XQLQ
1.2.26	ovefL6j	virtus impellens in magna , <b> quam retrahens nos ab illis . </b> Principalius ergo magnanimitas reprimit desperationem ,	e nos esfuerca a cosas grandes <b> que non retrayendo nos dellas . </b> Et pues que assi es mas prinçipalmente la magnanimidat repremela deses paracion	nTPAiWY
1.2.26	lOeYQzb	Nam ( ut patet ex dictis ) <b> magnanimitas est virtus non impellens , </b> ne ratione difficultatis retrahamur ,	Ca assi commo paresce delas cosas <b> ya dichas lama granimidat es uirtud | que nos allegua </b> e nos esfuerca	x9gqf84, zu2LL59
1.2.26	ve7g313	Sic etiam ex dictis patet , <b> quod humilitas est virtus nos retrahens , </b> ne ratione bonitatis et delectabilitatis ,	assi commo ya dicho es paresçe <b> que la humildat es uirtud | que nos tira </b> por que non siguamos las grandes honrras	xUyxBLl, upsp5AT
1.2.26	xvv7bBj	Est enim hoc notabiliter attendendum , <b> quod cum virtus magis sit retrahens quam impellens , </b> principaliter opponitur superabundantiae ,	que quando la uirtud . <b> mas nos trahe e tira | que nos allega e esfuerca . </b> Estonçe prinçipalmente	zqx1nk5, zoXuwaQ
1.2.26	zcLwPv4	per quem retrahimur . <b> Sed quum virtus magis est impellens quam retrahens , </b> e contrario se habet :	por el qual somos retraydos e tirados dellas <b> mas quando la uirtud mas es allegante </b> e esforcante que retrayente nin tirante hase en manera contraria	iSv0d7A
1.2.26	pXNgq56	Magnanimitas ergo , <b> quia est virtus impellens in ardua bona , </b> magis opponitur pusillanimitati ,	Et pues que assi es la magnanimidat <b> por que es uirtud allegante | e esforcante nos alos bienes muy altos </b> mas es contraria ala pusillanmidat	fnrB6Sp, wupPail
1.2.26	w5KJNbm	magis opponitur pusillanimitati , <b> quae est defectus nos retrahens </b> e talibus bonis ,	mas es contraria ala pusillanmidat <b> que es fallescemiento | que nos retraye </b> e tira de tales bienes	apOFcHt, m2uB1Yx
1.2.26	sRqFTcE	quam opponatur praesumptioni , <b> quae est excellentia expellens nos in illa . </b> Sed humilitas e contrario ,	que alla presup̃çion <b> que es dela sobrepuiança | qua nos allegua a aquellos bienes </b> mas la humil dat faze todo lo contrario	hbu2wvx, le2rVk6
1.2.26	brX1mVF	Sed humilitas e contrario , <b> quia est virtus retrahens , </b> ne ultra rationem	mas la humil dat faze todo lo contrario <b> por que es uirtud | que nos retraye </b> por que non podamos seguat las sobrepuianças e las honrras .	iOU4bgj, sSXJYt2
1.2.26	ioWV1Bq	Secundo decet eos esse humiles ratione operum fiendorum . <b> Nam superbus quaerens suam excellentiam ultra quam debeat , </b> ut plurimum tendit	que han de fazer . <b> Ca el sobra uio demandado | e quariendo su excellençia e sobrepuiamiento </b> mas que deue	qJfb8s4, iXukAzm
1.2.28	iF1SWJm	Viso quid est amicabilitas , ut hic de ea loquimur , <b> quia est uirtus reprimens litigia , </b> et moderans blanditias ,	segunt que della fablamos aqui . <b> ca es uirtud | que repreme las peleas </b> et tienpra los falages .	nPrkBQI, o7nGIYB
1.2.28	fvOTVnh	quia est uirtus reprimens litigia , <b> et moderans blanditias , </b> ut potest haberi	que repreme las peleas <b> et tienpra los falages . </b> assi commo el philosofo dize en el segundo	wbCtTEb
1.2.29	vbR0Zyw	haec autem communi nomine Veritas nuncupatur . <b> Patet ergo quid est veritas : quia est virtus moderans despectiones , </b> et reprimens iactantias .	Et pues que assi es paresçe <b> que cosa es la uerdat | ca es uirtud </b> que tienpra los despreçiamientos	j7G8Ne4, vqglqL8
1.2.29	osP0EEh	Patet ergo quid est veritas : quia est virtus moderans despectiones , <b> et reprimens iactantias . </b> Viso quid est veritas ,	ca es uirtud <b> que tienpra los despreçiamientos </b> e repreme los alabamientos ¶visto que cosa es la uerdat finca de veer	tLm6jNI
1.2.29	dfGK3C2	ne homines sint aliis onerosi . <b> Hanc autem rationem tangit Philosophus in eodem 4 Ethicorum dicens , </b> declinandum esse in minus	por que los omes non sean alos otros pesados e guaues . <b> Et esta razon misma tanne el philosofo en esse mismo quarto libro delas ethicas </b> o dize que deuemos	zZK8gPX
1.2.30	kUOJG4S	et ut hic de ea loquimur , <b> quia est reprimens </b> superfluitates ludi ,	Et segunt que della aqui fablamos <b> por que es uirtud </b> que repreme las superfluydades del iuego	eYIseN7
1.2.30	am7oLxZ	superfluitates ludi , <b> et moderans duritias . </b> Huiusmodi autem virtus habet esse	que repreme las superfluydades del iuego <b> et tienpra la menguas e los fallesçimientos del . </b> Et pues que assi es esta tal uirtud ha de seer tan bien	nkc8t8f
1.2.31	dbrpJ9I	habet perfectam prudentiam : <b> sed habens perfectam prudentiam , </b> habet omnem virtutem :	ha acabadamente la pradençia e la sabiduria <b> Mas aquel que ha acabadamente la pradençia </b> e la sabiduria ha todas las uirtudes morales	xEzXItc
1.2.31	oT1q2Jh	habet omnem virtutem : <b> ergo habens aliquam virtutem , </b> habet omnem virtutem .	e la sabiduria ha todas las uirtudes morales <b> Por ende aquel que ha alguna uirtud </b> ha todas las uirtudes .	tPDKKad
1.2.31	kutz6X5	non tamen oportet <b> quod habens perfecte unam virtutem moralem , </b> habeat omnes virtutes morales .	Enpero non conuiene <b> que aquel que ha vna uirtud moral </b> aya todas las uirtudes morales	zYPVTrk
1.2.32	m1bhZLW	et ipsum parabat in conuiuium , <b> spondens quod quando vellet conuiuium facere , </b> ei suum filium tribueret .	e aprestaual para fazer el conbit <b> et prometial que quando quisiesse fazer conbit </b> que el qual daria su fijo	i3cE2dX
1.2.32	vWxbOQZ	appellatur a Philosopho heroica <b> idest principans , et dominatiuat . </b> Ex hoc ergo manifeste patet ,	es llamada del philosofo eroyca <b> que quiere dezir prinçipante e sennor ante | por que es señora delas otras uirtudes </b> ¶ Et pues que assi es por esto paresçe manifiestamente que los Reyes	oa7yT2s, mZZBTNH
1.2.32	p76gRx9	quod Reges , et Principes <b> si debens recte dominari , </b> non sufficit eos fugere omnes gradus malorum ,	¶ Et pues que assi es por esto paresçe manifiestamente que los Reyes <b> e los prinçipes si derechamente deuen ensseñorear </b> non les abasta a ellos de foyr	a5SLewI
1.2.32	gFKanng	oportet quod habeant virtutem illam , <b> quae est dominans </b> et principans respectu aliarum ,	Conuienele que aya aquella uirtud <b> que es sennora e prinçipante a todas las otras uirtudes . </b> la qual quando la ouieren seran buenos	yzSvAES
1.2.32	p24hFQD	quae est dominans <b> et principans respectu aliarum , </b> et sint boni ultra modum aliorum ,	Conuienele que aya aquella uirtud <b> que es sennora e prinçipante a todas las otras uirtudes . </b> la qual quando la ouieren seran buenos	yzSvAES
1.2.33	bEuGDSk	et cognoscat defectum suum , <b> videns vitam et perfectionem principantis . </b> Quare apud Reges et Principes	que cada vno de los sus subditos tome del forma e manera de beuir <b> e conosca can vno su mengua veyendo la uida </b> e la grant perfeçion del prinçipe e del señor .	nmbKR6v
1.2.34	z2ybPDN	quam sit virtus . <b> Unde Philosophus 7 Ethicorum loquens de hac virtute , </b> ait , quod non est virtus ,	que uirtud <b> ¶ Onde el philosofo en el septimo libro delas etl sfablando desta uirtud dize </b> que non es uirtud	zI3meQ5
1.3.1	lCYJ81h	quia omnis passio <b> et omnis motus animae pertinens ad concupiscibilem , </b> vel sumitur respectu boni ,	assi se puede tomar <b> por que toda passion | e todo mouimiento del alma </b> que pertenesçe al appetito desseador o se torna en conparaçion de algun bien	cJQfX9r, aFoA8bB
1.3.3	rNXXW5U	ex consequenti autem <b> et quasi per accidens intendit bonum commune , </b> inquantum ex bono communi	ca prinçipalmente entiende en el su bien propio mas despues desto <b> e assi conmo por açidente entiende en el bien comun </b> en quanto del bien comun se leunata a el algun bien ppreo .	l1q1je2
1.3.3	cuLET5D	Immo quia speciali modo Rex <b> et quilibet principans est minister Dei et persona publica et communis , </b> speciali modo spectat ad Reges	Mas avn por que en espeçial manera el rey <b> e cada vn prinçipe es ofiçial de dios | e ꝑson a publica e comun . </b> espeçialmente ꝑtenesçe alos Reyes	tcX5DXS, g1CEQNv
1.3.4	d4ATPpG	ut est oditum , <b> est aliquid displicens </b> et difforme voluntati nostrae :	que non nos plaze <b> e es cosa non conformada </b> nin conuenible ala nuestra uoluntad .	rgcjvzj
1.3.6	y2vKVrM	Timor autem si moderatus sit , <b> expediens est Regibus et Principibus . </b> Moderato enim timore omnes principantes timere debent ,	e de ser osados <b> por que el temor si fuere tenprado es conuenible alos Reyes e alos prinçipes . </b> Ca por temor tenprado todos los prinçipes deuen temer	hR0bxad
1.3.6	iO6zC6g	sic cum quis timet , <b> calor existens in exterioribus membris , </b> statim confugit ad interiora ;	En essa misma manera <b> quando alguno teme la calentura natural | que esta en los mienbros de fuera </b> luego fuye alos mienbros de dentro .	kxcUU2q, wBljxVn
1.3.6	sqpHily	reddit hominem inoperatiuum . <b> Nam homo propter timorem immoderatum tremens </b> et obstupefactus immobilitatur ,	que non obre . <b> Ca el omne por el temor destenprado | e sin razon </b> trieme e esta atomeçido	uYwbisF, jl4ackU
1.3.7	gR1zaBM	quia iratus appetit contristare : <b> sed odiens appeti nocere . </b> Vult enim iratus	e de fazer triste a a qual contra quien a saña . <b> Mas el que quiere mal a alguno tenssea dele enpeçer . </b> Ca el sannudo quiere dar dolor e tsteza	y7UqZpb
1.3.7	ntrKbzP	inferre dolorem , et tristitiam : <b> sed odiens vult </b> inferre damnum , et nocumentum .	Ca el sannudo quiere dar dolor e tsteza <b> mas el mal quariente quiere fazer danno e enpeçemiento¶ </b> La quinta diferençia es	tY2ughS
1.3.7	bimceZU	Secundo , quia eam obnubilat . <b> Ira enim rationem praecedens </b> secundum Philosoph’	Lo segundo por quela sanna escuresçe <b> e a nunbla el entendimiento . | Ca la saña que es ante de la razon e del entendimiento </b> segunt el philosofo	yaZgFgU, yWpmWfs
1.3.7	n4O37ac	latrant , non distinguentes , <b> an veniens sit amicus , vel inimicus . </b> Sic et ira facit :	luego ladran <b> non departiendo nin conosçiendo si aquel que viene es amigo o enemigo . </b> Bien assi faze la saña .	vaYjf31
1.3.7	dc8omWg	ut vindictam exequatur , <b> non expectans super hoc iudicium rationis , </b> qualiter vindicta illa fieri debeat .	por que sea fecha uengança <b> non espando sobresto iuyzio delanrazon e del entendimiento </b> en qual manera esta uenganca deue ser fecha .	oz4DaYR
1.3.7	cRdukvS	Cauenda est ergo ira inordinata , <b> et rationem praecedens . </b> Sed si sequatur imperium rationis ,	que es de esquiuar la sanna desordenada <b> e aquella que viene ante iuyzio de la razon . </b> Mas si la sanna	xJnpgQU
1.3.8	x2YeeoA	absque delectatione aliqua nullus viuere potest . <b> Si ergo negans loquelam , </b> concedit loquelam	sin alguna delectaçon <b> Et pues que assi es | assi commo aquel </b> que niega la fabla otorga	eVzLEAJ, ygvnlIk
1.3.8	rEQXtdK	( ut patet per Philos 4 Metaphy’ ) <b> sic ponens omnem delectationem esse fugiendam , </b> ponit aliquam delectationem esse prosequendam .	en el quarto libro delas ethicas <b> En essa misma manera el que pone que toda delectaçiones de esquiuar e de foyr pone que alguna delectaciones de segnir . </b> Ca assy commo la fabla non puede ser negada sinon por la fabla .	rFnhTcd
1.3.8	l0jJnnM	nisi per loquelam , <b> negans loquelam , </b> loquitur :	ø	ø
1.3.8	wnIpzeF	ei omnem delectationem fugere ; <b> sequitur quod fugiens omnem delectationem , </b> sequatur aliquam delectationem .	si non fuere a el delectable de foyr toda delectaçion siguese <b> que aquel que fuye toda delectaçion </b> sigue algunan delectaçion .	tyUM1Wy
1.3.8	lXJCVAv	esse <b> quoddam pondus aggrauans animam . </b> Sicut ergo in pondere corporali	nono de las ethicas dize el philosofo por qui paresçe que latsteza es vn peso <b> que agua uia el alma </b> Et por ende assi commo en el peso corporal	bWOAFEL
1.3.8	avx4OsP	ideo eis amissis non dolebimus , <b> nisi forte per accidens , </b> inquantum per amissionem	Et por ende aquellos perdudos <b> non nos dolemos dellos sinon por auentura por accidente alguno en </b> quanto por perdimiento de aquellos bienes somos enbargados delas obras uirtuosas .	kPxyuT7
1.4.3	gLMS1Dj	prout disponitur , <b> existens in aliqua passione , </b> naturaliter passionatur passione illa .	qual quier que es inclinado naturalmente a alguna passion <b> assi commo aquel que esta puesto en aquella passion </b> natraalmente es passionado de aquella passion	qpKUVP4
1.4.4	jVUlRqp	fit remissio venereorum , <b> et concupiscientiarum . Constat enim quod concupiscens venerea per appetitum , </b> in alia se extendit .	fazese en el abaxamiento e atenpramiento delas cobdiçias dela luxͣia . <b> Ca cierça cosa es que aquellos que dessean la lux̉ia | por su appetito se estienden </b> e van a ella .	sSfwvsA, zEULLEs
2.1.1	eyeZ518	intelligendum est de cibariis aliis . <b> numquam cum homo existens </b> solus sufficit sibi	de todas las otras uiandas <b> por que nunca el omne estando señero puede conplir assy mismo </b> para auer viandas conuenibles	mrUKJpk
2.1.1	sEeB9fh	Ideo dicitur primo Politicorum <b> quod eligens solitariam vitam , </b> non est pars ciuitatis :	Et por ende dize el philosofo <b> en el primero libro delas politicas el que toma e escoge de beuir uida sola </b> e apartada non es parte dela çibdat	uoWFUBK
2.1.2	nIAVah8	Dubitare forte aliquis , <b> dicens nos scientiarum limites ignorare : </b> quia societas , siue communitas illa ,	ora uentura dubdaria alguno et diria <b> que nos non sabiamos los terminos destas sçiençias </b> por que aquellas conpania o aquella comunidat	ziFIjN6
2.1.3	sbpJ30a	Unde et Philosophus 1 Politicorum <b> comparans ciuitatem </b> ad vicum et domum ,	Onde el philosofo en el primero libro delas politicas <b> conparando la çibdat aluarrio </b> e ala casa dize	qAgsTUv
2.1.4	z82i7ko	In hac autem descriptione aliquid declaratum est <b> per praecedens capitulum , </b> et aliquid restat ulterius declarandum .	que se fazen de cada dia . <b> Mas en esta declaraçion alguna cosa es ya declarada en el capitulo </b> sobredich̃o Et alguna cola finca adelante de declarar .	zuS62Gl
2.1.4	j4XF5Tm	non solum est <b> expediens communitas domus , </b> sed et vici , ciuitatis , et regni .	por las cosas ya dichͣs en la uida humanal <b> non solamente es menester la comunidat dela casa </b> mas ahun la comunidat del uarrio e dela çibdat e del regno	jP53hce
2.1.4	pFViu1d	quam propter iam dictas , <b> sit expediens communitas ciuitatis , et regni , </b> in tertio libro plenius ostendetur .	que por las que ya dichos son <b> es menester la comunidat dela çibdat </b> e del regno esto se mostrara mas conplidamente en el terçero libro .	jFsEhyJ
2.1.5	dW0ClIB	( ut patet per Philosophus 1 Politic’ ) <b> qui deficiens intellectu , </b> pollet fortitudine corporali Seruus ergo ,	en el primero libro delas politicas <b> que fallesçe en el entondemiento </b> e ha mayor fortalleza en el cuerpo .	j4hx1sP
2.1.5	bXvUCdr	ut consequatur salutem per eum , <b> et ut dirigatur per ipsum . Nam deficiens intellectu , </b> est quasi coecus ,	por que alcançe salud por el <b> e por que sea enderescado por el en sus obras . | Ca el que fallesçe en el entendemiento es </b> assi commo çiego	worIST3, e1MQPyH
2.1.6	srKoRGL	aliquam bene ordinatam , <b> nisi aliquid sit ibi dirigens , </b> et aliquid directum :	Ca nunca podemos dar comunindat ninguna bien ordenada <b> si non fuere . </b> y algun gouernador o si non fuere	ekLJLTE
2.1.6	qJnY3ly	vel nisi aliquid sit <b> ibi principans , </b> et aliquid obsequens .	y algun gouernador o si non fuere <b> y alguno que sea senñor </b> e alguno que faga su mandado .	gIGeCkY
2.1.6	kyYT6fa	Quare cum in communitate maris et foeminae , <b> mas debet esse principans , </b> et foemina obsequens :	Por la qual cosa commo en la comunindat del uaron <b> et dela fenbra el uaron deua ser prinçipal et ordenador </b> e la fenbra obediente .	gNlFAvc
2.1.6	jDMKhuB	in communitate vero patris et filii , <b> pater debet esse imperans , </b> et filius obtemperans ;	Mas en la comunidat del padre <b> e del fijo el padre deua sienpre mandar </b> e el fij̉o ser obediente .	q8rBYhI
2.1.6	ptC7NwI	pater debet esse imperans , <b> et filius obtemperans ; </b> in communitate quidem domini et serui ,	e del fijo el padre deua sienpre mandar <b> e el fij̉o ser obediente . </b> Et en la comunidat del señor	dPTZRQ5
2.1.6	mW78hXI	in communitate quidem domini et serui , <b> dominus debet esse praecipiens , </b> et seruus ministrans et seruiens ,	Et en la comunidat del señor <b> e del sieruo el señor deue mandar </b> e el sieruo seruir e ministrar .	kltDlmD
2.1.6	a4iiGJl	dominus debet esse praecipiens , <b> et seruus ministrans et seruiens , </b> in domo perfecta	e del sieruo el señor deue mandar <b> e el sieruo seruir e ministrar . </b> Siguese que en la casa acabada	jZXbH9g
2.1.7	afJ7qOj	et quod homo naturaliter est animal coniugale . <b> Sciendum ergo quod Philosophus 8 Ethic’ volens </b> ostendere	esaianl coniugable e ayuntable en mater moino . <b> Et pues que assi es que el philosofo en el octauo delas ethicas </b> quariendo mostrar	jJOxgWz
2.1.7	oTKdjji	probat amicitiam illam esse secundum naturam : <b> adducens triplicem rationem </b> quod homo sit naturaliter animal coniugale .	que aquella amistança es segunt natura . <b> Et aduze para esto tres razones </b> que el omne sea naturalmente	mhjMNYl
2.1.7	eRwR5tj	Hanc autem rationem tangit Philosophus <b> 8 Ethic’ dicens : </b> Homo enim natura	Et esta razon tanne el philosofo <b> en el octauo libro delas ethas | do dize </b> e que el omne	n21TlB6, f09IogI
2.1.7	yT8g4zf	de societate politica , <b> videlicet quod eligens solitudinem , </b> et nolens ciuiliter viuere ,	conmodiziemos dela uida politica e de çibdat . <b> Conuiene a saber que el que escoge beuir solo </b> e non quiere beuir	rr9nq8f
2.1.7	dcgGX9r	videlicet quod eligens solitudinem , <b> et nolens ciuiliter viuere , </b> vel est bestia ,	Conuiene a saber que el que escoge beuir solo <b> e non quiere beuir | çiuilmente </b> este tal o es bestia o es assi commo dios	yztLr8T, bLVWnRc
2.1.7	e9OoPWh	sic et de coniugio dicere possumus . <b> Nam nolens coniugaliter uiuere , </b> uel hoc est ,	En essa misma manera podemos dezir del mater moion <b> que aquel que non quiere beuir conuigalmente e con su muger o esto es </b> por que quiere mas libremente fazer forniçio .	uXqifsC
2.1.8	oMb68c3	est quod diuidat et distinguat . <b> Hanc autem rationem tangit Philosophus 8 Ethic’ dicens , </b> quod quia commune continet	assi commo dela razon del bien propreo es que ayunte e desayunte el vno del otro . <b> Et esta razon pone el philosofo en el viii̊ libro delas ethicas </b> do dize que por que el bien comunal contiene	hCgaC1w
2.1.14	wvn8Q2X	sed secundum eas quas ciues instituerunt . <b> Cum enim principans in ciuitate ipse </b> secundum seipsum principatur ,	que establesçieron los çibdadanos . <b> Ca quando el que | enssennorea en la çibdat el mesmo ensseñorea por si e el </b> establesçe leyes aquel gouernamiento toma nenbre	foTFsFS, cwXV9aa
2.1.15	vgJxSOB	quod unumquodque organorum optime perficiet suum opus , <b> si non multis operibus sit seruiens , sed uni . </b> Quare cum natura ordinauerit	Ende en esse logar dize el philosofo <b> que qual si quier de los instrumentos fara conplidamente su obra si non siruiere en muchos obras mas en vna . </b> Por la qual cosa commo la natura aya ordenada la mugr	q9dosct
2.1.15	qlEjVQe	idem sunt foemina et seruus , <b> ut recitat Philosophus 1 Politicorum dicens , </b> quod inter Barbaros foemina et seruus eundem habent ordinem .	assi commo entre los bartaros vna ꝑlona es muger e lieruo . <b> Assi conmo dize el philosofo </b> en el primero libro delas politicas do dize que entre los barbaros la fenbra	frAeWjM
2.1.15	qY8B33N	( ut recitatur ibidem ) <b> quia inter Barbaros nullus est naturaliter principans , </b> sed idem est	assi commo el philosofo dize en esso mismo logar <b> por que entre los barbaros non era ninguno natrealmente sennor </b> mas vn omne era naturalmente barbaro e sieruo .	kTjj3q5
2.1.15	k3Daett	nisi careat usu rationis et intellectus . <b> Sed cum carens rationis usu sit naturaliter seruus , </b> quia nescit seipsum dirigere ,	si non fuese priuado de vso de razon e de entendimiento . <b> Mas commo aquel que es priuado de vso de razon e de entendemiento sea naturalmente sieruo </b> por que non sabe gniar assi mismo	lVVxgfO
2.1.17	i637FAG	quia calor eius interius <b> propter frigus circunstans </b> non exalat ,	por la calentura natural se ençierran de dentro <b> por el frio qual çerca de fuera </b> e non salle la calentura mas esforçada	oShmElQ
