Localisation	Id. source	Segment source	Segment cible	Id. cible
1.1.2	tPsJUvm	et bonis operibus regulatis ordine rationis : <b> volens tractare de regimine sui , </b> oportet ipsum notitiam tradere de omnibus his	por orden de Razon <b> el que quiere tractar del gouernaiento </b> e fablarde sy mesmo conujene de tractar	vP6jbhQ
1.1.3	smfRzxe	et dominus aliorum . <b> Nam vigens prudentia , </b> et aliis virtutibus moralibus ,	que sea fecho gouernador e senonr de los otros <b> Ca el que ha sabiduria </b> e las otras uirtudes morales	mMUCzsf
1.1.5	hAMCaYj	unde in eodem 3 dicitur , <b> quod nullus est beatus nisi volens . </b> Sed quae non agimus ex electione ,	en el terçero libro de las ethicas <b> que njguon non es bien auer turado | si non obra de voluntad </b> Mas aquellas cosas que nos non fazemos por	yf3jHLJ, hoikGi8
1.1.5	vJJQnRf	habitus electiuus <b> in medietate consistens , </b> ut dicitur 2 Ethic . )	que muestra a omne escoger . <b> Et esta sabiduria esta en medio delas buenas obras </b> Ca asy lo praeua el philosofo	xQikv8C
1.1.5	sp5TYOi	propter quod sicut <b> si non esset agens primum , </b> nullum agens ageret :	por la qual cosa <b> asi commo si el primero mouedor non fuese ninguno otro non seria mouedor </b> asi si la fin postrimera non fuese	mESuwyA
1.1.5	pO8fHss	si non esset agens primum , <b> nullum agens ageret : </b> sic si non esset finis ultimus ,	por la qual cosa <b> asi commo si el primero mouedor non fuese ninguno otro non seria mouedor </b> asi si la fin postrimera non fuese	mESuwyA
1.1.5	nGGzc9q	Unde Philosophus 1 Ethicor’ <b> volens ostendere </b> necessariam esse praecognitionem finis , ait ,	mas es por auentra <b> a¶ Onde el philosofo quariendo mostrar en el primero libro delas ethicas </b> que es neçesario de connosçer ante la fin	nsSIcYm
1.1.5	bn2K0xd	intendere bonum gentis et commune , <b> quod est magis expediens et diuinius , </b> quam bonum aliquod singulare .	e al bien comun <b> que es mas conuenible | e mas diuinal </b> que ningun bien singłar njn personal ¶	kuM4NEI, iGorJMD
1.1.6	s2lFHO6	Unde Philosophus 1 Ethicorum <b> describens felicitatem , </b> ait ,	en el primero libro delas ethicas <b> quariendo mostrar | que cosa es la fe liçidat </b> e la bien andança .	zFWdyEY, fDjFZ4p
1.1.6	tWwTMAm	ut in seipso quilibet experiri potest . <b> unde Philosophus 3 Ethi’ loquens de talibus delectationibus ait , </b> quod insatiabilis est delectabilis appetitus .	asi commo cada vno prueba en si mesmo . <b> ¶ Onde el philosofo en el terçero libro delas ethicas fablando de tales delectaçonnes dize </b> que el apetito delectable de los sesos	nFWMhMQ
1.1.6	m0sgjwh	et magnitudine bonitatis . <b> In tanto ergo gradu existens , </b> indignum est ,	e en grandeza de bondat ¶ <b> pues que asi es el que esta en tan alto grado </b> non deue escoger uida de bestia .	zHJ0Kiu
1.1.6	msvhjGS	nec qui uigil , <b> sed qui dormiens , </b> decet Regiam maiestatem	e ueladoͬ e espierto . <b> Mas quando es dormidor </b> e enbriago es de menospreçiar	medNv3o
1.1.7	kdDB2uW	nec etiam potest esse Magnanimus , <b> quia metuens pecuniam perdere , </b> nihil magnum attentabit .	nin de grant coraçon . <b> Ca temiendo deꝑder los des e las riquezas nunca acometra grandes cosas </b> Et la razon es esta	ifYcE2P
1.1.7	aAAiLN5	Cum ergo finis maxime diligatur , <b> ponens suam felicitatem in numismate , </b> principaliter intendit reseruare sibi ,	a aquel que pone las un feliçidat <b> e la su bien andança en las riquezas | e en los aueres </b> prinçipalmente entiende de thesaurizar e fazer thesoro e llegar muchos dineros	sAyDC08, iR5l5IR
1.1.8	y74A9Fa	suam felicitatem in honoribus ponere . <b> Tertio hoc est indicens ei , </b> ne sit iniustus et inaequalis :	nin se ensoƀuezca mucho nol conuiene de poner su bien andança en las honrras ¶ <b> Lo terçero se demuestra | assi porque non conuiene al prinçipe en ninguna manera </b> que sea iniusto nin desegual ¶	lqv94Ar, aSXy1pY
1.1.10	n9PWPWr	in quo suam felicitatem ponit : <b> ponens ergo suam felicitatem </b> in ciuili potentia ,	e toda su bien andança . <b> Et por ende aquel que pone su feliçidat | e su bien andança </b> en poderio çiuil	siLewpb, jJCCcNh
1.1.10	frO0cJU	et incurret nocumentum <b> secundum animam . Propter quod Philosophus 7 Politicorum vituperans Lacedaemones , </b> ponentes felicitatem	Et contesçer le ha muy grant daño segunt su alma . <b> por la qual cosa dize el philosofo | en el septimo libro delas politicas </b> deno stando alos griegos	fIHrZID, wCMZIuw
1.1.12	oTj4MZW	Nec etiam voluit esse ponendam eam in habitibus , <b> quia habens habitum , </b> et non operans ,	que son en el alma <b> que el que ha las scians </b> e non obra segunt el lassemeia a aquel que duerme .	uQZPJTN
1.1.12	o52abvX	quia habens habitum , <b> et non operans , </b> quasi assimilatur dormienti :	que el que ha las scians <b> e non obra segunt el lassemeia a aquel que duerme . </b> Ca mientre los omes duermen	uXi88To
1.1.12	eNLuYpf	quod est multitudinis rector : <b> nam regens multitudinem debet </b> intendere commune bonum .	es por que es gouernador de mucho <b> Ca el que gouienna a muchos deue tener </b> mientesal bien comun de todos .	gMtSRLk
1.1.13	rDswloi	qualis homo sit , <b> cum in principatu existens , in quo potest bene et male facere , </b> cogitat qualiter se habeat .	por que estonçe paresçe qual es el omne <b> quando es puesto en señorio | en que pueda fazer bien e mal . </b> Et aquella hora entiendan los omes	om0Q6OE, aT0mVTJ
1.2.1	d7Y1grb	vel subtiliter audit , <b> nisi forte hoc esset per accidens , </b> ut si quis ex superflua comestione ,	o oye sotil mente . saluo ende <b> si por auentura esto fuese | por algun açidente </b> assi commo alguon	i0elcuj, eIsJEUo
1.2.2	wGTBZyd	et quia quanto aliquid sub uniuersaliori modo accipitur , <b> tanto unum et idem existens </b> ad plura se extendit ,	que el appetito del seso . <b> Et por que cada cosa quanto es tomada so manera mas general tanto essa misma cosa se </b> estieñde amas cosas	x4AjWi0
1.2.2	hNhwusa	appetitus tamen intellectiuus unus , <b> et idem existens fertur </b> in omne bonum intelligibile .	Enpero el appetito del entendimiento seyendo vno <b> e esse mismo ua a todo bien que se puede entender ¶ pues que assi es non es otro </b> nin departido el appetito del entendimiento	yGS6wBf
1.2.3	kQkIEDn	sed sit Eutrapelus <b> et bene se vertens , </b> ut se habeat circa ludos	Mas sea buen conpanon <b> e sepa bien beuir con los omes </b> assi commo conuiene en los trebeios .	jtCALo1
1.2.6	oSfih98	quod prudentia est virtus <b> secundum uniuersales maximas particularia facta concernens . </b> Huiusmodi autem uniuersales regulae	diziendo que la pradençia es uirtud <b> que iudga alos negoçios particulares seg̃t las reglas vniuerssales . </b> las quales reglas generales son buenas leyes e buenas costunbres .	eSV6jsK
1.2.6	fWytlC9	quam est recta ratio agibilium , <b> praesupponens rectitudinem voluntatis . </b> Ex omnibus ergo his ,	que auemos de fazer <b> que requiere e demanda reglamiento de uoluntad ¶ </b> Et pues que assi es de todas estas cosas sobredichas podemos tomar vna	uLn1Y2S
1.2.6	w2KeXTn	et iudicata secundum uniuersales maximas , <b> particularia contingentia agibilia concernens , </b> praesupponens rectitudinem voluntatis .	e iudgandas <b> que cata sienpre las obras particulares | que pue den contesçer segunt las reglas uniuerssales </b> e que demanda endereçamiento e reglamiento de uoluntad	zr2aM0O, w8U249e
1.2.6	rcIlRRD	particularia contingentia agibilia concernens , <b> praesupponens rectitudinem voluntatis . </b> Viso quid est prudentia ,	que pue den contesçer segunt las reglas uniuerssales <b> e que demanda endereçamiento e reglamiento de uoluntad </b> isto que cosa es la prudençia	kdePNiH
1.2.7	oCquzbL	cuiusmodi sunt diuitiae et bona exteriora ; <b> prudentia carens , </b> quia non cognoscet ,	e estos otros bienes de fuera <b> que son del cuerpo . | Et el Rey sin sabiduria </b> por que non conosçe nin faz cuenta	waOaVLc, sjJjJJd
1.2.7	o68GPqG	et illud natureliter dominatur , <b> semper principans pollet prudentia , a qua deficit </b> qui naturaliter seruus existit .	Et do quier que ay sabiduria ha naturalmente sennorio . <b> Por ende sienpre el prinçipe deue auer sabiduria . | por la qual sera sennor </b> por cuya mengua el sieruo esta naturalmente en su seruidunbre .	mVxgLK0, vo8x8nV
1.2.8	o5ROjPS	ratione propriae personae <b> quae alios est dirigens , oportet quod sit solers , et docilis : </b> ratione vero gentis quam dirigit ,	por razon de la su propia persona <b> que ha de guiar los otros . | Conuiene le de ser sotil e doctrinable ¶ </b> Mas por razon dela gente	ooZBU2x, nmnCqA3
1.2.8	qHX3WgA	siue oportet <b> quod sit intelligens et rationale . </b> Modus enim ,	Conuiene le que aya entendimiento <b> e razon o conuiene le que sea entendido e razonable . </b> Ca la manera por que el Rey guia el su pueblo	cZvzsdH
1.2.8	xWZArta	qui est inditus hominibus , <b> volens alios dirigere , </b> oportet quod sit intelligens ,	çer que es enxerida naturalmente alos omes . <b> El que quiere alos otros guiar </b> conuiene le que sea entendido	vis50db
1.2.8	jL02JXg	volens alios dirigere , <b> oportet quod sit intelligens , </b> cognoscendo principia ,	El que quiere alos otros guiar <b> conuiene le que sea entendido </b> conosciendo los prinçipios e las razones .	fQAkFvh
1.2.8	i9kK3HO	ex illis praemissis cunclusiones intentas . <b> Vel oportet quod sit intelligens , </b> sciendo leges ,	e las razones que quiere ençerrar ¶ <b> Et otrosi conuiene al Rey | que sea entendido </b> e sabio sabiendo las leys	loV1AgS, eCGM1gF
1.2.8	rvbQlwy	Sed ratione propriae personae <b> quae est alios dirigens , </b> oportet quod sit solers , et docilis .	Mas por razon dela su persona propia <b> que es tal que ha de gouernar los otros . </b> Conuiene le de sor sotil e doctrinable .	xv0uDph
1.2.8	zEwyysD	Patet ergo quod ratione propriae personae <b> quae est alios dirigens , </b> oportet Regem esse solertem , et docilem .	que por razon dela su propia persona <b> que es gouernandor de los otros . </b> Conuiene al rey de ser engennioso e doctrinable .	qUzpugG
1.2.9	wsOmtoL	sicut intellectus principiorum est . <b> Tanto ergo Rex magis intelligens est </b> circa agibilia ,	e delas costunbres les faze auer manera <b> para bien gouernar . | Et por ende tanto deue el Rey ser mas acuçioso cerca </b> lo que deue fazer	fGffERi, oBfJNee
1.2.9	iNwLdfy	Verum quia malitia est corruptiua principii . <b> Sicut enim quis habens corruptum gustum , </b> male iudicat de saporibus ,	corronpadera dela razon e del comienco para obrar . <b> Ca assi commo aquel que ha el gosto </b> corronpido mal iudga delos sabores .	nkgGIQq
1.2.9	gDIvv7v	et e conuerso : <b> sic habens infectam , </b> et deprauatam voluntatem , excoecatur in intellectu ,	Et lo que es amargo que es dulçe Bien <b> assi aquel que ha corrupta e desordenada la uoluntad </b> por maliçia es ciego en el entendimiento	yUxt7iQ
1.2.10	q0wuty6	fortis est , <b> et agens temperata , </b> quia delectatur in ipsis , temperatus est .	en quanto se delecta en ellas es dicho fuerte . <b> Et el que faze las obras tenpradas </b> en quanto se delecta en ellas es dicho tenprado .	kiQBxVF
1.2.10	l7OepAD	quia delectatur in ipsis , temperatus est . <b> Sed agens talia , </b> non quia delectatur in eis ,	en quanto se delecta en ellas es dicho tenprado . <b> Mas aquel que faze estas obras </b> non en quanto se deleyte en ellas	j4cOZKT
1.2.12	nkZCLjZ	manifeste Regi et Regno infertur iniuria . <b> Satis per praecedens capitulum </b> persuadetur Principibus atque Regibus ,	su gregnos <b> poro quier que assaz es ya prouado | por el capitulo sobredicho </b> que conuiene alos prinçipes e alos Reyes	gScGt5t, u0NUIKw
1.2.13	v9uCqsy	Erit igitur Fortitudo virtus <b> quaedam reprimens timores , </b> et moderans audacias .	Et por ende la fortaleza es vna uirtud <b> que repreme los temores </b> e tienpra las osadias .	tl2jSRn
1.2.13	zwTbvSk	quaedam reprimens timores , <b> et moderans audacias . </b> Reprimit enim Fortitudo timores ,	que repreme los temores <b> e tienpra las osadias . </b> Ca la fortaleza repreme los temores	jOR4y8j
1.2.13	lmoH7jo	Non enim sic per fugam vitare possumus aegritudines : <b> quia cum aegritudo sit aliquid in nobis existens , </b> per fugam eam vitare non possumus .	assi por foyr escapar las enfermedades <b> por que la enfermedat es alguna cosa | que esta en nos </b> e por foyr non la podemos escusar .	z8oGt5b, m6Aomof
1.2.13	sCnOmTr	debilioris est . <b> Aggrediens autem comparatur ad alios , sicut ad debiliores sed sustinens , </b> sicut ad fortiores :	por que el que acomete es conparado a aquellos a quien acomete <b> assi commo a omes mas flacos . | Mas el que sufre es conparado alos otros </b> assi commo amas fuertes .	eH6timn, f6YhjDo
1.2.13	vmRzu5o	Secundo est difficilius , <b> quia aggrediens imaginatur malum ut futurum : </b> sed sustinens habet malum prae oculis ,	Lo segundo esto es mas guaue por que aquel que acomete <b> ymagina el mal | assi commo cosa que ha de venir . </b> Mas el que sufre ha el mal ante los oios	vPrGHM6, nkHUAxS
1.2.13	viDsAim	quia aggrediens imaginatur malum ut futurum : <b> sed sustinens habet malum prae oculis , </b> et ut praesens .	assi commo cosa que ha de venir . <b> Mas el que sufre ha el mal ante los oios </b> e assi conmo presente .	sL9tsKN
1.2.13	fWgZKDu	quid est Fortitudo : <b> quia est virtus reprimens timores , </b> et moderans audacias .	que cosa es la fortaleza <b> ca es uirtud | que te pree me los temores </b> e refrena las osadias .	v8Fz5iu, nDWkbqc
1.2.13	fBX7w3B	quia est virtus reprimens timores , <b> et moderans audacias . </b> Rursus manifestum est ,	que te pree me los temores <b> e refrena las osadias . </b> Otrosi ya es mostrado en quales cosas es la fortaleza .	pM6xIwx
1.2.14	oXJBC0y	Fortitudo enim ciuilis est , <b> quando aliquis timens verecundiam , </b> et volens honorem adipisci ,	¶La fortaleza çeuiles <b> quando alguno temiendo uerguença </b> e quariendo ganar honrra	eJjbev4
1.2.14	qlwUDAo	quando aliquis timens verecundiam , <b> et volens honorem adipisci , </b> aggreditur aliquod terribile ,	quando alguno temiendo uerguença <b> e quariendo ganar honrra </b> acomete alguna cosa fuerte e espantable .	iTpKUkN
1.2.14	weGyhdU	Hector fortis erat , <b> qui timens increpationes Polydamantis , </b> aggrediebatur terribilia .	enxienplo que ector era fuerte en esta manera <b> que temie ser denostado de polimas . | Et por ende </b> acometie cosas espatables	ziaS6UK, vcjAbFm
1.2.14	pwMEjZP	si non strenue bellaret , <b> Hector laudans se in Troianis diceret </b> Diomedem ab eo deuictum esse .	Ca dize que si non lidiase reziamente su contrario ector <b> alabandose entre los troyanos </b> dirie que diomedes era flaco	ytaoH9X
1.2.14	uXxrbLE	quis pugnam aggrediatur , <b> inueniens resistentiam , </b> pugnam non sustinet ;	Mas si por la sana alguno acomete la batal la <b> quando falla resistençia </b> e fortaleza non sufre la batalla .	e7hhFpu
1.2.14	objDIIA	Sexta fortitudo dicitur esse bestialis , <b> ut cum aliquis ignorans fortitudinem aduersarii , bellatur . </b> Ut puta si habitantes in septentrione sunt fortes , et audaces ,	La sexta fortaleza es testial e de bestia <b> assi commo quando alguno comiença de lidiar non sabiendo | nin conosçiendo la fortaleza del su contrario . </b> Enxient lo desto .	gHBSV4b, wtVKA6s
1.2.15	mOoBNfH	Nam sicut fortitudo est <b> reprimens timores , </b> et moderans audacias ,	Ca assi commo la fortaleza <b> reprime los temotes </b> e refrena las osadias	uH1vRIV
1.2.15	qHemldr	reprimens timores , <b> et moderans audacias , </b> inter quas ipsa fortitudo habet esse :	reprime los temotes <b> e refrena las osadias </b> entre las quales cosas ha de ser la fortaleza .	l2NQfaH
1.2.15	q0WNnXu	inter quas ipsa fortitudo habet esse : <b> sic temperantia est reprimens </b> delectationes sensibiles ,	entre las quales cosas ha de ser la fortaleza . <b> assi la tenpranca </b> repreme las delecta connes corporales	irNLRAt
1.2.15	syuOMc0	delectationes sensibiles , <b> et moderans insensibilitates , </b> inter quas habet esse .	repreme las delecta connes corporales <b> e resten a los non sentimientos . </b> Et pues que assi es si la tenpranca reprime	ye80eMM
1.2.15	aKcH4UR	Si autem est circa delectationes aliorum sensuum , <b> hoc est per accidens : </b> quia aliis sensus per accidens percipiunt	Mas si ella ha de seer çerca las <b> delectaconnes de los otros sesos es | por algun accidente </b> por razon que los otros sesos	rFEVvjJ, nEr362K
1.2.15	k0hWoEx	hoc est per accidens : <b> quia aliis sensus per accidens percipiunt </b> delectabilia gustus , et tactus .	por algun accidente <b> por razon que los otros sesos | por algun accidente resçiben </b> delecta connes del gostar e del tanner .	uoeDIcL, qvoRPbU
1.2.15	flVcXf8	in aliis vero sensibus <b> delectantur per accidens . </b> Propter quod in eodem libro dicitur ,	Et en los otros sesos se delectan <b> por algun accidente . </b> por la qual razon dize el philosofo en esse milmo terçero	jGRxAcL
1.2.15	c3ESw3j	et ex consequenti circa gustum : <b> per accidens autem est </b> circa delectabilia aliorum sensuum .	e desi cerca del gusto <b> Mas por algun accidente es cerca las cosas delectables </b> de los otros sesos .	et5ZWwa
1.2.15	pbWuiIM	quid est Temperantia : <b> quia est virtus reprimens </b> delectationes sensibiles ,	que cosa es la tenpranca . <b> Ca es uirtud que repreme las delectaçonnes sensibles de los cinco sesos </b> e tienpra los non sentimientos	t7Q6RPF
1.2.15	sKjJQRY	delectationes sensibiles , <b> et moderans insensibilitates . </b> Secundo vero declarabatur circa quae habet esse :	Ca es uirtud que repreme las delectaçonnes sensibles de los cinco sesos <b> e tienpra los non sentimientos </b> ¶L segundo auemos declarado cerca quales cosas ha descer la tenpranca .	o3v3EhN
1.2.15	wQ8Jolm	ex consequenti circa gustum : <b> per accidens vero </b> circa alios sensus .	e desi çerca el gusto <b> mas por algun acçidente ha de ser cerca los otros sesos ¶ </b> Lo terçero auemos mostrado	dmQiISq
1.2.16	gy1eYoa	et experiri bellum , sine periculo non potest . <b> Valde est ergo increpandus carens tempesantia , </b> cum eam sine periculo possit acquirere :	e puar las batallas non se puede fazer sin periglo . <b> Et pues que assi es mucho es de denostar el | que non ha </b> tenpranca	q70UWLb, kcpBULI
1.2.16	eczFS1W	non autem adeo increpandus est <b> carens fortitudine , </b> quia virtus illa est difficilis ,	Mas non es tanto de denostas el <b> que non ha fortaleza </b> por que aquella uirtud dela fortaleza es mas guaue	y0XR56D
1.2.16	pc7SIQZ	et fideliter , <b> Rex ille volens complacere illi Duci , </b> praecepit quod duceretur ad ipsum .	Et acaesçio que vn prinçipe mucho su priuado que grant t p̃o le auia seruido e fiel mente . <b> Et el Rey que tiendo fazer plazer a aquel </b> prinçipe mando qual pusiessen dentro ante si .	v29ZpLa
1.2.16	djCnJZf	Dux autem ille assuetus rebus bellicis , <b> videns Regem suum esse totum muliebrem et bestialem , </b> statim ipsum habuit in contemptum :	veyendo <b> que el su Rey era todo mugeril | e toda su </b> conuerssaçion era entre mugers e era bestial .	qXEDM3e, cncD5jc
1.2.16	eVD7mhk	voluit eum inuadere . <b> Rex autem timens , fugit : </b> et quia credebat se non posse fugere manus illius Ducis ,	e quaso yr contra el para lo matar . <b> Et el Rey temiendo lo fuyo . </b> Et por que creya que non podia foyr delas manos	l09dzD4
1.2.17	ih1bQAG	quia est media <b> inter timores et audacias , ideo est virtus reprimens timores , </b> et moderans audacias :	e por E ende es uirtud <b> que repreme los temo eres </b> e tienpra las osadias .	mzx66Cm
1.2.17	mZHhtix	inter timores et audacias , ideo est virtus reprimens timores , <b> et moderans audacias : </b> ita liberalitas	que repreme los temo eres <b> e tienpra las osadias . </b> Assi la fre anqueza es medianera	fNEeDh5
1.2.17	g41lGIr	quia est media inter auaritias et prodigalitates , <b> ideo est virtus reprimens auaritias , </b> et moderans prodigalitates .	entre las auariçias e los gastamientos <b> Et por ende es uirtud | que repreme las auariçias </b> e tienpra los gastamientos . Et esta uirtud esta en bien vsar del auer e de los dineros .	qmwsL2Q, mjP9M7U
1.2.17	oT1w2Dg	ideo est virtus reprimens auaritias , <b> et moderans prodigalitates . </b> Consistit autem haec virtus	que repreme las auariçias <b> e tienpra los gastamientos . Et esta uirtud esta en bien vsar del auer e de los dineros . </b> Mas para bien usar del auer	qHAMjIs
1.2.17	fDWkfHa	est ex consequenti . <b> Usurpans enim bona utilia , </b> et non accipiens ea sicut debet ,	Et despues es en non tomar nin forcar los bienes agenos . <b> Ca aquel que vsurpa e toma los bienes prouechosos agenos malamente commo non deue . | este paresçe que es muy cobdicioso de auer ¶ </b> Et por esso el philosofo	kdpyx5o, pezT18W
1.2.17	cq6EG7f	Usurpans enim bona utilia , <b> et non accipiens ea sicut debet , </b> nimis videtur auidus pecuniae . Propter quod Philosophus 4 Ethic’ usurarios , lenones ,	este paresçe que es muy cobdicioso de auer ¶ <b> Et por esso el philosofo | en el quarto libro delas ethicas llama a estos tales non liberales </b> que quiere dezir non francos	iji7brR, tUzhQ2B
1.2.17	r9oeEQj	et illud magis . <b> Si enim liberalis conseruans proprios redditus , </b> et accipiens unde debet ,	por que lo es . es dicha mastal . <b> Et por ende si alguno es liberal e franco en guardando las sus rentas propreas </b> e tomando onde deue esto	eCeYrQl
1.2.17	gUQQhyt	Si enim liberalis conseruans proprios redditus , <b> et accipiens unde debet , </b> hoc ideo facit ,	Et por ende si alguno es liberal e franco en guardando las sus rentas propreas <b> e tomando onde deue esto </b> por tanto lo faze por que pueda fazer espessas quales deuede sus rentas prop̃as	gFNYhbV
1.2.17	lVoUdhY	Custodiens vero proprios redditus , <b> et accipiens pecuniam a propriis possessionibus , </b> bene patitur siue bene recipit	Mas el que guarda las rentas propias e lo suyo propio <b> e toma el auer delas sus possesiones propias </b> este sufre bien o resçibe bien	yuhVZlx
1.2.17	aBImqqz	eo modo quo debet . <b> Non usurpans autem aliena , </b> non operatur turpia .	en aquella manera que deue . <b> Mas aquel que non vsurpa | nin toma las cosas agenas </b> este non obra mal	obigC5P, wbPJ3kB
1.2.17	jVy0Cg1	secundum se difficultatem habet : <b> quia propria bona sunt aliquid ad nos pertinens , </b> et naturaliter afficimur ad illa . Immo auari adeo afficiuntur	Mas dar los sus biens propios ha alguna guaueza por si . <b> Ca los bienes propios son | cosaque parte nesçen a nos mismos </b> e naturalmente amamos lo que pertenesçe anos .	ph1iHNq, bS8IYBI
1.2.17	iB45Ftt	Viso quid est liberalitas , <b> quia est virtus reprimens auaritias , </b> et moderans prodigalitates .	visto que cosa es la franqueza . <b> Ca es uirtud | que te preme las auariçias </b> e que tienpra los gastamientos	o6Jha1X, qtkShLa
1.2.17	zEmSU2E	quia est virtus reprimens auaritias , <b> et moderans prodigalitates . </b> Et ostenso circa quae habet esse ,	que te preme las auariçias <b> e que tienpra los gastamientos | e las superfluydades delas espenssas . </b> Et mostrado en quales cosas ha de ser la franqueza .	tgxQhmV, gmP7ng5
1.2.19	zKzYK3G	Dicitur enim magnificus , <b> quasi magna faciens . </b> Inde est ergo ,	que faze es nonbrada la magnificençia <b> ca es dichon magnifico aquel que faze grandes cosas </b> Et por ende por que en qual quier estado	wCzpfUE
1.2.19	nqCaNW5	sic liberalitas est circa magnos sumptus , <b> si faciens eos , </b> multas habeat facultates :	si assi la libalidat es certa grandes espenssas <b> si el que las faze ouiere muchas riquezas </b> e ahun sera cerca espenssas mesuradas si el que faze las espenssas	rtlsJNP
1.2.19	hnO2LM7	et etiam circa mediocres , <b> si faciens sumptus illos , </b> mediocriter facultatibus abundet .	si el que las faze ouiere muchas riquezas <b> e ahun sera cerca espenssas mesuradas si el que faze las espenssas </b> mesuradosmente abondare en las riquezas .	fIayIzU
1.2.19	jHWIVYk	Magnificentia vero , <b> respiciens sumptus </b> ut sunt decentes operibus ,	guaue cosa es dese auer bien los omes en ellas . <b> Mas la magnificençia que cata alas espenssas en quanto son conuenbles alas obras non cata </b> nin tiene oio quales sean las obras .	bmKLLak
1.2.19	gp7G5F0	inter auaritiam , et prodigalitatem . <b> Patet ergo quid est magnificentia . Nam sicut liberalitas est reprimens auaritias , </b> et moderans pro digalitates :	Pues que assi es desto paresçe <b> que cosa es la magnificençia . | ca assi commo la liberalidat </b> repreme las auariçias	uUon4BX, l0fl76k
1.2.19	g71OPM9	Patet ergo quid est magnificentia . Nam sicut liberalitas est reprimens auaritias , <b> et moderans pro digalitates : </b> sic magnificentia est reprimens paruificentias ,	ca assi commo la liberalidat <b> repreme las auariçias | et tienpra los gastamientos </b> assi la magnificençia	h7zyWja, lrCRVqb
1.2.19	uSMiqGI	et moderans pro digalitates : <b> sic magnificentia est reprimens paruificentias , </b> et moderans consumptiones .	et tienpra los gastamientos <b> assi la magnificençia | repreme las paruifiçençias e las pequenas espenssas </b> e tienpra los consumimientos e destruymientos .	m5BbAGc, irp6nqW
1.2.19	xcuHkFa	sic magnificentia est reprimens paruificentias , <b> et moderans consumptiones . </b> Et sicut liberalitas est faciens sumptus ,	repreme las paruifiçençias e las pequenas espenssas <b> e tienpra los consumimientos e destruymientos . </b> Et assi commo la libalidat faze espenssas	z14YYtI
