Localisation	Id. source	Segment source	Segment cible	Id. cible
3.2.1	srU0rWi	debet enim intendere legislator <b> ut per leges consequamur conferens , </b> et vitemus nociuum :	ca deue entender el fazedor dela ley <b> que por las leyes alcançemos | lo que nos cunple </b> e escusemos	cQ2Tony, dgBPQvc
3.2.1	ey6M8xv	quorum est cognoscere <b> quid conferens et quid nociuum , </b> et quales debeant esse iudices	alos quales parte nesçe de conosçer <b> que cosa non es buena | e que cosa non es enpeesçible </b> e quales deuen ser los iuezes alos	gQElSEi, iU5Jb4e
3.2.2	o2Wkz28	regis autem est intendere commune bonum . <b> Si vero ille unus dominans </b> non intendit commune bonum ,	ca al Rey parte nesçe de enteder el bien comun . <b> Et li aquel vno assi </b> enssennoreante non entiende el bien comun	nRU3cM6
3.2.2	qdHSjnC	non intendit commune bonum , <b> sed per ciuilem potentiam opprimens alios , </b> omnia ordinat in bonum proprium et priuatum ,	enssennoreante non entiende el bien comun <b> Mas entiende por poderio çiuil apremiar los otros </b> e todas las cosas ordena al su bien propio	pSOebkF
3.2.2	cOE5f74	si rectus sit . <b> Sed si populus sic dominans non intendit bonum omnium secundum suum statum , </b> sed vult tyrannizare et opprimere diuites ,	si derecho es . <b> Mas si el pueblo assi | enssennoreante non entiende a bien de todos </b> segunt su estado	ebxzXil, j1Q70we
3.2.3	e6RfLkx	efficacior esset ; <b> et ille principans </b> propter abundantiorem potentiam	fuesse ayuntado en vn prinçipante e vn sennor mas fuerte seria . <b> Et aquel prinçipe por ma . </b> yor cunplimiento de poderio meior podria gouernar la çibdat	skkK9oh
3.2.3	yJEPqAK	semper totum illud regnum reducitur <b> in aliquod unum principans . </b> Ut si in eodem corpore	ca do quier que es gouernamiento natra al sienpre todo aquel gouernamiento es reduzido en algun prinçipe gouernador <b> assi commo si en vn cuerpo son departidos mienbros ordenados </b> a departidos ofiçios	gnQ2KU3
3.2.3	jXmFEZG	et in toto uniuerso est <b> unus deus singula regens et disponens . </b> Si apes etiam	E en essa milma manera en todo el mundo es vn dios <b> que gouierna todas las cosas | e las ordena cada vna a ssu fin . </b> Et avn las abeias	hi2MxXD, sk0MZXs
3.2.3	i94WZPT	semper videmus multitudinem quamlibet reduci <b> in unum aliquod principans et gubernans . </b> Nam sicut naturale est ,	que cada vna muchedunbre es reduzida a vn prinçipe <b> e avn gouernador </b> ca assi commo es cosa natraal	y9iwboc
3.2.4	bXMjYIm	quia homo sic constitutus <b> et multitudo sic principans , </b> efficacio erit in principando .	Por la qual cola meior sera este tal prinçipado <b> ca el omne assi conpuesto de muchs oios e la muchedunbre </b> que assi ensseñorea sera mas abiuada	g0RFBpr
3.2.4	k4t4c6r	quae requiritur in principante . <b> Tunc enim principans rectam habet intentionem , </b> si non intendat bonum proprium sed commune : quanto igitur minus intenditur commune bonum ,	que deue ser en el prinçipe <b> por que estonçe ha derecha entençion </b> si non entiende abien propo mas a bien comun .	tO2Eorr
3.2.4	cGqB5gj	quasi bonum omnino priuatum , <b> sic intendens recedit </b> quasi omnino a communi bono .	assi commo bien apropiado el <b> que assi entiende el bien propre </b> o apartasse much del bien comun .	sYkm4xR
3.2.4	wOY3qu8	dubitando , <b> assignans rationes multas , </b> quod melius sit dominari multitudinem :	que el pho pone en el terçero libro delas politicas dudado <b> e poniendo muchͣs razones para esto </b> que meior es que much	br24h6e
3.2.5	qAoHLqz	quam per haereditatem . <b> Nam superficialiter considerata veritate quaesiti , dubitans . </b> An melius sit regiam dignitatem	que non por heredamiento <b> por que penssada la uerdat desta | questiuo liuianamente el que duda </b> si es meior de ser la dignidat real	ty56qEC, sCRkYkf
3.2.6	xihbdo9	quantus honor sequitur , <b> et quanto honore est dignius intendens commune bonum . </b> Quare si tyrannus intendit	assi non se puede dezir nin contar quanta honrra se sigue <b> e quanto es digno de honrra | el que entiende en el bien comun . </b> por la qual cosa si el thirano entiende el su bien propreo siguese	rkWSExv, edpRISR
3.2.6	crgX5FN	nisi de delectationibus propriis , <b> maxime versatur sua intentio circa pecuniam , credens se per eam posse huiusmodi delectabilia obtinere . </b> Sed regis intentio versatur circa virtutem ,	si non delas sus delectaçonnes propreas . <b> Et por ende la su entençion toda se pone en el auer | o en los dinos creyendo que por ellos puede auer las otras cosas delectables . </b> Mas la entençion del Rey esta	bJflkMK, kjKPUVC
3.2.6	sCQRwRT	nisi de delectationibus propriis , <b> videns se esse onerosum et tediosum </b> ab iis	si non delas sus delecta connes proprias . <b> veyendo se en carga e en aborresçimiento </b> de aquellos que son en el regno .	mihrv3s
3.2.7	bfQnsV9	Sed si tyrannus dominetur , <b> cum unus sit dominans , </b> et non intendat nisi bonum proprium ;	Mas si el tirano <b> enssennoreare commo vno sea el señor </b> e non entienda	t8cdrmp
3.2.9	nb90VZ5	ut appareat magis esse procurator communis boni , <b> quam tyrannus quaerens utilitatem propriam . </b> Octauo decet verum Regem	assi que parezca mas ser procurador del bien comun <b> que tirano que quiere sienpre supro . </b> Lo octauo conuiene al uerdadero .	mRD1Flk
3.2.10	bwGNE14	quod signum est tyrannidis pessimae . <b> Verus autem Rex econuerso intendens commune bonum , </b> et cognoscens se diligi ab ipsis	la qual cosaes muy mala señal de tirama . <b> Mas el uerdadero Rey faze todo el contrario | entendiendo en el bien comun </b> e conosçiendo que el es amado de todos	nOwWmqk, ztP0mcC
3.2.10	hdmOGrt	Verus autem Rex econuerso intendens commune bonum , <b> et cognoscens se diligi ab ipsis </b> qui sunt in regno , excellentes , et nobiles ,	entendiendo en el bien comun <b> e conosçiendo que el es amado de todos </b> los que son en su regno	mcLqIJf
3.2.10	eCiWItc	et conseruat , <b> videns quod per ipsum , bonum commune , </b> et bonus status regni ,	e mantiene le ueyendo <b> que por el bien comun </b> e el buen estado del regno	zmQe2YX
3.2.10	w6RNYzx	aeque de facili eius potentiae resisti : <b> nam tunc quaelibet partium timens alteram , </b> neutra insurgit contra tyrannum .	Entre tanto non puede de ligero contradezer al su mal poderio <b> por que estonçe cada vna delas partes ha miedo dela otra </b> e ninguna dellas non se leunata contra el tyrano .	w2FBaX9
3.2.11	mXFis5U	Primo enim potest hoc accidere ex magnanimitate , <b> ut quia insurgens est tanti cordis </b> ut nihil reputet magnum .	La primera sale le de sabiduria e de grant entendimiento . <b> por que cuyda que podra fallar tantas carreras e tantas maneras </b> por que pueda matar el tyrano	dOyMJbM
3.2.11	t4p7usm	Tertio potest contingere ex potentia , <b> ut si insurgens confidat de aliis ciuibus , </b> et credat se iuuari ab eis ,	¶ La . iij es que esto puede ser por fiança <b> que si el que se leunata contra el tyrano | fiare delos otros çibdadanos </b> e creyere que sera ayudado dellos	gL0o0N1, ycR64bj
3.2.12	hTrSm0m	Intendunt enim pecuniam : <b> quia quilibet principans </b> intendit augmentum illius ,	Aopmero entienden en los dineros . <b> por que cada vn prinçipan te entiende acresçentamiento de aquella cosa . </b> por la qual cosa se vee ser prinçipe .	kx6bz5J
3.2.12	gbA86zZ	ideo non credit se multitudini , <b> sed semper dubitans de furia populi , </b> maxime solicitatur circa custodiam corporis .	non fia dela muchedunbre de los çibdadanos <b> massienpre dubda dela sanna e dela ira del pueblo . </b> e por ende ha muy grant acuçia dela guarda del su cuerpo .	uOf6iy4
3.2.12	lSfklWi	et quare nunquam hylarem vultum ostenderet . <b> Tyrannus ille volens reddere causam quaesiti , </b> eum expoliari fecit ,	que nunca mostraua la cara alegte <b> e aquel tirano quariendo dar razon desto fizo despoiar a su hͣmano </b> e fizola tar	rwYYWES
3.2.12	iCQP0mV	Et cum frater eius timore horribili inuaderetur , <b> timens ab acuto gladio vulnerari , </b> et a ballistis perfodi ,	Et estonçe commo aquel su hͣrmano tomasse grant espanto <b> e grant temor | e ouiesse miedo de ser ferido del cuchiello </b> e llagado delas ballestas dixo el tyrano h̃mano gozate	fcr2cvx, rlWWILv
3.2.13	zSmNqgv	Unde et prouerbialiter dicitur , <b> quod nimis fugans timidum , </b> vi compellit esse audacem .	onde el prouerbio dize <b> que quien muncho faze foyr al temeroso </b> por fuerça lo costrange desee oscido en essa misma manera	mAHPbgb
3.2.13	gN44W9T	qui spreto communi bono totum se dedit venereis . <b> Quidam vero dux contemnens eum , </b> eo quod vitam pecudum elegisset ,	tomun todo se dapla lururia <b> e vn prinçipe despciandol </b> por que suiera vida bescia lacomenol	vcBvwsv
3.2.13	m0kk9eU	et peremit ipsum . <b> Sic etiam Dionysius posterior tyrannizans , </b> et curans magis de gula	por que suiera vida bescia lacomenol <b> e matol aver en essa is mermana diomsio el tipano </b> que cupana mas dela garganta	a6lCdYm
3.2.13	a7RfEvE	Sic etiam Dionysius posterior tyrannizans , <b> et curans magis de gula </b> quam de bono communi ,	e matol aver en essa is mermana diomsio el tipano <b> que cupana mas dela garganta </b> que del bien comun era despreçiado de los sbraditos	iDnJ9rs
3.2.13	xJ98wTK	eo quod quasi semper esset ebrius : <b> quidam enim nomine Dion videns ipsum </b> quasi semper esse ebrium ,	e por ende vn omne <b> que auja nonbre dion viendol </b> que sienpre estaua enbriago	oNtYZER
3.2.14	aXDgjL4	tres modos corruptionis tyrannidis , <b> dicens , </b> Tyrannidem corrumpi a se ,	Ca cuenta el phon enel quinto libro delas politicas tres maneras dela corrupçion dela tiranja <b> e dize que la tiranja corrope de si mismar coronpese desta çirana </b> e corronpese por El regno ¶	fxP5YZg
3.2.14	mlhEkPl	vel aliquis unus Princeps tyrannizet in populum , <b> gens illa oppressa non valens </b> sustinere tyrannidem Principis ,	enparadoro algun <b> prinçipe vno titaniza en el pueblo aquella gente apremiada non podie do sofrir su tira </b> maleunatasse e tiraniza contrael prinçipe matandol o echandol del prinçipado .	bTZIUj3
3.2.14	lKygi3U	insurgit et tyrannizat in ipsum , <b> eum perimens vel expellens . </b> Totus ergo populus efficitur	prinçipe vno titaniza en el pueblo aquella gente apremiada non podie do sofrir su tira <b> maleunatasse e tiraniza contrael prinçipe matandol o echandol del prinçipado . </b> Et por ende todo el pueblo es fech	vimMQFU
3.2.15	aggj9Uk	etiam modicae . <b> Secundum praeseruans politiam </b> et regnum regium ,	e deuen avn ser defendidos los males pequanos . <b> La segunda cosa que guarda la poliçia </b> e el gouernamiento del regno es bien vsar	uUogk6K
3.2.15	fdHTXhf	ne repente constituatur aliquis in maximo principatu . <b> Septimum saluans regnum et politiam , </b> est Regem siue principantem habere dilectionem	que adesora non sea ninguno puesto en muy grant senorio . <b> La vi jncosa que salua el regno | e la poliçia es </b> que el Rey	f0uMF11, k0V2NJC
3.2.15	fv7ZSms	Quare si Rex bonum regni diligat , saluabitur regnum ; <b> quia timens ne in regno aduersa contingant , </b> adhibebit multa consilia qualiter possit	saluat se ha el regno <b> ca temiendo que | cotezccan alguas cosas contrarias en el regno </b> aura tomar muchs consseios	h8VkSKp, lz7JNJL
3.2.15	tsjKZLi	et periculis imminentibus obuiare . <b> Octauum saluans regnum et politiam , </b> est habere ciuilem potentiam .	e pueda contradezir alos peligros <b> que pueden acaesçer¶ La . viijn . | cosa que salua el regno </b> e la poliçia es auer poderio	ezgYmH4, jDlO2ve
3.2.15	v5kSCAA	et transgressoribus iusti . <b> Nonum maxime saluans regnum , </b> est esse regem bonum et virtuosum .	que traspassan la iustiçia . <b> La ixͣ cosa que much salua el regno es </b> que el rey sea bueno e uirtuoso .	k1x9ob8
3.2.16	c623tMu	sed pro quibus sapiens , <b> et intellectum habens . </b> Ideo primo videndum est	Mas de aquellas cosas de que el sabio <b> e el que ha buen entendimiento toma consseio </b> por ende primero deuemos ver	t5kHfkD
3.2.16	i4Gq0JP	non per se , <b> sed per accidens potest </b> sub consilia cadere ,	non por si mas <b> por algun acçidente </b> por que sepamos en	pnmBkG3
3.2.17	eGJAmSu	quia ( ut dicitur 6 Ethicorum ) <b> consilians siue bene siue male consiliatur , </b> quaerit aliquid , et ratiocinatur .	en el sesto libro delas ethicas <b> aquel que demanda conseio | si quier demande conseio bien </b> si quier mal demanda alguna cosa	smiu0YR, aqdgqAf
3.2.17	wz7PLGy	non enim consiliatur scriptor <b> ( nisi sit omnino ignorans ) qualiter debeat scribere litteras , </b> quia hoc sufficienter determinatum est	Ca el esceruano non toma consseio <b> commo esceruir a las letris | si non fuere del todo nesçio </b> que non sepa en	jgNvjrU, nqaDfyx
3.2.17	wlhre6k	capitulo de Institutis antiquis , <b> commendans Romanos consiliatores , </b> ait , quod fidum et altum erat	establesçimientos antigos <b> alabando alas consseieros de roma </b> dize que de grant fe	rqtd7lt
3.2.17	khE1Zk6	2 Rhetor’ <b> quidam poeta nomine Alexander videns </b> Priamum in consiliis esse secretarium et veracem , commendans eum dicebat ,	en el terçero libro de la rectorica <b> que vn poeta | que auie nonbre alixandre veyendo </b> que primero era muy guardado enlos conseios	om3hLlR, l1cC2he
3.2.17	zYhbGOr	quidam poeta nomine Alexander videns <b> Priamum in consiliis esse secretarium et veracem , commendans eum dicebat , </b> Iste est qui consuluit .	que auie nonbre alixandre veyendo <b> que primero era muy guardado enlos conseios | e muy uerdadero </b> alabandolo dize del este es aquel que conseia	xk5QpTU, lks6w3G
3.2.18	aXlingF	sed facere consiliata velociter . <b> Omnia autem illa quae habere debet bene persuadens </b> et bene creditiuus apparenter ,	mar ala Real magestado das aquellas cosas <b> que deue auer aquel | que bien amonesta </b> e bien razona	e6vM6y6, gQ6XR0H
3.2.18	fASFrST	Bene igitur dictum est <b> quod quicumque bene persuadens , </b> habet apparenter ,	Et pues que assi es bien dicho es <b> que todas aquellas colas </b> que ha el	gY4tGkH
3.2.18	j40MRfC	quod contingit , <b> si dicens sit bonus , </b> vel credatur bonus .	que oyen puede ser de parte de aquel que las dize e esto <b> contesçe quando el que lo dize es en ssi bueno </b> o creen los omes que es bueno .	mOOHK7Z
3.2.18	qtgf0aG	ex parte dicentis ; <b> nam quia dicens creditur esse bonus , </b> cum tales mentiri nolint ,	mas esta fe uiene de parte de aquel que dize e fabla . <b> ca por que el dezidor es creydo | que es bueno </b> e los bueons non quieren mentir	yCqlI0b, a3uO505
3.2.18	wqcsYFa	quod contingit <b> si proferens sermones </b> sit beniuolus et amicus .	de parte de los dizidores la qual cosa contesçe <b> si el que dize las palabras </b> fuereentre los oydores bien quarido	gjJyk8U
3.2.18	caxZwXG	quod contingit , <b> si dicens sit prudens </b> vel credatur esse prudens .	la qual cosa contesçe <b> quando el dezidor es sabio </b> o es tenido por sabio .	t8mRHvL
3.2.18	yYrVrpd	vel quod credatur esse prudens . <b> Omnis ergo bene persuadens , </b> vel omnis ille cuius dictis creditur	o que sea tenido por sabio . <b> Et pues que assi es todo buen amonestador o razonador </b> o todo aquel	gPDFBGy
3.2.18	x8KPwye	Itaque cum dictum sit <b> quod qui bene persuadens , </b> et ille cui fides adhibetur ,	Et por ende commo sea dicho <b> que el que es buen amonestador e razonador </b> e aquel a que los omes creen	fQBBYPB
3.2.19	mJMZ8Tb	secundum quem dominatur habet saluari et corrumpi : <b> ut eligens optimum modum principandi , </b> ferat leges iustissimas ,	enssennorea se ha de saluar o corronper . <b> por que escogiendo la meior manera de prinçipar o de </b> enssennorear	pdIOHZq
3.2.20	fgGB8kZ	et quam paucissima arbitrio iudicum committere . <b> Has autem tres rationes tangit Philosophus 1 Rhetoricorum dicens </b> quod maxime quidem contingit	e en aluedrio de los iuezes . <b> Et estas tres cosas tanne elpho | en el primero libro de la rectorica </b> diziendo	n555Xxq, i7Z44QY
3.2.21	p2vmKXk	sic debet se habere inter partes litigantes , <b> sicut lingua volens discernere de saporibus , </b> vel sicut quilibet alius sensus volens discernere	que contienden <b> commo la lengua | quando quiere iudgar de los sabores </b> o si commo cada vno de los otros sesos	wE4KUqH, sabxnQV
3.2.21	dAYgvTw	sicut lingua volens discernere de saporibus , <b> vel sicut quilibet alius sensus volens discernere </b> de proprii sensibilibus ,	quando quiere iudgar de los sabores <b> o si commo cada vno de los otros sesos | quando quieren iudgar delas otras cosas </b> que sienten propriamente	p3w5zyQ, amZYWEU
3.2.21	mQH9Qsj	infecto aliquo humore , recte iudicat , <b> dicens amarum esse amarum , </b> et dulce dulce .	por algun humor iudga derechͣmente diziendo <b> que lo amargo es amargo </b> e lo dulçe es dulçe .	fCrNF6j
3.2.21	kB7yNBI	colera vel phlegmate vel aliquo alio humore , <b> tunc non quasi existens in medio , </b> sed contracta ad alterum contrariorum ,	o por alguno de los otros humores estonçe <b> assi commo aquella que non esta en medio </b> mas esta trayda a	h9DYofb
3.2.21	z9c8JDr	peruersae iudicat , <b> dicens dulce esse amarum , </b> et econuerso ,	algundelas partes contrarias iudga mal diziendo <b> que lo dulçe es amargo </b> e lo amargo es dulçe .	vRYT4Er
3.2.21	sJrd0Hs	quando est medius <b> inter litigantes non declinans ad alteram partem , </b> quasi regula recta decet	assi el uiez mientra el esta medianero <b> entre las partes | que contienden non se enclinando a ninguna delas partes es </b> assi commo regla derecha diziendo	pefjBGQ, h8t8ymS
3.2.21	fKS5SBK	Si autem discit ab eis quid iustum , <b> hoc est per accidens , </b> inquantum allegant leges conditas a legumlatore .	Mas delas partes aprende qual es el fecho <b> o qual non es el fecho . Mas si aprende delas partes quales el derecho esto es auentura en quanto </b> allegansas leyes establesçidas	onG3MqO
3.2.21	aQe8tH2	nihil oportet dici in iudicio <b> nisi pertinens ad rem vel ad negocium , </b> de quo est litigium :	non se deue dezir ninguna cosa en iuizio <b> si non lo que pertenesçe a aquel fecho | o a aquel negoçio </b> de que contienden	oMOKoiR, diqY3bv
3.2.23	aKYy24X	Ideo dicitur 1 Rheto’ <b> quod iudicans potius debet </b> respicere ad legislatorem ,	Et por ende dize el pho enel primero libro de la rectorica <b> que el iuez </b> mas deue tener mientes al ponedor dela ley	cbfjk5o
3.2.23	qtwJJbq	quam ad leges . <b> Tertium inclinans ad pietatem </b> est pius intellectus legum .	que alas leyes . <b> Lo terçero que inclina al iuez a piedat </b> e es piadoso entendimiento delas leyes .	oukEzMi
3.2.23	ieZSYjK	hoc est ergo quod dicitur 1 Rhetor’ <b> quod iudicans non debet </b> respicere ad verba legum ,	enl primero libro de la rectorica <b> que el iuez non deue parar mientes </b> alas palabras delas leyes mas al	p7zAk2z
3.2.23	yGfnvT8	dicitur 1 Rhet’ <b> quod iudicans debet </b> aspicere non ad actionem ,	en el primero libro de la rectorica <b> que el que iudga non deue tener </b> mientesa la obra mas ala entençion .	p7hN5RO
3.2.23	n9JlO01	sed ad electionem . <b> Quintum inducens ad misericordiam , </b> est multitudo bonorum operum .	mientesa la obra mas ala entençion . <b> Lo quinto que enduze el iuez ami bicordia </b> es muchedunbre de buean sobras .	arFDMIp
3.2.23	zFZFOze	ideo dicitur 1 Rhetor’ <b> quod iudicans non debet respicere ad partem , </b> sed ad totum .	en el primero libro de la rectonca <b> que el uiez non deue catar ala parte mas al todo | nin deue tener mientes a vna obra </b> que fizo mas a todas las buenas obras	sLjyj3a, nGNo0LA
3.2.23	mJ1jrDO	Istud itaque sextum inclinatiuum ad pietatem <b> respiciens diuturnitatem temporis , </b> non est idem cum quinto ,	Et por ende estas esta razon que inclina al iues a piedat <b> catando alongamiento de tp̃o non es vna </b> nin es essa misma	aV0Pt0n
3.2.23	aBqAiTE	est cum ipso misericorditer agendum , <b> et magis respiciendum est ad multum et ad totum tempus praecedens , </b> quam ad modicum	deue el iuez con el passar mibicordiosamente . <b> Et en tal cosa commo esta mas deue omne tener mientes alo much | assi commo a todo el tp̃o passado </b> que alo poco	vQsJVJm, xY5bzwU
3.2.23	lwl4CQk	semper in multo tempore praecedenti . <b> Septimum inclinans ad pietatem , </b> est excessus bonitatis supra malitiam .	mas qual fue en el mucho t pon que passo¶ La . vij̊ <b> que enduze al iuez a piedat </b> es sobrepuiança de bondat sobre la maldat .	xZiH7Gd
3.2.23	b5ohEmS	Ideo Philos’ 1 Rhet’ <b> volens iudicantes </b> ad misericordiam adducere	por ende el pho en el primero libro de la <b> rectorica quariendo enduzir los iuezes a misericordia </b> contra los que yerran contra ellos dize	hxwGUGw
3.2.23	a9STFGQ	si credat magis peccantem iudicari velle sermone quam opere . <b> Decimum inclinans ad clementiam , </b> est subiectio et humiltas delinquentis :	mas iudgado e castigado <b> por palabta que por obra . | Lox̊ que inclina el iues a mihicordia </b> e a piedat es la	lqVE4Mr, nTG0lrq
3.2.23	tXcTZbo	est subiectio et humiltas delinquentis : <b> nam si delinquens omnino se subiicit , </b> omnino se humiliat ,	subiectonn e la humildat del que peca . <b> ca si el que peca en toda manera se somete </b> e se homilla e se pone todo en el aluedrio del iuez	rbC6et0
3.2.24	jXUF3Po	Quare si ius naturale dictat fures et maleficos esse puniendos , <b> hoc praesupponens ius positiuum procedit ulterius , </b> determinans qua poena sint talia punienda .	e los mas fechores sean castigados <b> e ayan pena el derech | positiuo prisu pone esto va adelante </b> determinando de qual pena de una ser	hazAHLw, mFXiwNc
3.2.24	iwtBM5W	hoc praesupponens ius positiuum procedit ulterius , <b> determinans qua poena sint talia punienda . </b> Hoc viso quantum	positiuo prisu pone esto va adelante <b> determinando de qual pena de una ser | tales cosas castigadas o condep̃nadas . </b> ¶ Esto uisto quanto pertenesçe alo presente podemos mostrar dos departimientos	qaUiTf7, lDG2Skn
3.2.29	aq3gC0J	sed lex <b> quia est aliquid pertinens ad rationem , </b> videtur dicere intellectum solum :	mas la ley por que es alguna cosa <b> que parte nesçe </b> a razon paresçe	av5LPxE
3.2.30	m4xhq7n	et humanam fuerit <b> expediens </b> dare legem euangelicam et diuinam ,	ø	ø
3.2.30	tWw3Ofw	ut vitentur adulteria . <b> Secunda via ostendens necessariam esse legem euangelicam et diuinam , </b> sumitur ex parte cognitionis nostrae ,	por que sean escusados los adulterios . <b> ¶ La segunda razon que muestra la ley en angelical </b> e diuinal ser neçessaria es tomada deꝑte del nuestro conosçimiento	apbPG7U
3.2.30	hSBMc7l	Quare cum in humanis iudiciis cadere possit dubieras et error , <b> expediens fuit lex euangelica </b> et diuina	cosa muy aprouechable <b> e muy neçessaria fue la ley e una gelical e diuinal </b> en la qual non puede caer yerro .	q2X4Din
3.2.31	b8TmiSY	cum disputat contra Hippodamum , <b> utrum sit expediens ciuitatibus </b> innouare patrias leges ,	quando disputa contra ypodomio <b> si es cosa conuenible alas çibdades </b> de renouar las leyes dela tierra	qugoPXF
3.2.31	hSIfvQM	( ut supra tetigimus ) <b> quod inueniens aliquam legem ciuitati proficuam , </b> honorem acciperet in ciuitate illa ;	assi commo dixiemos de suso <b> que aquel que fallasse algunan ley a prouechosa ala çibdat </b> resçibiesse honrra en aquella çibdat .	eGmucCK
3.2.31	svhJGNl	ab eo reputabatur <b> fugiens reus homicidii : </b> dicebat enim legislator	si suye tenien le <b> por culpado del omiçidio . </b> Ca dizia el fazedor dela ley	i2uqK8c
3.2.32	x58vneQ	quod bonorum illorum sit potius . <b> Narrat quidem Philosophus 3 Politic’ volens diffinire </b> quid sit ciuitas ,	qual de aquellos bienes es el meior . <b> Et cuenta el philosofo enel terçero libro delas politicas | quariendo de el arar </b> que cosa es la çibdat seys bienes	wKPEcuP, oae9btx
3.2.32	v1xbNZP	et propter non iniustum pati . <b> Nam quia homo unus solitariam vitam ducens , </b> non est sufficiens resistere impugnantibus ,	e por que non pudiessen resçebir tuerto delos enemigos . <b> Por que vn omne biuienda solo </b> apartadamente non se podria	oBgf5OO
3.2.32	sC6FCD6	ut homo qui solitarius se non potest tueri <b> ab hostibus existens pars multitudinis , </b> tute et absque formidine viueret .	non se podria defender de los enemigos . <b> Et seyendo parte de muchedunbre de çibdat </b> puede benir seguro	kHP5dbl
3.2.32	aachaRy	de leui patere potest , <b> qualis debeat esse populus existens </b> in ciuitate et regno .	e que cosaes regno de ligero puede paresçer <b> qual deue ser el pueblo que es en el regno e enla çibdat . </b> Ca si la çibdat e el regno son ordenados	kKEvOOQ
3.2.33	cq6zglj	nec unde ei inuideat <b> videns se ei quasi aequalem existere , </b> et non esse magnum excessum inter ipsos .	nin donde aya enuidia al otro <b> ueyendo que es su egual e veyendo </b> qua non ay grant auna taia entre el vno e el otro .	eiGDlz7
3.2.34	gKjpqdQ	quantum sit utile <b> et expediens populo </b> obedire Regibus et Principibus ,	por tres razones <b> quanto es prouechoso e conuenible al pueblo de obedesçer alos Reyes </b> e guardar las leyes .	wrNdRXB
3.2.34	vGfWQw7	et ei cuius est leges ferre . <b> Quare si principans recte regat populum sibi commissum , </b> quia intentio eius est	e a aquel a quien pertenesçe de poner las leyes . <b> Por la qual cosa si el prinçipe gouernar e derechamente el pueblo qual es acomne dado </b> por que la su entençion es enduzir los otros a uirtud .	pf1lKWs
3.2.34	ssP9VUq	Imo tanto magis est <b> hoc expediens nobilibus quam ignobilibus , </b> quanto decentius est	ante digo que tanto mas es meester tan bien alos nonbles <b> commo alos non nobles </b> quanto mas conuenible es	of59c8Z
