Localisation	Id. source	Segment source	Segment cible	Id. cible
2.1.19	kKxhMsc	in uniuersali tractare de regimine coniugali , <b> dicendo ipsum esse differens </b> a paternali et seruili ,	assi en general del gouernamiento matermonial del marido ala mugni <b> que es departido del gouernamiento paternal </b> e del gouernamiento	qydPt5Z
2.1.21	kzEo6mr	ostendit Philosophus 1 Rhet’ <b> qui loquens de Lacedaemoniis , </b> ait , eos esse infelices secundum dimidium ,	en el primero libro de las rectorica <b> do dize fablando de los laçedemonios | que son gente de greçia </b> e desauentraados en la meytad de su fazienda	ds8bBB1, lStkZow
2.1.21	smfUsc4	humilis <b> non ornans se propter vanam gloriam , </b> posset delinquere in ornatum ,	que la muger eł uaron fuesse humillosa <b> e non se posie con sse </b> por uana eglesia podria pecar	x7eXVJX
2.1.23	byUUsy8	propter quod magis obsequitur ei : <b> et anima existens in tali corpore , </b> liberius utitur operibus propriis ,	mas es proporçionado e egualado al alma . <b> Et el alma que esta en tal cuerpo meior vsa de sus obras propiçias </b> e mas	wvL5Q7q
2.1.23	pDy18c8	quod mala herba cito crescit <b> quia natura de ea modicum curans , </b> cito perducit	que yerba mala mas ayna cresçe <b> por que la natura ha poco cuydado della </b> e ayna la aduze a su conplimiento .	jJqGIQP
2.2.3	vfV2RgA	Sciendum ergo triplex esse regimen . <b> Nam omnis regens alios , </b> vel regit eos	que tres son los gouernamientos . <b> Ca todo omne que gouierna alos otros </b> o los gouierna segunt ciertas leyes	zcatJbE
2.2.3	g0qZTj7	et hoc potest esse dupliciter : <b> quia vel sic regens </b> intendit bonum proprium ,	Et esto puede ser en dos maneras . <b> Ca el que gouierna o entiende el su bien prop̃o </b> e assi es dicho gouernamiento despotico o suilo	j8CYE5r
2.2.3	x0qhfT6	quia filius naturaliter est <b> quaedam similitudo procedens a patre : </b> cum secundum naturam ad huiusmodi similia fit dilectio ,	Por la qual cosa si el gonernamiento del padre desto tora a comienco <b> por que el fijo naturalmente es vria semerança que desçende del cadre . </b> Canmo segunr nacsta	xoWedVP
2.2.4	k0rTuqn	quia de illis certiores existunt . <b> Tertia via probans hoc idem , </b> sumitur ex unione parentum ad filios .	¶ <b> La tercera razon que peua esto mismo se toma del ayuntamiento de los padres alos fijos . </b> Ca los fijos son mas ayuntados	eRSJo4L
2.2.4	sKIMa3Y	qui est quaedam gleba <b> a parentibus descendens , </b> et quia est quaedam pars ipsorum ;	que es vn çesped <b> que desçende del padre es vna parte del </b> e non ay ninguna cosa en el fijo	xTHDQSR
2.2.5	cmSGWVs	Unde et Philosophus 2 Meta’ <b> volens probare </b> consuetudinem esse magnae efficaciae ,	Onde el philosofo en el segundo libro dela <b> methafisica quariendo prouar </b> que la costunbre es de grand fuerça dize assi .	wDP2Npj
2.2.8	oJpKFgk	quae est quaedam grossa dialectica <b> docens modum arguendi </b> grossum et figuralem .	assi fue neçessaria la rectorica <b> que es assi commo vna logica gruessa </b> que nos mostrasse manera gruessa e figural	nBLWn06
2.2.8	aPl0X0G	dicitur esse arithmetica , <b> docens proportiones numerorum , </b> ad quam forte filii liberorum ideo tradebantur ,	La quinta sçiençia libal es dicha arismetica <b> que muesterra las proporçiones | e las concordanças de los cuentos </b> ala qual sçiençia	jes6GxJ, rs8BZ8L
2.2.8	j5GptPC	longe nobiliores istis . <b> Nam Naturalis Philosophia docens </b> cognoscere naturas rerum ,	qua non estas . <b> Ca la natural ph̃ia </b> que muestra conosçer las naturas delas cosas	syRzDwI
2.2.9	i3V8G34	sed quod sit perspicax <b> et intelligens aliorum dicta . </b> Tertio oportet ipsum esse iudicatiuum :	que alguno sea inuentiuo e fallador dessi mas conuiene que sea agudo <b> e que entienda los dichͣs de los otros . </b> ¶ Lo terçero conuiene que sea iudgador	gxEWWnK
2.2.9	aXNOfxK	qui sit inuentiuus ex se , <b> intelligens alios , </b> et bene iudicatiuus	que sea fallador dessi <b> e entendedor de los otros </b> e buen iudgador tan bien delas cosas entendidas	qFoW1oH
2.2.9	y5zJ6OB	recolendo praeterita . <b> Nam sicut volens rectificare virgam , </b> nunquam eam rectificare posset	Ca primero deue ser menbrado e acordado delas colas passadas . <b> Ca assi commo aquel que quiere enderesçar la pierte </b> ga nunca la puede enderesçar	nsSWeMR
2.2.9	lOvbENJ	ex qua parte esset obliquata : <b> sic volens alios rectificare </b> nunquam eos congrue rectificare posset	ga nunca la puede enderesçar <b> si non conosçiere de qual parte esta tuerta . En essa misma manera aquel que quiere enderesçar los otros </b> nunca los podria enderesçar	xHIuWKk
2.2.9	e9I0VOh	Sic qui vult iuuenes dirigere debet esse , <b> cautus proponens eis bona </b> sine admixtione malorum .	deue ser sabio <b> aponiendo les los bienes </b> sin mesclamiento de ninguons males	fjST5DE
2.2.12	gPNo9vM	In qua autem aetate debeant uti coniugio , <b> ostendit Philosophus 7 Poli’ dicens , </b> quod in muliere requiritur aetas decem et octo annorum ,	Mas en qual hedat deuen los omes vsar del casamiento <b> muestra lo el philosofo | en el septimo libro delas politicas </b> o dize	oTGWIWD, wPut1jR
2.2.20	f2RFdzE	non vacaret ociose , <b> sed saepe saepius librum arripiens , </b> se lectionibus occuparet .	non estudiesse baldia nin oçiosa mas muchͣs <b> e muchos uegadas tomando el libro s </b> e trabaiasse en rezar sus leçiones o sus salmos o sus oronnes .	rOlBACI
2.3.1	tWAQBgq	et spectat ad fabrum talia instrumenta cognoscere . <b> Sic volens tradere notitiam de arte textoria , </b> debet determinare de pectinibus ,	cognosçertales estrumentos . <b> Et dessa misma manera | el que quiere dar conosçimiento del arte del texer </b> deue determinar de los peinnes	ubjQPSx, hnqcYHG
2.3.1	ngpl4oF	talia instrumenta cognoscere . <b> Quare volens tradere notitiam </b> de arte gubernationis domus ,	e pertenesçe al texedor de conosçer tales estrumentos . <b> Por la qual cosa el que quisiere dar conosçimiento del arte del gouernamiento dela casa </b> deue determinar de los hedifiçios	m0I44vE
2.3.3	tzqdFRi	et talia aedificia construere , <b> quod populus ea videns , </b> quasi sit mente suspensus propter vehementem admirationem .	e de fazer tales moradas <b> que el pueblo que lo viere </b> finque assi commo espantado	f1H6DUJ
2.3.3	u7IgeU1	Nam populus minus insurgit contra principem , <b> videns ipsum sic magnificum : </b> quilibet enim de populo	contra el prinçipe <b> quando vee | que el es muy magnifico </b> por que cada vno del pueblo	iSd0guU, zos0ohK
2.3.3	eM12bR5	Sic enim imaginari debemus , <b> quod sicut aqua currens sanior est quam stans , </b> eo quod aquae stantes	porque deuemos assi ymaginar <b> que assi commo el agua corre es mas ssana | que non la estançia </b> que non corre	sIOrxt4, x0EmO7Z
2.3.4	c2v0vy5	eo quod eis sit <b> aqua quodammodo stans , </b> ut plurimum habent aquam non salubrem .	por que en ellas es el agua <b> estantiaqua non corre </b> e por ende por la mayor parte non han el agua sana¶	iRqiKo7
2.3.4	e6rHiee	ut horum natatu aqua <b> stans agilitatem currentis imitetur . </b> Viso , qualiter est aedificium construendum quantum	por que por el nadamiento de los peces <b> el agua estante semeie en lignieza al agua que corre ¶ Visto en qual manera son de fazer las moradas </b> quanto ala salud delas agunas finca de ver	yBveEKv
2.3.4	eHkvvjm	si aedificium <b> secundum suam ampliorem partem respiciat oriens hyemale : </b> tunc enim eo quod in hyeme oppositum sit soli ,	Lo primero puede contesçer si la morada <b> segunt la su parte mayor | catare a lorsete del yuierno </b> por que estonçe la morada	ajIaVeg, aU5dFT3
2.3.5	iBNsr7Y	sic natura ordinauit , <b> ponens in ipsis ouis album et rubeum , </b> ita quod ex albo generatur auis ,	assi commo son las aues la natura <b> assi ordeno poniendo en los hueuos blanco e bermeio </b> assi que del blanco se engendra el aue	hTkahqN
2.3.6	gtSHl7r	quod esset utile <b> et expediens ciuitati </b> quod ciues propriis possessionibus non gauderent ,	que cola aprouechosa <b> e conueniente serie ala çibdat </b> que los çibdadanos non gozassen de sus possessiones proprias	tVMSytC
2.3.6	dQNaQC6	ne faciat quod mandatur , <b> sperans alium implere </b> quod iubetur ;	aquello qual es mandado <b> elperando que el otro cunplira aquello que a el es mandado . </b> Por la qual cosa conuiene	s0NXQ2g
2.3.7	axdSUJD	quia natura talia produxit , <b> ordinans ea ad usum hominis : </b> semper enim imperfecta	por quela natura engendro tales cosas <b> ordenando la sal vso del omne | ca sienpre las cosas </b> que non son acabadas son ordenadas alas mas acabadas	gTHbNwk, h600ENV
2.3.7	iQHwBMM	Si enim homines aliqui contra alios iuste bellant , <b> hoc quasi per accidens , </b> inquantum illi aliquo modo forefaciunt	conuenibleca si algunos omes batallan derchamente contra otros <b> esto es por algun açidente en quanto aquellos en algua manera </b> fazen o fizieron algua cosa desagnisada contra ellos .	y80eS5L
2.3.7	iu6u4gj	Si autem in offensione bestiarum est delictum , <b> hoc est quasi per accidens , </b> inquantum talis offensa redundat	Et si en faziendo mal alas bestias es pecado <b> esto es </b> por açidente en quanto tal danno se torna en danno del omne	yyXTZIy
2.3.9	iivzXlc	quibus factis videtur <b> utens illis esse in honore et gloria . </b> Primitus ergo inuentae fuerunt commutationes ad metalla solum secundum pondera :	los quales assi fechs paresçen alos omes <b> que los que vsan dellos son en eglesia e en honrra . </b> Et pues que assi es primeramente fueron falladas las mudaçiones delas cosas alos metalles	vS9Cbot
2.3.11	jUYwZUZ	et nihil usurpat , <b> si retinens sibi dominium domus , </b> uendit inhabitationem ,	Et por ende assi faziendo non robanada <b> nin toma uso ageno si retiniendo en ssi el señorio dela casa vede la morada </b> e el uso della mas en los dineros non es	ael65JK
2.3.11	rwZTQMc	ipsam substantiam alienare . <b> Quia ergo accidens a substantia dependet , </b> et usus ex ipsa re sumit originem ,	dellos commo atal uso pertenezca de enagenar la sustançia . <b> Et pues que assi es por que el açidente desçende dela sustançia del subieto </b> en que esta e el uso toma nasçençia dela sustançia	bPOraUa
2.3.13	bYkvpFi	secundum debitum ordinem efficiunt aliquid unum , <b> nisi sit ibi aliquid praedominans respectu aliorum : </b> ut si plures voces efficiunt aliquam harmoniam ,	segunt orden conuenible <b> siy non fuere entre ellas algunan cosa | que en ssennore </b> e en conpara conn delas otras .	yPpsR9c, oFks7e8
2.3.13	hHSEijb	ad constitutionem eiusdem corporis mixti , <b> oportet aliquod elementum praedominans , </b> secundum quod illi mixto competat	conuiene de dar <b> ay algun helemento | que ssennoree sobre los otros </b> segunt el qual conuiene aquel cuerpo mesclado mouimiento con ueinble o asentamiento con ueible	mms0Naf, pKS3V6N
2.3.13	ujcbvsu	naturaliter aliquid unum , <b> nisi ibi naturaliter aliud sit praedominans : </b> cum societas hominum sit naturalis ,	muchas fazen naturalmente alguna cosa <b> que sea vna si non | fuereynatraalmente alguna cosa </b> que en ssennore e a todas aquellas muchͣs .	v17UeHc, uqZ2awO
2.3.13	sPiFD50	in partes naturales diuiditur in corpus et animam : <b> ubi anima est quasi dominans , </b> et corpus est quasi obsequens et obediens .	assi commo en partes essençiales . <b> En la qual particion el alma es | assi commo señora . </b> Et el cuerpo es	wfvdfsw, tkA9sl6
2.3.14	yUiDfJg	Prima congruitas sic patet : <b> oportet enim dominans </b> ( ut dicitur in Politic’ )	la primera razon paresçe assi . <b> Ca conuiene que el sennor | segunt </b> que dize el philosofo	oCuXv1E, bRmCb4W
2.3.14	lVqmTNe	sed magis faciunt ipsum legale et positiuum . <b> Quod enim superans in bonis corporis , </b> ut in fortitudine ,	e positiuo por establesçimiento de los omes . <b> Ca aquel que ha auentaia en los bienes del cuerpo </b> assi commo en fortaleza o en poderio ciuil deue	sS8G0Ui
2.3.15	pxxBZza	ille enim mercenarius dicitur , <b> qui principaliter mercedem intendens , </b> obsequitur ei ,	por que aquel es dich merçenario <b> que prinçipalmente entiende resçebir merçed </b> e por ende obedesçe	biuti96
2.3.15	mjPTbIo	ampliora beneficia tribuenda : <b> cum ergo virtuosus seruiens </b> ex amore honesti ,	Ca sienpre alos mas digunos son de dar los mayores benefiçios . <b> Et por ende commo el seruiente uirtuoso </b> que sirue por amor de bien e de honestad sea mas digno que el que sirue	gIEkfrY
2.3.16	i2nTAFY	nam saepe quilibet ministrantium huiusmodi ministerium negligit , <b> credens quod alius exequatur illud : </b> ubicunque enim est multitudo ,	Ca muchͣs uezes cada vno de aquellos seruientes <b> menospreçia aquel seruiçio cuydando que el otro lo fara . </b> Por que do quier que ay muchedunbre alli es confusion	z8zd4pq
2.3.19	k7asCSs	et ab usu rationis deficiat . <b> De his autem loquens Philosophus </b> circa finem primi Politicorum ait ,	e aquel que fallesçe de uso de razon e de entendimiento <b> e atal non deuen descobrir sus poridades . | Mas fablando elpho destas cosas </b> cerca la fin del prim̃o libro	mShJr0f, ikByQMh
3.1.1	udvY25v	et eam quae est omnium maxime principalis , <b> et omnes alias circumplectens , potissime gratia boni constitutam esse contingit : </b> haec autem est communitas politica ,	Et toda cosa que encieira en ssi las o triscosas <b> couiene que sea establesçida prinçipalmente | por grande algun bien </b> e esta es comunidat politica	wPiN66W, lqPVdFT
3.1.2	fzw94UM	et secundum aliquas laudabiles ordinationes , <b> recusans sic viuere , </b> non vult viuere ut homo ,	e segunt alguas ordenaconnes de loar <b> el que refusare de beuir </b> assi non quiere beuir commo omne	vRsUfS8
3.1.2	uFjBewo	vel in uno vico non reperiuntur <b> omnia quae ad vitam sufficiunt , ideo fuit ciuitas constituta habens plures vicos , </b> in quorum uno exercetur ars fabrilis ,	que cunplen ala uida del omne . <b> Et por ende sue establesçida la çibdat | que ha muchos uartios en el vno </b> de los quales se obra la ferreria	qKw0V8v, h7RhDw0
3.1.2	f7HtNlx	huiusmodi communitas est <b> habens terminum omnis </b> per se sufficientiae vitae .	ca esto se sigͤel dezir <b> que tal comunidat es la que ha termino </b> por si e todo conplimiento e abastamiento de uida	mpZhIvM
3.1.2	wPZohLE	quidem igitur est ciuitas viuendi gratia : <b> existens autem gratia bene viuendi </b> forte	non solamente por grande beuir <b> mas por grande beuir bien </b> e segunt ley	dvO7aUR
3.1.2	sfy4sBn	constituerunt ciuitatem , <b> ut unus alterius defectum supplens </b> haberet sufficientia in vita .	por ende establesçieron çibdat <b> por que vn uario cunpliesse la mengua del otro </b> e ouiessen abondança en la uida	v888712
3.1.3	rW10bxz	quos ( ut recitat Philosophus 1 Poli’ ) <b> maledicebat Homerus , dicens , </b> Maledictus insocialis , inlegalis , sceleratus , affectator belli ,	en el primero libro delas politicas <b> do dize que maldicho es el | qua non tiene conpan nina </b> e el que non es legal nin guarda ley	y0KAfUo, uKcbMVq
3.1.3	tfAI3Yb	veluti sicut <b> sine iugo existens sicuti volatilia . </b> Tertio aliqui non ciuiliter viuunt	assi commo si fuesses un yugo <b> e sin ley commo las aues todos estos linages de oms son maldichos </b> ¶la terçera razon	mtIW5tX
3.1.3	wOp4rLQ	vel est bestia et sceleratus et sine iugo , <b> non valens legem et societatem supportare , </b> vel est quasi deus idest diuinus ,	o pecadar e sin yugo de ley <b> que non quiere conplir les | nin sofrir conpannia </b> o por que es diuinal	m7EWr8B, jgZjQSo
3.1.3	wUX6Dmu	vel est quasi deus idest diuinus , <b> eligens altiorem vitam : </b> propter quod scribitur primo Poli’	assi commo dios <b> que escoge uida mas alta que los otros </b> por la qual cosa dize el philosofo	pHJqgbk
3.1.4	twtoYWQ	per quem distincte significatur <b> quid conferens , </b> quid nociuum ,	departidamente <b> qual cosa le es delectable </b> e qual enpeçible	y1EOtFF
3.1.4	kAoDp3l	et quid iniustum . <b> Si ergo communitas domestica ordinatur ad prosequendum conferens , </b> et ad fugiendum nociuum :	e qual non iusta <b> por ende | si la comunidat dela casa es ordenada a alcançar lo que es delectable </b> e para foyr	jVc6Ecx, op5BACq
3.1.4	oUvpMIn	quia in ea non solum quaeritur <b> quid conferens et quid nociuum , </b> sed etiam quid iustum et quid iniustum :	por que non solamente en la çibdat es demandado <b> que cosa es delectable | e que cosa es enpesçible </b> mas avn y es demandada	ycaHfV4, u11XEhD
3.1.4	bjtwF2t	datum a natura repraesentatur <b> conferens et nociuum , </b> et iustum et iniustum .	por quela palabra anos en dada naturalmente demostrar <b> qual cosa nos es delectable | e qual enpesçible </b> e qual nos es iusta	utiVpgn, omv73fF
3.1.5	h0cDn20	ex pluribus vicis , <b> est habens terminum omnis </b> per se sufficientiae vitae .	que es çibdat se faga de muchsuarios <b> e aya en ssi conplimiento delas cosas </b> que ꝑtenesçen ala uida esto non es assi de entender que sienpre conuenga	idyNFVf
3.1.5	q4PuIor	quanto minorem haberet potentiam , <b> tanto magis esset expediens ciuitati . </b> Tertia via ad inuestigandum hoc idem ,	en todo quanto menor poderio ellos ouieren tanto <b> mas es pro dela çibdat </b> ¶ La terçera razon para prouar esto mismo se toma	jUpGb4H
3.1.6	waBxIG1	et per tyrannidem constitui posset , <b> ut si quis dominans alicui ciuitati per tyrannidem </b> et per ciuilem potentiam	e por tirania se podia establesçer <b> assi como si alguno quisiesse | senorear alguna çibdat </b> por tirania e por poderio ciuil apremiasse las otras çibdades	y1esVg1, l4yHAJc
3.1.7	zTEBiYc	circa naturas rerum , <b> videns circa naturalem scientiam </b> magnam difficultatem esse ,	as socrates commo ouiesse phophado luengo tienpo çerca las naturas delas cosas <b> ueyendo muy grant guaueza cerca la sciençia natural </b> assi commo cuenta el pho	rNRomUE
3.1.8	nDazFtc	oportet in ciuitate diuersitatem esse . <b> Tertia via declarans </b> et manifestans vias praedictas ,	conuiene que enla çibdat sea algun departimiento . <b> La tercera razon que declara e manifiesta las razones </b> ya dichos se toma en conparaçion del todo alas partes	eal5phx
3.1.8	j9no1FP	nam ciuitas est communitas <b> habens terminum omnis </b> per se sufficientiae vitae :	ca la çibdat escomunidat <b> que ha </b> por si termino de abastamiento deuidaso	eCU7PGt
3.1.8	yasSyXW	et diuersos habere vicos , <b> ut expediens ad vitam </b> quod non neperitur in uno vico ,	e de auer departidos uarrios <b> assi que abonden a la uida </b> por que aquello que non fuer fallado en vn uarrio	bqU7MUy
3.1.9	xnn2Jou	quam ponebat Socrates , <b> non est expediens ciuitati , </b> Decet autem hoc Reges ,	pues que assi es aquella comuidat <b> que ponian platon e socrates non era conueinble ala çibdat . </b> Mas conuiene alos Reyes	d693J0w
3.1.10	rSEZmCr	et patres filias . <b> Socrates volens hoc inconueniens vitare , </b> dixit ,	e los padres con sus fijas . <b> Empero socrates quariendo escusar este mal dix̉o </b> que al prinçipe dela çibdat pertenesçia de auer cuydado e acuçia	aq4HA9U
3.1.11	pLMhlyQ	( ut Philosophus ait ) <b> superficietenus considerata valde expediens ciuitati : </b> cum enim quis audit ciuitatem	assi commo dize el philosofo <b> si fuere penssada a de fuera | e liuianamente paresçe muy conueinble a la cibdat </b> ca quando algud vee	zPkeE3g, fBeCna4
3.1.11	zG4NsOw	et possessiones proprias quantum ad dominum : <b> nam quilibet dominans bonis propriis </b> adhibebit	e las possessiones prop̃as quanto al sennorio . <b> ca cada vn sennor de sus bienes propreos aura mayor acuçia de aquellos bienes </b> que si fuessen comunes	g3jSckj
3.1.12	wJfIcED	sicut et viri : <b> assumens exemplum ex bestiis , </b> ex quibus tam mares quam foeminae bellant .	assi commo los omes <b> e tomaua enxienplo delas bestias </b> entre las quales las fenbras lidianta bien commo los mas los .	bV6XPvA
3.1.12	he7ek7J	a similitudine bestiarum , <b> insufficiens est : </b> quia secundum Philosophum 2 Poli’	la qual razon tomo delas semesaças delas bestias <b> non es buena nin conplida </b> por que segunt el philosofo	ssGoqkR
3.1.13	nDScP6e	Possumus autem triplici via ostendere , <b> quod non sit expediens ciuitati </b> semper praeponere	por tons razones <b> que non es conuenible ala çibdat </b> que sienpre sean puestos vnos maestros	aZTDMeo
3.1.13	sLSPWY2	non sic potest iniustificare , <b> ut publica et habens potestatem ; </b> et quia non tot oculi respiciunt	assi mostrat la su maldat <b> commo quando es persona publica | e ha poderio </b> por que non paran mientes tantos oios	s9oqvg9, xUfOmmn
3.1.13	qapEctE	non scitur qualis sit vir , <b> donec est persona priuata non habens potestatem , </b> sicut cognoscitur postquam	assi saber quales el uaron mientra es persona preuada <b> que non ha poderio </b> commo se conosçe despues que esle un atada en alguna dignidat o en algun maestradgo o en algun poderio	zFBPkWk
3.1.14	vScQOoC	Numerum autem bellantium statuebat , <b> dicens , </b> in qualibet ciuitate	Ca dizia que los lidiadores deuen ser parte dela çibdat apartada de los otros çibdadanos <b> e establesçie cuento de los lidiadores </b> diziedo que en cada vna çibdat deuen ser	z8ru4Ch
3.1.14	xatBJiI	tantam multitudinem pascere . <b> Propter quod Philosophus 2 Politicorum reprehendens Socratem de huiusmodi ordine ciuitatis , </b> ait , quod oportet ciuitatem illam sic institutam esse in regione Babilonica ,	tal gouernamiento de çibdat <b> do dize | que aquella çibdat assi establesçida deuie ser </b> tamannera	coUQ26S, tfeDGNT
3.1.14	eQohOmJ	Nam secundum Philosophum secundo Politicorum , <b> volens ponere leges </b> vel facere ordinationem aliquam in ciuitate ,	en el segundo libro delas politicas <b> el que quiere poner leyes o fazer ordenaçion alguna en la çibdat a tres </b> co sas deue deuer mietes .	csfbyUT
3.1.14	opNZTYo	esse circa particularia signata , <b> volens tradere artem de regimine ciuitatum , </b> non potest statuere determinatum numerum bellatorum :	cerca las cosas particulares e senñaladas . <b> El que quiere dar arte e sçiençia de gouernamiento dela çibdat </b> non puede	caQKxaw
3.1.15	uvzwEhL	in agricolas , artifices , et bellatores , <b> volens ciuitatem </b> ad minus mille continere bellatores .	e en batalladores quariendo <b> que alo menos la çibdat ouiesse mil ł batalladores </b> por auentura	sH7FUFi
3.1.16	shoTeSC	2 Politicorum intromisit se de ordine ciuitatis , <b> statuens quomodo posset </b> optime politia ordinari .	que se entremi tio del ordenamiento dela çibdat <b> establesçiendo en qual manera se podria ordenas muy bien la poliçia e la çibdat </b> ca dizia	bEt5WCu
3.1.16	wyl232D	in possessionibus aliis ciuibus . <b> Sic etiam perdens placitum , </b> non multum amitteret :	ygualado en las possessiones con los otros çibdadanos . <b> En essa misma manera </b> el que perdiesse el pleito non perderia mucho	bFcclCM
3.1.16	hqvCgoB	statuit potissime curandum esse de possessionibus ciuium , <b> volens eos aequatas possessiones habere . </b> Si considerentur dicta Philosophi 2 Politicorum ,	que much deuia ser tomado grant cuydado delas possessiones de los çibdadanos <b> e quaria que los çibdadanos ouiessen las possessiones eguales </b> i fueren penssados los dichos del philosofo	mkNSXqI
3.1.19	xNJU05T	Praeter Socratem et Phaleam fuit quidam alius Philosophus nomine Hippodamus , <b> intromittens se de regimine ciuitatis , </b> statuens multa pertinentia ad regimen ciuium .	y podo mio <b> que se entremetio del gouernamiento dela çibdat </b> establesçiendo muchas cosas	y0z0KjG
3.1.19	gPvCSqc	intromittens se de regimine ciuitatis , <b> statuens multa pertinentia ad regimen ciuium . </b> Videntur autem quasi ad sex reduci	que se entremetio del gouernamiento dela çibdat <b> establesçiendo muchas cosas | que parte n esçiençia al gouernamiento de los çibdadanos </b> e paresçe que aquellas cosas	bFEBS0k, y2JpJqh
3.1.19	mCtVz2h	diuersa genera personarum . <b> Hippodamus autem statuens suam politiam , </b> primo intromisit se de multitudine	que tannian alguons linages de personas dezimos <b> que y podo mio | establesciendo su poliçia </b> primero se entremetio dela muchedunbre	w0mMTNi, aCQCYcS
3.1.19	ua9gIjc	et distinctione ciuium , <b> dicens quod optima quantitas ciuium est circa decem millia virorum . </b> Hanc autem quantitatem distinxit in tres partes ,	e del deꝑtimiento de los çibdadanos <b> e dizia que sia muy buena quantidat de çibdadanos | si fuessen fasta diez minl uarones </b> e esta quantidat departia en tres partes	d5gMWDV, s01xFxi
3.1.19	yTde7Mm	et determinauit de distinctione possessionum , <b> diuidens totam regionem idest </b> totum territorium ciuitatis	entremetiose e determino del departimiento delas possessiones <b> partiendo todo el regno </b> o todo el terretorio de la çibdat en tres partes .	y8UedXs
3.1.19	qqMimvJ	quod quicunque inueniret aliquid , <b> quod esset expediens ciuitati , </b> quod retribueretur ei debitus honor .	establesçio que qual quier que fallasse algua cosa <b> que fuesse buena e conueinble ala çibdat </b> qual feziessen grant honrra	wAr2RYN
3.1.20	v4m78T3	et specialiter quantum ad legem quam statuit erga sapientes . <b> Nam si quicunque sapiens inueniens aliquid expediens ciuitati , </b> deberet ex hoc debitum honorem accipere ;	que establesçio alos sabios diziendo <b> que si qual quier sabio | que fallasse alguna cosa conuenible </b> e buena para la çibdat deue	ha9Q0Qf, pHYoSo4
3.1.20	umL0bmV	qui inuenit <b> aliquid expediens ciuitati </b> ( ut ait Philosophus )	que el sabio <b> que alguna cosa fallaua a prouechosa ala çibdat deuia ser honrrado | por ello esto </b> assi commo dize el philosofo visto	gjYG4Qb, xqdtj1T
