Localisation	Id. source	Segment source	Segment cible	Id. cible
2.2.10	d9gmEat	e de fazer cosas torpes <b> e de faz cosas </b> que han manziella .	quaecunque sunt turpia , <b> et quaecunque infectionem habent : </b> quia quae primo aspiciuntur ,	yue6AHT
2.2.11	oU2mwQb	por que esto non solamente enpeesçe al alma <b> por que se fazen golosos </b> aquellos que toman el comer muy cobdiçiosamente	Nam hoc non solum nocet animae , <b> quia nimis ardenter </b> et auide sumentes cibum fiunt gulosi et intemperati ;	e8UqwXp
2.2.11	g14kvwA	Et assi se sigue <b> que non faga nudrimiento conueinble¶ Lo . iij . </b> pecan si toma la uianda torpemente e suzia mente .	ei dominari non possit , non bene digeritur , <b> et per consequens non causat debitum nutrimentum . </b> Tertio delinquitur ,	sKSlEfv
2.2.11	zifQDog	commo se deuan auer çerca las viandas . <b> Ca ninguno adesora non se faze grande . </b> Et por ende abasta alos mocos	ut se habeant circa cibos . <b> Nam nullus repente fit summus . </b> Sufficit autem eos paulatim et pedetentim instruere ,	g0hrwG7
2.2.12	z9Jn3xk	Et por ende en la hedat de los moços deuemos guardar <b> que non se fagan destenprados . </b> Ca la tenprança ha de ser puesta çerca de tres cosas .	in puerili aetate cauendum est <b> ne iuuenes efficiantur intemperati . </b> Temperantia autem circa tria est adhibenda :	gahgD9i
2.2.12	u3fVaZ8	Ca non solamente la uianda tomada <b> commo non conuiene faze destenprança mas avn el beuer faze esso mismo </b> Pues que assi es conuiene alos moços de ser guardados	non solum esse abstinentes , <b> ut non efficiantur gulosi </b> ex sumptione cibi :	cdbrtfh
2.2.12	axtti7K	Pues que assi es conuiene alos moços de ser guardados <b> non solamente que se non fagan gollosos por el comͣ </b> mas avn les conuiene de ser mesurados	ut non efficiantur gulosi <b> ex sumptione cibi : </b> sed etiam decet eos esse sobrios ,	n9eGx4y
2.2.12	xuMHhLH	mas avn les conuiene de ser mesurados <b> que non se fagan beodos </b> por el beuer o por el much vino .	sed etiam decet eos esse sobrios , <b> ut non efficiantur ebrii </b> ex sumptione potus .	dSXQKdS
2.2.12	iBeX6Z2	Ca quanto pertenesçe alo presente el vino tomado <b> sin mesura faze tres males . </b> ¶ El primer mal es que abiua el omne asa lux̉ia .	( quantum ad praesens spectat ) <b> tria mala causat . </b> Primo , quia venerea prouocat .	f2MNNRv
2.2.12	vFs97o4	¶ El primer mal es que abiua el omne asa lux̉ia . <b> Ca escalentado el cuerpo faze se enł omne mayor inclinaçion alas obras de luxia . </b> Onde el vino tomado	Primo , quia venerea prouocat . <b> Cum enim corpore calefacto maior fiat | incitatio ad actus venereos , </b> vinum quod maxime calorem efficit immoderate sumptum ,	li7ClPh, p9ApHqE
2.2.12	aYYign6	Onde el vino tomado <b> destenpradamente faze en el omne grand calentraa </b> e abiualo a destenprança de lux̉ia .	incitatio ad actus venereos , <b> vinum quod maxime calorem efficit immoderate sumptum , </b> incitat ad incontinentiam nimiam .	bL9n0nM
2.2.12	mEr9KRZ	e ençiende la sangre <b> por ende faze el omne de mayor coraçon </b> e mas sanudo la qual cosa	vinum , quod propter sui caliditatem inflammat sanguinem , <b> reddit hominem animosum et irascibilem : </b> quo facto facilius prouocatur	msEQoYQ
2.2.13	vMTZMxP	que vsa de razon e de entendimiento . <b> Et pues que assi es para fazer el omne obras conueinbles non es inclinado conplidamente </b> por la natura	ut homo , qui utitur ratione et intellectu ; <b> et ad agendum sibi opera debita , </b> non sufficienter inclinatur ex natura .	dk2bOOh
2.2.13	vIkKCYx	mucho a menudo o leuna tan los onbros <b> o fazen aquellas cosas </b> que non siruen en ninguna cosa ala fabla .	vel erigunt humeros , <b> vel faciunt alia , </b> quae ad locutionem nihil deseruiunt .	tdzO4dV
2.2.13	yaA6Wwv	por que sir una alas obras <b> que entienden fazer . </b> Ca fazer alguons mouimientos de los mienbros	ut habeant tales gestus , et ut sic utantur motibus membrorum , <b> ut deseruiant ad opera quae intendunt . </b> Nam agere aliquos motus membrorum	cVC0a3f
2.2.13	k7raM17	que entienden fazer . <b> Ca fazer alguons mouimientos de los mienbros </b> que non siruen ala obra	ut deseruiant ad opera quae intendunt . <b> Nam agere aliquos motus membrorum </b> non deseruientes operi intento ,	rzBNYhc
2.2.13	rzaPqtO	que non siruen ala obra <b> que entienden fazer . </b> Et estos salle	Nam agere aliquos motus membrorum <b> non deseruientes operi intento , </b> vel procedit ex insipientia mentis ,	fI3CLI8
2.2.13	h47lX5K	e çerca toda delectaçion que es en ellas . <b> Ca por esto se faze algᷤ </b> destenprado e temeroso por que de ligero cada vno va a loçania	et circa delectationem in ipsis : <b> nam ex hoc efficitur </b> quis intemperatus et timidus .	lzZT2fM
2.2.13	cPFCT4w	e de ligero saltan en locania . <b> ¶ Lo segundo la grand blandura delas vestiduras faze al omne temeroso </b> por que las armas del fierro han en ssi alguna dureza	sed molles et de facili in lasciuiam prorumpunt . <b> Secundo , nimia mollicies vestium reddit hominem timidum . </b> Nam cum arma ferrea in se	e6GxfI7
2.2.13	b67Ni27	dubdan de tomar las armas <b> e fazen semedrosos . </b> Et por que mucho conuiene alos mançebos	dubitant arma arripere , <b> et efficiuntur timidi . </b> Iuuenes , maxime cum ad aliam aetatem venerint ,	qSqa8Lx
2.2.14	g5jHtfL	Et non han vso acabado de razon de ligero son aduchos por los conpannones <b> e de ligo les fazen los conpannones razones </b> por que ciean	de facili inducuntur a sociis , <b> et de facili persuadetur eis , </b> ut credant bona sensibilia esse sequenda .	vh1olJe
2.2.15	ymbkRrV	por que de ligero enferman los moços <b> e se fazen de mala disposicion enel cuerpo </b> si en el tienpo en que manian se acostunbraren a beuer vino	De facili enim aegrotantur pueri <b> et efficiuntur male dispositi in corpore , | si tempore quo </b> ut plurimum pascuntur lacte	oUWBdRF, lRRyH4l
2.2.15	rdA2r3f	que el vso que toman en el <b> frio faze buena </b> disposiconn en los moços	unde idem Philosophus ait , <b> quod exercitium ad frigora facit </b> bonum habitudinem in pueris	d4PMacR
2.2.15	g7ebNU0	e los de nuruega de vannar los sus fijos en los trios muy frios <b> por que los fagan muy fuertes </b> Enpero deuemos entender	in fluminibus frigidis balneare filios , <b> ut eos fortiores reddant . </b> Attendendum est tamen ,	j3B42TT
2.2.15	kX38J1m	por que segunt el philosofo el mouimiento tenprado <b> en los mocos faze seys bienes ¶ </b> Lo primero faze el cuerpo mas sano	motus temperatus <b> in pueris quatuor bona facit . </b> Primo , quia reddit corpora magis sana :	uj1MKCU
2.2.15	aC2UgcQ	en los mocos faze seys bienes ¶ <b> Lo primero faze el cuerpo mas sano </b> e mas tenprado	in pueris quatuor bona facit . <b> Primo , quia reddit corpora magis sana : </b> moderatum enim exercitium	sERn8iu
2.2.15	npYSBzk	e el mouimiento tenprado <b> en qual si quier hedat aprouecha ala sanidat ¶L segundo faze los cuerpos mas ligeros . </b> Ca si encomienço los moços se acostunbran a algunos mouimientos	in quacunque aetate videtur <b> ad sanitatem proficere . | Secundo , quia reddit corpora agibilia . </b> Si enim a principio assuescant pueri	xBrRcoG, it6B1Ut
2.2.15	mXgPC2L	Ca si non fueren acostunbrados a algunos mouimientos <b> e fazen se pesados e ꝑezosos e mal dispuyestos </b> ¶	nam nisi ad aliquales motus assuescant , <b> fiunt graues , pigri , et inertes . </b> Tertio facit ad augmentum .	sOWrxwJ
2.2.15	bDLaPZR	¶ <b> Lo terçero faze el mouimiento </b> e tenprado a acresçentamiento del cuerpo	fiunt graues , pigri , et inertes . <b> Tertio facit ad augmentum . </b> Nam eo ipso quod temperatum exercitium iuuat	nfDISpD
2.2.15	h55sT2B	tenprado ayuda al cozimiento dela uianda <b> e faze abuean disposiçion del cuerpo </b> Et por ende se sigue	ad digestionem ipsam , <b> et facit ad bonam dispositionem corporis , </b> sequitur quod sit	z5twGEC
2.2.15	bsLLaoi	que sea aprouechoso alacresçentamiento del cuerpo . <b> Ca commo el acresçentamiento se faga del nudrimiento </b> aquellas cosas	quoddam proficuum ad augmentum . <b> Nam cum augmentum fiat </b> ex ipso alimento faciente corpus bene dispositum ,	xvmESKU
2.2.15	dC4QNoS	aquellas cosas <b> que fazen el cuerpo bien dispuesto </b> e quel fazen que se cere bien son	Nam cum augmentum fiat <b> ex ipso alimento faciente corpus bene dispositum , </b> et quod bene nutriatur ,	xlcW8RP
2.2.15	fmPgsDz	que fazen el cuerpo bien dispuesto <b> e quel fazen que se cere bien son </b> aprouechabłsal acresçentamiento del ¶	ex ipso alimento faciente corpus bene dispositum , <b> et quod bene nutriatur , </b> et alatur , sunt proficua ad augmentum .	p5LGbRf
2.2.15	iP00LnK	dize <b> que conuiene alos moços de faz quales quier mouimientos pequanos </b> para soldar los mienbros	unde Philosophus 7 Poli’ ait , <b> quod expedit in pueris | facere motus quoscunque </b> et tantillos ad solidandum membra ,	g1tP8xK, bqTbdMU
2.2.15	pSGQuAV	en tanto lo alaba el philosofo que diz que luego enł comienço de su nasçençia <b> deuen fazer alguons instrumentos </b> en que se mueun a los moços	ut ab ipso primordio natiuitatis dicat , <b> fienda esse aliqua instrumenta , </b> in quibus pueri vertantur ,	yLNRQqJ
2.2.15	mpcIGv1	escusase que non sean ꝑezosos <b> e fazen se los cuerpos mas ligeros </b> Otrossi avn deuen rezar alos moços alguas estorias despues que comiençan at entender las significaçiones delas palabras .	et per moderatum ludum vitatur inertia , <b> et redduntur corpora agiliora . </b> Sunt etiam pueris recitandae aliquae fabulae ,	bVBLSkq
2.2.15	nm2fq8q	que non lloren <b> por esse mismo defendimiento se faze </b> que retengan en ssi el spun e el eneldo .	Nam cum pueri a ploratu cohibentur , <b> ex ipsa prohibitione fit , </b> ut retineant spiritum et anhelitum .	vQIGNpr
2.2.15	wXF9Xm8	en el septimo libro delas politicas <b> faze a fortaleza del cuerpo . </b> Et pues que assi es por que los moços sean mas fuertes	secundum Philosophum septimo Politicorum , <b> facit ad robur corporis . </b> Ut ergo pueri robustiores fiant ,	xUGbnEg
2.2.16	isOSrzl	Ca por la desordenacion del appetito de los sesos <b> se faze la desordenaçion en la uoluntad . </b> Et pues que assi es si las cobdiçias se tienen de parte del cuerpo .	nam ex inordinatione appetitus sensitiui <b> redundat inordinatio in voluntate . </b> Si ergo concupiscentiae se tenent ex parte corporis ,	gDGSJAW
2.2.16	dnFNm2u	e todas las cosas <b> que fazen fazen las mucho </b> mas que deuen asi que quando aman am̃a much̃ . Etrͣndo	et de facili mentiuntur , <b> et omnia faciunt valde , </b> ita quod cum amant nimis amant ,	pT0nxRE
2.2.16	w6lpcwM	comiençan de trebeiar trebeian much̃ . <b> Et assi que todas las cosas que fazen </b> fazen la ssienpre con sobrepuiança .	cum incipiunt ludere nimis ludunt , <b> et in caeteris aliis semper excessum faciunt , </b> adhibenda est cautela	deG8O9S
2.2.16	qcpSioN	Et assi que todas las cosas que fazen <b> fazen la ssienpre con sobrepuiança . </b> Por ende deuemos poner cautela	cum incipiunt ludere nimis ludunt , <b> et in caeteris aliis semper excessum faciunt , </b> adhibenda est cautela	deG8O9S
2.2.16	l721G1I	por que non sean mintrosos mas uerdaderos <b> nin fagan todas las cosas </b> que fazen mas que deuen mas en todas sus obras	ne sint mendaces sed veridici , <b> nec omnia agant valde </b> sed in suis actibus	cX1OJkp
2.2.16	zp9bz8H	nin fagan todas las cosas <b> que fazen mas que deuen mas en todas sus obras </b> e en todas sus palabras	nec omnia agant valde <b> sed in suis actibus </b> et sermonibus moderationem accipiant .	mdy7qS0
2.2.16	p1gg6KY	vso de razon non seanda todo mal apareiados ala sçiençia deuen ser acostunbrados alas otras artes delas <b> quales ya fiziemos mençion . </b> ni emos dessuso que trs cosas deuemos entender c̃ca los fijos .	assuescendi sunt ad alias artes , <b> de quibus fecimus mentionem . </b> Dicebatur supra circa filios tria intendenda esse ,	p35h3rc
2.2.17	x5KfMrs	por que puedan tomar trabaios conuenibles la qual cosa <b> mayormente se pue de fazer </b> si vsaren los fijos a ex̉çiçios	ut possint debitos subire labores , <b> quod maxime fieri contingit , </b> si ad debita exercitia assuescant .	mJCI80a
2.2.18	rjbup20	por al si fuere tenprado a todos es aprouechable <b> por que fazen en algua manera </b> para auer salud	omnibus videtur esse proficua , <b> eo quod faciat ad quandam sanitatem , </b> et ad quandam bonam dispositionem corporis :	aHoRls4
2.2.18	yNktJTM	enłbso delas armas <b> por que el mouimiento conuenible del cuerpo faze el cuerpo mas fuerte </b> e mas rezio para que pueda sofrir	circa armorum usum . <b> Exercitatio enim corporalis debita | reddit corpus robustius , </b> ut facilius duriciem armorum sustinere possit .	uoxup3Y, hhYuLO8
2.2.18	ve6sFUE	por que los trabaios del cuerpo <b> por los quales se faz la carne dura </b> enbargan la sotileza del alma e del entendimiento .	corporales igitur labores , <b> ex quibus redditur caro dura , </b> impediunt subtilitatem mentis .	iUG4Z0I
2.2.18	pKu7hBN	que el alma en seyendo <b> e enfolgado se faze sabia </b> ca por se assesegar	quod anima in sedendo <b> et quiescendo fit prudens . </b> Nam per sessionem et quietem redditur caro mollis ,	jmFqdYm
2.2.18	xsxuRhr	ca por se assesegar <b> e por folgar se faze la carne muelle </b> por la qual somos despuestos	et quiescendo fit prudens . <b> Nam per sessionem et quietem redditur caro mollis , </b> per quam sumus apti ad speculandum ;	zaH3E8w
2.2.18	xsazpZi	Mas por el trabaio <b> e por el mouimiento se faze la carne dura </b> por la qual cosa se enbarga la sotileza del entendimiento .	per quam sumus apti ad speculandum ; <b> per laborem vero et motum efficitur caro dura , </b> per quam impeditur mentis sublimitas .	wxdPnOO
2.2.18	gIpL3l4	nin de una assi escusar los trabaios del cuerpo <b> por que le fagan mugeriles </b> en tal manera	fugere corporales labores ; <b> ut effecti quasi muliebres , </b> nec pro defensione regni	grM3g3F
2.2.18	ln1JWwn	que los otros <b> por que por tales trabaios la carne dellos non se faga dura </b> e enbarguela sotileza del entendimiento .	minus sunt assuescendi ad corporales labores quam alii , <b> ne propter huiusmodi labores </b> caro eorum indurata	miNWU9U
2.2.19	kSSqZV3	¶ La primera se toma por que sea tirado <b> alas fijas manera de mal fazer . </b> ¶ La segunda por que non se fagan desuergonçadas ¶ la terçera	Prima sumitur , <b> ut tollatur filiabus commoditas malefaciendi . </b> Secunda , ne fiant inuerecundae .	aDX0QCv
2.2.19	yfmgzVs	alas fijas manera de mal fazer . <b> ¶ La segunda por que non se fagan desuergonçadas ¶ la terçera </b> por que non se fagan locanas nin desonestas	ut tollatur filiabus commoditas malefaciendi . <b> Secunda , ne fiant inuerecundae . </b> Tertiae , ne fiant lasciuae et impudicae .	mpzZ9dv
2.2.19	gKRaaVk	¶ La segunda por que non se fagan desuergonçadas ¶ la terçera <b> por que non se fagan locanas nin desonestas </b> por que comualmente todos los mas de los uarones son incliados para mal .	Secunda , ne fiant inuerecundae . <b> Tertiae , ne fiant lasciuae et impudicae . </b> Communiter enim quasi omnes viri proni sunt ad malum ,	pKMmcb6
2.2.19	dkIlljT	Onde el philosofo en la rectorica dize <b> que los omes en la mayor parte fazen mal </b> quando pueden .	unde et Philosophus in Rheto’ vult <b> quod homines | ut plurimum male faciant , </b> cum possunt .	lvx19Pp, lLhg7mf
2.2.19	ew8eCDB	por la qual cosa se dize vn prouerbio <b> que el azma de furtar faze el ladron </b> e por ende si en los omes	propter quod et prouerbialiter dicitur , <b> Furandi commoditas facit furem . </b> Si ergo in viris ,	cbrwQJK
2.2.19	vUWIyTY	e por ende por que non sea dada a ella <b> sazina de mal fazer son de guardar conueniblemente </b> e deuenles defender	ne ergo eis detur commoditas malefaciendi , <b> sunt debite custodiendae , </b> et prohibendae sunt	sHMjtxr
2.2.19	nYcl2UP	esto mismo se toma <b> por que non se fagan desuergonçadas </b> ca toda aquella cosa	hoc idem , sumitur , <b> ne fiant inuerecundae . </b> Nam omne insolitum est	tKL5mfR
2.2.19	kREe4cy	Et pues que assi es entre todas las cosas <b> que fazen las moças uergonçosas en </b> acatamientode los uarones es de non las acostunbrar entre los uarones	Inter cetera ergo , <b> quae reddunt puellas verecundas | in aspectu virorum , </b> est non assuescere eas inter gentes .	b97GBtO, jaucvQH
2.2.19	n4mMQLs	acostunbran se auer los omes <b> e fazen se familiares dellos </b> e tirasse dellas la uerguença	assuescant virorum aspectibus , <b> fiunt familiares eis , </b> et tollitur ab ipsis verecundia	hIEdtOs
2.2.19	cRKskBr	por el qual freno se retrahen <b> que non fagan mal </b> ca en las fenbras	quo trahuntur , <b> ne male agant . </b> Nam in foemina ,	ml8jmLn
2.2.19	mcUQJaZ	e mayormente delas moças es la uerguença <b> por que non puedan sallir a fazer cosas torpes . </b> Et pues que assi es cosa conuenible es de defender es alas mocas	et potissime puellarum , <b> ne prorumpant in turpia , </b> videtur esse verecundia .	udZ0zsH
2.2.19	vHQ8mFz	nin anden uagando allende <b> nin a quande por que non se fagan desuergoncadas </b> o por que non se tire dellas la uerguenca	a discursu et euagatione , <b> ne fiant inuerecundae , </b> vel ne tollatur ab eis verecundia ,	rBtwIq3
2.2.19	ytXF81B	¶ La terçera razon se toma <b> por que non se fagan orgullosas </b> e loçanas e desonestas	Tertia sumitur , <b> ne fiant lasciuae et impudicae : </b> puellae enim si debito modo sub custodia teneantur ,	qEf4lQN
2.2.19	euV4oVb	mas si se acostunbran a vsar con los omes <b> fazen se mansas </b> en tal manera	etiam valde syluestria <b> si assuescant conuersationibus hominum , domesticantur , </b> et permittunt se tangi et palpari :	ljTFUhR
2.2.19	qdXVOiT	o de beuir conellos <b> fazen se assi commo montes </b> mas delar la conpannanan de los omes	et a conuersatione virorum sint inconsuetae , <b> quasi syluestres ab ipsorum societate </b> difficilius ad lasciuiam	p473WbR
2.2.20	g9qnVTJ	e en uagar <b> mas que las fagan vsar </b> en alguas obras conuenibles e honestas ¶	ut nolint ociosae viuere , <b> sed ament se exercitare </b> circa opera aliqua licita et honesta .	ndKIEmh
2.2.20	yz5dE68	por que dende salga fructo e prouecho <b> por que se fagan ellas bueans e uirtuosas . </b> Mas si alguno demandare	et utilitas , <b> et efficiantur bonae et virtuosae . </b> Si autem quaeratur	qavMlGK
2.2.21	iOgvDsu	que es parlera en algua manera <b> se faze muy familiar </b> e muy conpanera en algua	eo ipso quod est loquax , <b> quodammodo se nimis familiarem exhibet , </b> et quodammodo se contemptibilem reddit ;	m0HmrxR
2.2.21	eQkyZJs	por que si las mugers fueren callantias en manera conueinble <b> por que assi non se fazen familiares </b> e conp̃aneras alos omes	Si enim mulieres sint modo debito taciturnae , <b> quia se sic non familiares exhibent , </b> eorum consortium videtur magis abesse ,	bHS4n1C
2.3.1	vU6ylQz	que cunplen la mengua corporal <b> e las que fazen agua edamiento </b> e a cunplimiento dela uida	in qua agitur de iis quae supplent indigentiam corporalem , <b> et quae faciunt ad conseruationem </b> et ad sufficientiam uitae :	bZHnoYs
2.3.1	eHrgZE8	çerca aquellas cosas <b> que fazen para beuir bien </b> e que son meneste para conplimiento dela uida	ut patrifamilias cuius est domum gubernare debite solicitetur <b> circa ea quae faciunt ad bene viuere , </b> et quae requiruntur ad sufficientiam vitae :	bpzWPaZ
2.3.1	kPH7oxA	por prop̃os estrumentos pueda alcançar estas cosas <b> que fazen al abastamiento dela uida . </b> Ca el arte del gouernamiento dela	quia per haec tanquam propria organa consequi poterit , <b> quae faciunt ad sufficientiam vitae : </b> habet enim ars gubernationis domus propria organa ,	lmFhGkC
2.3.1	miyvlR8	por que por ellos non queda <b> non finca ninguna cosa fecha de fuera </b> Mas finca perfeccion enłalma	ø	ø
2.3.1	tQL7Vpl	mas los estrumentos delas artes mecanicas son factiuos e obradores <b> por que por ellos finca algua cosa fecha de fuera </b> assi commo el arca .	ø	ø
2.3.1	yUtTlrN	mas el gouernamiento dela casa la regla es sabiduria que es derecha razon de todas las cosas <b> que ha de fazer . </b> Et pues que alsi es	sed in gubernatione domus <b> regula est prudentia . </b> Sicut ergo ars differt a prudentia ,	vHRsjpL
2.3.1	aGtSXax	por que el arte mecanica es derecha razon delas cosas <b> que ha de fazer de fuera . </b> Et por tal arte sale algcosa fechͣ	ab organis gubernationis . <b> Differt autem prudentia ab arte , </b> quia ars est recta ratio factibilium et per artem resultat aliquid factum in materia extra :	aci8Xvy
2.3.1	ezrIZYQ	Mas la sabiduria es derecha razon delas cosas <b> que son de fazer </b> e por ella non sale propreamente ninguna cosa fechͣ de fuera	quia ars est recta ratio factibilium et per artem resultat aliquid factum in materia extra : <b> sed prudentia est recta ratio agibilium , </b> et per eam non proprie	tvsx8yW
2.3.1	dPsxOef	accioono alguna perfection <b> en aquella que la faze </b> Mas los estrumentos delas artes me cauicas son fazedores	sed magis resultat aliqua actio , <b> et aliqua perfectio in agente . </b> Organa ergo moechanicorum erunt factiua ,	fs1Bsrq
2.3.1	bAYBKdk	que es delas cosas <b> que se fazen de fuera </b> mas los estrumentos del arte del gouernamiento dela casa son actiuos	quia sunt organa artis , <b> quae est de factibilibus : </b> sed organa gubernationis erunt actiua ,	h6fYXVF
2.3.1	jQwPVNq	que ha de ser çerca las cosas <b> que se han de fazer </b> e fincan en el alma .	quia sunt organa prudentiae , <b> quae circa agibilia habet esse . </b> Ars ergo gubernationionis domus licet	a7vlF9Q
2.3.1	rcQ9SGW	e delas possesiones <b> que fazen a gouernamiento </b> e a conplimiento dela uida dela uida dela casa .	de domibus , numismatibus , et possessionibus : <b> quae faciunt ad conseruationem , </b> et ad sufficientiam vitae .	dnpZTZA
2.3.2	lGPNxNb	por que los instrumentos sin alma <b> por si non pueden fazer las obras </b> para que son fechos .	quia organa inanimata per se ipsa exercere <b> non possunt illud , </b> ad quod sunt facta .	sGwvf1x
2.3.2	vIijU2C	por que puedan conplir su obra <b> propraa e fazer sus ofiçios . </b> Ca non es cosa conueinble	vel organa carentia ratione , <b> ut opus proprium possint implere . </b> Indignum est enim	gsDNqwg
2.3.2	yAhtO5g	mas cosaco nueible es <b> que fagan estas cosas </b> por los siruientes medianeros .	aut aliqua talia exercere : <b> sed congruentius est haec </b> per medios ministros efficere .	fYirE1H
2.3.3	orObZoW	agnitul traa es la sotileza dela obra <b> por que la morada sea sotilmente et conueiblemente fecho </b> Lo otro es el tenpramiento del ayre	est industria operis , <b> ut aedificium sit subtiliter | et debite factum : </b> et temperamentum aeris ,	nvXBCoV, xnOnHzv
2.3.3	t6tv8AC	mas non es conuenible morada al magnifico <b> si non es fecha </b> por muy marauillosa maestria .	praepare habitationem decentem : <b> non est autem decens habitatio , </b> nisi magnifico opere ,	m213YvD
2.3.3	lIiHPeK	e alos prinçipes parte nesçe <b> de fazer tan grandes cosas </b> e de estroyr	quod Principes decet <b> sic magnifica facere , </b> et talia aedificia construere ,	sEgKlsb
2.3.3	eCUOXsz	e de estroyr <b> e de fazer tales moradas </b> que el pueblo que lo viere	sic magnifica facere , <b> et talia aedificia construere , </b> quod populus ea videns ,	sxixIIf
2.3.3	fXhZYa1	cada vno del pueblo se guar da <b> que non faga bolliçio </b> contra el prinçipe	quilibet ex populo retrahitur , <b> ne dissensionem faciat contra Principem , </b> si aspiciat ipsum tantum ,	amUV9MJ
2.3.3	yPkyzjv	ca la grandeza delas moradas <b> maguer non se de una fazer aparesçençia </b> nin a grandezaauana eglesia	Magnitudo enim aedificiorum licet <b> non sit fienda </b> ad ostentationem et inanem gloriam :	eiah9Bb
2.3.3	fPVt7LU	enpero conuiene alos Reyes <b> e alos prinçipes de fazer moradas costosas e nobles </b> assi commo el su estado demanda	decet tamen Reges et Principes , <b> ne in contemptum habeantur a populo , | facere aedificia magnifica , </b> prout requirit decentia status ,	udHaMeJ, p2q8xZe
2.3.3	k9slZHq	ueinblemente en las casas <b> que ellos fazen a </b> conuiene	sed etiam multitudo ministrorum debite commorari possint <b> in aedificiis constructis , </b> oportet ipsa esse magnifica .	vbIVWX3
2.3.3	p3KOPd9	por las quales podemos conosçer <b> en que ayre es de fazer la morada </b> o dize	ex quibus cognoscere possumus , <b> in quo aere sit aedificium construendum . </b> Dicit enim salubritatem aeris primo	rYnEEL1
2.3.3	vpa1Afv	por que las aguas estantias <b> en la mayor parte se fazen gruessas </b> e se podresçen en essa misma manera el ayre	eo quod aquae stantes <b> ut plurimum ingrossantur et putrescunt : </b> sic aer reclusus in vallibus ,	bmz991h
2.3.3	cxSZklg	por que non ha mouimiento libre <b> fazese commo gruesso e non sano . </b> Et pues que assi es deuemos cuydar	eo quod non habeat liberum motum , <b> quasi ingrossatur , | et efficitur non salubris ; </b> est ergo propter salubritatem aeris considerandum	cM0am1Y, ht8lZ3b
2.3.3	hG9l9Sa	Et pues que assi es deuemos cuydar <b> por la sanidat del ayre en las moradas que auemos de fazer </b> que non se fagan	est ergo propter salubritatem aeris considerandum <b> in aedificiis construendis , </b> ut non fiat talis constructio	oYgKrcj
2.3.3	u5BGh6C	por la sanidat del ayre en las moradas que auemos de fazer <b> que non se fagan </b> nin se costruyan en los valłs muy baxos	in aedificiis construendis , <b> ut non fiat talis constructio </b> in vallibus infimis .	qdwEwEt
2.3.3	zcncM0t	cuydarl <b> que aquel lugar en que deuemos fazer la morada sea guardado delas timebras dela </b> meblaca en alguna parte dela tierra	ut locus ille , <b> in quo est aedificium construendum , | sit a nebularum tenebris absolutus . </b> Nam in aliqua parte terrarum ,	oZ8D1Qs, z2zM2uF
