Localisation	Id. source	Segment source	Segment cible	Id. cible
1.2.24	kqsc0w7	Et pues que assi es bien dich̃ones <b> que la maguanimidat faze todas las uirtudes mayors </b> Et bien dicho es	Recte ergo magnanimitas <b> dicitur omnes virtutes maiores facere , </b> et dicitur omnes eas perficere et ornare :	omZuO3t
1.2.24	t3BpLtq	que las acaba todas e las honrra . <b> Por que por la magranimidat fazemos las obras de todas las uirtudes </b> mas altamente e mas honrradamente e mas acabadamente ¶	et dicitur omnes eas perficere et ornare : <b> quia actus omnium earum per magnanimitatem </b> facimus excellentius , ornatius , et magis perfecte .	bsR2Z44
1.2.24	cJjVDZH	en la manera que dich̃ones de suso . <b> Conuiene saber que amen e cobdicien fazer lobras </b> que sean dignas de honrra .	et honoris amatiuos . Reges enim et Principes decet honores diligere modo quo dictum est ; <b> videlicet , ut diligant et cupiant facere opera , </b> quae sint honore digna .	w2LlQqd
1.2.24	ci6IphA	Et en essa misma manera <b> los que fazen obras dignas de honrra medianera </b> son dichos amadores de henrra	nisi in magno corpore . <b> Sic facientes opera mediocri honore digna , </b> dicuntur honoris amatiui :	lGWf0fX
1.2.24	gJkFpv8	son dichos amadores de henrra <b> Mas propreamente quando fazen obras dignas de grant honrra </b> estonçe son dichos magranimos	dicuntur honoris amatiui : <b> tamen tunc proprie sunt magnanimi , </b> quando agunt opera magno honore digna .	nWBMttC
1.2.24	hFQvLGo	altosñen los medianeros <b> non fagan alguna cosa rorpe </b> mas por que sienpre fagan obras dignas de honrra .	Ut igitur Reges et Principes nec in negociis arduis , <b> nec in mediocribus faciant aliquid turpe ; </b> sed ut semper agant opera honore digna :	u5K0oDD
1.2.24	dauyoXk	non fagan alguna cosa rorpe <b> mas por que sienpre fagan obras dignas de honrra . </b> Bien dicho es	nec in mediocribus faciant aliquid turpe ; <b> sed ut semper agant opera honore digna : </b> bene dictum est ,	wujasIQ
1.2.25	woDa0Xx	La qual cosa paresçe ser contraria de ssi milma <b> por que el humildoso faze reuerençia alos otros . </b> Mas el magnanimo assi commo dize el philosofo	omnis magnanimus esset humilis : <b> quod videtur esse oppositum in obiecto , quia humilis alios reueretur , </b> magnanimus vero	fyrc9x3
1.2.25	tWB0Z2i	en manera que non podamos desuiarnos del bien de razon . <b> Mas que las passiones nos fagan desuiar del bien de razon </b> en dos maneras puede contesçer	ne deuiemus a bono rationis . <b> Sed quod passiones deuiare nos faciant a bono | secundum rationem </b> ( ut supra dicebatur )	hpcOetQ, h4dqoLJ
1.2.25	qUyKxxC	en quanto ha razon de grande nos tira <b> que non lo fagamos nin lo alcançemos </b> por razon dela guaueza	nos retrahit , <b> ne prosequamur illud , </b> ratione difficultatis .	dIZ2RxQ
1.2.25	l3HxMX7	que el magranimo despreçia los otros non <b> por que faga tuerto </b> en mala manera alos otros mas .	Ideo magnanimus dicitur alios despicere , <b> non quod aliis vitiose iniurietur , </b> sed quia est tanti cordis ,	swXjmyY
1.2.25	kvNNcGU	por ellas delas obras uirtuosas <b> Mas la humildat faze el contrario . </b> Ca prinçipalmente nos tira delas honrras	ab operibus virtuosis . <b> Humilitas autem e contrario principaliter retrahit : </b> ex consequenti impellit .	bluOFSf
1.2.25	ySehPPr	por que cuydando en los sus desfallesçimientos propios en las cosas conuenibles e honestas . <b> faze reuerençia alos otros ¶ </b> Lo segundo ha departimiento entre la magnanimidat e la humildat	in rebus licitis et honestis alios reueretur . <b> Secundo differt haec ab illa , </b> quia magnanimitas principaliter moderat desperationem ,	wKHgpVY
1.2.26	kDh17hl	qua nos allegua a aquellos bienes <b> mas la humil dat faze todo lo contrario </b> por que es uirtud	quae est excellentia expellens nos in illa . <b> Sed humilitas e contrario , </b> quia est virtus retrahens ,	myNu1RK
1.2.26	nMg4FBc	La segunda de parte delas obras <b> que se deuen fazer </b> Ca assi commo dicho es de suso ninguno non puede serudaderamente magnanimo	Prima sumitur ex parte magnanimitatis . <b> Secunda vero ex parte operum fiendorum . </b> Dicebatur enim supra ,	o5bPBmP
1.2.26	rZJpAnT	mas assi comma conuiene al su estado dellos . <b> e esto es lo que fazen los humildosos . </b> Et otrosi que non pongan la su bien andança	sed ut decet eorum statum , <b> quod faciunt humiles : </b> quod tamen suam felicitatem	a7QDlGe
1.2.26	nnTMmeb	Et otrosi que non pongan la su bien andança <b> en sobrepuiança de honrra lo que fazen los sobuios </b> por que deuen fazer los Reyes bueans obras e dignas de honrra	non ponant <b> in excellentia et honore , | quod faciunt superbi . </b> Debent enim agere bona opera	xdHoLsI, xdiPGBq
1.2.26	gBJVLiT	en sobrepuiança de honrra lo que fazen los sobuios <b> por que deuen fazer los Reyes bueans obras e dignas de honrra </b> non por alabança	quod faciunt superbi . <b> Debent enim agere bona opera </b> et honore digna boni gratia ,	ceriBNe
1.2.26	cPjsOOt	por razon delas obras <b> que han de fazer . </b> Ca el sobra uio demandado	ø	ø
1.2.27	xeoJUmg	por que aquel que dessea los males <b> que le son fechos de ser vengado </b> o que el otro que resçiba penna	quod appetimus vindictam . <b> Qui enim propter mala aliqua illata vindictam </b> aut punitionem appetit ,	nDeNXCM
1.2.27	uDkZF3Y	por que enssannar se de qual se quier cosa <b> e sobre qual cosa dessear uengança la qual cosa fazen los sannudos </b> esto es de denostar .	et semper , <b> et de quolibet vindictam exposcere , | quod faciunt iracundi , </b> vituperabile est .	wSMZzoI, h3ibesD
1.2.27	vWTpkg4	que por los males <b> e por las jniurias que nos fazen </b> desseemos de ser vengados	ex consequenti autem intendit moderare passiones oppositas irae . <b> Nam naturale est nobis </b> ut ex malis nobis illatis appetamus punitionem , et vindictam .	mryNZuK
1.2.27	o7Uobva	desseemos de ser vengados <b> e los otros que las fazen sean atormentados </b> e ayan pena	Nam naturale est nobis <b> ut ex malis nobis illatis appetamus punitionem , et vindictam . </b> Rursus , quia malum proprium vix potest	hTDLJKN
1.2.27	jLVuvkt	e dar pena <b> a aquellos que nos fazen alguons males . </b> Mas avn en alguna manera natural cosa esa nos de dessear de ser vengados dellos mas que deuemos .	ut velimus puniri <b> inferentes nobis aliqua mala , </b> sed etiam quodammodo naturale est nobis	uc1hz1U
1.2.27	oIdORry	Mas avn en alguna manera natural cosa esa nos de dessear de ser vengados dellos mas que deuemos . <b> Ca por que el mal que ellos nos fazen paresçe a nos </b> que es mayor de quanto es	appetere punitionem ultra condignum . <b> Nam quia malum nobis illatum videtur nobis maius esse , </b> quam sit ;	qrYeULN
1.2.27	opufRSV	por ende queremos <b> que aquellos quanos fazen mal </b> e iniuria ayan mayor pena	quam sit ; <b> iniuriatores nostros </b> plus puniri volumus ,	do3B44m
1.2.27	i566L1N	que deuen <b> por el mal que nos fazen . </b> Et por que muy	plus puniri volumus , <b> quam puniendi sint . </b> Difficile est ergo valde reprimere iras ,	kpR3v64
1.2.27	w8gxCX6	por que si las penas non se diessen <b> e las uenganças non se fiziesen en el regno </b> los omes serian fechos jniuriadores e forçadores de los otros .	indecens esset : <b> quia si punitiones non fierent in regno , </b> homines fierent iniuriatores aliorum ,	kaJ9Rtj
1.2.27	mrH8mxd	e alos prinçipes de se mouer a dar penas . <b> e fazer uengancas </b> quanto mas pertenesçe a ellos de seer guardadores dela iustiçia	Tanto ergo magis decet Reges et Principes moueri <b> ad punitionem faciendam , </b> quanto magis spectat ad ipsos	d4VK2Nv
1.2.27	llCnPMy	segunt orden de razon e de entendimiento <b> para fazer uenganças e dar penas . </b> Et commo esto faga la manssedunbre	secundum ordinem rationis , <b> ut fiant punitiones et vindictae , </b> cum hoc faciat mansuetudo ,	idmhXOd
1.2.27	iIrYsDE	para fazer uenganças e dar penas . <b> Et commo esto faga la manssedunbre </b> conuiene a ellos de ser manssos	ut fiant punitiones et vindictae , <b> cum hoc faciat mansuetudo , </b> decet eos mansuetos esse .	sp9UD9m
1.2.28	xzTgwE2	Ca estos en tanto se muestran conpanneros <b> que non quieren fazer pesar nin tristeza a ninguno </b> Mas todos los dichos	Hi enim adeo se ostendunt communicabiles et sociales , <b> ut nullum contristari velint ; </b> sed omnia dicta	ytjPeQL
1.2.28	tiB9Xb9	e todos los fechos de los otros alaban . <b> Mas otras algunos ay que fazen todo lo contrario </b> por que fallesçen mucho desta conuerssa conn tal .	et facta aliorum laudant . <b> Aliqui vero econtrario , </b> ab hac conuersatione nimis deficiunt .	o7gbEgb
1.2.28	ywIumsb	por mengua de palaura <b> la qual cosa fazen los desacordabłs </b> e mouedores de pelea ¶ visto que cosa es la amistanca	nec deficiamus , <b> quod faciunt litigiosi , et discoli . </b> Viso quid est amicabilitas , ut hic de ea loquimur ,	xMATq1H
1.2.28	zwdg1zC	Empero non deuen todos en vna manera seramigables e bien fablantes . <b> por que la grant familiaridat pare e faze despreçiamiento . </b> Et pues que assi es los Reyes e los p̃nçipes	non tamen omnes eodem modo amicabiles debent esse . <b> Nam quia nimia familiaritas contemptum parit , </b> Reges et Principes ,	iEdHaxi
1.2.28	wYucVlr	e alos prinçipes de paresçer <b> perssonas reuerendas a quien deuen fazer reuerençia </b> por qua non sean auidos en despreçiamiento .	ait , quod decet Reges et Principes <b> apparere personas reuerendas , </b> ne contemptibiles habeantur .	qukHSBy
1.2.29	evqoGxL	Et pues que assi es desta uirtud <b> por la qual alguno se faze uerdadero e manifiesto . </b> algunos se desuian por sobrepuiança mostrando de ssi mismos	Ab hac ergo veritate , <b> per quam quis reddit se veracem et manifestum , </b> aliqui deniant per superabundantiam ,	gj6Poba
1.2.29	dLlYlH8	en ninguna manera <b> la qual cosa fazen muchos . </b> Ca otorgan alguons de ssi mismos grandes bondades	quam sint , <b> quod multi faciunt . </b> Concedunt enim de se aliqui magnas bonitates ,	pQl7sJr
1.2.29	zjmNjUb	mas deuemos nos inclinar alo menos <b> si se pudiere fazer sin mentira . </b> Et non deue el omne partir se notablemente del medio e de la egualdat	sed magis declinandum in minus : <b> dum tamen sine mendacio fiat , </b> et non notabiliter recedat a medio :	pFIrqYj
1.2.29	oFBdPMD	nin alabando dessi mayores cosas que son <b> nin prometiendo alos otros mayores cosas que faran . </b> Mas por tanto conuiene alos Reyes	vel iactando de se maiora quam sint , <b> vel promittendo aliis maiora quam faciant . </b> Immo tanto magis decet Reges et Principes cauere iactantiam ,	diisThi
1.2.30	svtWjdz	e trabaiando en los negoçios del regno <b> e faziendo otras cosas </b> muchas trabaiamos continuada mente .	vel negociis regni insistendo , <b> vel alia faciendo , </b> continue laboramus ,	u8fBFIV
1.2.30	fIC7a8w	contesçe de pecar <b> e de bien fazer </b> conuiene erca tales iuegos	Quare cum in talibus contingat peccare , <b> et bene facere , </b> oportet	sFS3MqG
1.2.30	yz8YqVS	de aquella prea alguna cosa en essa misma manera <b> los que quieren fazer de todo en todo riso </b> e enduzir alos otros a escarnio	qualitercunque possent aliquid de illa praeda capere : <b> sic volentes omnino facere risum , </b> et prouocare alios ad cachinnum ,	n8piFA4
1.2.30	riPlhJq	tales sobrepuian en los trebeios . <b> Mas ay otros que fazen todo el contrario </b> que fallesçen en todos los trebeios .	Hi ergo superabundant ludis . <b> Aliqui vero econtrario , deficiunt : </b> et hi vocantur duri , et agrestes .	cubzjoX
1.2.30	gzkZyxh	nin de iuego antes son tristes e malenconosos de aquellos <b> que fazen los solazes e los iuegos </b> Et pues que assi es paresçe	nec dicentes aliquid ridiculum : <b> immo dicentibus sunt molesti . </b> Patet ergo quid est iocunditas ,	w0HAqDr
1.2.30	kARzsT2	Ca uirtudes prinçipalmente çerca aquellas cosas <b> que son mas guaues de fazer mas repremir las </b> superfluydadesde los iegos es muy mas	quia virtus semper est principalius <b> circa difficilius . | Reprimere autem superfluitates </b> ludorum est difficilius ,	brRONBX, tgdOpiO
1.2.30	ajsMnHI	mas esto conuiene alos Reyes e alos prinçipes en tanto vsar tenpradamente delas delecta connes delos iuegos <b> que si esto feziesen algunas ottas personas comunes paresçeria </b> que serian montesinos e siluestres .	uti iocosis delectationibus , <b> quod si hoc facerent personae communes , </b> viderentur esse durae et agrestes .	mYOBkl9
1.2.30	khqxFbv	si fueren honestos o tenprados . <b> Et esto faremos mas o menos segunt </b> que requeere el departimiento delas perssonas .	si sint honesta et moderata : <b> et hoc magis et minus , </b> prout requirit diuersitas personarum .	kK6lJzr
1.2.31	ggW07Jh	Otrossi ay otros algunos <b> que fazen todo lo contrario desto ca son castos . </b> Et enpero estudian en auaricia e en escasseza .	Aliquos vero , <b> qui econtrario sunt casti : </b> et tamen auaritiae student .	iVlwz7A
1.2.31	l47Rin2	empero que non pueden seer magnificos <b> por que non pue den fazer grandes cosas </b> por que non han nin pueden fazer grandes espenssas .	qui tamen non possunt esse magnifici : <b> quia nequeunt magna facere , </b> eo quod non habeant magnos sumptus .	qgz8XV8
1.2.31	xalXooT	por que non pue den fazer grandes cosas <b> por que non han nin pueden fazer grandes espenssas . </b> Et pues que assi es deuedes saber	quia nequeunt magna facere , <b> eo quod non habeant magnos sumptus . </b> Sciendum igitur ,	uIrdOu6
1.2.31	eRrfWUN	los quales non son castos . <b> Mas veemos a otros fazer el contrario desto </b> por que han algpradençia natural	qui non sunt casti : <b> aliqui vero econtrario habent </b> quandam naturalem pudicitiam ,	zd2icFA
1.2.31	vPySfi1	assi commo en las riquesas <b> luego farian grandes cosas . </b> Et pues que assi es deuemos declarar	quia si bonis exterioribus abundarent , <b> statim magnifica facerent . </b> Declarandum est ergo	cDBDy66
1.2.31	y9oKDSK	e ordenaremos a nos mala fin <b> assi commo fazen los que pecan </b> assi commo los auarientos	Primo , si proponamus nobis malum finem , <b> ut vitiosi faciunt . </b> Auari enim proponunt sibi ,	ydmSuBU
1.2.31	dVpwgJx	donde o de qual parte tomen <b> para fazer estas obras </b> tanto que puedan dar algunos dones alos otros .	undecunque accipiant , <b> dum possint aliis dona aliqua elargiri : </b> et aliquando per furtum ,	jJZyHOr
1.2.31	pbXBE78	e algunas uegadas por robo <b> por que puedan fazer obras de largueza </b> e de franqueza .	aliquando per manifestam oppressionem alios depraedantur , <b> ut exerceant opera largitatis . </b> Hi ergo licet	vcSrDTl
1.2.31	dJXsGdq	e enderesçan al omne ala fin . <b> Mas la pradençia e la sabiduria faze obrar al omne </b> derechͣmente aquellas cosas	quod virtutes morales rectificant finem , <b> Prudentia vero facit operari recte </b> ea quae sunt ad finem .	ofMBlZJ
1.2.31	e82XAaI	si aella non fuere ayuntada la pradençia <b> e la sabiduria Et por ende entiende el philosofo fazer tal razon çerca la fin del sexto libro delas ethicas </b> aquel que acabadamente ha alguna uirtud moral	Talem ergo rationem intendit <b> facere Philosophus | circa finem 6 Ethicor’ . </b> Habens perfecte	grSk24S, uAxsW5O
1.2.31	cKpSfBZ	e acaba a aquel que la ha <b> e faga la su obra buena . </b> Por ende commo havien escoger	et perficiat habentem , <b> et opus suum bonum reddat : </b> cum ad bene eligere ,	qytjmik
1.2.31	tXTRcTL	Por ende commo havien escoger <b> e a buena obra fazer </b> non abasta de entender buena fin	cum ad bene eligere , <b> et ad bonum opus , </b> sufficiat proponere bonum finem ,	hSfdqWb
1.2.31	pXWKvaC	assi commo su fin <b> non aurie cuydado de fazer lux̉ia </b> en tal que pudiesse ganar algo .	quam intenderet ut finem , <b> non curaret moechari . </b> Incomplete ergo ,	xu3kM6t
1.2.32	zBIlzBN	e es uençido por las tentaçiones <b> mas non le es cosa delectable de mal fazer quando cae . </b> Et pues que assi es los non continentes	et per tentationes deiicitur , <b> sed delectabile est ei malefacere . </b> Incontinentes ergo	glwmLNx
1.2.32	takDYXB	Et pues que assi es los non continentes <b> e los muelles non se delectan en mal fazer </b> mas escogen conueniblemente	Incontinentes ergo <b> et molles | non delectantur in malefacere : </b> immo aliud eligunt ,	fvyKpU9, rX1LHnP
1.2.32	yBR5qiw	por las quales son tentados tan bien los non continentes <b> commo los muelles escogen bien fazer </b> e ponen assi muy buean sleyes	enim extra passiones tam incontinentes , <b> quam molles , | eligunt benefacere , </b> et proponunt optimas leges .	h3q9Qnt, tcHCNms
1.2.32	lGbrN9p	que non puede bien gouernar el cuerpo van ala simestro En essa misma manera los muelles <b> e los non continentes proponen de bien fazer </b> e escogen de yr ala diestra .	vadunt in sinistram . <b> Sic molles et incontinentes proponunt benefacere , </b> et eligunt ire in dextram :	zURq7AQ
1.2.32	sMDURbe	por que aquellos son dichos bestiales <b> que fazen mal sobre manera de los omes . </b> Et son estos omes bestiales	Illi enim bestiales esse dicuntur , <b> qui ultra modum hominum malefaciunt . </b> Sunt autem bestiales operantes ea ,	v83Y7IE
1.2.32	xyHed0a	otrossi el su fiio non era en casa tomaua prestado el fijo de otro su vezino <b> e aprestaual para fazer el conbit </b> et prometial que quando quisiesse fazer conbit	a vicino suo mutuabat filium , <b> et ipsum parabat in conuiuium , </b> spondens quod quando vellet conuiuium facere ,	of8ALS7
1.2.32	i3cE2dX	e aprestaual para fazer el conbit <b> et prometial que quando quisiesse fazer conbit </b> que el qual daria su fijo	et ipsum parabat in conuiuium , <b> spondens quod quando vellet conuiuium facere , </b> ei suum filium tribueret .	m1bhZLW
1.2.32	bnOpx00	que el qual daria su fijo <b> que fiziesse conbite del¶ </b> En essa misma manera avn çerca aquella tierra que llama una	ei suum filium tribueret . <b> Sic etiam multae de Phalaride bestialitates narrantur . </b> Quaedam etiam aliae gentes bestiales	k5hDFKs
1.2.32	xExn1Iz	Et por ende aquellos son dichos bestiales <b> que fazen mal fuera de razon </b> e dela manera comunal de los omes	Illi ergo sunt bestiales , <b> qui ultra modum hominum male agunt . </b> Dicto de quatuor generibus malorum ,	kafmjlu
1.2.32	j2IFHPp	por que contener se el omne <b> e tener se de fazer males mas queꝑ seuerar . </b> Ca quando alguno tentado poco o muy tentado non cae este es dicho ꝑse uerar .	Continere enim est plus , <b> quam perseuerare . </b> Nam si quis etiam non tentatus ,	wA4f3FO
1.2.32	zP5rxqt	contra las fuertes passiones <b> la qual cosa faz en los continentes . Mas son assi castigados en el appetito e en el desseo </b> e han las passiones del alma	vel contra fortes passiones se tenent , <b> quod faciunt continentes : | sed sunt ita castigati in appetitu , </b> et habent tam moderatas passiones ,	jwnPb82, uAG7jcC
1.2.32	xFnIMbE	que non sienten aquella batalla <b> nin aquella tentaçion mas es los a ellos cosa delectable de bien fazer </b> ¶ Et pues que assi es	quod quasi pugnam non sentiunt , <b> et delectabile est eis benefacere . </b> Sicut ergo perseuerantes opponuntur mollibus ,	hbrqigm
1.2.32	j313Bdw	Ca assi commo es cosa delectable <b> alos destenprados de mal fazer </b> assi es cosa delectable	sic temperati opponuntur intemperatis . <b> Nam sicut delectabile est intemperatis mala facere , </b> sic delectabile est temperatis bona operari .	hep6Qch
1.2.33	fz6bo1S	Las politicas amollesçen <b> e desponen el coraçon a bien fazer e reduzen lo a medio¶ </b> Et las uirtudes segundas	scilicet politicae , <b> molliunt idest ad medium reducunt . </b> Secundae , scilicet purgatoriae ,	zc02OZW
1.2.33	jpxzfUK	conuiene saber las pgatorias tiran <b> e fazen oluidar las passiones </b> de que el alma padesçe ¶	Secundae , scilicet purgatoriae , <b> auferunt . </b> Tertiae , quae sunt purgati animi ,	x1Tplpy
1.2.33	lVLSCCC	que son del coraçon pragado <b> fazen oluidar del todo las passiones . </b> ¶ Mas en las quartas uirtades	Tertiae , quae sunt purgati animi , <b> obliuiscuntur . </b> Sed in quartis ,	rRm1BtK
1.2.33	kd6rVBA	pues que assi es las uirtudes politicas <b> que amollesçen e ordenan el coraçon abien fazer </b> e lo reduzen a medio parte nesçen alos perseuerantes	Virtutes ergo politicae <b> quae molliunt , | idest disponunt animum ad benefaciendum , </b> et reducunt ipsum ad medium ,	fcpXGsX, iJykSNQ
1.2.33	kKUtz28	que non tiran las passiones <b> mas fazen las oluidar . </b> Ca el tenprado	nam istae non auferunt , <b> sed obliuiscuntur . </b> Temperatus enim habet sic appetitum castigatum ,	mga53cS
1.2.33	psV0vkr	tal auer las uirtudes del coraçon pragado <b> las quales le fazen escaeçer e oluidar las passiones </b> e las delectaçiones desordenadas	Merito ergo talis dicitur <b> habere virtutes purgati animi facientes </b> ipsum obliuisci passiones illas crebras ,	iw3B7EW
1.2.34	m6pKWnC	por que al uirtuoso es cosa delectable <b> de bien obrar e de bien fazer . </b> Et el continente	Continentia enim non proprie est virtus , <b> quia virtuoso delectabile est benefacere : </b> continens enim licet	jLRclnM
1.2.34	jaJpTDi	por razon dela lid <b> que siente non es a el cosa delectable de bien fazer Et </b> pues que assi es en quanto alguno es continente	ratione pugnae quam sentit , <b> non est ei delectabile benefacere . </b> Quandiu ergo aliquis est continens ,	rYhdxgL
1.3.1	jqrhLJz	Mas si alguno quisi esse trabaiar de enponer o fallar <b> non bͤapio a cada vna cosa podia lo fazer </b> mas quando nos somos çiertos dela cosa non deuemos auer cuydado delas palauras .	Si quis autem laborare vellet , <b> cuilibet posset | inuenire nomen proprium . </b> Sed cum constat de re ,	hJpTwVf, rcQbN68
1.3.1	m1yjesL	Ca en quanto por el nos <b> leunatamos a fazer uengança assi es saña . </b> O en quanto fallesçemos	quia vel ex hoc consurgimus <b> ad faciendam vindictam , | et sic est ira : </b> vel a tali vindicta deficimus ,	tOWzTpT, n9Us5Kb
1.3.3	yenRakb	Empero desto mas conꝑlidamente tractaremos adelante <b> or que las passiones fazen departimiento </b> en el nuestro gouernamiento	De hoc tamen infra diffusius tractabitur . <b> Passiones autem </b> quia diuersificant regnum et vitam nostram ,	rTwSrI6
1.3.3	zcDEC3l	Ante si el nuestro bien fuese destroydo <b> e perdido dios donde el quisiese lo podria refazer </b> por la qual cosa ningun omne sin ayuda de dios non pue da	immo et si annihilatum esset bonum nostrum , <b> Deus unde vellet , | posset illud reficere . </b> Quare cum nullus homo	mFpAwJd, o8suIp2
1.3.3	sc4d3lN	por la qual cosa ningun omne sin ayuda de dios non pue da <b> assi mismo fazer bueno o guardar </b> assymismo en bondat . La razon natural muestra	sine diuino auxilio possit <b> seipsum bonum facere , | vel se in bonitate conseruare , </b> dictat naturalis ratio	eYAQxUg, hnzzHFy
1.3.3	hH5fVJK	e demandan grandia singular de su persona <b> por la qual cosa fazen iniurias </b> e tuertos alos otros .	et quaerentes excellentiam singularem : <b> propter quod fiunt iniuriatores aliorum , </b> depraedant sacra ,	i3REHuw
1.3.3	oHZAVZN	casasscans e despoian el pueblo <b> e fazen e vsan de toda iniustiçia . </b> Onde ualerio maximo cuenta de dionsio seziliano	expoliant populum , <b> omnem iniustitiam exercent . </b> Unde et Valerius Maximus de Dionysio Ciciliano recitat ,	paj03Pj
1.3.3	kQg1Phy	e matando los omes malos <b> que fazen mal . </b> Por ende tales son de destroyr e de matar	nisi exterminando maleficos homines , <b> extirpandi sunt tales , </b> ne pereat commune bonum .	iUZy1lV
1.3.4	c78RpJ0	e la delectaçion <b> nos faze folgar en el . </b> Et esto que dicho es del bien	desiderium nos mouet : <b> et delectatio nos quietat . </b> Et quod dictum est	uv7buzD
1.3.4	kxbO08Q	se ayan bien alas cosas diuinales e de dios <b> e que fagan obras uirtuosas </b> e que sea entre ellos paz e assesiego	bene se habeant ad diuina , <b> quod agant opera virtuosa , </b> quod sint in eis pax tranquillitas ,	xFotjxW
1.3.4	eHnzfGc	por las cosas desiguales e malas . <b> Et fazer o tris cosas tales delas quales nasçe e cuelga la salud del regno </b> ¶	punire iniusta , <b> et facere talia , | a quibus regni salus dependere videtur . </b> Viso , quae ,	rs6gaJN, xZW6Vkn
1.3.5	dcMBmv1	Mas avn les conuiene de entender <b> en bien alto e grande e guaue de fazer De mas desto </b> quanto mayor es la comunidat	et Principes tendere in bonum , <b> sed etiam decet eos tendere in bonum arduum . </b> Amplius quanto maior est communitas ,	j82VF1v
1.3.6	z5AyXym	Empero conuiene de tractar primero estas cosas uniuersales et generales <b> por que el conosçimiento dellas faze mucho al conosçimiento delas cosas que se siguen . </b> Et por ende en el terçero	Expedit tamen haec uniuersalia pertransire , <b> quia horum cognitio faciet | ad cognitionem sequentium . </b> In tertio ergo libro	ojWd2Kp, yCvrA0j
1.3.6	lZ1quMD	La segunda se to ma de parte dela obra <b> que es de fazer </b> la primera manera se puede assi mostrar .	ex parte consilii habendi . <b> Secunda ex parte operis fiendi . </b> Prima via sic patet :	grlTiHl
1.3.6	gtJTi0U	en el capitulo del temor <b> que el temor nos faze auer consseio . </b> Ca por que alguno teme alguna cosa	nam , ut dicitur 2 Rhetoric’ cap’ de timore , <b> Timor consiliatiuos facit , </b> ex eo , quod aliquis ei timet ,	eq2Kcqw
1.3.6	arHzIIk	Lo segundo podemos esso mismo mostrar <b> de parte dela obra que es de fazer . </b> Ca non abasta de ser acuciosos	Secundo hoc idem inuestigare possumus <b> ex parte operis fiendi . </b> Nam non sufficit solicitari	pLc3VnC
1.3.6	tklTfSt	Mas el <b> temortenprado non solamente faze alos Reyes tomadores de conseio mas faze avn que fagan las obras mas acuçiosa mente . </b> Ca si nos viniere algun temor tenprado mas	non solum consiliatiuos facit , <b> sed etiam agit | ut opera diligentius operemur . </b> Nam si moderatus adsit timor ,	eBs4s2u, wTmZGTx
