Localisation	Id. source	Segment source	Segment cible	Id. cible
1.1.1	m6vQhgw	que demanda esta obra <b> que nos fazemos , </b> E primero veamos qual es la manera	ut non fiant ulteriores sermones <b> quam praesens opus requirat , </b> primo videndum est ,	a6GNDlL
1.1.1	sauZgcb	dizeque conplidamente se dize dela <b> moralph̃ia si fuer fecha manifestaçion </b> e declaraçion della sengund la materia de que ella es	quod dicetur sufficienter de morali negocio , <b> si manifestatio fiat </b> secundum subiectam materiam .	hIjglNC
1.1.1	dOXf0Vz	conujene al subdito <b> De saber fazer ¶ </b> E si por qual manera Deuen mandar a los sus Subditos	si per hunc librum instruuntur Principes , <b> quomodo debeant se habere , </b> et qualiter debeant	pIcBaAW
1.1.2	nvtFPSo	que son cerca delas obras <b> commo las deue omne fazer </b> Mas las nr̃as obras	scrutari ea quae sunt circa operationes , <b> quomodo faciendum sit eas . </b> Operationes autem nostrae ex quatuor	ptRbFAw
1.1.2	k2IMRrv	por que cada vnos deseos <b> e cada vnas pasiones fazen en nos alguna inclinaçion </b> por que fagamos departidas obras	singulae enim affectiones et passiones <b> aliquam inclinationem in nobis efficiunt , </b> ut alia , et alia opera faciamus .	q5U9DR1
1.1.2	eUVpXld	e cada vnas pasiones fazen en nos alguna inclinaçion <b> por que fagamos departidas obras </b> ¶Otrosy lo quarto paresçe	aliquam inclinationem in nobis efficiunt , <b> ut alia , et alia opera faciamus . </b> Quarto etiam ipsi mores opera diuersificare videntur .	eqv2t0g
1.1.2	y0Xgc07	¶Otrosy lo quarto paresçe <b> que las costunbres fazen departimjento en las obras </b> por que los que h̃a costunbres de vieios	ut alia , et alia opera faciamus . <b> Quarto etiam ipsi mores opera diuersificare videntur . </b> Nam habentes mores senum ,	bTsE2Gv
1.1.2	y3wQGAn	por que la fin en conparaçion delas obras <b> que se ha de fazer es </b> mas prinçipal comjenço	quia finis respectu agendorum , <b> est principalius principium , </b> quam aliquod aliorum .	s8052Gs
1.1.3	fa6yUdt	or que asy commo dicho es esta obra tomamos <b> e comneçamos a fazer porgera de ensseñar los pnçipes </b> et commo nunca el prinçipen ̃j otro	Quoniam ( ut dictum est ) <b> opus istud suscepimus gratia eruditionis Principum : </b> cum nunquam quis plene erudiatur ,	wnSlMee
1.1.3	zBAQg3K	para preguntar actento e acuçioso para rretener e tomar Et <b> pues que ya en el primero capitulo fizimos la magestad Real begniuola </b> e uolunterosa mostradol aquellas cosas	nisi sit beniuolus , docilis , et attentus : <b> postquam in primo capitulo reddidimus | regiam maiestatem beniuolam , </b> ostendendo , quae dicenda sunt ,	n2hetoi, y6idCAI
1.1.3	lLtpvyb	que nos prometiemos de tractar ligniamente ¶ <b> et en el segundo capitulo fiziemos </b> essa mjsma magestad doçible	nos esse faciliter tractaturos : <b> et in secundo reddidimus eam docilem , </b> narrando ordinem dicendorum :	uVmfFnR
1.1.3	grT10Er	contando la orden de las cosas que aqui auemos de dezir ¶finca que en este terçero capitulo <b> fagamos la Real magestad atenta e acuçiosa </b> declarandol quanto es el prouecho delas cosas	restat ut in hoc capitulo tertio <b> reddamus eam attentam , </b> declarando quanta sit utilitas in dicendis .	nZD89UG
1.1.3	v1YcE8P	e atal arte ¶ <b> pues que asy es en esta mjsma arte faremos el oydor begniuolo </b> e uolunteroso	sed magis est ordo rectus et debitus . <b> In huiusmodi ergo arte </b> ex facilitate tradendi	rsCpOiN
1.1.3	g1p0kur	por la orden de lans cosas <b> que son de dezer le faremos doçible e engeñoso </b> por que cada vno mayormente es fechͣo ensennable e engennoso	sed ex ordine dicendorum <b> redditur docilis ; </b> nam quis maxime efficitur docilis	uU0iVOh
1.1.3	gPFgKyy	Mas por el prouecho delas cosas <b> que son de dezer es fecho el oydor atento e acuçioso </b> para aprender	ex utilitate autem dicendorum <b> redditur auditor attentus , </b> nam quilibet attente audit ,	nXMk4ae
1.1.3	k1eykTa	que bien gouierna asy mesmo es digno <b> que sea fecho gouernador e senonr de los otros </b> Ca el que ha sabiduria	ut efficiatur rector , <b> et dominus aliorum . </b> Nam vigens prudentia ,	evgI6bL
1.1.4	l5HVWf3	Ca en rrelaçion desta obra <b> que se sigue feziemos la Real magestad begniuola et uolunterosa para oyr </b> e a prinder	Praemissis quibusdam praeambulis necessariis ad propositum , <b> quia respectu sequentis operis </b> ex facilitate modi tradendi	jKm2NVO
1.1.4	h1XjEg4	Et ahun diemos la <b> e fiziemos la ensennable e engennosa </b> para preguntar	ex facilitate modi tradendi <b> reddidimus regiam maiestatem beniuolam , </b> ex ordine dicendorum	fwfPmpU
1.1.4	dQ7MJoY	que auemos de dezir <b> Et aun fiziemos la actenta e acuçiosa </b> para tomar e rretener	ex ordine dicendorum <b> reddidimus eam docilem , </b> ex utilitate reperta	jZ2SzSV
1.1.4	oPyaOoa	Mas por que la fin es comjenço mas prinçipal de todas las obras <b> que fazemos que njnguno delons otros prinçipios </b> asy commo dicho es de suso	principium agibilium principalius , <b> quam aliquod aliorum , </b> ut dicebatur supra ,	btI87Lm
1.1.4	dy1RxfU	que es Razon derecha de todas las cosas <b> que ha de obrar e de fazer ¶ </b> Mas es dicho bien auenturado en vida contenplatina	habendo in se prudentiam , <b> quae est recta ratio agibilium : </b> dicatur felix contemplatiue ,	caC0CFH
1.1.4	tXxIkBg	pues que asy es llaman al omne acabado en las obras <b> que ha de fazer bien auenturado </b> çiudadanamente	et aliquid melius homine . <b> Perfectum igitur in agibilibus , </b> vocabant felicem politice :	peyvWTW
1.1.4	p51seqH	mas mejor que omne <b> Ca fazer e partiçipar enlas obras </b> con los otros omes	sed homine meliorem . <b> Nam agere et communicare </b> in actionibus cum aliis ,	iroH0ek
1.1.4	qGImsL3	entre el sabio en las obras <b> que ha de fazer </b> Et el acabado ente las sçiençias especulatians quanta es	Tanta est ergo differentia <b> inter prudentem in agibilibus , </b> et perfectum in speculabilibus ,	u3uZCpR
1.1.4	r6xnCay	entienden las obras <b> faziendo cosas granadas </b> e honrra das et gouernando derechamente los sus .	non enim vitam contemplatiuam <b> ponimus in pura speculatione , </b> ut Philosophi sentiebant .	qvIHoIw
1.1.5	ghWMhGe	tres cosas le son le mester ¶ <b> Lo primero que faga bien </b> ¶Lo segundo que faga bien	tria requiruntur . <b> Primo , quod agat bene . </b> Secundo , quod ex electione .	wZ9kyk0
1.1.5	qtZqJDG	Lo primero que faga bien <b> ¶Lo segundo que faga bien </b> por eleçion e por uoluntad ¶	Primo , quod agat bene . <b> Secundo , quod ex electione . </b> Tertio , quod agat delectabiliter .	a63NNj6
1.1.5	hXzegGq	por eleçion e por uoluntad ¶ <b> Lo terçero que el bien que feziere </b> que lo fiza deletablemente	Secundo , quod ex electione . <b> Tertio , quod agat delectabiliter . </b> Si enim non ageret bene sed male ,	wAJq8U3
1.1.5	vKCjWDX	e de buena uoluntad . <b> Ca sy non feziese bien </b> mas mal non podria alcançar buena fin	Tertio , quod agat delectabiliter . <b> Si enim non ageret bene sed male , </b> non consequeretur finem ,	beF1e92
1.1.5	bCj9xfY	e enbarga todo bien <b> El qual bien tirado los que mal fazen dignos son </b> que ayan mala postremeria .	tollit omne bonum . <b> Quare si male agentes digni sunt </b> ut mala consequantur ,	uwDXYK7
1.1.5	wayT2XP	Ca el mal es contrario del bien <b> Et por ende el mal es contrario ala fin del que mal faze . </b> Por la qual rrazon los malos dignos son	quia malum contrariatur bono , <b> per consequens contrariatur fini , | male agentes </b> ( secundum quod huiusmodi )	qt8NRj0, ty2fVYc
1.1.5	iTvALbn	mas el contrario e mala fin . <b> Mas non solamente los que mal fazen non alcançan buena fin </b> mas avn los que pueden bien fazer	sed contrarium finis . <b> Immo non solum male agentes | non consequuntur finem , </b> sed potentes bene agere ,	p8rThuc, nSDrcFv
1.1.5	vVzCd7g	Mas non solamente los que mal fazen non alcançan buena fin <b> mas avn los que pueden bien fazer </b> sy non fazen bien non les es deuido corona	non consequuntur finem , <b> sed potentes bene agere , </b> nisi bene agant ,	voR3UCx
1.1.5	c25W2PB	mas avn los que pueden bien fazer <b> sy non fazen bien non les es deuido corona </b> njn les es deuido buena fin njn buean andança ¶	sed potentes bene agere , <b> nisi bene agant , | non debetur eis corona , </b> nec debetur eis finis ,	q54xjRE, jO7o9Ag
1.1.5	pJisXhT	Enpero si non lidiaren de fech̃o non les es deuida corona ¶ <b> pues que asi es conviene bien fazer de fecho </b> por que por las nr̃as obras merescamos de auer buena fino buena ventura	non debetur eis corona . <b> Oportet igitur actu bene agere , </b> ut per opera nostra mereamur	jsRPhVA
1.1.5	p5QexYq	Ca aqual <b> que faze bien acaso e auentura por esto non es de alabar </b> njn por esto non le es deujda buean fin njn buena ventura .	quod ex electione agamus . <b> Nam qui casu vel fortuitu bene agit , | ex hoc non est laudandus , </b> nec debetur ei	fMs18ib, w3zh8Sg
1.1.5	kJkhXGV	njn por esto non le es deujda buean fin njn buena ventura . <b> Ca las cosas que se non fazen </b> por eleçio non son de uoluntad	ex hoc finis vel felicitas : <b> nam quae ex electione non fiunt , </b> non sunt voluntaria .	ndR432X
1.1.5	giHvy47	por eleçio non son de uoluntad <b> Et por las cosas que fazemos non de uoluntad </b> non deuemos ser loados njn denostados .	non sunt voluntaria . <b> Ex inuoluntariis autem | ( ut patet per Philosophum 3 Ethic’ ) </b> non laudamur nec vituperamur :	mCHyKPW, veEbgT1
1.1.5	kf0mHDX	si non obra de voluntad <b> Mas aquellas cosas que nos non fazemos por </b> electiuo non las fazemos de uoluntad ¶	quod nullus est beatus nisi volens . <b> Sed quae non agimus ex electione , </b> non agimus volentes :	lKsZWLQ
1.1.5	suZgBhs	Mas aquellas cosas que nos non fazemos por <b> electiuo non las fazemos de uoluntad ¶ </b> pues que asy es fablando propiamente de tales obras qua non son de uoluntad fechas segunt que tales son non se nos sigue buena fin	Sed quae non agimus ex electione , <b> non agimus volentes : | ergo per se loquendo </b> ex talibus operibus	hgz0tVN, aMnB1kI
1.1.5	kOqKFIK	por que qua quanto cada vno mas se delecta en la obra <b> que faze tanto </b> mas faze aquella obra	nam quanto quis in aliquo opere magis delectatur , <b> tanto magis voluntarie </b> et ex habitu efficit opus illud .	kcSZhVf
1.1.5	t3QJp2P	que faze tanto <b> mas faze aquella obra </b> por voluntad e por elecçio¶	tanto magis voluntarie <b> et ex habitu efficit opus illud . </b> Unde Philosophus 2 Ethic’ vult ,	dd9WgiD
1.1.5	ggzUvqB	en el segundo libro delas ethicas <b> que non cunple solamente fazer buenas obras </b> mas fazerlas bien njn cunple de obrar obras iustas	Unde Philosophus 2 Ethic’ vult , <b> quod non sufficit agere bona , </b> sed bene : nec sufficit operari iusta ,	bQZ7Qin
1.1.5	idTOw49	que non cunple solamente fazer buenas obras <b> mas fazerlas bien njn cunple de obrar obras iustas </b> mas fazer las iustamente e con iustiçia .	quod non sufficit agere bona , <b> sed bene : nec sufficit operari iusta , </b> sed iuste .	ygrcJ7H
1.1.5	bB8JcJ1	mas fazerlas bien njn cunple de obrar obras iustas <b> mas fazer las iustamente e con iustiçia . </b> por que contesçe que algunos malos fazen algunas buenas obras	sed bene : nec sufficit operari iusta , <b> sed iuste . </b> Contigit enim aliquos prauos	mIGFr98
1.1.5	dqUYwGR	mas fazer las iustamente e con iustiçia . <b> por que contesçe que algunos malos fazen algunas buenas obras </b> Enpero por que las non .	sed iuste . <b> Contigit enim aliquos prauos | facere aliqua de genere bonorum , </b> tamen quia non faciunt ea bene et delectabiliter ,	demuMMt, w0yDsyf
1.1.5	wycfprj	Enpero por que las non . <b> fazen bien njn </b> delectosamente non les conuiene	facere aliqua de genere bonorum , <b> tamen quia non faciunt ea bene et delectabiliter , </b> non oportet per huiusmodi opera	kivxQHf
1.1.5	cIeMqfY	Et quando estas tres cosas todas uienen en vno <b> que nos fagamos buean sobras </b> e las fagamos de voluntad	Cum ergo ista tria contingunt , <b> quod agamus bona , </b> ex electione , et delectabiliter ,	cvBncJG
1.1.5	qOgLMvC	que nos fagamos buean sobras <b> e las fagamos de voluntad </b> e delectosamente estonçe contesçe que nos alcançemos conplidamente buena fin .	quod agamus bona , <b> ex electione , et delectabiliter , </b> maxime contingit nos sic finem	a7Gs5nY
1.1.5	v5wqdgF	esto es por ventura asy los que ante non conosçen la su fin <b> si bien fazen </b> e alcançan la fin	sic non praecognoscentes finem , <b> si bene agant , </b> et finem consequantur ,	kq916Gr
1.1.5	a38eg7J	que para lanr̃auida grant acresçentamiento <b> faze connosçer ante la fin </b> Ca por esta Razon alcançaremos ante la fin	ad vitam nostram magnum habet incrementum : <b> consequemur enim </b> ex hoc magis ipsum finem ;	xAyqegp
1.1.5	bvH5ZbK	Lo terçero conesçer ante la fin <b> non solamente nos faze bien obrar e obrar de uoluntad </b> mas ahun faze nos obrar delectosamente	Tertio praecognitio finis <b> non solum facit | nos agere bene , </b> et ex electione ,	sQhjvA6, qqmqZp1
1.1.5	lrrUAYW	non solamente nos faze bien obrar e obrar de uoluntad <b> mas ahun faze nos obrar delectosamente </b> Ca pensada la bien andança	nos agere bene , <b> et ex electione , </b> sed etiam delectabiliter .	zuksbKp
1.1.5	lgSOvn4	e la buena uentraa <b> que omne ha por las buean s obras las obras guaues e fuertes de fazer se </b> fazen muy delectables e plazenteras ¶	sed etiam delectabiliter . <b> Nam grauia efficiuntur delectabilia et dulcia , </b> considerata beatitudine , et felicitate ,	m8qkqhv
1.1.5	rcA1YL5	que omne ha por las buean s obras las obras guaues e fuertes de fazer se <b> fazen muy delectables e plazenteras ¶ </b> pues que asi e sacanda	sed etiam delectabiliter . <b> Nam grauia efficiuntur delectabilia et dulcia , </b> considerata beatitudine , et felicitate ,	m8qkqhv
1.1.5	sOvKyQf	que a otro ninguno . <b> por que pueda fazer buenas obras e comunes </b> que son en alguna manera obras diuina les .	cognoscere suam felicitatem , <b> ut opera communia , </b> quae sunt quodammodo diuina ,	lFfyUCH
1.1.5	bDeuNjK	que son en alguna manera obras diuina les . <b> Et estas obras que los faga bien e delectosamente e de buena uoluntad </b> ¶ lo segundo esto mesmo paresçe asy	quae sunt quodammodo diuina , <b> exerceat bene , delectabiliter , | et ex electione . </b> Secundo patet hoc idem	fJRo4xY, upLj2gK
1.1.6	hN6vwXC	La primera es que la bien andança es bien acabado <b> e tal bien que por si mesmo faze el omne acabado . </b> Ca estonçe dezimos	Felicitas enim dicit perfectum , <b> et per se sufficiens bonum . Nam tunc dicimus aliquem esse felicem , </b> quando assecutus est id ,	ojnj78t
1.1.6	dMiBMo1	e es bien acabado e bien sufiçiente <b> por si para fazer al omne acabado ¶ </b> Et desto primero se sigue lo segundo	et perfectum , <b> et per se sufficiens bonum . </b> Ex hoc autem primo sequitur secundum ,	hG5MJ3W
1.1.6	eLKrdrU	Por que quantomayores son los bienes <b> tantom fazen la razon libre e desenbargada </b> Ca lo que es segunt razon non conuiene	quanto maiora sunt , <b> tanto magis reddunt rationem liberam , et expeditam . </b> Nam quod secundum rationem existit ,	gCvt7bR
1.1.6	u22PExy	que maguera que alguas delecta connes sean conuenibles e honestas <b> por que las obras uirtuosas fazen al omnen bueno e uirtuoso e de grant delectaçion . </b> Enpero njnguna delectaçion non es feliçadat	quod licet sint delectationes aliquae licitae , et honestae , <b> eo quod ipsa opera virtutum Homini bono , | et virtuoso magnam delectationem faciant : </b> nulla tamen delectatio est essentialiter ipsa felicitas ,	ymuAWfZ, w57nF4W
1.1.6	mOchKI3	la segunda que estas plazenterias carnales <b> le fazen ser menospreçiado de los omes </b> ¶la terçera es que las plazenterias dela carne le fazen	quia ipsum maxime deprimunt . <b> Secundo , quia eum contemptibilem reddunt . </b> Tertio , quia esse ipsum indignum principari faciunt .	u0w52vB
1.1.6	fY17XWj	le fazen ser menospreçiado de los omes <b> ¶la terçera es que las plazenterias dela carne le fazen </b> que non sea digno de ser prinçipe¶	Secundo , quia eum contemptibilem reddunt . <b> Tertio , quia esse ipsum indignum principari faciunt . </b> Dicebatur enim supra ,	gzI2RzT
1.1.6	tB0fplT	es que por esso seria denostado e menospreçiado <b> e farie que los otros le touiese en pos . </b> ¶ Onde el philosofo en el quinto libro delas politicas	ø	ø
1.1.7	sYcgMtk	dende ¶ El pmero mal es que pierde muy grandes bienes ¶ <b> El segundo es que se faze por ende tirano quiere dezer le unadoro . </b> apremiador del pueblo	Primo , quia amittit maxima bona . <b> Secundo , quia efficitur Tyrannus . </b> Tertio , quia efficitur populi depiaedator .	z25yaEw
1.1.7	xx3iJFG	nin granado <b> el qual magnifico ha de fazer grandes espensas para ser granado </b> nin ahun puede ser mager fico	nunquam potest esse magnificus , <b> cuius est facere magnos sumptus : </b> nec etiam potest esse Magnanimus ,	i6rh7hI
1.1.7	sO2zO9o	que pone su bien andança en las riquezas corporales . <b> ¶ Ca por esto se fare tirano </b> ca ay grant diferençia entre el Rey e tirano	vel Principi suam felicitatem ponere in diuitiis , <b> quia hoc facto Tyrannus efficitur . </b> Est enim differentia	ofJot8s
1.1.7	nHkYtyx	esto es por que del bien comun se le siguͤ bien ala persona <b> Mas al tirano faze todo el contrario . </b> Ca prinçipalmente para mientes al su bien propio .	hoc est ex consequenti . <b> Tyrannus vero econuerso , </b> principaliter intendit bonum priuatum :	avFobeg
1.1.7	uFhTAP3	e en los aueres <b> prinçipalmente entiende de thesaurizar e fazer thesoro e llegar muchos dineros </b> Et por ende se sigue	ponens suam felicitatem in numismate , <b> principaliter intendit reseruare sibi , | et congregare pecuniam . </b> Non ergo est Rex ,	tV9fqZA, f3GMCju
1.1.7	kBPnvv6	por que non solamente non les procura bien <b> mas faze les mal . </b> Por la qual cosa si es muy contra razon que el Rey dexe muy grandes bienes . Et si es contra razon otrosi	quando non solum non procurat bonum , <b> sed etiam infert malum . </b> Quare si detestabile est ,	qy6dpQY
1.1.8	vkVifIZ	e non de dentro del alma ¶ <b> Lo terçero por que la honrraes tal bien que es mas en aquel que la faze </b> que non en aquel que la resçibe .	Secundo , est bonum extrinsecum . <b> Tertio , est magis in honorante , </b> quam in honorato .	azjr0hQ
1.1.8	hZEsTtt	do dize que honrra es reuerençia <b> que fazen unos omes a otros en testimoino de uirtud </b> por que son omes uirtuosos ¶	esse exhibitionem reuerentiae <b> in testimonium virtutis . </b> Causa ergo ,	as1xJHT
1.1.8	z5bKYEr	Ca ya dixiemos <b> que la honrraes reuerençia fecha a alguno en sennal de uertud . </b> Mas la señal o el testimoino	dictum est enim <b> quod honor est reuerentia exhibita | in signum virtutis : </b> signum autem ,	lyKckce, sDy7ax0
1.1.8	llpMsLc	lo que cada vno pienssa en su coraçon <b> mas lo que faze de fuera¶ </b> Pues que asi es si la reuerençia es honrra	quae quis in corde cogitat , <b> sed quae exterius repraesentat . </b> Reuerentia ergo ,	tVyX4wF
1.1.8	o6J0aIh	e ha de magnifestar la uirtud de aquel <b> a quien la fazen non cunple </b> que la uertud sea penssada en el coraçon	si debet manifestare virtutem eius <b> cui exhibetur , | non sufficit , </b> quod si cogitata in corde ,	imbqsQW, pvYMThg
1.1.8	a2EmlK2	que esta de fuera <b> por que es reuerençia fecha </b> por señales mostradas de fuera¶	Honor ergo habet rationem boni extrinseci , <b> cum sit reuerentia exhibita </b> per quaedam exteriora signa .	zT2QcxX
1.1.8	jRbXXfh	por que la honrra es mas enel <b> que la faze que non en el que la resçibe </b> assi como dize el philosofo en el primero libro delas ethicas .	ex eo quod honor magis est in honorante , <b> quam in honorato , </b> ut plane vult Philosophus 1 Ethicorum	u72V130
1.1.8	wWQeZbR	Ca asi commo dize vn prouerbio la cortesia e la enseñaça <b> es en aquel que la faze . </b> Assi la honrra es mas en aquel que la faze	curialitas est eius <b> qui facit ipsam , </b> sic honor magis in eo est ,	cXvlCEh
1.1.8	cBEibov	es en aquel que la faze . <b> Assi la honrra es mas en aquel que la faze </b> que non en aquel que la resçibe¶	qui facit ipsam , <b> sic honor magis in eo est , | qui facit ipsum , </b> quam in eo qui per huiusmodi reuerentiam honoratur .	e0uuOR3, rcCz6AU
1.1.8	tVmEN4W	Et esso mesmo paresçe manifiestamente al seso . <b> Por que sy alguno inclinando se faze reuerençia a otro o le honrra . </b> çierto es que aquella inclinaçion	Apparet autem hoc esse sensibiliter verum : <b> nam si aliquis inclinat se reuerenter ad alium , | vel honorat ipsum , </b> constat inclinationem illam proprie esse in inclinante ,	hbs0aYB, llK2Zab
1.1.8	wwSTUOo	çierto es que aquella inclinaçion <b> quel faze propnamente es </b> en el que se indina	vel honorat ipsum , <b> constat inclinationem illam proprie esse in inclinante , </b> non in eo cui inclinatio exhibetur .	q5loEeb
1.1.8	l6PipzH	que la reuerençia o la honrra mas es en el honrrador <b> e en el que la faze </b> que non en el honrrado	Inclinatio ergo illa et reuerentia siue honor <b> magis est in honorante , </b> quam in honorato .	mLiYQZa
1.1.8	jYi1roC	do dize <b> que los que fazen fuerça tan solamente de ser honrrados </b> que estos son infintos e superfiçiales .	unde et Philosophus in Politicis , <b> curantes de honore tantum , </b> dicit esse fictos , et superficiales .	soEx4SZ
1.1.8	dCczQuM	si el prinçipe pusiere la su bien andança enlas honrras <b> por que pueda delo que feziere honrra alcançar </b> presumira de poner los pueblos a todo peligro	si Princeps suam felicitatem in honoribus ponat , <b> ut possit honorem consequi , </b> praesumet suam gentem exponere omni periculo .	htxvxkx
1.1.9	eqnNyfP	e enlos epitafios Reuerençia de antiguedat <b> que fazen algunos </b> por que son antigunoo e bueons .	recordationes in metris , decantatio , <b> aut solutae orationis </b> ad laudem recitatio ,	bGzUPBN
1.1.9	aI3UI0q	Ca la fama es vn claro conosçimiento con loor . <b> Enpero si quisieremos fazer depart ineto entre la fama e la eglesia </b> diremos	cum laude notitia . <b> Si tamen vellemus aliquo modo distinguere | inter gloriam , et famam : </b> diceremus quod fama oritur ex gloria :	zyjRDOy, oCTOp8c
1.1.9	tnwZZg9	por que dura por mucho stp̃os <b> e non se puede desfazer . </b> Et ahun paresçe	cum per multa tempora contingat <b> ipsam indelebilem esse . </b> Videtur ergo quod maxime Princeps	uOyZAEh
1.1.9	pCpiUl3	se departe el conosçimiento de dios del nuestro conosçimiento . <b> Ca el conosçimiento de dios fizo </b> e faze todas las cosas	est quaedam clara cum laude notitia . <b> Dei autem notitia </b> ( ut ad praesens spectat )	enxMQW6
1.1.9	qGvfK7c	Ca el conosçimiento de dios fizo <b> e faze todas las cosas </b> mas el nuestro conostimiento es fecho delas cosas que dios fizo .	Dei autem notitia <b> ( ut ad praesens spectat ) </b> in tribus differt a notitia nostra :	le2aGhC
1.1.9	thoPh03	e faze todas las cosas <b> mas el nuestro conostimiento es fecho delas cosas que dios fizo . </b> asi commo dize el philosofo	( ut ad praesens spectat ) <b> in tribus differt a notitia nostra : </b> nam notitia Dei causat res ,	xGUQDLn
1.1.9	tfL1DDy	que cosa es la honrra en si¶ <b> La otra manera es teniendo mientes al talante de aquellos que la fazen . </b> Ca la honrra en si non es	vel ut procedit <b> ex affectione dantium . </b> Honor autem in se ,	itiWYfG
1.1.9	i7bEodk	en quanto salle de buean uoluntad <b> de aquellos que la fazen es en ella vn </b> gualardon conuenible	ex affectione dantium , <b> habet ibi esse </b> quaedam congrua remuneratio :	trwrslG
1.1.9	jcNxfug	gualardon conuenible <b> Por que los que la fazen non han cosa mayor </b> nin mas conuenible	quaedam congrua remuneratio : <b> nam eo ipso , | quod dantes non habent aliquid </b> maius quod retribuant ,	vDKjCRl, t2iPOZD
1.1.9	ltGGFxc	Et en esta manera deuen resçebir la honrra <b> que les fazen </b> Por la qual cosa	congruit Principi <b> hoc modo honorem exhibitum acceptare . </b> Propter quod	lzpAUSM
1.1.9	lvbTlXr	de aquellos <b> que fazen la honrra </b> e non propiamente la honrra en sy .	in huiusmodi retributione <b> acceptatur affectio dantium , </b> et non proprie honor datus .	u51GiPP
1.1.9	aw8AIf4	Ca si el prinçipe non resçibiese esta buena uoluntad delas <b> que les fazen honrramas quesiese </b> que la su gente	et non proprie honor datus . <b> Quod si tamen Principes non acceptarent hanc affectionem dantium , </b> sed requirerent a gente sibi commissa alia exteriora bona ,	tZqnKQi
1.1.10	wbQ4aGk	ize vegeçio enł primero libro <b> que fizo dela caualleria </b> que sobre todas las cosas es de alabar la maestria	Quod non decet regiam maiestatem suam <b> Vegetius in libro De re militari , </b> super omnia commendare videtur bellorum industriam .	yHZVRgr
1.1.10	hA0u8fp	¶La quinta daquello por que tal sennorio <b> en la mayor parte faze gerat danno¶ </b> La primera razon se puede assi declarar	Quinta vero , ex eo quod tale dominium <b> ut plurimum infert nocumentum . </b> Prima via sic patet .	qZ5Dhsx
1.1.10	mj0P39a	poner la su bien andança en el poderio çiuiles <b> por que este sennorio faze grant danno en las mas cosas . </b> Ca commo la feliçidat	quia huiusmodi principatus infert <b> ut plurimum nocumentum . </b> Nam cum felicitas sit finis omnium operatorum ,	lbQWyR0
1.1.10	bN0yY2O	Et en aquello que en las mas cosas . <b> faze danno siguese </b> que non es cosa conuenible	ad minora bona , <b> et ut plurimum infert nocumentum : </b> inconueniens est etiam Principem	zhjmkdo
1.1.11	rYbIE03	Ca perdida la sanidat <b> fazen se los mienbros magros e flacos </b> e non finca en ellos color natraal	quia amissa sanitate , <b> membra fiunt macilenta , </b> non remanet in eis color debitus :	qpjtaN7
