Localisation	Id. source	Segment source	Segment cible	Id. cible
3.2.16	p41Eeg5	e por ende delas luuias <b> que sienpre se fazen en el tpon del yuierno </b> e delas calenturas	Ideo de imbribus <b> quae semper fiunt tempore hyemali , </b> et de caumatibus	y5qdqeS
3.2.16	q1MpFe2	e delas calenturas <b> que muchas uezes se fazen en el tro del </b> estiuo non auemos a tomar consseio	et de caumatibus <b> quae sepe contingunt tempore aestiuali , </b> non habet esse consilium :	u1PwPBu
3.2.16	fsovA03	en aquellas cosas <b> que se fazen pocas vezes </b> si contesçe a auentura	Quarto non sunt consiliabilia <b> quae etiam fiunt raro , </b> si ex fortuna contingant .	ieDDvY1
3.2.16	mG80g7I	cada vne de los omes toma conseio de aquellas obras <b> que se puden fazer por el </b> ¶Lo vi̊ non caen sosico consseio todas aqllas cosas	consiliantur de iis operabilibus , <b> quae fieri possunt per ipsos . </b> Sexto non sunt consiliabilia	jnkPJAg
3.2.16	fzxd8Xg	e toma assi <b> conmocosa çierta e conosçida e ha consseio en qual manera estas cosas se pueden meior fazer . </b> Et pues que assi es los consseios son de aquellas cosas	sed haec accipit tanquam certa et nota , <b> et consiliatur quomodo melius fieri possint . </b> Sunt ergo consiliabilia	e0tx4uk
3.2.17	pPFVwxG	que pueden obrar los omes <b> ca pueden se fazer questiones </b> en las sciençias especulatiuas	sed solum de agibilibus humanis : <b> possunt autem circa speculabilia , </b> et circa naturas rerum ,	zSovtPx
3.2.17	lSWBLEC	ca es question delas obras <b> que pueden fazer los omes finca de ver </b> en qual manera es de tomar el conseio	quia est quaestio agibilium humanorum : <b> restat videre qualiter est consiliandum , </b> et quem modum in consiliis habere debemus .	zyYv6yc
3.2.17	yNPt6kN	e non son çiertas del todo <b> nin determinadas en qual manera se deue fazer . </b> Por ende dudamos	et non sunt omnino certa <b> et determinata qualiter fieri debeant , </b> ideo dubitamus	o8RV7QF
3.2.17	sERnShQ	pues que assi es vna manera es de toraar en los consseios e es esta . <b> que quando algun fecho del regno se propone </b> quanto al fech	Est ergo unus modus in consiliis adhibendus , <b> quod quando aliquod factum regni proponitur , </b> quanto pluribus modis fieri potest	coaDRNA
3.2.17	ca5jmOf	quanto al fech <b> por mas maneras se puede fazer . </b> Et quanto menos ha çiertas	quod quando aliquod factum regni proponitur , <b> quanto pluribus modis fieri potest </b> et quanto minus habet certas et determinatas vias ,	wacv2O4
3.2.17	xzZUBto	e determinadas carreras <b> para se fazer tanto mayor tienpo ha menester omne </b> para tomar consseio dello .	et quanto minus habet certas et determinatas vias , <b> tanto per plus tempus est consiliandum , </b> ut de illis viis facilior et melior eligatur .	baGsEKE
3.2.17	nCmrPaO	Ca dicho fue desuso <b> que el temor faze alos omes tomar conseio . </b> Et por ende paresçe	Dicebatur enim supra , <b> quod timor consiliatiuos facit : </b> qui ergo consiliatur ,	eQt6xGa
3.2.17	vfimQej	connusco otros con los quales ayamos acuerdo delas cosas <b> que auemos de fazer </b> ca commo quier que el omne entre ssi mismo pueda fallar carreras e maneras para fazer alguna cosa	inter quos conferamus <b> de negociis fiendis . </b> Nam licet homo inter seipsum possit	snk4qWt
3.2.17	nyGXZGJ	que auemos de fazer <b> ca commo quier que el omne entre ssi mismo pueda fallar carreras e maneras para fazer alguna cosa </b> enpero non es sabio aquel	de negociis fiendis . <b> Nam licet homo inter seipsum possit | inuenire vias et modos ad aliquid peragendum , </b> attamen imprudens est	gdePzYH, zl7FX6X
3.2.17	c3U4C4A	que con los otros ayamos acuerdo <b> delo que auemos de fazer la qual cosa paresçe por dos cosas . </b> ca los conseios assi conmo dicho es	ut cum aliis conferamus quid agendum , <b> quod ex duobus patet . </b> Nam consilia	x3N7Z40
3.2.17	aT75eo1	por que el conseio es delas obras particulares <b> que fazemos en las quales vale much la prueua </b> ca en las tales cosas	circa agibilia particularia , <b> in quibus multum valet experientia . </b> Nam in talibus ,	zfCMahk
3.2.17	qIBz0Fh	que non fablen y cosas plazenteras mas uerdaderas <b> ca los lisongeros estudiando de fazer plaza los prinçipes callan la uerdat </b> e dizen las cosas	ut non loquantur ibi placentia , sed vera . <b> Adulatores enim | dum Principi placere student , </b> vera silentes ,	tOgAoHo, zgYPdLQ
3.2.17	gW7CEBz	si derechͣmente queremos obrar <b> e non lo fazemos e esto es por que non sabemos </b> si auemos de fazer aquella cosa o non ¶	et si recte volumus <b> et non illud facimus , </b> hoc est quia ignoramus an expediat illud fieri .	aBQjE8Z
3.2.17	fIiayB5	e non lo fazemos e esto es por que non sabemos <b> si auemos de fazer aquella cosa o non ¶ </b> pues que assi es muy bien es de	et non illud facimus , <b> hoc est quia ignoramus an expediat illud fieri . </b> Bene ergo se habet diligenter	d9D4uCX
3.2.17	fPBlpDa	pues que assi es muy bien es de <b> escodrinnar con grant acuçia todo negoçio alto e noble si es prouechoso delo fazer . </b> mas despues que fuere conosçido derechamente	Bene ergo se habet diligenter <b> quodlibet negocium discutere arduum , | an utile sit illud facere : </b> sed post quam per diuturnum consilium est recte cognitum	pc96DJ5, rgw0oH8
3.2.17	qZS9JWj	por el conse io prolongado <b> que es lo que deuemos fazer </b> si ouieremos tp̃o conueinble e poder para obrar	sed post quam per diuturnum consilium est recte cognitum <b> quid fiendum , </b> si adsit operandi facultas ,	fcbwkqL
3.2.17	fID4ngk	e luego e que conuiene de touiar conseio prolongadamente <b> mas conuiene de fazerl cosas conseiadas mucho ayna . </b> mar ala Real magestado das aquellas cosas	et quod oportet consiliari tarde , <b> sed facere consiliata velociter . </b> Omnia autem illa quae habere debet bene persuadens	cLMIjLx
3.2.18	tEaT9yQ	por razones <b> e en quantas maneras les ha omne de fazer fe . </b> e en quantas maneras son los omes enclinados	quot modis persuadetur hominibus , <b> vel quot modis fit eis fides </b> et inclinantur ad credendum sermones auditos .	kRcmZaB
3.2.18	d9pO7of	de ligero creen los omes asodichos . <b> lo segundo se puede fazer creençia alos oydores </b> de parte de los dizidores la qual cosa contesçe	de facili creditur eorum dictis . <b> Secundo potest fieri credulitas auditoribus </b> ex parte ipsorum auditorum :	z4g85d6
3.2.18	rQoAGjL	de quanto son enlos negoçios <b> que han de fazer comunalmente creen los omes </b> que veen mas cosas de quanta sueen	et esse magis sapientes quam sint , <b> et in negotiis fiendis communiter credunt homines </b> plus videre quam videant ,	iEp1rJH
3.2.18	k6fgpNj	por que las sabe conosçer e iudgar uiene la creençia <b> e faze fe el sabio alos oydores . </b> mas esta creençia et este amonestamiento es por si .	cognoscere et iudicare , <b> facit fidem auditoribus . </b> Haec autem credulitas	nk3Tm74
3.2.18	ysx5eJg	mas esta creençia et este amonestamiento es por si . <b> Ca fazerse el omne digno de creer </b> e buen amonestador e razonador por si .	et haec persuasio est per se : <b> nam reddere se credibilem </b> et bene persuadere per se ,	ku6uJ6Y
3.2.18	gq1Rjom	razonadorca sabe tomar razones e argumentos <b> por los quales faga fe alos oydores </b> e porque los sabios saben esto fazer	de quibus loquitur scire assumere rationes et argumenta , <b> per quae fides fiat audientibus . </b> Et quia prudentes sciunt facere ,	u2yQY5U
3.2.18	iuvUzZn	por los quales faga fe alos oydores <b> e porque los sabios saben esto fazer </b> e aquellos que son tenidos	per quae fides fiat audientibus . <b> Et quia prudentes sciunt facere , </b> et qui existimantur prudentes ,	mAu6AWe
3.2.18	tecDFVl	por sabios son contados <b> para fazer tales cosas </b> Morende para que alguno faga fe delas cosas de que fabla o conuiene que sea sabio	et qui existimantur prudentes , <b> existimantur talia facere : </b> ideo ad hoc quod aliquis ex rebus	mfaRbqP
3.2.18	ipXdfSD	para fazer tales cosas <b> Morende para que alguno faga fe delas cosas de que fabla o conuiene que sea sabio </b> o que sea tenido por sabio .	existimantur talia facere : <b> ideo ad hoc quod aliquis ex rebus | de quibus loquitur fidem faciat , vel oportet quod sit prudens </b> vel quod credatur esse prudens .	p8Nsrps, inPa3Qv
3.2.18	z5Thc9q	ca conosçen los negoçios <b> que han de fazer </b> e saben en qual manera los han de fazer .	de quibus loquuntur ; <b> quia cognoscent negocia agibilia , </b> et scient qualiter sit agendum .	qV6BGOH
3.2.18	qbb6MKx	que han de fazer <b> e saben en qual manera los han de fazer . </b> Et pues que assi es estas tres cosas	quia cognoscent negocia agibilia , <b> et scient qualiter sit agendum . </b> Haec ergo tria quaerenda sunt in consiliariis :	bHeMwAk
3.2.19	jZZvzYF	e puestas ordena <b> çonns quals deuen o quales se pueden fazer </b> ca non es pequana cosa de auer consseio er la mantenençia	ut circa haec debita consilia <b> et debitae ordinationes fieri possint : </b> non enim modicum consiliandum est circa alimentum ,	u3BfAbK
3.2.19	sV4fjvx	Et en estas cosas <b> que parte nesçen para la uida deuense fazer mudaçiones </b> e canbios conuenibles	quia aliter iam non esset ciuitas : <b> ut in huiusmodi sufficientibus ad vitam fieri debent debitae commutationes , </b> ut debitae emptiones ,	rLPe9zh
3.2.19	nxbzLP9	e del regno <b> la qual cosa se puede fazer en dos maueras . </b> ca lo primero es de poner guarda	circa custodiam ciuitatis et regni , <b> quod dupliciter fieri habet : </b> nam primo est custodia adhibenda	lX3ClNc
3.2.19	dRTLQAr	ca lo primero es de poner guarda <b> por que se non le una ten discordias nin se fagan malefiçios entre los çibdadanos . </b> por ende deuemos cuydar con grant acuçia	nam primo est custodia adhibenda <b> ne insurgant seditiones et malitia inter ciues . </b> Ideo attendendum est diligenter	ji25Q2J
3.2.19	xZ2LaDA	Avn son de penssar los logares <b> en los quales se suelen fazer malos malefiçios </b> ca assi commo alguons delos omes fazen mayores tuertos	Sunt etiam consideranda loca <b> in quibus consueuerunt magis maleficia perpetrari : </b> nam sicut quidam hominum magis iniustificant quam alii	wcdHQA2
3.2.19	kkjsEz4	en los quales se suelen fazer malos malefiçios <b> ca assi commo alguons delos omes fazen mayores tuertos </b> que los otros	in quibus consueuerunt magis maleficia perpetrari : <b> nam sicut quidam hominum magis iniustificant quam alii </b> sic sunt quaedam loca magis apta ad iniustificandum quam alia :	hF3FCbZ
3.2.19	lPMHWsH	assi son algunos logares mas apareiados <b> para fazer mal e mi usticia que los otros </b> assi commo contesçe	nam sicut quidam hominum magis iniustificant quam alii <b> sic sunt quaedam loca magis apta ad iniustificandum quam alia : </b> ut in ciuitate contingit	gC0Mtpx
3.2.19	ogHsUgB	e son brios mas apareiados <b> para fazer mal que los otros . </b> e por ende deue ser tomado consseio	loca aliqua sunt nemorosa et umbrosa <b> magis apta ad iniustificandum , | quam alia : </b> debet ergo adhiberi consilium ,	yiRz5LJ, j4MWRrK
3.2.19	zhZcZO7	por essos mismos çibdadanos o por aquellos que son en el regno <b> que el vno non faga tuerto contra el otro </b> mas avn deuen tomar consseios	qui sunt in regno , <b> ne unus iniustificet in alium : </b> sed etiam propter ipsos extraneos :	jFQUcOW
3.2.19	vkbGQ1W	que non sea con razon e con derecho . <b> por que fazer tuerto alos otros </b> e apremiar sos sin derecho es mala cosa por si	Primo , ut nunquam capiatur iniustum bellum , <b> quia iniustificari in alios , </b> et eos indebite opprimere ,	zRDT2bo
3.2.19	e3LBugb	Ca puesto que los mas <b> poderolos alos quales non podemos contradezer nos fagan alguna fuerca o algun tuerto grant sabiduria </b> es non nos leunatar contra ellos	Posito enim quod potentiores , <b> ad quos resistere non valemus , | in nos forefaciant , prudentiae est , </b> non insurgere in ipsos ,	efCF5T9, zJdIETS
3.2.20	wF4zB7Q	que pueden acaesçer çerca desta materia <b> mas commo el iuyzio se deua fazer </b> por las leyes o por aluedrio o por amas estas cosas .	et alia quae circa istam occurrunt materiam . <b> Sed cum iudicium fiat per leges , </b> aut per arbitrium ,	nr9FdFB
3.2.20	dGMKJ32	Et en aquella misma çibdat <b> en que se fazen las leyes </b> pueden ser mas uiezes	Immo illa eadem ciuitate <b> in qua leges conduntur </b> contingit	sjpE51W
3.2.20	cesjcGU	corronper nin mudar . <b> ca en lłas non deue ser fecha mudaçion ninguna o muy pequana . </b> Enpero los iuezes	Nam leges si iustae sint , debent esse quasi immortales et immutabiles : <b> quia circa eas nulla aut modica mutatio fieri debet . </b> Iudices tamen iudicantes	w6VnzCd
3.2.20	ijWtemm	e delas cosas que auien de venir diziendo <b> que qual quier que tal cosa fiziere tal pena aura </b> non sabiendo si serie amigo o enemigo	in uniuersali et de futuris , <b> dicentes quicunque sic egerit , </b> sic puniatur , ignorantes an amicus ,	oc5Z0GF
3.2.20	omLjDCV	non sabiendo si serie amigo o enemigo <b> aquel que auie de fazer aquella cosa </b> e deuie passar por tal suina .	sic puniatur , ignorantes an amicus , <b> vel inimicus sit illa facturus , </b> et debeat illam subire sententiam .	r6tcvOO
3.2.20	nLH1szx	ca si por auentra asopiessen ellos <b> que su amigo auie de fazer aquella cosa </b> por	et debeat illam subire sententiam . <b> Nam si scirent quod amicus , </b> forte obliquerentur in iudicando ,	iZz7FEe
3.2.20	zuzzUyM	non se tuerçen en iudgando <b> nin en faziendo las leyes enclinados se </b> por amor o por mal querençia .	non peruertuntur <b> in iudicando amore , </b> vel odio inclinati .	tzVYecy
3.2.20	vYzly0F	por amor o por mal querençia . <b> Mas los iuezes non fazen </b> assi ca los iuyzios de los uiezes	vel odio inclinati . <b> Iudices autem non sic . </b> Nam iudicum iudicia non sunt de futuris ,	oCwUrEn
3.2.20	opMnBzu	Lo primero por que mas ligeramente pueden auer los omes vn sabio o pocos que muchos . <b> lo segundo por que los establesçimientos delas leyes se fazen </b> por penssamiento prolongado	unam aut paucos sapientes , <b> quam multos . | Deinde quia legislatores fiunt </b> ex consideratis ex multo tempore ,	sYYLC7i, hXafrSu
3.2.20	vFl5KOt	los que han de dar los iuyzios <b> tanto mas ayna uerna fazer essecuçion </b> e dar fin a los iuyzios	quanto utique minor inimicitia fuerit exequentibus iudicia , <b> tanto magis accipient </b> finem executione iudiciorum .	gqbxmf9
3.2.20	hqooA5W	ca non paresçe <b> que lo faze el </b> por si mas	quia non videtur ipse <b> secundum se hoc agere , </b> sed lege compulsus dicitur	bwhh217
3.2.20	doiwE5g	por si mas <b> que lo faze costrennido por la ley </b> e por ende es dicho dar e publicar tal snïa	secundum se hoc agere , <b> sed lege compulsus dicitur </b> talem sententiam promulgare .	uSeb5Du
3.2.21	fPC0uHM	sabiendo que tienen mal pleito <b> non cuentan lo que es fecho </b> o lo que non es fecho	multi enim litigantium cognoscentes se habere malam causam , <b> non narrant quid factum et quid non factum , </b> sed conuertunt se	yqhq9sT
3.2.21	iOuqIAx	non cuentan lo que es fecho <b> o lo que non es fecho </b> mas tornassea mouer el uuez a sana o a aborrençia	multi enim litigantium cognoscentes se habere malam causam , <b> non narrant quid factum et quid non factum , </b> sed conuertunt se	yqhq9sT
3.2.21	yxOYc5B	e iudgar mal e desigual mente . <b> Et por que esto fazen las palabras desiguales </b> et malas consentir tales palabras en el iuyzio non es otra cosa	quasi regula tortuosa peruerse iudicabit , <b> et quia hoc faciunt sermones passionales , </b> permittere talia in iudicio nihil est aliud quam regulam obliquare :	revL1sd
3.2.21	xqXVWfZ	enclinan la uoluntad de los omes <b> e fagan paresçer alguna cosa derecha . </b> por que los que assi son munnidos	inclinent voluntatem , <b> et faciant apparere aliquid iustum , </b> vel non iustum ,	yg78HLi
3.2.21	waRXeaU	Ca las partes mouiendo el iuez <b> assi fazen paresçer </b> alguͣ cosa derechͣo non de rethica .	quia partes passionando iudicem , <b> ei faciunt apparere aliquid iustum vel iniustum , </b> quod non est officium partium ,	vw73HZA
3.2.21	gNl9PMW	e qual non es el derecho . <b> Mas esto non se deue fazer </b> por las partes que contienden o por las palabras desiguales dichas delas partes .	quid iustum et quid iniustum : <b> non autem hoc debet fieri </b> per partes litigantes ,	emy6u7g
3.2.21	m5m7nmL	por palabras contando le las miurias . <b> las quales la parte contraria fizo al iuez </b> o contando le los bienes	aut narrare iniurias <b> quas pars aduersa iudici intulit , </b> vel narrare bona	xKgEFhO
3.2.21	iNydkFG	o contando le los bienes <b> que ellos fizieron a liiez . </b> Et en esta manera inclinar al iuez a malenconia	vel narrare bona <b> quae ipsi iudici contulerunt , </b> et hoc modo prouocare iudicem	nk5poNF
3.2.22	t8vDE0z	al fazedor dela ley <b> fazen que el iuyzio sea fortado . </b> Et entonçe los iuezes non se han derechamente al fazedor dela ley	si non recte se habent ad legislatorem , <b> faciunt iudicium usurpatum . </b> Tunc quidem dicuntur iudices non recte se habere ad legislatorem ,	hyYTFOe
3.2.22	pTIIIZi	que les es a comne dada . <b> Lo segundo los iuezes fazen iuyzio loco </b> quando non se han derechamente	quando excedunt auctoritatem sibi commissam . <b> Secundo dicuntur iudices | facere iudicium temerarium , </b> si non recte se habent ad leges ,	eWeMuyL, naICAGH
3.2.22	xXR5FSA	que contienden <b> fazen ser el iuyzio malo e desigual . </b> Ca assi commo paresçe	ad partes litigantes , <b> facient iudicium iniquum : </b> nam ut patet ex habitis iudex debet esse quasi regula recta media inter utrasque partes :	vriISEN
3.2.22	aHUyw7p	en las obras de los omnes <b> faran el iuyzio ser sospechoso e arrebatado . </b> Ca algunas uezes	ut si sint inexperti humanorum actuum , <b> facient iudicium suspitiosum , </b> quia aliquando ex leui suspitione alios condemnabunt .	og8dFe0
3.2.23	qsHZEm6	es muchedunbre de buean sobras . <b> ca por auentra a aquel que agora peca fizo ante muchas bueans obras </b> Et por ende eliez non deue	Nam sorte ille <b> qui nunc deliquit | multa bona opera prius fecit : </b> debet ergo iudex non ita respicere ad partem	vQ59Kbu, fsFABTm
3.2.23	imBbhSs	nin deue tener mientes a vna obra <b> que fizo mas a todas las buenas obras </b> que auia fecho ¶	quod iudicans non debet respicere ad partem , <b> sed ad totum . </b> Sextum est diuturnitas temporis retroacti .	pOK6K7y
3.2.23	xL1fUMX	que fizo mas a todas las buenas obras <b> que auia fecho ¶ </b> Lo sexto que inclina ali es a piedat es alongamiento	quod iudicans non debet respicere ad partem , <b> sed ad totum . </b> Sextum est diuturnitas temporis retroacti .	pOK6K7y
3.2.23	dLKNg9G	Lo sexto que inclina ali es a piedat es alongamiento <b> detpo passado por que contesçe que alas uezes alguno en poco tp̃o faze muchas buenas obras . </b> Et por ende dos cosas deuen endozir al Rey o al prinçipe	Sextum est diuturnitas temporis retroacti . <b> Nam contingit etiam in pauco tempore facere multa bona opera : </b> duo ergo debent inducere Regem	xn5ACXd
3.2.23	maTBM72	ca el que mucho t pon sirmo <b> por la mayor parte much sseruiçios fizo . </b> Et el que muchs seruiçios fizo por la mayor parte mucho t p̃o siruo	ut plurimum se committentur , quia qui multo tempore seruiuit <b> ut plurimum multa seruitia fecit , </b> et econuerso ;	k5cRhJe
3.2.23	phgkunh	por la mayor parte much sseruiçios fizo . <b> Et el que muchs seruiçios fizo por la mayor parte mucho t p̃o siruo </b> Et enpero contesçe que alas uezes	ut plurimum se committentur , quia qui multo tempore seruiuit <b> ut plurimum multa seruitia fecit , </b> et econuerso ;	k5cRhJe
3.2.23	bvDarOq	que algun subdito peca agora en algua parte detp̃o <b> el que fizo bien en todo </b> elt pon passado	in aliqua parte temporis delinquere : <b> qui toto tempore se bene habuit praecedenti , </b> est cum ipso misericorditer agendum ,	zXPvhM8
3.2.23	vNe6QXl	que resçibieron del que <b> erroque del tuerto que les fizo . </b> Lo viij̊ que enduze el iuez amisicordia	quae passi sunt a delinquente , <b> quam iniuriae quam fecit . </b> Octauum est patientia incusati .	bPAdiBW
3.2.23	vqeDgdC	que por solo deuuesto e por la sola <b> palabrase meioran e dexan de fazer mal </b> e atalon deuemos mucho perdonar .	quod sola increpatione , <b> idest solo sermone meliorantur | et desinunt praua agere : </b> talibus ergo est valde indulgendum ,	dQlFPzm, wg93InE
3.2.23	cKEXMku	e esto prouamos <b> por que los canes non fazen mal a aquellos que se les homillan </b> e que se echa ante ellos .	cum bestiae hoc agant : <b> canes quidem non offendunt humiliantes se , </b> et prosternentes se coram eis .	dvUrTCi
3.2.24	xpXEiQS	Mas nos podemos tan bien dela ley <b> commo del derecho fazer çinco departimientos </b> de los quales los dos pone el pho enel primero libro de la rectorica .	Possumus autem tam de lege <b> quam de iusto | quinque distinctiones facere , </b> quarum duae tanguntur 1 Rhet’ tertia	b3Fo2g9, b84d9vy
3.2.24	p0mz1ZU	Et estos çinco departimientos <b> que fiziemos del derecho dela cosa </b> derechͣ podemos fazer dela ley .	Has ergo quinque distinctiones , <b> quas fecimus de iure siue de iusto , </b> facere possumus de ipsa lege . Ut ergo haec omnia melius patefiant ,	aXPJLsr
3.2.24	p4ol6Jb	que fiziemos del derecho dela cosa <b> derechͣ podemos fazer dela ley . </b> Et por ende por que estas cosas todas sean meior mostradas .	quas fecimus de iure siue de iusto , <b> facere possumus de ipsa lege . Ut ergo haec omnia melius patefiant , </b> et ut has diuersitates ad concordiam reducamus sciendum	kCSBuve
3.2.24	hua0RoP	por que la razon natural muestra <b> que se deuen fazer . </b> Et auemos natural inclinaçion	de iure naturali , <b> quia haec esse fienda | dictat ratio naturalis , </b> et habemus naturalem impetum	bA7RZTS, gfnkGCa
3.2.24	mGDANH8	Et auemos natural inclinaçion <b> que estas cosas se fagan . </b> ca estas cosas sele una tan dela natura dela cosa .	et habemus naturalem impetum <b> ut haec fiant . </b> Surgunt enim ista	eTiF2a0
3.2.24	oCX69uZ	que non han ley natural <b> fazen aquellas cosas </b> que son dela ley e muestran la obra dela ley escpta en sus coraçons .	Nam gentes quae legem non habent , <b> naturaliter ea quae legis sunt faciunt , </b> et ostendunt opus legis scriptum	iUVB0AV
3.2.25	eY1etyd	Mas si aquellas reglas se tomaren en quanto el omne naturalmente <b> dessea fazer fiios e carlos </b> assi podria ser de derecho natural	ex eo quod homo naturaliter <b> appetit filios producere et educare : </b> sic esse poterunt de iure naturali ,	xesMbEW
3.2.26	uAJCqmg	et con las costunbres de los omes e dela tierra e del tienpo . <b> Ca en las obras que fazemos </b> algunan cosa auemos de dar ala costunbre	et compossibilis consuetudini patriae et tempori : <b> nam in agibilibus aliquid </b> dandum est consuetudini , tempori , et patriae	tVM4Xuh
3.2.26	zqyMtp0	e esto queremos alcançar <b> conuiene que fagamos estas cosas . </b> Et pues que assi estales deuen ser las leyes	et hoc sequi volumus , <b> oportet hoc agere . </b> Tales ergo debent esse leges ,	mV1QXuG
3.2.26	ioVPfy5	para fazerobras uirtuosas <b> e para dexar de fazer obras malas . </b> Mas alguons otros son tales	ut agant opera virtuosa , <b> et desistant agere peruerse . Aliqui vero si ex seipsis , </b> id est ,	da0hCJo
3.2.26	sckOjOh	non son conplidamente inclinados <b> para dexar el mal e fazer el bien . </b> Enpero son de ligero disçiplinables e corrigibles por los otros buenos .	in seipsis <b> non sufficienter inclinantur ad bonum , </b> attamen sunt facile disciplinabiles per alios ,	h0JJyF2
3.2.27	fI5VFze	son algunas reglas delas obras <b> que auemos de fazer </b> que nos ordenan a bien comun	sunt quaedam regulae agibilium , <b> ordinantes nos in commune bonum , </b> habentes coactiuam potentiam .	gccvhZm
3.2.27	z2xAJMS	que non parte nesçe aquel <b> si quier de fazer leyes ¶ </b> La primera se toma de aqual	Duplici ergo via venari possumus , <b> quod non cuiuslibet est leges condere . </b> Prima via sumitur	m9zsouh
3.2.27	rJkz8AT	Ca puede cada vno del pueblo amonestar e enduzir a otro o a otros <b> que fagan bien . </b> Mas estas muniçonnes e estas condiçiones tales non son dich̃ͣs leyes	et persuadere alteri <b> ut bene agat , </b> sed huiusmodi monitiones et persuasiones non dicuntur leges ,	ju0ziXo
3.2.27	wSnMjMo	en el primero libro delas politicas <b> dizia omero que cada vno podia fazer leyes a sus fijos e a so mugers . </b> Caquaria ommo que las leyes e los mandamientos	quod unusquisque statuit <b> legis pueris et uxoribus : | volebat enim Homerus </b> quod monitiones et praecepta ,	u7az6AP, vc29Ng3
3.2.27	oEox6xd	Caquaria ommo que las leyes e los mandamientos <b> que faze el padre familias a su muger </b> e asus fijos	quod monitiones et praecepta , <b> quae facit paterfamilias uxori , filiis , </b> et aliis existentibus in domo ,	hKLhzOn
3.2.27	lj6wWMm	quando comiença de auer uso de razon e de entendimiento <b> por el qual conosçe qual cosa ha de fazer e de escoger </b> e qual cosa ha de foyr e de escusar	quando incipit habere rationis usum , <b> per quam cognoscit </b> quid sequendum et quid fugiendum ,	cj6JHmN
3.2.28	b8SY0vi	¶ <b> El vno es delas obras que son de fazer ante que sean fechͣs . </b> El otro es delas obras	duplex cura esse potest : <b> una cum opera sunt futura , | priusquam sint effectui mancipata : </b> alia vero opera	fCzM5Yk, sI4FIVu
3.2.28	t9w3rgw	Et en estas dos maneras deuen auer cuydado <b> los que fazen las leyes delas obras humanales ¶ </b> Et pues que assi es dende	utroque modo debet <b> esse cura conditoribus legum de humanis actibus . </b> Inde est ergo quod aliqui effectus legum sumuntur	jR9fKpg
