Localisation	Id. source	Segment source	Segment cible	Id. cible
3.2.7	degBWmm	e esta razon tanne el philosofo <b> en el quinto libro delas politicas </b> do dize que la tirnia es la postrimera obligarçia	multa mala efficere . <b> Hanc autem rationem tangit Philosophus quinto Politicorum ubi ait , </b> tyrannidem esse oligarchiam	qtsvEwm
3.2.7	bMIXXgt	mas avn esfuercasse para enbargar los bienes dellos <b> e tanne espho en el quinto libro delas politicas muy grandes tres bienes </b> que puna de enbargar el tirano .	impedire eorum maxima bona . <b> Tangit autem Philosophus 5 Polit’ tria maxima bona , </b> quae satagit impedire tyrannus ,	vBNffcN
3.2.9	wK7zxDi	Mas avn assi commo dize el philosofo <b> en el terçero libro delas politicas deue enduziras Ꝯmugres propraas </b> por que sean familiares e bien querençiosas alas mugers	per quos bonus status regni conseruari potest , <b> sed etiam ut ait Philosophus in Polit’ inducere debent uxores proprias </b> ut sint familiares et beniuolae uxoribus praedictorum :	m3Jdbvb
3.2.9	tt81f7a	ca assi conmo dize el pho <b> en el quinto libro delas politicas </b> nunca es menospreçiado el mesurado .	ne a subditis habeatur in contemptu : <b> nam ut dicitur 5 Polit’ </b> non contemnitur	q9haMJM
3.2.9	wvPuhYC	assi commo dize el philosofo <b> en el quinto libro delas politicas . </b> muchos de los tiranos non solamente non son tenpdos mas quieren paresçertenprados	Immo ( quod peius est ) <b> ut narrat Philosophus 5 Politic’ </b> multi tyrannorum	zBXYOg0
3.2.9	aFYD58Q	Ca assi commo dize el philosofo <b> en el tercero libro delas politicas </b> mas durable es regnar sobre pocos que sobre muchos .	ø	ø
3.2.9	kNasjjh	Ca cuenta el philosofo <b> en el quanto libro delas politicas </b> que commo vn Rey dexasse vna parte de su regno .	per usurpationem et iniustitiam . <b> Recitat autem Philosophus 5 Polit’ </b> quod cum quidam Rex partem sui regni dimisisset ,	fwF7wKw
3.2.10	m8p8gVG	e por auentura de paresçer tal . <b> nchas cautelas tanne el philosofo en el quinto libro delas politicas delas quales quanto par tenesçe alo presente podemos tomar diez . </b> por las qualose esfuerça el tiranno de se mantener en su sennorio .	sed simulat se talem esse . <b> Multas cautelas tangit Philosophus 5 Polit’ | ex quibus quantum ad praesens spectat , </b> possumus enumerare decem	dqtXjW7, cM1tbrM
3.2.12	rH7sdS2	que ninguno de los otros . <b> por que assi commo prueua el philosofo en el quanto libro delas politicas . </b> qual quier cosa de maldat es	Tyrannis tamen est peruersior principatus : <b> quia ut probat Philosophus 5 Polit’ </b> quicquid peruersitatis est	jCxsxVv
3.2.13	qqn3fIJ	Ca cuenta el philosofo en el <b> quanto libro delos politicas seis cosas </b> por que los sbraditos asecha alos tisanos ¶	Narrat autem Philosophus <b> 5 Polit’ sex causas , </b> quare subditi tyrannis insidiantur .	hlMq09B
3.2.13	qNLntQI	enxienplo desto pone el philosofo <b> enel quinto libro delas polititas </b> do dice	de facili inuaduntur . <b> Exemplum horum recitat Philosophus 5 Politicor’ </b> ubi habemus de Sardinapalo rege ,	yqEqlDV
3.2.13	lTP4xpQ	por quel tomne los tesoos Oude Dize el philosofo <b> enel quinto libro delas politicas </b> que algunos veyendo las grandes ganançias	et accipiunt thesauros eius . <b> Unde dicitur 5 Polit’ </b> quod quidam tyrannos inuadunt ,	z5QxJqE
3.2.14	g5TvVQQ	nin el prinçipado rreal <b> Ca cuenta el phon enel quinto libro delas politicas tres maneras dela corrupçion dela tiranja </b> e dize que la tiranja corrope de si mismar coronpese desta çirana	quam rectus et regius principatus . <b> Narrat autem Philosophus 5 Politicorum | tres modos corruptionis tyrannidis , </b> dicens ,	hxiiUoB, iQLUZ1O
3.2.14	iSRNdDY	E por ende dize el pho <b> en el terçero libro delas politicas </b> que la tirama quanto mayor es tanto menos dura	corrumpitur et durare non potest . <b> Ideo dicitur in Politi’ </b> quod tyrannis quanto intensior ,	zdyVQXK
3.2.15	p9D3dcp	por que non se pongan alos peligros sobredichos <b> anne el pho en el quànto libro delas politicas diez cosas </b> que saluna la poliçia	ne praedictis periculis exponatur . <b> Tangit autem Philosophus 5 Polit’ decem </b> quae politiam saluant ,	uXH7UQY
3.2.15	dY08TBi	anne el pho en el quànto libro delas politicas diez cosas <b> que saluna la poliçia </b> e el gouernamiento del regno	Tangit autem Philosophus 5 Polit’ decem <b> quae politiam saluant , </b> et quae oportet facere Regem ad hoc	weu8yHE
3.2.15	uBMTyRY	egualan se a vn grant mal <b> assi commo dize el philosofo en las politicas bien </b> assi commo muchas pequanans despenssas se ygualan a vna	Nam multae modicae transgressiones <b> ( ut ait Philos’ ) | aequantur uni magnae , </b> sicut multae paruae expensae	sDFegKX, cbSvyCu
3.2.15	uUogk6K	e deuen avn ser defendidos los males pequanos . <b> La segunda cosa que guarda la poliçia </b> e el gouernamiento del regno es bien vsar	etiam modicae . <b> Secundum praeseruans politiam </b> et regnum regium ,	aggj9Uk
3.2.15	fjDtie3	pol . <b> bien vsar de los çibdadanos non solamente guarda la poliçia </b> e el gouernamiento derecho .	bene uti ciuibus <b> non solum praeseruat politiam rectam , </b> sed etiam principatus ex hoc durabilior redditur ,	trcvvfD
3.2.15	w2WtrdC	que es puesto enlos omans guardan <b> e saluna lo poliçia </b> e el gouernamiento dela çibdat	nam corruptiones longe secundum rem , <b> prope autem secundum timorem politiam saluant : </b> ciues enim magis sunt subiecti Principi	fC5ud7g
3.2.15	gPPEFfE	uirtudessi non de fortaleza . <b> Estos tales segunt el philosofo en el vii̊ libro delas politicas semeian al fierro </b> que mientra es en vso continuado esta luzio e claro .	de virtutibus aliis nisi de fortitudine , <b> secundum Philosophum 7 Politicorum assimilantur ferro , </b> quod dum est in continuo exercitio claritatem habet ,	y2ejcmL
3.2.15	vpHPptu	que puede ser muy prouechosa la quarta cosa <b> que salua la poliçia </b> es escusar las discordias	et antecessores sui obtinuerunt huiusmodi principatum , tanta cautela non magnam utilitatem habere videtur . <b> Quartum autem quod politiam saluare videtur , </b> est cauere seditiones et contentiones nobilium ;	iuQ3P6O
3.2.15	caMSVt8	La quinta cosa <b> que guardan la poliçia es catar con grant acuçia </b> en qual manera se han aquellos que honrro la real maiestad	ut dissoluatur regius principatus . <b> Quintum , est diligenter aspicere , </b> quomodo se habeant ,	s5GWeLj
3.2.15	ayLXUGo	ca ninguna cosa non salua tanto el regno <b> e la poliçia </b> commo poner los bueons e los uirtuosos en las dignidades	Nihil enim adeo regnum conseruat <b> et politiam saluat , </b> sicut praeficere homines bonos et virtuosos ,	cDbaRQ6
3.2.15	wdxe4c1	por la qual <b> cosalo que mucho salua la poliçia </b> es que el Rey piensse con grant acuçia	et conferre eis dominia et principatus . <b> Quare maxime saluatiuum politiae est , </b> regiam maiestatem considerare diligenter	mRQ0D19
3.2.15	gWLhN17	e de su unar de muerte ¶ <b> La vjͣ cosa que guarda la poliçia . </b> es non dara ninguer muy grant señorio	vel etiam capitali sententia condemnandi . <b> Sextum est , nulli valde magnum dominium conferre . </b> Nam magna dominia	sdXjcKY
3.2.15	k0V2NJC	La vi jncosa que salua el regno <b> e la poliçia es </b> que el Rey	ne repente constituatur aliquis in maximo principatu . <b> Septimum saluans regnum et politiam , </b> est Regem siue principantem habere dilectionem	fdHTXhf
3.2.15	mXZbjlM	cosa que salua el regno <b> e la poliçia es auer poderio </b> çiuilca	Octauum saluans regnum et politiam , <b> est habere ciuilem potentiam . </b> Nam ( ut dicitur in Magnis moralibus )	rhXCIcQ
3.2.15	ifB8bRE	ca assi commo dize el philosofo <b> en el quinto libro delas politicas </b> mayor uirtud es menester	est esse regem bonum et virtuosum . <b> Nam ut dicitur 5 Politicorum , </b> maior virtus requiritur	aNhAxiz
3.2.15	cv3rkWh	e esto es lo que much salua el regno <b> e la poliçia </b> si el Rey fuere bueno e uirtuoso	sic eos bonitate superet : <b> hoc enim maxime saluabit regnum et politiam , </b> si Rex sit bonus et virtuosus ,	voEKZOt
3.2.15	zqW6McB	en el bien comun del regno ¶ <b> La xͣ cosa que salua la poliçia es </b> que el Rey sepa aquella poliçia e gouernamiento	quia intendet bono regni et communi . <b> Decimum , est Regem non ignorare qualis sit illa politia </b> secundum quam principatur ,	aD5lwbm
3.2.15	ec0JZBH	La xͣ cosa que salua la poliçia es <b> que el Rey sepa aquella poliçia e gouernamiento </b> segunt el qual el	quia intendet bono regni et communi . <b> Decimum , est Regem non ignorare qualis sit illa politia </b> secundum quam principatur ,	aD5lwbm
3.2.20	sb1hi0U	en el primero libro de la rectorica <b> e la quat catanne en el sexto libro delas politicas </b> cos son los fazedores delas leyes	quarum tres tanguntur 1 Rhet’ <b> quarta vero tangitur 1 Polit’ . </b> Prima via sic patet .	n8pcnhE
3.2.20	y7uFpTh	assi commo dize el pho en el vij̊ . <b> libro de las politicas </b> pues que assi es	sunt arbitrio iudicum committenda : <b> quia ( ut dicitur 6 Politicorum ) </b> quanto utique minor inimicitia fuerit exequentibus iudicia ,	yokKhtn
3.2.24	zvnPRRz	que las palabras e las smones son a uoluntad . <b> Et esse mismo pho dize en el primero delas politicas </b> que la palabra non es dada por natura .	voces et sermones dicit esse ad placitum , <b> qui primo Politicorum ait , </b> sermonem nobis esse datum a natura .	cXFV8kM
3.2.26	dcumLRJ	Et por ende dize el philosofo <b> en el quarto libro delas politicas </b> que non conuiene de apropar las comunidades	Ideo dicitur 4 Politicorum <b> quod non oportet </b> adaptare politias legibus ,	i1RCt8X
3.2.27	zJoZjqA	assi commo cuenta el philosofo <b> en el primero libro delas politicas </b> dizia omero que cada vno podia fazer leyes a sus fijos e a so mugers .	dicebat Homerus <b> quod unusquisque statuit </b> legis pueris et uxoribus :	slK7wpM
3.2.27	h471Ro8	Ca segunt dize el philosofo <b> en el quarto libro delas politicas . </b> çerca las leyes deuen ser tomados dos cuydados .	et promulgatas custodire et obseruaret : <b> quia secundum Philosophum 4 Politicorum </b> circa leges duplex cura esse debet :	vCv7Fdk
3.2.28	vKzUhXU	que se contienen enla fisi ca . <b> assi la sçiençia politica </b> que es del gouernamiento del regno	vult regulare et aequare humanos humores : <b> sic scientia politica </b> quae est de regimine regni et ciuitatis ,	tlHhhHE
3.2.29	hTPwvk9	o quales son de conssentir <b> L philosofo en el terçero delas politicas demanda </b> si es meior de ser gouernado el Regno o la çibdat	et permittenda . <b> Philosophus 3 Politicorum inquirit , </b> utrum regnum aut ciuitas sit	ncawwRS
3.2.29	azyiHAa	Et esto es lo que dize el philosofo <b> en el tercero delas politicas </b> que mas de escoger es	quam Regi optimo Rege . <b> Hoc est ergo quod ait Philosophus 3 Politicorum , </b> quod eligibilius est principari lege ,	iBgx8hl
3.2.29	kww9MiI	que diga entendimiento solo . <b> Et por ende dize el pho en el terçero delas politicas </b> que aquel que manda	videtur dicere intellectum solum : <b> ideo dicitur 3 Polit’ </b> quod qui iubet principari intellectum ,	weBCKlZ
3.2.29	dMVj8Sd	lo que dize el philosofo <b> en el tercero delas politicas </b> que en el derecho gouernamiento	Propterea bene dictum est <b> quod innuit Philosophus tertio Politicorum </b> quod in recto regimine principari	oGftuwu
3.2.30	fKRXRnw	assi commo paresçe por el pho <b> en el segundo libro delas politicas </b> do disputa contra socrates .	Immo ut patet <b> per Philosophum 2 Politicorum </b> cum disputat contra Socratem ,	l5xc5Ao
3.2.31	o6lP9N4	e en uirtud <b> e manda el pho en el segundo libro delas politicas </b> quando disputa contra ypodomio	sic eos superent bonitate et virtute . <b> Quaerit Philos’ 2 Polit’ </b> cum disputat contra Hippodamum ,	e6jcZVt
3.2.31	fl3uYsO	que paresçiessen ser mas aprouechosas e meiores . <b> Mas el philosofo enel quarto libro delas politicas pone quatro razones </b> por las quales para pesçe	quae videantur esse magis proficuae et meliores . <b> Adducit autem Phil’ | in Polit’ quatuor vias , </b> per quas videtur ostendi ,	vtibLim, hbX0KB5
3.2.31	c4aBNqD	Et en la sçiençia del luchar o del torneamiento <b> assi commo dize el pho en las politicas </b> muchas cosas	siue in arte luctatiua <b> quae docet luctari , | ut innuit Philosophus </b> in Polit’ multa quae priores tradiderunt ,	l064qUg, ktDDAjq
3.2.31	qMKvJuv	assi commo dize elpho <b> en el segundo libro delas politicas . </b> es acostunbrar sea non obedesçer alas leyes	Nam assuescere inducere nouas leges <b> ( ut innuit Philosophus 2 Pol’ ) </b> est assuescere non obedire legibus .	x9aqiIj
3.2.31	jzy2pTD	e qual es la soluçion della . <b> Conuiene de saber que la ley politica sitiua </b> si fuere derecha conuiene que se raygͤ	de quae sito , <b> sciendum quod lex positiua si recta sit , </b> oportet quod innitatur legi naturali ,	oA9tt6h
3.2.32	wKPEcuP	qual de aquellos bienes es el meior . <b> Et cuenta el philosofo enel terçero libro delas politicas </b> quariendo de el arar	quod bonorum illorum sit potius . <b> Narrat quidem Philosophus 3 Politic’ volens diffinire </b> quid sit ciuitas ,	x58vneQ
3.2.32	cCgk2R1	Bien diches lo que dize el philosofo <b> en el terçero libro delas politicas . </b> que la morada del lo gar	accipienda est eius notitia , <b> benedictum est quod dicitur 3 Polit’ </b> quod unitas loci , communicatio connubiorum , compugnationis gratia , commutatio rerum ,	pd06VAz
3.2.32	ejPnAIH	Ca segunt el philosofo <b> en las politicas </b> vno es el bien	et in toto regno . <b> Nam secundum Philos’ in Polit’ </b> Idem finis est unius ciuis ,	nfaIw95
3.2.32	wQwWecF	Mas si cada vn çibdadano deue ser uirtuoso <b> segunt que dize el philosofo en las politicas . </b> segunt que alguno sobrepuia alos otros en poderio	Sed si quilibet ciuis debet virtuose se habere ; <b> quia secundum Philos’ in Polit’ </b> secundum	cnCBxai
3.2.32	dsal1g0	conuiene que sea atal que biuna bien e uirtuosamente . <b> Et por ende assi conmo dize el philosofo en el terçero libro delas politicas </b> mas es çibdadano	quod viuat bene et virtuose . <b> Inde est ergo quod ait Philosop’ 3 Politicorum quod magis est ciuis abundans </b> in bonis operibus virtuosis ,	i1F2FlA
3.2.33	btVbS8V	e muchedunbre de bienes tenporales <b> uenta el philosofo en el quarto libro delas politicas </b> que conuiene que sean tres partes dela çibdat .	et multitudinem ipsorum bonorum exteriorum . <b> Quarto Politicorum ait Philosophus , </b> quod tres oportet	lSmyGPh
3.2.33	kHtPv66	que nin sean muy ricos nin muy pobres . <b> Et pone el pho en el quarto libro delas politicas quatro cosas </b> delas quales se pueden tomar quatro razonnes	ex multis personis mediis constitutus . <b> Tangit autem Philosophus | 4 Politicorum , quatuor , </b> ex quibus sumi possunt quatuor viae ,	xrM5tVP, ks3jwDP
3.2.33	kYuax9D	delas quales se pueden tomar quatro razonnes <b> que muestran que meior es la poliçia </b> o meior es el regno o la çibdat	ex quibus sumi possunt quatuor viae , <b> ostendentes meliorem esse politiam , </b> vel melius esse regnum et ciuitatem ,	nPLETkx
3.2.33	sVESKLM	e de ligero los omes obedescran ala razon . <b> Et esto es lo que dize el philosofo en el quarto libro delas politicas </b> que por que lo medianero es muy bueno la possesion medianera es muy buena .	et de facili rationi obediunt . <b> Hoc est quod dicitur 4 Politicorum </b> quod quoniam mediocre est optimum ,	iuH0xT3
3.2.33	yjYI8Fc	Ca assi commo dize el philosofo <b> enł quarto libro delas politicas . </b> los pobres han grant enuidia alos ricos	Nam pauperes <b> ( ut dicitur 4 Polit’ ) </b> maxime inuident diuitibus ,	uqXjgNi
3.2.34	jXodliS	sobredichos la entençion del ponedor dela ley es enduzer los çibdadanos o uirtud . <b> Ca en la derecha poliçia </b> assi commo dize el philosofo çerca el comienço del quarto libro delas polticas vna misma es la uirtud del buen çibdadano e del buen uaron .	intentio legislatoris est inducere ciues ad virtutem . <b> In recta enim Politia </b> ( ut vult Philosophus )	v0McFBE
3.2.34	bnigFoz	e obedesçer el Rey lea algunasiudunbre . <b> Enpero leguntel pho en el quanto libro delas politicas </b> esto non es suidunbre mas es libertad .	sit quaedam seruitus . <b> Sed secundum Philosoph’ 5 Politic’ </b> hoc non est seruitus ,	ziMrsPG
3.2.34	z9F3wds	si fueren penssadas las palabras del philosofo <b> en el quato libro delas politicas . </b> El qual philosofo con para el Rey al regno	si considerentur verba Philosophi <b> 4 Polit’ qui comparat Regem ad regnum , </b> sicut animam ad corpus .	zZVrgrE
3.2.35	yFWon4O	e aguardar aquellas cosas <b> que demanda la poliçia </b> o el gouernamiento del regno	et ad obseruandum <b> ea quae requirit politia , </b> vel regimen regni ,	vo2qCNn
3.2.36	rcrKUXH	por iustiçia non deue perdonar a ninguno . <b> Por ende dize el philosofo en el vij̊ . libro delas politicas . </b> que el que bien obra	Nam iustus pro iustitia nulli parcere debet . <b> Ideo dicitur 7 Politicorum </b> quod bene operans nulli parcit :	a5uzMjb
3.3.1	fpBdegO	para gouernar el regno . <b> Et prudencia politica o çiuil </b> para gouernar la çibdat .	distinguere quinque species prudentiae : <b> videlicet prudentiam singularem , oeconomicam , regnatiuam , politicam siue ciuilem , et militarem . </b> Dicitur enim aliquis habere singularem	gV0hTn4
3.3.1	muABP0y	Et la regnatiua que muestra gouernar el regno . <b> la quarta manera de sabiduria es dicha politica o çiuil . </b> Ca assi commo en el principe es neçessaria mayor sabiduria	videlicet particularem , oeconomicam et regnatiuam . <b> Quarta species prudentiae dicitur | esse politica siue ciuilis . </b> Nam sicut in principante requiritur	q8zJXoL, bJ0nujl
3.3.5	tyzdS1o	que si el fuyesse de la batalla <b> que polimidias otro cauallero le denostaria muy mal . Avn en essa misma manera </b> diomedes fue fecho atreuido cauallero .	Si ex pugna fugiam , <b> Polydamas mihi redargutiones ponet . </b> Sic etiam et Diomedes	mjRwUi4
