Localisation	Id. source	Segment source	Segment cible	Id. cible
2.1.19	yjAUl1A	por que sea callada conueniblemente . <b> Ca assi commo dize el philosofo en el pramer libro delas politicas </b> grand conponimiento es delas mugers el silençio .	quomodo regenda sit , ut debite sit taciturna . <b> Nam , ut scribitur 1 Polit’ ornamentum mulieris est taciturnitas . </b> Si enim mulieres debite se habeant ,	lSFvAub
2.1.23	aHCQZop	assi conmo dize el philosofo <b> en el primero delas politicas es flaco . </b> Ca assi comm̃el moço ha consseio menguado por que	Consilium mulierum , <b> ut dicitur 1 Politicorum est inualidum : </b> nam sicut puer habet consilium imperfectum ,	y0y9Ncl
2.2.1	sjvEERJ	deuiemos determinar del gouernamiento de los sieruos . <b> Enpero assi commo dize el philosofo en el primero delas politicas en el gouernamiento dela </b> casa mayor deue ser el cuydado de los omes	determinandum esse de regimine seruorum . Verum quia , <b> ut dicitur primo Politicorum , </b> oeconomiae amplior est solicitudo	jwWOChD
2.2.2	vtU102h	e mayor nobleza que los otros . <b> Ca segunt el philosofo enlas politicas . </b> segunt que algunos son en mayorestado e en mas alta dignidat	maiori bonitate pollere quam alios : <b> quia secundum Philosophum in Politic’ | secundum </b> quod aliqui sunt	oUxqUvb, byYrOyZ
2.2.3	rpqqUQO	Et tal gouer namiento <b> segunt dicho es de lulo es nonbrado politico o çiuil </b> o los gouenena segunt albedrio .	Et tale regimen <b> ( ut superius dicebatur ) | nominatur politicum vel ciuile . </b> Vel regit eos secundum arbitrium ,	t0dlNSO, a3PQOHo
2.2.3	udPl2CG	Este gouernamiento non es semeiante al gouernamiento çiuil mas al Real . <b> Onde el philosofo en el primo libro delas politicas </b> dize	huiusmodi regimen non assimilatur regimini politico , sed regali . <b> Unde et Philosophus 1 Politicorum ait , </b> virum praeesse mulieri ,	pghP6Ic
2.2.3	hK1c1l7	que non puede auer conplimiento de sieruos <b> Ende el philosofo en el sexto libro delas politicas dize </b> que los robres han menester de vsar de sus mugers e de sus fiios	quod seruorum copiam habere non potest . <b> Unde et Philosophus 6 Polit’ ait , </b> quod egenis necesse est	owV2McM
2.2.7	zgX6CiJ	assi commo otra natraa <b> Et commo segunt el philosofo en las politicas </b> aquellas obras	quasi altera natura , <b> cum secundum Philosophum in Polit’ nobis </b> magis placeant illa opera ,	hyaEZf9
2.2.8	sjbirIB	La quarta sçiençia libal es dichͣ musica . <b> Et esta segunt que dize el philosofo en el octauo delas politicas </b> conuiene alos mançebos	dicitur esse Musica . <b> Haec secundum Philos’ | 8 Polit’ </b> conuenit ipsis iuuenibus ,	mES9up2, micZBWd
2.2.8	a5oS2Ov	La segunda razon para prouar esto mismo puede ser esta <b> que pone el philosofo en el vii i̊ libro delas politicas </b> do dize que el entendimiento del omne non sabe ser vagaroso nin estar de ualde .	Secunda ratio ad hoc idem esse potest , <b> quia ( ut Philosophus innuit | in eodem 8 Poli’ ) </b> mens humana nescit ociosa esse .	i0Kp3S6, vRfhbeS
2.2.8	zzZXPBA	que son conueinbles e honestos . <b> Mas el philosofo tanne muchͣs razones en las politicas </b> por las quales se podrie mostrar	quae sunt licitae et honestae . <b> Tangit enim Philosophus | multas rationes in Politicis , </b> per quas ostendi posset ,	vvbkaKU, gBb8OSF
2.2.8	a8Tsx0h	que es del gouernamiento dela casa e dela conparatid̃ . <b> Et la politica </b> que es del gouernamiento de las çibdades e del regno	et Oeconomica , quae est de regimine familiae : <b> et Politica , quae est de regimine ciuitatis et regni , </b> valde sunt utiles	rET05vV
2.2.8	zGll1hW	e de los prinçipes <b> li quisieren beuir uida politica e çiuil </b> e quasieren gouernar los otro	et maxime filii Regum et Principum , <b> si velint politice viuere , </b> et velint alios regere et gubernare ,	yvIbHlE
2.2.8	bbVoJQM	que son de las obras de los omes <b> sonsola politica quees del gouernamiento delas çibdades . </b> Ca assi con mocios dixiemos en otro logar	quae sunt de actibus hominum , <b> sub politica , | quae est de regimine ciuitatum . </b> Nam ( ut alibi nos dixisse meminimus )	jIHOOg3, qWASMdr
2.2.8	ycPMvz3	que todos los legistas son <b> assi commo vnos nesçios politicos . </b> Ca assi commo los legos	omnes legistae sunt <b> quasi quidam idiotae politici . </b> Nam sicut laici et vulgares ,	tsWx0ew
2.2.8	eMgaLbf	en essa misma manera los legistas <b> por que aquellas cosas delas quales es la sçiençia politica </b> digen los legistas contando	appellantur a Philosopho idiotae dialectici : <b> sic Legistae , quia ea de quibus est politica , </b> dicunt narratiue et sine ratione ,	xTgDILs
2.2.8	fP65zSo	e non demostrando las <b> por razon por ende pueden ser llamados nesçios politicos . </b> Et desto puede parescer en qual manera	dicunt narratiue et sine ratione , <b> appellari possunt idiotae politici . </b> Ex hoc autem patere potest	fnPsQyk
2.2.8	whrX5F0	mas son de honrrar <b> los que saben la politica </b> e las sçiençias morales	quod magis honorandi sunt <b> scientes politicam </b> et morales scientias ,	ug1hXMI
2.2.8	jrkfhG2	maguera que entiendan ser caualleros <b> e entender en el fecho politico dela çibdat deuen trabaiar </b> por que sepan el lenguage delas letras .	quantumcunque intendant esse milites , <b> et vacare negocio politico , | debent insudare , </b> ut sciant idioma literale .	dvPjatx, kblTOxn
2.2.8	tSmYW0C	por que sepan gouernar assi e alo . s otros . <b> Otrossi segunt el philosofo en las politicas conuiene les </b> alguacosado saber dela musica	Nam et de musica <b> secundum Philosophum in politicis </b> eos scire decet ,	gB7YxNS
2.2.9	tJmkEdu	Por que seg̃t que dize el philosofo <b> en el primero libro delas politicas </b> mayor cuydado deuemos auer sienpre delas cosas	possessionibus , et rebus inanimatis : <b> quia secundum Philosophum 1 Politicorum , </b> semper de animatis amplior cura habenda	efBCjVY
2.2.10	eb2aOp8	qual maestro deuen poner en gouernamiento de sus fijos <b> erca la fin del septimo delas politicas </b> muestra el philosofo	qualem magistrum proponerent in regimine filiorum . <b> Circa finem 7 Politicor’ docet Philosophus </b> iuuenes cohibendos esse	fsbOvOm
2.2.10	ebpEjLS	si les fuer defendido de oyr cosas torpes . <b> Ca segunt el philosofo en el vi̊ libro delas politicas </b> do fabla desta materia es	si prohibeantur ab auditione turpium . <b> Nam secundum philosophum vii Polit’ </b> ubi de hac materia loquitur ,	nDlasMW
2.2.12	wPut1jR	muestra lo el philosofo <b> en el septimo libro delas politicas </b> o dize	In qua autem aetate debeant uti coniugio , <b> ostendit Philosophus 7 Poli’ dicens , </b> quod in muliere requiritur aetas decem et octo annorum ,	gPNo9vM
2.2.12	wdmy6Lv	e de los nançebos <b> assi commo dize el philosofo en esse mismo libro dela o politicas </b> Et pues que assi es en esta misma manera	et impeditur eorum augmentum , <b> ut vult Philosophus in eisdem Poli’ . </b> Sic ergo utendum est coniugio ,	b1SiTdc
2.2.13	ceo1ZEY	assi commo prueua el philosofo <b> en el viij̊ libro delas politicas </b> es neçessario enla vida	ut probat Philosophus <b> 8 Poli’ </b> est necessarius in vita quod	aK1UVfT
2.2.13	sWMnFSd	luego comiença a andar vagando cuydando enlas cosas desconueibles . <b> Onde el philosofo enłviiij libro delas politicas dize </b> que el trebeio es vn reduzimiento	statim incipit vagari cogitando de illicitis : <b> unde Philosophus 8 Polit’ ait , </b> quod ludus est quaedam deductio	i8BW8IH
2.2.13	meNxXrU	assi que en esto resçibiendo alguno folgua a puedan mas trabaiar para alcançar su fin . <b> Onde el philosofo enłviij̊ delas politicas dize </b> que por que el ome non puede sienpre folgar en la fin ganada .	magis possint laborare in consecutione finis . <b> Unde et Philosophus 8 Politicorum ait , </b> quod quia homo non potest	w8URGyK
2.2.13	j4bgphS	assi commo dize el philosofo enł . viij̊ <b> delas politicas ¶ </b> Visto en qual manera los moços se deuen auer çerca los trebeios finca de ver	et deductiones inhonestae prohibendae sunt a iuuenibus , <b> ut vult Philosophus 7 Politicorum . </b> Viso qualiter iuuenes se habere debeant circa ludos .	s8aicLV
2.2.15	z2JM7TA	e dende adelante <b> Mas el pho tanne enł septimo libro delas politicas seys cosas </b> que se deuen guardar çerca los moços enla primera hedat .	Postea a decimoquarto et deinceps . <b> Tangit autem Philosophus 7 Polit’ sex </b> circa ipsos pueros ,	qLbiXpB
2.2.15	kScWVlP	mayormente sean cerados de leche <b> Onde el philosofo en el septimo libro delas politicas </b> dize que el humor dela leche es muy conuenible	ita tamen quod a principio maxime alendi sunt lacte : <b> unde et Philosophus 7 Politic’ ait , </b> quod nutrimentum lactis maxime videtur	d2OIxv1
2.2.15	yyN5Nyj	¶ Lo terçero los mocos deuen ser acostunbrados al frio . <b> Onde el philosofo en el septimo libro delas politicas </b> dizeque luego conuiene alos mocos pequanos	Tertio pueri sunt assuescendi ad frigora : <b> unde Philosophus septimo Politi’ ait , </b> quod mox expedit pueris paruis consuescere ad frigora .	l9SZqQC
2.2.15	k3moNbX	por que los mienbros dellos sean mas firmes . <b> Onde el philosofo en el septimo libro delas politicas </b> dize	ut membra eorum solidantur <b> unde Philosophus 7 Poli’ ait , </b> quod expedit in pueris	wozoabe
2.2.15	pEuxTGK	segunt dize el philosofo <b> en el septimo libro delas politicas </b> faze a fortaleza del cuerpo .	Detinere autem spiritum et anhelitum <b> secundum Philosophum septimo Politicorum , </b> facit ad robur corporis .	ix5HZhq
2.2.16	c5zkiYb	non deuen tomar obras de caualłia nin otras obras fuertes . <b> Et por ende el pho enł viij̊ libro delas politicas dize </b> que fasta la hedat dela pubeçençia	non sunt assumenda opera militaria nec opera ardua . <b> Unde Philosophus 8 Polit’ ait , </b> quod usque ad pubescentiam ,	bctNPCk
2.2.16	vhV2u25	que el philosofo enl vij̊ . <b> libro delas politicas </b> dizeque muy mala cosa es de non enssennar	Sciendum ergo , <b> quod Philosophus 5 Polit’ ait , </b> quod pessimum est	socgG3x
2.2.16	qr3FPZW	Ca el philosofo enłvij̊ libͤ <b> delas politicas </b> demanda si primeramente deuemos auer cuydado de los moços .	et ad obseruantiam legum utilium . <b> Inquirit enim Philosophus 8 Polit’ </b> utrum prius curandum sit de pueris ,	xzgoB2R
2.2.16	iq76D5V	Assi segunt dize el philosofo en el . <b> vij̊ libro delas politicas </b> primeramente deuemos auer cuydado de los mocos	et postea illi anima infunditur : <b> sic secundum Philosophum 8 Politicorum , </b> prius curandum est	hsZSebk
2.2.17	vY1icRx	por que fasta el xiiij ano <b> segunt el philosofo en las politicas </b> mas son de enduzir los moços a bien	usque enim ad quartumdecimum annum <b> secundum Philosophum in Polit’ </b> magis inducendi sunt pueri	kiGgnvp
2.2.17	dvYtSgv	Mas la buena disposiçonn del cuerpo <b> aquellos que quieren beuir uida politica e de çibdat es esta que del . xiiij ̊ . </b> año adelante t omne trabaios mayores que tomaron ante .	Bona autem dispositio corporis , <b> ut volentibus viuere vita politica , | a quartodecimo anno et deinceps , </b> est ut assumant fortiores labores quam hactenus .	tXG9YLn, dAQpj0v
2.2.17	sARxvn9	Et esto dize elpho <b> enł viij̊ libro delas politicas </b> que fasta los . xiiij años los moços deuen ser acostunbrados a trabaios ligeros	ex tunc autem assumendi sunt labores fortiores . <b> Nam et Philosophus 8 Poli’ ait , </b> quod usque ad quartumdecimum annum pueri	z1Xkfzx
2.2.17	jnLpCtZ	Mas el pho pone en el vii̊ . <b> libro delas politicas tres </b> razono breues	8 Poli’ <b> tres breues rationes , </b> quare decet filios esse subiectos ,	tHVemcD
2.2.17	ly7VYEe	por las cosas ya dichos . <b> Ca si quieren beuir uida politica </b> e de çibdat e de caualłia	patet etiam per iam dicta . <b> Nam si volunt viuere vita politica et militari , </b> potissime studere debent	nfyuaO6
2.2.18	qQH2dck	o dos los mançebos <b> que quieren beuiruida politica </b> e de çibdat en alguna manera se deuen bsar en los trabaios corporałs	qualiter seipsos regant . <b> Omnes iuuenes volentes viuere vita politica , </b> aliquo modo exercitandi sunt	cLuCMBp
2.2.18	jGsbADp	ca segunt el pho <b> en łviij̊ libro delas politicas los trabaios corporales </b> e el cuydar del entendimiento	minores labores assumere . <b> Nam secundum Philosophum 8 Politicorum labor corporalis , </b> et consideratio per intellectum ,	t1f8q81
2.2.21	gRgMMRD	mauera se torna despreçiada <b> e por ende el philosofo en el primero libro delas poliricas </b> dizeque el honrramiento delas mugers es callar	et quodammodo se contemptibilem reddit ; <b> unde et Philosophus primo Politicorum ait , </b> quod ornamentum mulierum est silentium .	aNUYXEs
2.3.1	dz3SifD	Esto muestra el philosofo muy conplidament en <b> enldmero libro delas politicas </b> demuestra dot dos razones	ut in principio capituli proponebatur , <b> sufficienter ostendit Philosophus 1 Poli’ . </b> Ostendit autem duabus rationibus ,	uUDVEUS
2.3.1	wyzLx35	por la qual <b> cosasi para beuir uida politica </b> e de çibdat son menester casas e possesiones et dineros	et quae requiruntur ad sufficientiam vitae : <b> quare si ad vinendum politice requiruntur domus , possessiones , et numismata , </b> spectat ad gubernatorem domus considerare de talibus .	pDGJYTy
2.3.1	b41Gdih	segt̃ dize el philosofo <b> enł primero libro delas politicas </b> Ca los estrumentos del arte del gouernamiento dela casa son actiuos	Differunt tamen haec ab illis <b> secundum Philosophum primo Poli’ </b> quia organa gubernationis sunt actiua ,	e0NPmN5
2.3.2	hgeLE0x	e el sieruo estas dos materias conueniblemente son ayuntadas en vno¶ <b> lpho enl primero libro delas politicas </b> reduze todos los estrumentos	congrue hae duae materiae connectuntur . <b> Philosophus primo Politicorum omnia organa gubernationis domus </b> ad bimembrem distinctionem reducit .	yaD8gcP
2.3.2	ewmO1n9	assi segunt el philosofo <b> enl primero libro delas politicas </b> deue ser cerca el gouernamiento dela casa .	Sicut enim vidimus in aliis artibus , <b> sic ( secundum Philosophum ) </b> circa gubernationem domus esse habet .	t6kc7VN
2.3.2	aPXj8d7	la qual cosa declara el philosofo <b> enł primero libro delas politicas </b> por cosa semeiable en las otras artes	ut per animata ; <b> quod declarat Philosophus 1 Polit’ </b> per simile in aliis artibus ,	zCgstMn
2.3.2	cGNUZTO	commo era la ymagen de dalo <b> dela qual dize el philosofo en las politicas </b> en manera de fabli ella	qualis erat statua Daedali , <b> de qua Philosophus fabulose recitat in Politicis ; </b> quod per se implebat opus debitum :	qaNaqjw
2.3.3	kzVUegi	e esta razon tanne el philosofo <b> enł vi̊ libro delas politicas </b> do dize que alos Reyes	sumitur ex parte ipsius populi : <b> et hanc tangit Philosophus 6 Politicorum , </b> ubi ait ,	qw1KSsu
2.3.5	dIQ5csG	conuiene en algunan manera <b> que las cosas naturales sean neçessarias enla uida politica . </b> mas segunt el philosofo	oportet aliquomodo naturalia esse <b> quae sunt necessaria in vita politica ; </b> sed secundum Philosophum primo Polit’	gZhNsY5
2.3.5	sxGwHAY	mas segunt el philosofo <b> en el primero libro delas politicas </b> la possession de las cosas es neçessaria en el	quae sunt necessaria in vita politica ; <b> sed secundum Philosophum primo Polit’ </b> necessaria est rerum possessio in gubernatione domus ,	u1UARTw
2.3.5	b2uAhHb	la possession de las cosas es neçessaria en el <b> gouernamientode la casa si alguno quisiere beuir uida politica . </b> Et pues que assi es por esta razon misma	necessaria est rerum possessio in gubernatione domus , <b> si quis debeat politice viuere ; </b> eo ergo ipso quod rerum possessio deseruit necessitati vitae ,	y7gBkmO
2.3.5	gVQGCRg	omenatanlonde el philosofo <b> enł primer libro delas politicas do prueua </b> que la possession de tales cosas es natural .	ideo eorum possessio est ei naturalis . <b> Unde et Philosop’ 1 Politic’ </b> ubi probat possessionem talium naturalem esse ,	olpMX9a
2.3.5	rgIa0Fm	mas esto faze e deue fazer alas aianlias acabadas . <b> Et por ende el philosofo dize en el primero libro delas politicas </b> que estas cosas de que	multo magis hoc facit animalibus perfectis . <b> Ideo ait Philosophus primo Polit’ </b> quod haec ,	pu0jlYv
2.3.5	el8xJJm	ca assi commo es dicho <b> enł primero libro delas politicas </b> nos somos en alguna manera fin de todas las cosas Et pues que assi es aquellos	ø	ø
2.3.5	lB9mwRv	segunt dize el philosofo <b> enl primero libro delas politicas de auer possession </b> e sennorio de algers cosas de fuera	ut homo est , <b> ut vult Philosophus primo Polit’ habere possessionem , </b> et dominium aliquarum rerum exteriorum	uw6qVPb
2.3.6	tsQMJzy	assi commo cuenta el philosofo <b> enł segundo libro delas politicas </b> que cola aprouechosa	Fuit opinio Socratis et Platonis , <b> ut recitat Philosophus 2 Polit’ </b> quod esset utile	gQMWoQr
2.3.6	gCZC98h	de departidos logares <b> enł libro delas politicas tres cosas </b> por las quales podemos prouar	Possumus autem ex diuersis locis <b> in libro Polit’ accipere tria , </b> per quae triplici via venari possumus ,	v2puGPU
2.3.6	pN7PRaK	Ca segunt dize el pho <b> enł segundo libro delas politicas </b> assi contescria estonçe	ex remotione inordinationis et confusionis : <b> nam secundum Philosophum 2 Politicorum , </b> sic accideret tunc ,	dVAO4Un
2.3.7	yjU259e	que fazen fructo sean labrados <b> el pho enł primero libro delas politicas </b> muestra	et absque litigio , campi et terrae et alia fructifera excolantur . <b> Philosophus primo Politicorum ostendit , </b> quod ex alio et alio usu exteriorum rerum ,	mH6OD0M
2.3.7	rCl4EeW	e non han vna manera de beuir . <b> Et el philosofo enł primero libro delas politicas </b> departe quatro vidas sinples	et non eodem modo viuendi viuunt . <b> Distinguit enim Philosophus primo Politicorum quatuor vitas simplices , </b> vel quatuor modos viuendi ,	vIzTGCG
2.3.7	oSnZ9ZH	es aquello que es triuio el philosofo <b> en el primero libro delas politicas </b> que la natura dio anos tales cosas	Propter quod bene dictum est <b> quod scribitur 1 Polit’ </b> quod natura dedit nobis talia ,	ufVLVYW
2.3.7	k3D5UL7	lias batalla derecha <b> por la qual cosa el philosofo enl ꝑ̀mo libro delas politicas </b> dize	habet contra talia iustum bellum <b> propter quod Philosophus 1 Politic’ vult venatiuam et piscatiuam </b> esse vitas licitas .	aYaYwI7
2.3.8	pxGIPyz	que non quisiessen ante muchͣs mas ¶ <b> Mas el philosofo da en el primero libro delas politicas dos razones </b> por las quales la cobdiçia de las riquezas es sin fin e sin mesura¶	quin plura velint . <b> Assignat autem Philosophus 1 Politicor’ duplicem causam , </b> quare concupiscentia diuitiarum est infinita .	w4Y0OA4
2.3.8	xEiQYtp	ca assi commo departe el philosofo <b> enł primero libro delas politicaͤ </b> e assi commo dixiemos dessuso enl primero	Nam ut distinguit Philosophus primo Polit’ <b> et ut supra in primo libro diffusius diximus , </b> aliter appetitur finis ,	nSfQii8
2.3.8	a4LzkTK	que dize el philosofo <b> enł primero libro delas politicas . </b> Et pues que assi es nin el arte del gouernamiento dela casa non deue demandar possessiones et riquezas sin mesura e sin fin .	nulla , autem ars , <b> ut ait Philosophus 1 Politicor’ </b> habet organa infinita ,	rTqGKzk
2.3.9	h6sDR3a	n fueren penssados los dichs del philosofo <b> eñł primero libro delas politicas </b> todas las muda connes son aduchos a tres linages	Si considerentur dicta Philosophi <b> in 1 Politicor’ </b> omnes commutationes	qdsE2ho
2.3.9	aH4Xeys	bien dicho es lo que se dize <b> enł primero libro delas politicas </b> que en la primera comunidat	bene dictum est <b> quod dicitur 1 Politicorum </b> quod in prima communitate quae est domus ,	oH2VZWT
2.3.9	i2M2D0l	assi commo da a entender el philosofo <b> en el prim̃o libro delas politicas </b> buuendo en su sinpliçidat	sed etiam denariorum ad denarios . Antiquitus enim homines <b> ( ut satis innuit Philosophus primo Politicorum ) </b> in simplicitate viuentes	ssNruoI
2.3.10	ztD3HxR	e los dineros finca de dezer quantas son las maneras de los dineros . <b> Et el philosofo en las politicas </b> pone quatro maneras de dineros conuiene saber .	quot sunt species pecuniatiuae . <b> Distinguit autem Philos’ | in Poli’ </b> quatuor species pecuniatiuae :	gQCRuRc, iAn7Dgu
2.3.10	bLqgI99	Et esta segunt el philosofo <b> enel primero libro delas politicas </b> primeramente fue fallada sinplemente e auentura .	dicitur esse campsoria : <b> haec enim ( secundum Philosophum 1 Politicorum ) </b> forte primitus casu	oFOx3wv
2.3.10	gbBIzDj	segunt el pho <b> en el primero libro delas politicas </b> e el dinero es comienço e fin por que esta e arte comiencaen erl dinero	Sed in ea <b> ( secundum Philosophum primo Politicorum ) </b> denarius est elementum et terminus ,	aRwXyPn
2.3.10	fIElZ9g	¶ Mas destas quatro maneras <b> segunt que dize el p̃h̃o en las politicas </b> la primera que es assi commo	Harum autem quatuor species <b> secundum Philosophum in Polit’ sola prima , </b> quae est quasi oeconomica et naturaliter ,	oQSFDe7
2.3.11	gonv3jk	Ca primeramente la llamamos parto de dineros <b> del qual nobre el philosofo la rephede en el primero libro delas politicas </b> diziendo que es contra natura	Vocatur enim primo denariorum partus , <b> ex quo nomine arguit Philosophus 1 Polit’ </b> eam contra naturam esse .	b6r8TaZ
2.3.11	lV22OD3	bien dicho es lo que dize el ph̃co <b> en el primero libro delas politicas </b> que la usuraes de denostar	bene dictum est <b> quod dicitur 1 Poli’ usuram esse </b> quid detestabile et contra naturam .	tVmzx4H
2.3.11	rbLGaT2	Enpero deuedes saber que assi commo dize el pho <b> enl primero delas politicas de cada cosa </b> ay dos usos vn uso propo	( ut ait Philos’ 1 Politicorum ) <b> quasi cuiuslibet rei est duplex usus : | unus proprius , </b> et alius non proprius .	v379fWA, k1WYTxz
2.3.12	jDMWBXN	por que son contrael derecho natural <b> erca la fin del primero libro delas politicas </b> pone el philosofo departidas maneras	quod iuri naturali contradicant . <b> Circa finem primi Polit’ distinguit Philosophus diuersos modos , </b> quibus numismata acquiruntur .	iy38znO
2.3.12	kWOXO0w	entre todas las cosas <b> que acresçientan las riquezas es fazer monopolia </b> que quiere dezer vendiconn de vno solo .	( secundum Philos’ ) <b> est facere monopoliam , </b> idest facere vendationem unius :	euA0FUy
2.3.12	hrbGpZo	que quiere proueer ala mengua dela casa <b> segunt uida politica de auer cuydado de ganar dineros segunt que requiere </b> e demanda el su estado de cada vno .	secundum vitam politicam volentem prouidere indigentiae domesticae , <b> habere curam de acquisitione pecuniae , </b> secundum quod exigit suus status :	mCuBIiO
2.3.12	crdpHb8	¶ Avn en essa misma manera <b> segunt el philosofo dize enlas politicas deuemos cuydar cerca el labramiento delas tr̃ras </b> por que deuemos cuydar	Sic etiam , <b> ut Philosophus in Polit’ ait , | insistendum est circa apum culturam , </b> si partes illae aptae essent	qAZnM2h, uf0igi8
2.3.13	p3WHV3L	la qual cosa praeua el philosofo <b> en el primero libro delas politicas por quatro razones . </b> ¶ La primera razon se toma dela semeiança	et quod naturaliter expedit aliquibus aliis esse subiectos : <b> quod probat Philosophus primo Polit’ quadruplici via , </b> sumpta ex quadruplici similitudine .	dvaJWYf
2.3.13	xhQQzCM	mas conplidamente nunca de mucho omes se faria naturalmente <b> vna conpannia o vna poliçia </b> si naturalmente non fuesse a ellos conuenible que algunos fuessen sennores	ut superius diffusius probabatur , <b> numquam ex pluribus hominibus fieret naturaliter una societas vel una politia , </b> nisi naturale esset	vvFhtLG
2.3.13	xpze19y	e bien ordena de el alma en ssennorea <b> e el cuerpo obedesçe assi en la poliçia </b> e enla çibdat bien ordenadlos sabios deuen enssennorear	anima dominatur , <b> et corpus obedit : </b> sic in politia bene ordinata sapientes debent dominari ,	sGY3RhL
2.3.13	jayd4xm	Mas esto contesçe <b> por desordenança dela poliçia e dela çibdat . </b> Ca assi commo en el omne pestilençial e malo	Sed hoc accidit <b> ex peruersitate politiae : </b> nam sicut in homine pestilente ,	e1wr7l2
2.3.13	kkcsFZT	nin la razon <b> assi enlas poliçias </b> delas çibdades pestilençiosas e desordenadas	magis quam anima vel ratio : <b> sic in politiis pestilentibus , </b> et corruptis magis dominantur ignorantes ,	tM0GFlv
2.3.13	lrX4Gx1	ssennorea ala feribra dela qual dize el philosofo <b> en el primero libro delas politicas </b> que ha conseio muy flaco	naturaliter dominari foeminae , <b> de qua dicitur primo Politicorum </b> quod habet consilium inualidum :	d8HCZr0
2.3.14	c9QDbwy	que dize el philosofo <b> enl primero libro delas politicas </b> que los uençidos en la fazienda deuen seruir alos uençedores .	Est enim iustum legale , <b> ut recitat Philosophus 1 Politicorum superatos </b> in bello seruire superantibus .	brt4Ho6
2.3.14	qG0hQgk	que dize el philosofo <b> en las politicas </b> aya algua auentaia sobre el su sieruo .	oportet enim dominans <b> ( ut dicitur in Politic’ ) </b> habere aliquem excessum respectu serui .	izWOcVQ
2.3.14	g6TSV2Q	Por la qual cosa bien dicho es <b> lo que dize el pho enel primero libro delas politicas </b> que si dizumos	propter quod bene dictum est , <b> quod dicitur 1 Politicor’ </b> quod si debemus aliquos digne dominari	xxx37oE
2.3.16	lHYS3PU	Et la razon desto pone el philosofo <b> en el segundo libro delas politicas </b> do dize que alguas vezes peor siruen los muchs seruidores que los pocos .	Ratio autem assignatur 2 Polit’ <b> ubi dicitur , </b> quod aliquando deterius seruiunt	gGm7IaT
