Localisation	Id. source	Segment source	Segment cible	Id. cible
2.3.16	raDW3E5	que son dichͣs <b> en el quarto libro delas politicas . </b> Ca deuemoos assi ymaginar que comm̃o se ha la guand çibdat ala pequeña .	Ratio autem huius haberi potest <b> ex iis quae dicuntur 4 Polit’ . </b> Debemus enim sic imaginari	hY5cGN4
2.3.16	meQrPgH	çerca la fin del quarto <b> librdelas politicas non son de ayuntar </b> muchsofiçios	sic se habet magna domus ad paruam . <b> In magna enim ciuitate non sunt congreganda officia et principatus , </b> ita quod eidem committantur diuersa officia ,	qLNVcDr
2.3.17	jxtsZzk	assi commo prueua el philosofo <b> en el sesto libro delas politicas¶ </b> Lo segundo çerca las uestidas es de penssar la semeiança de los siruientes .	decet eos magnifica facere , <b> ut probat Philosophus 7 Poli’ . </b> Secundo circa vestitum consideranda est uniformitas ministrantium .	pPCCOOj
2.3.17	ssRc6lZ	assi commo dize el philosofo çerca la fin del . viij̊ . <b> libro delas politicas </b> que sienpre la persona	nimis afficimur ad illa . <b> Ideo dicitur circa finem 7 Polit’ </b> quod semper prima magis amamus .	kGBCMKg
2.3.18	hRRJCyu	non puede ser falso del todo <b> assi commo dize el philosofo en el viij̊ . libro delas politicas . </b> Et esta tal opinion del pue blo ha de ssi alguna prueua	impossibile est esse falsum secundum totum , <b> ut videtur velle Philosophus 7 Ethicorum , </b> huiusmodi vulgaris opinio alicui probabilitati innititur .	aplDfXH
2.3.18	xUrShbv	Ca assi commo dize el pho <b> enl primero libro delas politicas . </b> Assi commo de omne nasçe omne	ut plurimum quod nobiles genere sunt nobiliorum morum quam alii : <b> nam sicut ex homine nascitur homo , </b> et ex bestiis bestia :	woFlbJs
2.3.18	pg7HLB6	ay falssedat <b> ca assi commo dize el philosofo en las politicas la natura quiere sienpte fazer alguna cosa . </b> Enpero muchͣs uezes non la puede fazer	Huic autem probabilitati aliquando subest falsitas , <b> quia ( ut dicitur in Politicis ) | natura vult </b> qui de hoc facere multotiens ,	aMFxoBd, jb0rvNz
2.3.19	pfZpjZF	ca assi conmo conuiene alos çibdadanos de ser iustos e legales <b> para guardar su poliçia conueniblemente </b> assi conuiene alos sermient	Nam sicut decet ciues <b> ut debitam politiam seruent </b> esse iustos legales ,	io90XRw
2.3.19	iuNEGuk	ca assi commo dize el pho <b> enł primero libro delas politicas </b> que este fecho	nec Reges et Principes . <b> Nam ( ut dicitur primo Polit’ ) </b> et hoc non habet aliquod magnum	hKdOejM
2.3.19	uQX7DAk	que son dichͣs <b> en el quinto libro delas politicas </b> do dize que la persona del prinçipe	sumi potest <b> ex iis quae dicuntur 5 Polit’ </b> ubi dicitur ,	wqD8wDX
2.3.19	v7sw6zD	cerca la fin del prim̃o libro <b> delas politicas dize </b> que la fenbra por cierto ha conseio	De his autem loquens Philosophus <b> circa finem primi Politicorum ait , </b> quod foemina quidem habet consilium inualidum ,	acZ4jP5
2.3.20	ljytc8A	¶ La primera razon paresçe <b> assi ca assi commo es dicho en el primero libro delas politicas </b> estonçe cada vna cosa es ordenada a vna obra segunt natura	Prima via sic patet . <b> Nam , ut dicitur primo Poli’ </b> tunc secundum naturam unumquodque perficitur ,	nJDzRq6
3.1.1	xmm05v7	Ca pruena el pho <b> enl primero libro delas politicas </b> por dos razones	oportet ciuitatem ipsam constitutam esse propter aliquod bonum . <b> Probat autem Philosophus primo Polit’ duplici via , </b> ciuitatem constitutam esse gratia alicuius boni .	kVqZKrV
3.1.1	dCCatSe	que toda obra e toda electiuo dessea de auer algun bien . <b> Et en el primero libro delas politicas </b> dize	quoddam appetere videtur , <b> et primo Politicorum scribitur , </b> quod gratia eius quod videtur bonum ,	cfrdMdS
3.1.1	wxnqvJK	ca assi commo dize el philosofo <b> enl primero libro delas politicas </b> vna inclinaçion de natura es en todos los orans	quod tamen existit bonum : <b> huius autem est constitutio ciuitatis . Nam ( ut dicitur primo Poli’ ) </b> natura quidem impetus in omnibus inest	voOMxQv
3.1.1	ap3pYzC	e esto es lo que dize el philosofo <b> en el primero libro delas politicas </b> que si nos dizimos	maxime ordinatur ad bonum . <b> Hoc est ergo quod dicitur primo Polit’ </b> quod si communitatem omnem gratia alicuius boni dicimus constitutam ,	zOGEzBT
3.1.1	d2jR82M	por grande algun bien <b> e esta es comunidat politica </b> que es llamada	et omnes alias circumplectens , potissime gratia boni constitutam esse contingit : <b> haec autem est communitas politica , </b> quae communi nomine vocatur ciuitas .	dZqBtxS
3.1.2	ttRvEjn	porque por ella alcançan los omes ser acabados <b> e beuir en comunidat politica e de çibdat </b> ca sin ella la uida del omne non puede ser	quia per eam homines consequuntur <b> omnia tria praedicta bona . | Nam ipsum viuere consequuntur homines ex communitate politica : </b> quia sine ea vita hominis	moK7oa7, gUfTHDh
3.1.2	pUNEgAA	en quanto es omne . <b> Et por ende estendiendo el beuir politico </b> segunt alguas leys de loar	ut homo est . <b> Ostendendo ergo viuere politicum secundum aliquas leges </b> et secundum aliquas laudabiles ordinationes ,	bX6Xb6z
3.1.2	zWw3dsj	por que el ome <b> esnatraalmente aianl politico </b> e çiuil	homo enim est <b> naturaliter politicum animal et ciuile , </b> ut infra patebit .	e3mMwME
3.1.2	zx6ubM3	commo omne los omes alcançan tal beuir <b> por partiçipamiento politico o por establestimiento dela çibdat </b> ¶ Lo segundo por tal establesçimiento de çibdat los omes	( loquendo de viuere ut homo ) <b> consequuntur homines excommunicatione politica | siue ex constitutione ciuitatis . </b> Secundo ex tali constitutione homines	ziCis38, gAkK5bc
3.1.2	ohRntqa	lo que dize el pho <b> en el primero libro delas politicas </b> que la comunidat	Bene ergo dictum est , <b> quod scribitur primo Politicorum </b> quod communitas ,	eTKbw5C
3.1.2	ofse49P	Et por ende dize el pho <b> en el primero libro delas politicas </b> que fue fecha la çibdat	secundum leges et virtuose . <b> Ideo dicitur primo Politicorum </b> quod facta	peWLRYv
3.1.2	fXN5jmb	nin durar <b> otdenaron la comunidat politica </b> que era fechͣ	constituta ciuitas stare non posset , <b> ordinauerunt communitatem politicam , </b> quae facta erat ad viuere ,	aLbqACF
3.1.2	uXzDjDP	aquello que dize el pho <b> en el primero libro delas politicas </b> que el primo	bene dictum est <b> quod scribitur primo Politicorum , </b> quod	k14V0sA
3.1.3	qWwJCmJ	si la çibdat es cosa natural <b> e si el omne es natraalmente aian l . politicas . </b> e çiuilca aque łłas cosas	secundum naturalem ? <b> et An homo sit naturaliter </b> animal politicum et ciuile ?	asiKCjS
3.1.3	qDnrYzs	mas veemos <b> que muchos fuyen la conpanna politicas </b> e çiuil	nullus reperiretur homo non ciuilis . <b> Videmus autem multos societatem politicam retinentes , </b> eligere solitariam vitam , et campestrem .	iGcTB82
3.1.3	t8VKXut	que non biuen çiuilmente . <b> Mas el pho tanne enl primero libro delas politicas tres razones </b> por las quales contesçe	reperiuntur tamen multi campestre viuentes . <b> Tangit autem Philosophus 1 Polit’ tria , </b> quare contingit alienos	gqW7ktp
3.1.3	qCKnbu9	assi commo dize el philosofo <b> en el primero libro delas politicas </b> do dize que maldicho es el	Hi autem sunt illi , <b> quos ( ut recitat Philosophus 1 Poli’ ) </b> maledicebat Homerus , dicens ,	wfegkcd
3.1.3	f1wiXmv	por la qual cosa dize el philosofo <b> en el primero libro delas politicas </b> que los que non pueden beuir en conpanna con los otros	eligens altiorem vitam : <b> propter quod scribitur primo Poli’ </b> quod non potens aliis communicare ,	heh5DZW
3.1.4	ybweqio	e podemos por dos razones mostrat <b> que la comiundat politicas </b> o la çibdat es algunan cosa segunt natura .	Possumus autem duplici uia ostendere <b> communitatem politicam </b> siue ciuitatem esse aliquid secundum naturam .	smPxuUG
3.1.4	tWxW8Ym	ca assi commo prueua el pho <b> en el primero libro delas politicas </b> lo que es fin dela generaçion	illarum communitatum finis et complementum . <b> Nam ut arguit Philosophus primo Politicorum </b> quod est finis generationis naturalium ,	cOucabk
3.1.4	dYAizbP	assi commo dize el philosofo <b> en el primero libro delas politicas </b> por la qual cosa	et nepotum , <b> ut vult Philosophus 1 Polit’ </b> propter quod si tale crementum est naturale ,	i8pjBje
3.1.4	vDXXi7s	que el omne es naturalmente <b> aianl politicas </b> e ciuilla qual cosa podemos demostrar	reliquum est ostendere , <b> hominem esse naturaliter animal politicum et ciuile , </b> quod etiam duplici via inuestigare possumus .	eqbZgDh
3.1.4	cAPoRA4	assi capuado fue <b> en el comienço del segundo libro delas politicas de parte dela palabra </b> que el omne es naturalmente	Probatur enim in principio secundi libri , <b> ex parte sermonis </b> hominem esse naturaliter animal sociale ,	gPFHdb8
3.1.4	nYFRTuG	que el omne es natraalmente <b> aianl politicas e ciuil </b> por que la boz del omne	Hoc autem ex parte sermonis ostendere possumus <b> hominem esse naturaliter animal politicum et ciuile , </b> ex eo quod vox humana ,	q1ck6qh
3.1.4	h5x4Rqn	que la bos delas bestias . <b> Onde el philosofo dize en el primero libro delas politicas </b> que en las o trisaian lias apartadas del omne	quam vox brutorum . <b> Unde Philos’ ait 1 Pol’ </b> quod in aliis animalibus ab homine ,	hDxAbCP
3.1.4	q2OKtQM	e por ende en todos los omes es inclinaçion natural <b> para beuir politicas miente en çibdat </b> e para fazer çibdat	Inerit ergo hominibus impetus naturalis <b> ad viuendum politice , </b> et ad constituendum ciuitatem .	ym6gTDR
3.1.5	w8fo42z	assi ca segunt que dize el philosofo <b> en el primero libro delas politicas </b> que la comunidat acabada	Prima via sic patet . <b> Nam cum ait Philosophus primo Polit’ </b> quod communitas perfecta ,	rPyLsNL
3.1.6	eUbMFL7	la otra manera es por concordia de los que establesçen la çibdat e el regno <b> ca assi commo cuenta el philosofo en el segundo libro delas politicas </b> enel tienpo antigo los omes mora una esparzidos	Alius modus est ex concordia constituentium ciuitatem vel regnum . <b> Nam ut recitat Philosophus 2 Politicorum , </b> antiquitus homines morabantur dispersi ,	fEALsqD
3.1.6	fCrdBkz	en qual manera de una gouernar las çibdades e los regnos ¶ <b> Lo segundo mostraremos qual es la muy buean politica o çibdat o muy vuen regno </b> e de quales cautelas deuen usar los prinçipes e los . Reyes	regere ciuitates et regna . <b> Secundo ostendetur , | quae sit optima politia siue optimum regnum , </b> et quibus cautelis uti debeant principantes ,	g8UE4C4, pb5BNBK
3.1.7	j0zVAzG	assi commo cuenta el philosofo <b> enł primero libro delas politicas </b> por aquellas cosas	sicut et viros . Inducebantur enim ad hoc <b> ( ut Philosophus recitat 2 Polit’ ) </b> ex iis quae videbant in bestiis	fo2mOBu
3.1.8	y6cEauz	e platon dixieron <b> ca el philosofo pone etł segundo libro delas politicas </b> seys razones	ut Socrates et Plato credebant . <b> Tangit autem Philosophus | 2 Polit’ </b> quasi sex rationes ,	hLua9CY, b2VqD6G
3.1.8	n78lDpj	alli commo dize el pho <b> enł segundo libro delas politicas </b> otra cosa es defendimiento de çibdat	vel ad pugnationem . <b> Nam ut dicitur 2 Polit’ </b> alterum est compugnatio ,	zASpR78
3.1.9	qmlpLpT	por la qual cosa commo en el gouernamiento dela çibdat <b> primeramente se ha de ordenar la poliçia </b> muy luengamente es de buscar	ne circa ipsa contingat error . <b> Quare cum in regimine ciuitatis primo sit politia ordinanda , </b> diu inuestigandum est ,	nm9tIPZ
3.1.9	yKxSAiB	losoens puedan beuir comunal mente . <b> Onde el pho dize en el terçero libro delas politicas </b> que los çibdadanos non deuen ser llegados alas leyes	secundum quam homines communiter possint uiuere . <b> Unde et Philosophus ait in Politicis ciues </b> non esse applicandos legibus ,	sSKohnZ
3.1.9	bSoMCwm	que lo semeiaua . <b> Onde el pho cuenta en el segundo libro delas politicas </b> que entre algunas gentes	quem videret sibi esse similem . <b> Unde et Philosophus narrat 2 Politicor’ </b> quod apud quasdam gentes ,	drqZLnN
3.1.9	kM8jQZx	assi commo dize el pho <b> en el segundo libro delas politicas </b> por que vno ama a otro	Nam plus est modo de dilectione in ciuitate , <b> ut Philosophus innuit 2 Politicor’ , </b> quia unus diligit alium tanquam filium ,	cNZBUns
3.1.10	eNXII5v	assi commo conuiene ala comunidat de los çibdadanos <b> lpho prueua en el primero libro delas politicas </b> que muchos males se siguen en la çibdat	ut expedit communitati ciuium . <b> Philosophus 2 Polit’ probat multa mala sequi in ciuitate , </b> si uxores et filii ponantur esse communes .	aN0sETh
3.1.10	tJIKKKc	muy de coraçon por aquellos dos otres <b> Mas esto reprahende el philosofo enel segundo libro delas politicas </b> ca por dos o por tres o por pocos mocos querera mar grant muchedunbre de moços	quod omnes alios intime diligerent propter illos . <b> Sed ut arguit Philosophus 2 Politic’ | propter duos vel tres </b> vel propter paucos pueros velle magnam multitudinem diligere puerorum tanquam proprios filios ,	ireu9bI, oZyhBft
3.1.11	xF7haC4	assi commo dize el philosofo <b> en el segundo libro delas politicas </b> en tres maneras se puede entender	Esse res communes , <b> ut ait Philosophus 2 Politic’ , </b> tripliciter potest intelligi .	lduytOU
3.1.11	x3f4RNn	mas assi commo dize el philosofo <b> en el segundo libro delas politicas </b> en los fechos particulares	inter quos tanta communitas obseruatur . <b> Sed ut dicitur secundo Politicorum </b> in actibus particularibus oportet	umSCDbf
3.1.11	svEHl1C	que por la mayor parte han contiendas e uaraias por la qual cosa dize el philosofo <b> en el segundo libro de las politicas </b> que de los siruientes	ostenditur ut plurimum homines habere lites et iurgia <b> propter quod Philosophus ait 2 Polit’ </b> quod ab ipsis famulis ,	c4ByzVQ
3.1.11	dk1x0CJ	assi commo cuenta el philosofo <b> en el segundo libro delas politicas </b> tanta era la franqueza	Unde et apud Lacedaemones , <b> ut recitatur secundo Politi’ </b> tanta erat liberalitas ,	k6fA5AZ
3.1.12	jvB1Y0U	por que segunt el philosofo <b> en el segundo libro delas politicas </b> alas bestias	insufficiens est : <b> quia secundum Philosophum 2 Poli’ </b> bestiis nihil attinet oeconomice ,	ziRkroB
3.1.13	sNUAy21	assi commo dize elpho <b> en el segundo libro delas politicas </b> ca si menospreçiando alos vnos sienpre los otros fueren puestos en los ofiçios	et pacificum statum ciuium . <b> Nam si spretis aliis semper iidem in magistratibus et praeposituris praeficiantur , </b> alii videntes se esse despectos	qoHd5LW
3.1.13	ztYvYzy	pone el pho <b> en el segundo libro delas politicas </b> quando	Hanc autem tertiam rationem improbantem ordinationem Socraticam <b> tangit Philosophus 2 Poli’ </b> cum ait .	egPIg43
3.1.14	a5SQtiq	por la qual cosa el philosofo <b> en el libro delas politicas </b> reprehende a socrates deste	ø	ø
3.1.14	gYjWaXP	ca segunt dize el philosofo <b> en el segundo libro delas politicas </b> el que quiere poner leyes o fazer ordenaçion alguna en la çibdat a tres	in constituendo determinatum numerum bellatorum . <b> Nam secundum Philosophum secundo Politicorum , </b> volens ponere leges	oNcMiRj
3.1.15	uZRHSBg	esquariasocrates <b> que algua poliçia non deuiesse ser llamada çibdat </b> si a lo de menos non ouiesse en ella minłłomes nobles	Volebat ergo Socrates politiam <b> aliquam non debere nominari ciuitatem , </b> nisi saltem contineret mille nobiles ,	nRoyuv0
3.1.16	o27Fkil	assi commo cuenta el philosofo <b> en el segundo libro delas politicas </b> que se entremi tio del ordenamiento dela çibdat	ut narrat Philosophus <b> 2 Politicorum intromisit se de ordine ciuitatis , </b> statuens quomodo posset	l8ufopa
3.1.16	bEt5WCu	que se entremi tio del ordenamiento dela çibdat <b> establesçiendo en qual manera se podria ordenas muy bien la poliçia e la çibdat </b> ca dizia	2 Politicorum intromisit se de ordine ciuitatis , <b> statuens quomodo posset | optime politia ordinari . </b> Dicebat autem ,	shoTeSC, jWks2U9
3.1.16	fRlzAlc	La terçera por aquellas cosas <b> que ueya en las otras poliçias . </b> ¶ La primera razon paresçe	Tertio , ex his quae videbat <b> in politiis aliis . </b> Prima via sic patet .	gvvLySP
3.1.17	mBePMvV	i fueren penssados los dichos del philosofo <b> en el segundo libro delas politicas </b> quanto pertenesçe alo presente	volens eos aequatas possessiones habere . <b> Si considerentur dicta Philosophi 2 Politicorum , </b> quantum ad praesens spectat ,	xyPoc0N
3.1.17	jADTt3U	que se non puede guardar <b> ca segunt elpho en el quarto libro delas politicas </b> non solamente los principeᷤ deuen auer cuydado	quae conseruari non potest . <b> Nam secundum Philosophum 4 Politicorum </b> non solum debet esse cura	kN1L8dz
3.1.17	lqgl6mq	ca assi commo dize el philosofo <b> en el segundo libro delas politicas meesteres ala pazer dela çibdat </b> que los fijos de los ricos	quia ut dicitur 2 Polit’ <b> opus est </b> ad pacem ciuitatis filios diuitum	iWgvREJ
3.1.18	nHXjW9n	assi commo cuenta el philosofo <b> en el segundo libro delas politicas era ley </b> que para que las suertes antiguas fuessen guardadas	Sic etiam apud Locros , <b> ut recitat Philosophus 2 Politic’ lex erat , </b> quod ad hoc ut antiquae sortes seruarentur illesae ,	fdTpyRF
3.1.18	gENCv15	assi commo prueua el philosofo muy llanamente <b> en el segundo libro delas politicas . </b> Mas desto diremos adelante mas conplidamente	circa reprimendas concupiscentias quam circa alia , <b> ut plane probat Philosophus 2 Polit’ . </b> Sed de hoc inferius diffusius dicemus .	e90dbm2
3.1.18	l0CdWue	que fiziemos vn tractado del partimiento <b> que es entre la ethica e la rectorica e la politica </b> en el qual si los dichs fueren penssados superfiçialmeᷤte	nos edidisse quendam tractatum . <b> De differentia Ethicae Rhetoricae et Politicae , </b> ubi dicta superficialiter considerata contradicere videntur	qfhaSLG
3.1.19	aCQCYcS	que y podo mio <b> establesciendo su poliçia </b> primero se entremetio dela muchedunbre	diuersa genera personarum . <b> Hippodamus autem statuens suam politiam , </b> primo intromisit se de multitudine	mCtVz2h
3.1.19	q78IPzZ	assi commo dize el philosofo <b> en el segundo libro delas politicas </b> deuiese de vieios sabios escogidos	Volebat quidem principale praetorium , <b> ut narrat Philosophus 2 Politicorum , </b> debere esse ex senibus electis :	hl25OLt
3.1.19	hO1aveB	e en algunan manera de soltar deuie lo traer determinado por su estriptura . <b> Mas el philosofo en el segundo libro delas politicas </b> do pone la opinion del dicho	per scripturam determinaret illud . <b> Philosophus autem 2 Politicor’ | ubi positionem dicti Philosophi narrat , </b> assignat ,	sQM9YDs, yjXvwAO
3.1.20	vimRd3X	e por ende contamos la opinion de ipodomio <b> por que el en la su poliçia manifesto muchͣs bueanssmans . </b> Empo algunas cosas establesçio non conuenible mente .	Hippodami ergo opinionem recitauimus , <b> quia in sua politia multas bonas sententias promulgauit : </b> aliqua tamen incongrue statuit .	vjz1Gdt
3.1.20	o631Dmd	signiendo los dichos del philosofo <b> enel segundo libro delas politicas rephender a </b> ipodomio	Possumus autem quantum ad praesens spectat , <b> sequendo dicta Philos’ 2 Pol’ increpare </b> Hippodamum quantum ad tria .	jSTKl9I
3.2.1	nyBYplX	e rezando opiniones de departidos philosofos <b> que establesçieron poliçias </b> e dieron arte del gouernamiento dela çibdar	praemittendo quaedam praeambula ad propositum , <b> et recitando opinionem diuersorum Philosophorum instituentium politiam , </b> et tradentium artem	oVXSqy4
3.2.1	vT5eMb7	en el gouernamiento del regno e dela çibdat <b> Mas el philosofo en el terçero libro delas politicas </b> tanne quatro cosas	in tali regimine . <b> Videtur autem Philos’ 3 Polit’ tangere , </b> quatuor quae consideranda sunt	c9fmerg
3.2.2	nuE7egG	Enpero primero diremos del prinçipado . <b> el terçero libro delas politicas </b> departe el philosofo seys linaies de prinçipados	primo tamen dicemus de ipso principatu . <b> Tertio Politicorum distinguit Philosophus </b> sex modos principantium ,	he0rHrQ
3.2.2	z7YNyYE	que quiere dezer sennorio de buenos <b> e la poliçia </b> que quiere dezer pueblo bien	Nam regnum aristocratia , <b> et politia sunt principatus boni : </b> tyrannides , oligarchia , et democratia sunt mali .	aYkhCK9
3.2.2	k5wa4JF	llamalle el philosofo nonbre comun <b> e diz el poliçia </b> por que poliçia es	vocat eum Philosophus nomine communi , <b> et dicit ipsum esse Politiam . </b> Politia enim quasi idem est ,	dwidos5
3.2.2	yyB4YkB	e diz el poliçia <b> por que poliçia es </b> assi commo ordenamiento bueno de çibdat	et dicit ipsum esse Politiam . <b> Politia enim quasi idem est , </b> quod ordinatio ciuitatis quantum	ku9N8j9
3.2.2	ztB6a68	enssennorea a todos los otros <b> ca la poliçia esta mayormente en el ordenamiento del grant prinçipado </b> que es en la çibdat	qui dominantur omnibus aliis . <b> Politia enim consistit | maxime in ordine summi principatus , </b> qui est in ciuitate .	l87XQL5, dek0MPV
3.2.2	u4fHsUl	Pues que assi es todo ordenamiento de çibdat <b> puede ser dicħ poliçia . </b> Enpero el prinçipado del pueblo si derecho es	Omnis ergo ordinatio , <b> ciuitatis Politia dici potest . </b> Principatus tamen populi si rectus sit ,	wqC0Xoq
3.2.2	sfgQTGD	Enpero el prinçipado del pueblo si derecho es <b> por que non ha nonbre comun es dich poliçia </b> e nos podemos llamar atal prinçipado gouernamiento del pueblo	Principatus tamen populi si rectus sit , <b> eo quod non habeat commune nomen , | Politia dicitur . </b> Nos autem talem principatum appellare possumus gubernationem populi ,	bqUzk1M, zAoXtl6
3.2.3	q8uyXnp	ir que entendemos mostrar <b> qual es la muy buena poliçia </b> e que cosa es el muy buen prinçipado	Quia intendimus ostendere <b> quae sit optima politia , </b> et quis sit optimus principatus .	vjqKbHZ
3.2.4	pFEDzcP	e han cunplimiento delas cosas <b> lpho en el terçero libro delas politicas tanne tres razons </b> por las quales paresçe que se puede prouar	abundantia florent . <b> Philosophus 3 Politicorum videtur | tangere tres rationes , </b> per quas probari videtur ,	pkVIk8S, iw8zVxD
3.2.4	v2Lx2YJ	que vno solo si fuesse vn prinçipe . <b> Onde el pho en el terçero libro delas politicas </b> dize	quam si principaretur unus tantum : <b> unde Philosophus 3 Politicorum ait , </b> quod plures homines sic principantes quasi constituunt	oYBJGzj
3.2.4	nJMNvr2	que esta duda <b> que el pho pone en el terçero libro delas politicas dudado </b> e poniendo muchͣs razones para esto	quod hanc dubitationem <b> quam Philosophus 3 Politicorum venatur , | dubitando , </b> assignans rationes multas ,	yxK2X1K, aceMxfO
3.2.4	aP4VIo2	ca el dize muchͣs uezeᷤ <b> en esse mismo libro delas politicas </b> que el regno es prinçipado muy digno	dum tamen utrunque sit rectum , <b> cum ipse pluries dicat in eisdem politicis , </b> regnum esse dignissimum principatum :	ehtqZFR
3.2.4	mCl0Aov	segunt <b> que dize el philosofo enel terçero libro delas politicas </b> que deue aconpannar assi e tomar consigo muchos sabios	ille Princeps vel ille Rex <b> ( secundum Philosophum 3 Politicor’ ) </b> debet sibi associare multos sapientes ,	iXWjLnL
3.2.5	hCCcf76	La primera razon paresçe <b> assi ca segunt elpho en el segundo libro delas politicas </b> non se puede contar	Prima via sic patet . <b> Nam secundum Philosophum 2 Politic’ </b> inenarrabile est	dbcmJ5N
3.2.5	opT4Cpt	si penssare que el regno ha de venir a señorio de los fijos <b> enpero el pho enel terçero libro delas politicas </b> do fabla destamateria dize	ad dominium filiorum . <b> Philosophus tamen 3 Politic’ | ubi de hac materia determinat , </b> ait , quod hoc est difficile ,	pSI6ApU, wU2NxVq
3.2.5	xkhf6KZ	que alos otros segunt <b> que dize el pho en las politicas </b> conuiene	tribuere magis primogenito quam aliis : <b> quia ( ut ait Philosophus in Politiis ) </b> decet iuniores senioribus obedire .	pOf9Am9
3.2.7	w2ndiG5	e si non entendiere en el bien comun . <b> Onde en el terçero libro delas politicas </b> dize el philosofo	et nisi intendat commune bonum . <b> Unde 3 Polit’ dicitur , </b> quod principari talem ,	tDpxR8Q
3.2.7	hhtTykT	quanto por ella mas se arriedra el tirano dela entençion del bien comun . <b> Et esta razon tanne el philosofo çerca el comienço del quarto libro delas politicas . </b> do dize que assi conmo el regno es muy buena et muy digna poliçia .	ab intentione communis boni . <b> Hanc autem rationem tangit Philosophus | circa principium 4 Politicorum ubi ait , </b> quod sicut Regnum est optima	tR4ZYu8, oPf3pfE
3.2.7	psn6zSi	Et esta razon tanne el philosofo çerca el comienço del quarto libro delas politicas . <b> do dize que assi conmo el regno es muy buena et muy digna poliçia . </b> assi la tirania es muy mala	circa principium 4 Politicorum ubi ait , <b> quod sicut Regnum est optima | et dignissima politia , </b> sic tyrannis est pessima :	dpuOwz1, atrUY8F
3.2.7	pUcHvtz	assi commo y dize el pho <b> por quela tirama much se arriedra dela poliçia e del bien comun . </b> la segunda manera para prouar esto mismo se toma .	( ut ibi dicitur ) <b> quia tyrannis plurimum distat a politia , | idest a communi bono . </b> Secunda via ad inuestigandum hoc idem , sumitur ex eo quod tale dominium maxime est naturale .	uIUX6e8, aDt5pyF
3.2.7	x2Rwxzo	Et esta razon tanne avn el philosofo <b> en el quarto libro delas politicas </b> do dize que la tirania es muy mal prinçipado	Hanc autem rationem tangit Philosophus <b> in eodem 4 Politicorum ubi ait , </b> tyrannidem esse pessimum principatum ,	qOj3896
