Localisation	Id. source	Segment source	Segment cible	Id. cible
2.3.13	xpze19y	e bien ordena de el alma en ssennorea <b> e el cuerpo obedesçe assi en la poliçia </b> e enla çibdat bien ordenadlos sabios deuen enssennorear	anima dominatur , <b> et corpus obedit : </b> sic in politia bene ordinata sapientes debent dominari ,	sGY3RhL
3.1.15	uZRHSBg	esquariasocrates <b> que algua poliçia non deuiesse ser llamada çibdat </b> si a lo de menos non ouiesse en ella minłłomes nobles	Volebat ergo Socrates politiam <b> aliquam non debere nominari ciuitatem , </b> nisi saltem contineret mille nobiles ,	nRoyuv0
3.2.15	caMSVt8	La quinta cosa <b> que guardan la poliçia es catar con grant acuçia </b> en qual manera se han aquellos que honrro la real maiestad	ut dissoluatur regius principatus . <b> Quintum , est diligenter aspicere , </b> quomodo se habeant ,	s5GWeLj
3.2.15	gWLhN17	e de su unar de muerte ¶ <b> La vjͣ cosa que guarda la poliçia . </b> es non dara ninguer muy grant señorio	vel etiam capitali sententia condemnandi . <b> Sextum est , nulli valde magnum dominium conferre . </b> Nam magna dominia	sdXjcKY
3.2.15	mXZbjlM	cosa que salua el regno <b> e la poliçia es auer poderio </b> çiuilca	Octauum saluans regnum et politiam , <b> est habere ciuilem potentiam . </b> Nam ( ut dicitur in Magnis moralibus )	rhXCIcQ
