Localisation	Id. source	Segment source	Segment cible	Id. cible
1.1.1	nmNNc4K	E gruesamente <b> Ca Segund dize el philosopho enlas politicas </b> que aquellas cosas	incedendum est in morali negocio figuraliter et grosse . <b> Immo quia ( secundum Philosophum in Politicis ) </b> quae oportet dominum scire praecipere ,	uQn90y0
1.1.2	g882uXD	sirue lascin a quell manyconomica <b> que quiere dezjr gouernamjento de conpanans de casa ¶ al terçero libro sirue la politica </b> que es sçiençia de gouernamjento delas çibdades e del rreyno	ø	ø
1.1.4	o72JqPh	Conuien de saber ujda delectosa et plazentera ¶ <b> vida politica e çiuil¶ </b> Et uida contenplatina e acabada¶	( ut patet ex 1 Ethic’ ) <b> triplicem vitam , </b> videlicet , voluptuosam , politicam , et contemplatiuam .	kxw87Jf
1.1.4	xQcBkDk	quanto partiçipara con las bestias <b> Et en quanto es alguna cosa en sy mjsmo dizen qual coujene la uida politica e ordenada </b> Mas en quanto partiçipa con las sb̃as apartadas	ut communicat cum brutis , <b> competit vita voluptuosa ; | ut est aliquid in seipso , vita politica : </b> sed ut participat cum substantiis separatis ,	jJzw5vC, pKXFdHe
1.1.4	iWOIJJs	ca pusieron feliçidat <b> e bien andança politica e ordenada </b> e bien andança contenplatina	quod et Theologi negant : <b> posuerunt enim felicitatem politicam , et contemplatiuam : </b> ut dicatur quis felix politice ;	qjHjVqv
1.1.4	iftfMaQ	Et segunt esto partiçipamos con dios con los angeles <b> ¶ Onde dize el philosofo en el primero libro delas politicas </b> que cada vno de los omes o es omne o es peor que omne	et secundum quem communicamus cum Deo , <b> et cum substantiis separatis . | Unde ex 1 Politicorum patet , </b> quod quilibet vel est homo ,	wKtW4CI, z4XWUlr
1.1.4	x63bydW	segunt sabiduria e rrazon derecha <b> Et de beuir vida politica e ordenada </b> Mas sy el omne es bestia e peor	sequitur quod regatur secundum prudentiam , <b> et viuat vita politica . </b> Si autem est bestia ,	uooFsVi
1.1.4	c6J0ObK	Et el acabado ente las sçiençias especulatians quanta es <b> entre el que biue vida humanal e vida politica </b> que es vida ordenada .	et perfectum in speculabilibus , <b> quanta est inter viuentem vita humana et politica , </b> et viuentem uita contemplatiua et angelica .	fmVksqt
1.1.4	y0ipEFl	¶ <b> Et llamaron bien auenturado politico </b> aquel que biue	et ut hominem , <b> sed ut communicat </b> cum substantiis separatis .	c1OvMnV
1.1.4	lPoUkMW	¶ <b> Enpero del an vida politica e ordenada la qual los theologos llaman vida actiua </b> que quiere dezir vida de bien obrar	ut infra clarius ostendetur : <b> de vita tamen politica , | quam Theologi vocant vitam actiuam , </b> et de vita contemplatiua	zIrg8ld, jHGbKPn
1.1.4	uI3PGSh	Mas en lo que ellos dixieron <b> que la vida contenplatian es mejor que la vida politica e actiua </b> que esta en las obras en esto non descordaron de los cheologos njn dela uerdat .	Quod autem vitam contemplatiuam dixerint <b> esse potiorem , | quam vitam politicam et actiuam , </b> a Theologis et a veritate catholica non discordant .	rRM7nVz, x0Pg6Dp
1.1.6	ctEZbHH	Ca asi commo dize el philosofo <b> en el quinto libro delas politicas el prinçipado </b> e el señorio deue responder ala grandeza e ala dignidat de la persona	et totaliter diuinum . <b> Nam ( ut dicitur 5 Politicorum principatus debet </b> respondere magnitudini , et dignitati ,	nLCnz49
1.1.6	s8i8DX2	e farie que los otros le touiese en pos . <b> ¶ Onde el philosofo en el quinto libro delas politicas </b> dize	Secundo hoc est detestabile Regi , quia seipsum contemptibilem reddit . <b> unde Philosophus 5 Politicorum ait , </b> quod maxime expedit Principibus ,	reDEt65
1.1.7	xtLwg5P	deue menospreçiar las delecta connes desmesuradas e carnales <b> philosofo en el primero libro delas politicas </b> departe dos maneras de riquezas .	Quod non decet regiam maiestatem , <b> Philosophus 1 Politicor’ distinguit </b> duo genera diuitiarum	c7oYoYb
1.1.7	s1KQstV	Ca el philosofo tanne tres razones <b> enl primero libro delas politicas </b> por las quales nos pondemos prouar	est ponenda felicitas . <b> Tangit enim 1 Politicor’ tria , </b> propter quae venari possumus ,	sGr17NW
1.1.7	eTumJTp	por el ordenamiento de los omes <b> ¶ Onde el philosofo enl primero libro delans politicas dize que trismudados los usadores </b> e trismudado el ordenamiento de los usadores	nisi ex ordinatione Hominum . <b> Unde 1 Politicorum dicitur , | transmutatis utentibus , </b> idest transmutata dispositione utentium ,	vB8JBlC, iiTSQPK
1.1.7	dEh3A7X	Ca puede contesçer asy commo dizeel philosofo <b> en el primero libro delas politicas contado vna buena fabla </b> que alguno podia ser rico de mucho oro	Potest enim contingere <b> ( ut dicitur 1 Politicorum ) </b> quod quis diues pecunia , fame moriatur .	m3HPBpD
1.1.8	fxtK5IS	e la su bien andança en las riquezas corporales . <b> ora uentra a muchos biuen uida politica </b> e creen que es de poner la feliçidat	in diuitiis ponere . <b> Forte multi viuentes vita politica credunt </b> felicitatem ponendam esse in honoribus ,	peVhGpx
1.1.8	l8gpDie	superfiçialmente <b> Onde esto praeua el philosofo en el primero libro delas politicas </b> do dize	sed apparenter , et superficialiter : <b> unde et Philosophus in Politicis , </b> curantes de honore tantum ,	wqmHzw4
1.1.10	e2ZjWU1	la qual cosa es falsa . <b> Por que el philosofo praeua en el septimo libro delas politicas </b> por çinco razones	quod est falsum : <b> probat enim Philosophus | in 7 Pol’ quinque rationibus felicitatem </b> non esse ponendam	rFoxLiI, t82J3Lb
1.1.10	xvAkuwK	que muchos muy malos tiranos ouieron muy grant poderio çiuil <b> assi commo dize el philosofo en las politicas </b> que dionisio siracusano o dionisios çiçiliano ouo muy grant poderio çiuil	Nam Dionysius Syracusanus , siue Sicilianus , <b> ut recitat Philosophus in politicis , </b> maxime abundauit in ciuili potentia ,	p0Qpy2M
1.1.10	lxN6dfn	mas de grand cruel dat ¶ <b> Et por ende el philosofo dize en el se partimo libro delas politicas </b> que cosa de escarnio es cuydar	nec clementia aliqua . <b> Unde Philosophus 7 Politicorum ait , </b> quod ridiculum est	s003xRK
1.1.10	b9fPAN0	enssennorean <b> assi commo quiere el philosofo en las politicas </b> Et quanto los libres son meiores que los sieruos .	secundum eos quibus aliquis principatus , <b> ut vult Philosophus in Politicis , </b> quanto liberi sunt meliores seruis : tanto principari liberis ,	zwRecep
1.1.10	zuIUqbR	asi commo dize el philosofo <b> en el septimo libro delas politicas </b> es mayor bien que la fortaleza ¶	ut dicit Philosophus <b> 7 Politic’ est maius bonum , </b> quam sit fortitudo .	zJ0em1t
1.1.10	wCMZIuw	por la qual cosa dize el philosofo <b> en el septimo libro delas politicas </b> deno stando alos griegos	et incurret nocumentum <b> secundum animam . Propter quod Philosophus 7 Politicorum vituperans Lacedaemones , </b> ponentes felicitatem	frO0cJU
1.1.11	iJBehRd	Et esto paresçe por el philosofo <b> en el septimo libro delas politicas </b> que dize	Quod autem in bonis interioribus sit proprie felicitas , <b> patet per Philosophum 7 Politicorum dicentem , </b> quod testis est nobis Deus ,	ceG0l8c
1.1.12	kCpFQi4	e dos bien andanças <b> la vna es politica e actiua </b> que es en las obras	Duas autem felicitates Philosophus posuit , <b> unam politicam , aliam contemplatiuam . </b> Voluit autem felicitatem	hARk3Hi
1.1.12	q0HNX42	e la bien andança es obra del alma segunt uirtud acabada Et por que la uertud acabada <b> en la uida politica e çibdadana </b> segund el philosofo es pridençia .	est operatio animae <b> secundum virtutem perfectam . </b> Cum igitur perfecta virtus	g1ZgTKz
1.1.12	fyPS5CS	que han de fazer <b> es bien auentado en la uidapolitica . </b> Et qual quier que sepa bien entender	secundum Prudentiam , <b> est felix politice : </b> qui vero scit bene speculari	ijdSALn
1.2.3	hvPgT31	La nona famil yaridat <b> ¶La . x̊ . . eutropolia </b> que es uirtud	Igitur computata Iustitia , <b> et Prudentia duodecim sunt virtutes morales ; </b> de quibus omnibus quid sunt ,	cAimt3y
1.2.3	h7Afc6w	la otra es bien fablança . <b> La otra es eutropolia </b> que quiere dezir buena conuerssaçion o buena manera de beuir .	Erit ergo triplex virtus ; <b> videlicet , Veritas , Affabilitas , et Eutrapelia , </b> quae potest dici bona versio .	c8SFMER
1.2.3	bkV9eTu	mas es bien fablante e curial¶ <b> Mas entropolia que quiere dezir buena conpanma </b> o buena manera de beuir en conpanna es	sed est affabilis , et curialis . <b> Eutrapelia vero siue bona versio , </b> est , quando aliquis sic se habet in ludis ,	jSbZ3PH
1.2.3	fpld8ft	assi commo conuiene en los trebeios . <b> Et la su uirtud es eutropolia </b> que ̀ere dezir buena conpanma .	ut se habeat circa ludos <b> prout expedit . </b> Omnes autem hae tres virtutes ,	piHIMox
1.2.3	nb8eAhh	v̉dat de uida ¶a fabilidato bien fablança . <b> Et eutropolia </b> que es buen a conpania .	ø	ø
1.2.3	al4NaPj	Et assi es la uirtud <b> que llaman eutropolia </b> que es buena conpannia	quot sunt huiusmodi virtutes : <b> et quomodo distinguuntur . </b> Quod bonarum dispositionum ,	cyfkBZv
1.2.7	e6aV9Xi	enssennorear natural mente . <b> Ca assi commo dize el philosofo en el primero libro delas politicas </b> que por esso es dicho alguno naturalmente sieruo	quia sine ea non possunt naturaliter dominari . <b> Nam ( ut declarari habet 1 Polit’ ) </b> ex hoc est aliquis naturaliter seruus ,	mKV1ihO
1.2.7	eKhN2m7	Ca assi commo dize el philosofo <b> en el primero libro delas politicas </b> la hmuger ha poco de sabiduria	Sic etiam viri dominantur foeminis , <b> quia ( ut declarari habet 1 Politic’ ) </b> foemina habet consilium inualidum .	i7w82uZ
1.2.11	dhD247n	e al prinçipe que las da . <b> assi commo lo muestra el philosofo enlas polititas . </b> Si los çibdadanos non guardaren la iustiçia legal .	et ad Principem , cuius est leges ferre , <b> ut declarari habet in Politicis : </b> si ciues non participarent legalem Iustitiam ,	ko2Mk7l
1.2.14	ziaS6UK	enxienplo que ector era fuerte en esta manera <b> que temie ser denostado de polimas . </b> Et por ende	Hector fortis erat , <b> qui timens increpationes Polydamantis , </b> aggrediebatur terribilia .	weGyhdU
1.2.19	lv0RsLJ	assi commo dize el philosofo <b> en el primero libro delas politicas . </b> por ende semeiaria a alguons	et naturam rerum , <b> ut vult Philosophus 1 Politicorum , </b> non videtur sufficienter	nCEQfnT
1.2.28	phAtnca	assi commo se puede prouar <b> en el primero libro delas politicas . </b> Conuiene cerca las palauras	Si enim homo est naturaliter animal sociale , <b> ut probari habet 1 Politicorum , </b> oportet circa uerba ,	s83JeyU
1.2.28	fhJpaL6	commo quier que todos los omes <b> que quieren beuir uida politica </b> e de çibdat deuen seer	diuersimode sit conuersandum : <b> licet omnes homines uolentes viuere politice </b> debeant esse amicabiles et affabiles ,	urUx2G1
1.2.28	r6BM7Vg	que los otro . <b> Onde el philosofo enel quarto libro delas politicas </b> dando captelas alos Reyes	quam alii . <b> Unde Philosophus 5 Politicorum </b> dando cautelas Regum et Principum ,	c0UeuBp
1.2.30	hL59FDk	Et pues que assi es paresçe <b> que cosa es el alegria o la entropolia </b> en quanto es uirtud .	Patet ergo quid est iocunditas , <b> vel eutrapelia , </b> prout est virtus ,	pybsEO0
1.2.33	cNVXEPm	macrobio commo plotino quatro guados de uirtudes . <b> Ca algunas uirt Sudes son politicas . </b> Et algunas son purgatorias .	quam Plotinus quatuor gradus virtutum . <b> Nam quaedam sunt politicae , </b> quaedam purgatoriae ,	un5NCu3
1.2.33	czm712h	que son en dios . <b> Et las uirtudes politicas son uirtudes g̃nadas </b> que ganan los .	virtutes exemplares esse in ipso Deo . <b> Virtutes autem politicas , </b> esse virtutus acquisitas ,	iCwaLVP
1.2.33	uEL8kb9	Et por ende diremos <b> que los persseuerantes han uirtudes politicas </b> e los continentes han uirtudes pragatorias .	demus suum ordinem virtutum . <b> Dicemus ergo quod perseuerantes habent virtutes politicas : </b> continentes , purgatorias :	wt52mLO
1.2.33	vNhLI3x	son mas altas que las pragatorias . <b> Et las p̃gatorias son mas altas que las politicas ¶ </b> Et que estos linages destas	excellunt purgatorias : <b> et purgatoriae politicas . </b> Quod autem haec genera virtutum adaptari debeant	jNLERIy
1.2.33	lBthDMe	que las primeras uirtudes conuiene saber . <b> Las politicas amollesçen </b> e desponen el coraçon a bien fazer e reduzen lo a medio¶	quod primae virtutes , <b> scilicet politicae , </b> molliunt idest ad medium reducunt .	cuwEKyS
1.2.33	tYo3GLh	por la qual cosa bien dicho es <b> que las uirtudes politicas parten </b> e lçen alos ꝑlseuerantes	Quare bene dictum est , <b> quod perseuerantibus competunt virtutes politicae , </b> quia perseuerantes	oCwutN6
1.2.33	wTs2yfz	e non salga allende nin a quande¶ Et <b> pues que assi es las uirtudes politicas </b> que amollesçen e ordenan el coraçon abien fazer	quod teneat se in medio . <b> Virtutes ergo politicae </b> quae molliunt ,	kbuhRjn
1.2.34	m95Jit9	e podriemos ganar bondat acabada . <b> ssi commo es dicho dsuso commo quier que largamente tomando las uirtudes toda buean dispoliçion del alma </b> puede ser dicha alguna uirtud .	et perfectam bonitatem acquirere . <b> Dicebatur enim supra , | quod licet largo modo accipiendo virtutes , </b> omnis bona dispositio mentis possit	o9679yI, uOXWnGo
1.2.34	dU6mWGS	Por ende bien dichones <b> que delas bueans dispoliçiones del alma </b> algunas son uirtudes	benedictum est , <b> quod bonarum dispositionum </b> quaedam sunt virtutes ,	ium9ttm
1.3.3	zpcuyVA	Ca assi commo es dicho de suso <b> e assi commo el philosofo lo praeua en las politicas difetençia e deꝑtimiento es entre el Rey e el tyra non </b> por que el Rey prinçipalmente entiende el bien comun de todos .	nam ( ut superius dicebatur , <b> et ut Philosophus in Polit’ probat ) | differentia est inter Regem , et tyrannum : </b> quia Rex principaliter intendit bonum commune :	rYQiNFw, r9hXcmy
1.3.4	tBNrwtc	Ca nos veemos en cada vna delas obras <b> assi commo es prouado en el primero delas politicas </b> que la fin es desseada	Videmus autem in singulis artibus , <b> ut probatus primo Politicorum , </b> quod finis appetitur in infinitum :	i8krgXA
2.1.1	uGbMMUw	Et por ende el philosofo <b> en el primero libro delas politicas entre las otras razones </b> que tanne	Unde et Philosophus 1 Politicorum <b> inter alias rationes , </b> quas tangit ,	sVFpZ7t
2.1.1	uoWFUBK	Et por ende dize el philosofo <b> en el primero libro delas politicas el que toma e escoge de beuir uida sola </b> e apartada non es parte dela çibdat	Ideo dicitur primo Politicorum <b> quod eligens solitariam vitam , </b> non est pars ciuitatis :	sEeB9fh
2.1.2	a87IpjY	Ca segunt dize el philosofo <b> en el primero libro de las politicas </b> la comunindat dela casa	sed ciuilis : <b> quia secundum Philosophum 1 Politicorum , </b> Communitas domus ,	v32swt1
2.1.2	pov4KbK	que si nos cuydamos con grant acuçia los dichos del philosofo <b> en las politicas paresçra </b> que son quatro las comuindades Conuiene a saber .	Aduertendum ergo quod <b> si dicta Politica diligenter consideremus , </b> apparebit quadruplicem esse communitatem ;	xB12bYq
2.1.2	kJM2MW6	Ca assi commo paresçe por el philosofo <b> en el primero libro delas politicas </b> ca uatural nasçemiento	Naturalis enim origo ciuitatis <b> ut patet per Philosophum 1 Politicorum , </b> hoc modo existit ,	u6gN54x
2.1.2	irv0Y7T	e assi en esta manera fue secho de muchas casas vn <b> uarrio¶ Onde dize el philosofo en el primero libro delas politicas </b> que el uarrio es vezindat de casas	et sic ex multis domibus factus fuit vicus . <b> Unde et 1 Politicorum , | dicitur , </b> quod vicus est vicinia domorum ,	mDqobUP, o9yacsj
2.1.3	coyQT5j	en quanto ha orden ala <b> ca la que es comuidat delas perssonas assy commo parte nesçe al politico </b> que quiere dezir ordenador de çibdat	prout habet ordinem ad domum , <b> quae est communitas personarum ; | sicut spectat ad Politicum determinare </b> de ordine domorum ,	nymyp8g, vN9cG8Z
2.1.3	dydzXsk	por perfeccion e por conplimiento . <b> Onde el philosofo en el primero libro delas politicas </b> conparando la çibdat aluarrio	illis perfectione et complemento . <b> Unde et Philosophus 1 Politicorum </b> comparans ciuitatem	ne5cBa6
2.1.4	rUcSh3r	que el philosofo en el primero libro delas <b> politicasasse declara </b> e difine la comunidat dela casa	Sciendum ergo , <b> Philosophum 1 Politicorum sic describere communitatem domus : </b> videlicet , quod domus est communitas secundum naturam ,	ywmKoo3
2.1.4	rcyhYNh	que assi comm̃ departe el philosofo el philosofo <b> en el primero libro delas politicas </b> que algunas delas obras de los omes	quomodo domus sit communitas constituta in omnem diem . <b> Ad cuius euidentiam aduertendum , </b> quod humanorum operum ,	u8stopP
2.1.4	m1DdCw8	Et por ende dize el philosofo <b> en el primero libro delas politicas </b> que assi commo la comunidat dela casa es establesçida	reperiatur in alia . <b> Propter quod Philosophus 1 Politicorum ait , </b> quod sicut communitas domus	fM0SKKv
2.1.4	nJNPqbQ	e assi commo dize el philosofo <b> en el primero libro delas politicas </b> non solamente la casa es vna comiundat	immo ( ut infra patebit , <b> et ut vult Philosophus 1 Polit’ ) </b> non solum domus est communitas quaedam ,	iW69V27
2.1.5	zzUQc49	por mal gouernamiento de los otros . <b> l philosofo en el primero libro delas politicas </b> dize que la casa primera es establesçida de dos comuindades .	quam ex incuria aliorum . <b> Philosophus 1 Politic’ vult , </b> quod ex duabus communitatibus ,	cBljpGe
2.1.5	udaQCWk	Mas aqueles propraamente sieruo segunt dize el philosofo <b> en el primero libro delas politicas </b> que fallesçe en el entondemiento	ille vero est proprie seruus <b> ( ut patet per Philosophus 1 Politic’ ) </b> qui deficiens intellectu ,	hmeUWc2
2.1.5	bYZkNow	mas sienpre ay alguna cosa en logar de sieruo . <b> assi commo dize el philosofo en el primero libro delas politicas . </b> Ca assi commo alli dize los omes pobres	ibi aliquid loco serui , <b> ut vult Philosophus 1 Politic’ . </b> Nam ut ait , pauperes homines ,	hqblcLv
2.1.5	kCrCYd4	las quales son uaron e muger e sieruo o alguna cosa en logar de sieruo . <b> Onde el philosofo en el primero libro delas politicas alaba a </b> esiodo que dixo	videlicet , ex viro , uxore , seruo vel aliquo loco serui . <b> Unde et Philosophus 1 Politicorum commendat Hesiodum , </b> dicentem domum constare ex tribus ,	sTErR3U
2.1.5	wCmchiP	que dize el philosofo <b> enel primero libro delas politicas </b> non solamente sirue a gouernamiento dela casa	et quot communitates requiruntur ad domum : <b> secundum Philosophum 1 Politicorum , </b> non solum deseruit regimini domestico ,	giz97sF
2.1.6	fHOs4Oe	mas es de razon dela casa ya acabada <b> ¶ Onde el philosofo en el primero libro delas politicas </b> commo ouiesse dicho primeramente	sed est de ratione domus perfectae ; <b> unde et Phil’ 1 Poli’ </b> cum prius dixisset	rKNrppg
2.1.6	lzcxGxW	Siguese que en la casa acabada <b> assi commo dize el philosofo en el primero libro delas politicas tres son los gouernamientos . </b> Ca el vno matrimonial de marido e de muger	in domo perfecta <b> ( ut vult Philosophus 1 Politicorum ) | sunt tria regimina , unum coniugale , </b> secundum quod vir praeest uxori :	eTwM3Km, tGX0wzy
2.1.7	lIVRVIN	Ca segunt dize el philosofo <b> en el primero libro delas politicas </b> en la comunidat dela casa	primo agendum est de regimine coniugali : <b> quia secundum Philosophum 1 Politic’ </b> in communitate domestica ,	qK72zSO
2.1.7	iHXo1rI	por natura es aianl mas coniuigable <b> que politico </b> que quier dezer	Homo enim natura <b> magis est coniugale animal quam politicum , </b> quanto domus est prior	gElhQ03
2.1.7	oUdDyzx	aianl conuuigable e ayuntable por casamiento . <b> Et esta razon tanne el philosofo en el primero libro delas politicas </b> e en el octauo delas ethicas do prueua	homo naturaliter est animal coniugale . <b> Hanc autem rationem tangit Philosophus 1 Politicorum , et 8 Ethicorum , </b> ubi probat coniugium competere homini secundum naturam ,	aW6gMQP
2.1.7	l0JOK2d	Por la qual cosa assi <b> conmodiziemos dela uida politica e de çibdat . </b> Conuiene a saber que el que escoge beuir solo	Quare sicut dicebamus <b> de societate politica , </b> videlicet quod eligens solitudinem ,	wd2WB3w
2.1.10	rCcAXkv	assi commo paresçe <b> por el philosofo en las politicas </b> sienpre el uaron deue ser mayor	Nam secundum ordinem naturalem <b> ( ut patet per Philosophum in Polit’ ) </b> semper vir debet esse praeeminens ,	eo0OXWw
2.1.11	r38Q45A	que non saquan algunas perssonas del mater moino . <b> Onde el philosofo en las politicas </b> mouiendo se con razon natural saca algunas perssonas	non exceptuantes personas aliquas a coniugio contrahendo . <b> Unde et Philosophus 2 Polit’ </b> sola ratione naturali ductus	oVQBKrx
2.1.12	fjhEGLQ	ca la primera con pama natural <b> assi commo paresçe por el philosofo enlas politicas es del maslo e dela fenbra e del uaron e dela mugni . </b> Mas esto non si asi el casamiento non fuesen ordenado a algua conpanna conuenible e natural .	prima autem naturalis societas ( ut patet per Philosophum in Polit’ ) <b> est maris et foeminae , viri , et uxoris . </b> Hoc autem non esset ,	gadswYi
2.1.13	owcAMEY	assi commo dize el philosofo <b> en el septimo delas politicas . </b> non sabe ser uagarosa .	Nam mens humana <b> ( ut innuit Philosophus 7 Politicorum ) </b> nescit ociosa esse ;	q43EPXC
2.1.14	oZZchyO	falladasen vna casa . <b> Onde el philosofo en el primero delas politicas </b> conpara los gouernamientos de vna casa	per quandam similitudinem reseruantur in domo . <b> Unde et Philosophus primo Politicorum , </b> regimina unius domus	yuzTnrN
2.1.14	mtrRuxN	e de los lus çibdadanos <b> e es dicho tal gouernamiento politico e çiuil . </b> Et por ende tal regno sera dicho politico e çiuil .	sed magis ab ipsa politia et ab ipsis ciuibus . <b> Dicitur ergo tale regimen politicum vel ciuile . </b> His autem duobus regiminibus in ciuitate	zb7mNlm
2.1.14	crUudsU	e es dicho tal gouernamiento politico e çiuil . <b> Et por ende tal regno sera dicho politico e çiuil . </b> Mas estos dos gouernamientos que son en la çibdat	sed magis ab ipsa politia et ab ipsis ciuibus . <b> Dicitur ergo tale regimen politicum vel ciuile . </b> His autem duobus regiminibus in ciuitate	zb7mNlm
2.1.14	aKmx1fU	segunt el philosofo <b> enlaspoliticas son semeiantes dos gouernamientos dela casa de </b> lons quales el vno es paternal	His autem duobus regiminibus in ciuitate <b> secundum Philosophum in Polit’ </b> assimilantur	mxF7Y02
2.1.14	sPDjCtf	en qual manera el marido se deua auer çerca la muger . <b> Et por ende es dicho tal gouernamiento politico e çiuil por que es semeiado a aquel gouernamiento </b> en el qual los çibdadanos llamando a su señor muestran le los pleitos	quomodo vir habere se debeat circa ipsam . <b> Dicitur ergo tale regimen politicum : | quia assimilatur illi regimini , </b> quo ciues vocantes dominum ,	tINC5CP, g3zxlAF
2.1.15	cdFmt7r	Et por ende dize el philosofo <b> en el primero libro delas politicas </b> que na falmente se departe la muger del sieruo .	non erit ordinata ad seruiendum . <b> Ideo dicitur 1 Politicorum , </b> quod naturaliter distinguuntur	qFqLuNn
2.1.15	axqeG5n	Assi conmo dize el philosofo <b> en el primero libro delas politicas do dize que entre los barbaros la fenbra </b> e el sieruo han vna orden	ut recitat Philosophus 1 Politicorum dicens , <b> quod inter Barbaros foemina et seruus eundem habent ordinem . </b> Utebantur enim illi coniugibus tanquam seruis .	wFg1WpC
2.1.15	cjGdLvm	Onde dize el philosofo <b> en el sexto delas politicas </b> que los pobres	si uxor et seruus habeant eundem ordinem . <b> Unde dicitur 6 Politicorum , </b> quod pauperes ,	is9YPg6
2.1.16	g1R6Hr1	Ca el philosofo tanne en el . <b> vi̊ libro delas politicas quatro razones </b> por que praeua que enla hedat de grand moçedat	Tangit enim Philosophus 7 Polit’ <b> quatuor rationes probantes </b> quod in aetate nimis iuuenili non est utendum coniugio .	xg88I4k
2.1.16	aUUO3pE	deguatid moçedat se ayuntare el uaron ala muger <b> assi commo praeua el philosofo en las politicas </b> dende sallen los fijos dannados quanto al cuerpo .	Nam si in aetate nimis iuuenili contingantur vir et uxor <b> ( ut probat Philosophus in Polit’ ) </b> laeduntur inde filii quantum ad corpus ,	xkX266b
2.1.16	xHVO3pk	Onde en el . <b> vij̊ delas politicas dize el philosofo </b> que aquellas mugersmas son destenpradas que fueron vsadas seyendo moças ¶ La terçera razon se toma del periglo delas mugers	assueta ad illud . <b> Unde et 7 Politic’ dicitur , </b> quod intemperatiores videntur	rcPocVZ
2.1.16	aftK6Bp	ca assi commo dize el philosofo <b> en las politicas las mugers moças </b> mas se duelen en el parto que las otras	Tertia via sumitur <b> ex periculo mulierum . Nam ut dicitur in Polit’ | in partu iuuenculae </b> magis dolent et periclitantur plures .	prwoBCk, eyM2eKJ
2.1.16	yni4iv5	si en grand moçedat vsaren de casamiento . <b> Onde en las politicas dize el philosofo </b> que los cuerpos de los mas los resçiben	si in nimia iuuentute utantur coniugio . <b> Unde in Politicis , </b> dicitur quod masculorum corpora laeduntur ,	zFeSEYQ
2.1.17	c36TR2P	que cunple . <b> L philosofo en el . vij̊ libro dellas politicas </b> despues que prouo	si videbitur expedire . <b> Philosophus 7 Polit’ </b> postquam probauit per rationes plurimas ,	upiQ5bU
2.1.18	tFKdM8G	que estan en hedat acabada . <b> Ca legunt el philosofo enlas politicas </b> los mas los mas son ennoblesçidos	ad homines existentes in aetate perfecta . <b> Nam secundum eundem Philosophum </b> in Polit’ mares	cnvKxlq
