Localisation	Id. source	Segment source	Segment cible	Id. cible
1.3.3	hQ962eZ	brachium periculo se exponit . Sic etiam antiquitus <b> si perspeximus ciuitatem aliquam dominari et tenere monarchiam : </b> hoc erat , quia ciues pro Republica non dubitabant se morti exponere .	por que todo el cuerpo non ꝑesca . Et en essa misma manera avn si cataremos al tp̃o <b> quando alguna çibdat auie señorio e tenie sennorio sobre las otras esto era </b> por que los çibdadanos non duda una de se poner ala muerte por el bien comun de todos .	kXFRgxV
3.2.2	bunOjVc	vel intendit bonum proprium . Si intendit bonum commune et subditorum , <b> tunc dicitur Monarchia siue Regnum : </b> regis autem est intendere commune bonum . Si vero ille unus dominans	Si vnio o aquel entiende bien comun e bien de los subdictos <b> e estonçe es dicho tal sennorio monarch̃ia o e egno </b> ca al Rey parte nesçe de enteder el bien comun . Et li aquel vno assi	yyC2exc
3.2.4	nfHZl6T	in tantum est rectum et dignum , inquantum tenent locum unius : <b> dominari unum et facere monarchiam , </b> si debito modo fiat , erit omnino rectior et dignior .	en tanto es derecho e digno en quanto ellos tienen logar de vno <b> el sennorio de vno es meior | e fazer tal monarchia de vno </b> si se faze en manera conueinble sera en toda manera	mhHvrx2, eMsuPMk
3.2.4	kaSYoyW	multarum manuum , et multorum pedum . Non ergo dici poterit <b> talem unum monarchiam non cognoscere multa ; </b> quia quantum spectat ad regimen regni ,	e en esta manera se fara el prinçipe vn omne de muchs oios e de muchͣs manos e de muchs pies . Et pues que assi es non se puede dezer <b> que vn tal monarchia | o tal prinçipe assi fech̃ de muchos que non conogca </b> e non sepa muchͣs cosas . por que quanto parte nesçe al	euPwdLZ, oechMdC
3.2.7	dDDj4iP	est efficacissimus ad proficiendum : sic tyrannis efficacissima ad nocendum . <b> Monarchia enim quia ibi dominatur unus , </b> et est ibi virtus unita , ideo vel est optima ,	por que es muy vno es muy afincado para aprouechar . Assi la tirania es muy afincada para enpees çer <b> ca el senñorio de vno | enssennorea </b> e do la uirtud es ayuntada en vno o es muy buencoo es muy malo .	c3FKxJR, ewLwvjS
3.2.13	sm8o8gE	et honores magnos existentes in ipsis . Quinto fiunt insidiae tyrannis ab aliquibus , <b> non ut possideant monarchiam , </b> sed ut videantur facere actiones aliquas singulares .	e matanlos ¶ Lo quinto son puestos asechos alos tiranos de algunos non <b> por que ayan el su señorio mas por que paresca alos omes </b> que fazen algunos omes apartadas ca algunos quieren ser en alguna nonbrada o en alguna fama	oPxkMSu
3.2.14	kpn0vCo	Una ergo tyrannis potest contrariari alii , et corrumpere ipsam ; <b> ut tyrannis populi contrariatur tyrannidi monarchiae : </b> et una monarchia tyrannica contrariatur alii . Cum enim aliquis monarcha	e el mal senorio es contrario al malo . Et por ende vna tirama puede ser contraria a otra <b> e corronper la assi cotio la tirania del pueblo | escontrana ala tirama del mal prinçipado </b> Et vn prinçipado tiranico es contrario a otro prinçipado tiranico e malo ca quando algun	rMNVqll, uiXVXG5
3.2.14	k0PZ5aQ	Totus ergo populus efficitur quasi unus tyrannus contra Principem , <b> et tyrannis populi corrumpit tyrannidem monarchiam . </b> Sic etiam una tyrannis monarchia corrumpit aliam : quia multotiens unus monarcha tyrannus insurgit in alium ,	Et por ende todo el pueblo es fech assi commo vn tirano contra el prinçipe e cotra su tirama . <b> la tirama del pueblo corronpe e destruye la tirana del prinçipe bien </b> assi avn vna tirama de sennorio corronpe a otra por que muchͣs vezes vn prinçipe tirano se leunata contra otro prinçipe tirano	x9Hb44I
