Localisation	Id. source	Segment source	Segment cible	Id. cible
1.1.3	lDpRa7l	muchos son ordenados a vn caudiello	et in regno plures ordinantur ad unum ducem ,	cWz4bt7
1.1.3	ar48WJY	njn el caudiello non puede auer la çibdat	nec dux dicitur habere ciuitatem ,	pjYjqSJ
1.1.3	vaV3JQX	o sy los moradores dela çibdat o del rregno non obedesçieren al rrey o al cabdiello	qui non obediant regi , vel duci :	jgfGkdt
1.1.6	d1dsnW0	que niguno non escoge alos mancebos por caudiellos	quod nemo eligat Iuuenes in Duces ,	dt3aHQr
1.2.11	fv3nQ9R	assi commo asu Rey o a su cabdiello	ut ad Regem , | vel ad ducem ,	hIP0Z1E, q2VJlLF
1.2.14	aXfWTkW	que era cabdiello dela caualłia eran fuertes .	vel aliqua necessitate ductus aggreditur pugnam . Hoc modo multi Troianorum timentes Hectorem fortes erant .	fEC77Yz
1.2.14	s1jOkvf	Et a esta manera de fortaleza enduzen los pueblos los caudiellos dela hueste	Ad hanc Fortitudinem inducunt populum Duces exercitus , statuentes poenam fugientibus ,	rtalKTo
1.2.14	lQT1skg	Et en esta manera vn caudiello dizen	Hoc autem modo quidam Dux dicitur exercitum suum coegisse ad Fortitudinem . Nam ,	doqWJWx
3.2.15	loBBTjR	que en el caudiello dela fazienda	quam in duce exercitus .	mcIYqzY
3.2.15	hBhjlW7	Ca en el caudiello dela fazienda es mucho menester espiençia e prueua .	Nam in duce exercitus requiritur potissime experientia ,	lm05Df3
3.3.6	x5DqROt	Et quando vieren los caudiellos maestros de las batallas	Et cum viderit magister bellorum	lhp1y07
3.3.9	hBvy7G4	Et pues que assi es en general el rey o el prinçipe o el cabdiello de la hueste	aut Princeps , | aut Dux exercitus	hNonS93, nB7tKxO
3.3.9	amazZ4t	Lo sexto quales son mas osados e mas fuertes de coracon . Estonçe el cabdiello de la hueste mesurado	et sagaciores mente . Sexto , | qui sunt audaciores , et viriliores corde .	nctoBY9, adG52R2
3.3.9	e7soMsT	Et por ende el cabdiello deue penssar todas estas cosasLo .	Debet igitur dux exercitus considerare primo ex qua parte sunt plures equi	t8kYhFq
3.3.9	yirJkLd	primero deue penssar el cabdiello de la hueste	Debet igitur dux exercitus considerare primo ex qua parte sunt plures equi	t8kYhFq
3.3.10	sDdWqlc	que en la hueste establesçiessen cabdiellos e çenturiones	Rursus constituere expediebat duces ,	gH6nl3D
3.3.10	kSDtl8r	sinon ouieren cabdiellos e mayorales	et duce ,	hryd4MZ
3.3.10	zwZ0vlf	establesçian algun cabdiello	ne accideret confusio in bello , constituebatur , dux aliquis	iw7PQ0O
3.3.10	wVa1IeF	Et so este cabdiello eran los çenturiones	Sub hoc autem duce erant centuriones .	hUYtzbM
3.3.10	qwnB4oG	e el dean es dicho cabdiello de dies caualleros	Dicitur enim decanus a decem .	hy4KrLT
3.3.10	ygzZLMw	commo de los peones son de establesçer cabdiellos e mayorales e alferezes	quam etiam peditum constituendi sunt duces et praepositi ,	aDbZE8Z
3.3.10	eVGHpTp	qual deua ser el cabdiello	qualis esse debeat	klt9Qpf
3.3.10	y3nsU6T	que el que es antepuesto es cabdiello de la caualleria en la batalla	Oportet igitur praepositum et ducem militaris belli esse habilem corpore ,	wbkZPFm
3.3.11	r2wVbuT	las quales deue el caudiello de la batalla retener en ssu memoria	quas debet dux belli retinere memoriter ,	ggIXtpr
3.3.11	n9HKlcP	por do ha de yr la hueste deue tener el cabdiello escriptos .	per quae exercitus proficisci debet :	e0IKszq
3.3.11	hJaVdhO	que aquellas carreras e los passos e los rios el cabdiello de la batalla pudiesse auer pintados .	et passus , | et flumina dux exercitus haberet depicta ,	aVXbspU, sjPZyHO
3.3.11	lZ3YloH	si el cabdiello de la batalla non ouiere escriptas .		
3.3.11	u6QMoBB	que el cabdiello aya consigo muchos sabios	Tertia est , habere secum plures sapientes fideles principi , exercitatos in bellis ,	lAIMFJ5
3.3.11	ptaPUG0	si non del cabdiello e de los conseieros .	per quae debet exercitus proficisci .	uktUyN2
3.3.11	lHOcSFj	Ca el conseno del cabdiello	Nam consilium ducis quanto minus est publicum ,	dwGT2gI
3.3.11	iJcoRFj	e aquellas carreras touiere el cabdiello escriptas e pintadas	et vias illas Dux habet conscriptas et depictas ,	pUd8Vvh
3.3.11	wHOhn63	Ca maguera quel conseio del cabdiello non sea sabido a ninguno .	Nam | etsi nullis esset notum ducis consilium ,	o4NGjzD, lkaqCtY
3.3.12	lPIguVT	luego deue el cabdiello de la batalla mandar	Quo facto statim debet praecipere dux belli ,	cbT7rYJ
3.3.12	jO41zFO	deue mandar el cabdiello de la batalla	se	jpWdD4p
3.3.12	fKcEXVO	assi que commo cada vno de los cabdiellos viere	ut prout quis plures	zbbrBsM
3.3.14	spJ3Evk	Lo terçero deue catar el cabdiello al tienpo .	Tertio debet aspicere ad ipsum tempus :	yuJDWz5
3.3.14	xbgqrxg	Lo quinto deue el cabdiello escodriñar con grant acuçia	Quinto debet diligenter explorare ,	mskTmhS
3.3.14	urbALZb	lo . vij° . deue el cabdiello con grant acuçia escudriñar las condiçiones de los sus enemigos	quia repugnaret bonis moribus . Septimo debet diligenter explorare conditiones hostium :	cwejgAL
3.3.14	qWhDsWO	e quien es el cabdiello dellos	quis est dux eorum ,	m5Rqlwt
3.3.14	pAbZz35	mas aquel cabdiello	de quo dux ille magis confidit ,	w4UhwAh
3.3.15	cJKRtYf	quanto pertenesçe a lo presente dos cautelas deue auer el cabdiello de la batalla .	debet dux belli duplicem cautelam habere . Prima est ,	n0YCeLc
3.3.15	f2Q4hTj	Ca si el cabdiello ouiere conseio de non lidiar .	quantum ad exercitum proprium . Nam et si dux consilium habeat non esse pugnandum ,	euW6L8J
3.3.15	kwHTGHD	assi es en tal manera se deue auer el cabdiello	Taliter itaque dux se habere debet ,	upLZxXJ
3.3.15	jmcYnHf	Deue avn el cabdiello de la batalla catar	Debet | etiam dux belli inquirere ,	clFfbPI, oJsCfU3
